,title,stars,date,r_title,text
84,Dumbo,10,11 January 2003,Best animated picture in movie History!!,"The reason Dumbo is my favorite cartoon is because of the way that Disney accomplishes the fact to create only brilliant scenes,from the bombastic opening titles to the unavoidable happy end,with the undisputed highlight:The Drunken Dream sequence! That scene has almost stayed in my memory since I saw it for the first time,probably about 5 or 6 years old.Now,at 22,I still think that this scene is the best scene ever in animation.The way that the song combines with the dances and constant change of characters(Pink Elephants!) is just superb.The way that Disney takes care of every small detail is also beautiful to watch and probably best seen in the train sequence with all the different animals and their ways.The music score is also very very good,with circus music of course but also a couple of great songs(the drunken dream song of course but also the song of the ravens,the scene after the dream. The message of Disney in this movie is probably their best,the outcast who becomes,with help from a tiny mouse,the great hero!Dumbo is the perfection of animated movies and will always be remembered as one of the all time classics! 10/10"
85,Dumbo,10,15 May 2014,Is Racism Rife In This Beloved Children's Classic?,"As a Disney classic made on the cheap to recoup the losses after Fantasia (1940) you can't fault this film for its charm. It tells the story of the mute baby elephant Dumbo as he goes through a series of trials and humiliations before learning to fly and having his ears insured for a million dollars. Quaint. Charming and quaint to be sure.What you can fault this film for, however, is its racism. Musical number 'Song Of The Roustabouts' which depicts a gang of African-American work- hands is awful by today's standards and was pretty horrendous even for the time (""We work all day/ We work all night/ We never learned to read or write""), I mean do you really want to be showing your kids this stuff? Not to mention the gang of shady stereotypes who croon out the regrettably catchy When I See An Elephant Fly (sung by Cliff Edwards and The Hall Johnson Choir as ""when I see a elephant fly"").It just strikes me as rather odd that in this day and age we still throw this stuff in front of our most impressionable minds and don't have the forethought to think about what's actually on screen. A group of faceless black men who's only purpose appears to be working for the man is really not the sort of thing that I want my kids to be told is normal. Yes, some might explain it away as a product of the times, or simply ignore it under some half-formed 'the magic of Disney' excuse, but the fact still remains that at least two of the major sequences in this film are prime examples of insidious racism.Still though, as an adult this film does have its merits. I mean, the Pink Elephants On Parade sequence is certainly inspired if a little terrifying, and the animation, while generally basically constructed, has its moments of stylistic grandeur. When Timothy Mouse's shadow throws out its Nosferatu shadow a la F.W Murnau, for instance, was a real delight to see. It also has the interesting historical distinction of being the second of only two classic Disney films to have had their backgrounds done solely in watercolours (the other being Snow White and The Seven Dwarfs (1937)).But, overall I've got to say that Dumbo really isn't one of the finest achievements to ever come out of the Disney studious. The storyline is, to be frank, utter nonsense and is poorly executed with the thing jumping from sequence to sequence with no real rhyme or reason. Nevertheless, there'll always be a small fondness for the floppy eared pachyderm in my heart (and I'm willing to bet the hearts of others), and for early animated cinema it is a considerable landmark. All I'm saying is that you should probably have a good, hard think before you sit your children down in front of it and consider it wholly innocent."
86,Dumbo,9,19 March 2016,Dumbo,"What strikes me about this film is its length and simplicity. It's only over an hour long, and the main character is silent. It's a simple story about an outcast trying to get along in an unjust world with the help of an unlikely friend. It's simple, to the point and the underlying message touched me more than it ever did as a child.Disney's fourth animated classic tells us the story of Jumbo Jr., or Dumbo. Dumbo, the large eared, big hearted child of Mrs Jumbo, is ridiculed by the rest of the elephants at the zoo. He's very close to his mother, and is devastated and left alone when she is locked away after defending her son from a nasty little boy. Rejected from his kind, and the laughing stock of the circus, Dumbo is befriended by Timoty Q Mouse, who sees nothing wrong with the youngster's apparent disfigurement. With Timothy's help, the silent elephant learns that it matters not what one looks like, but what you're made of, and that you can learn to use your weakness as your vehicle to achieve greatness.Dumbo himself is just adorable. I love silent characters like this, who convey emotion through action, expression and noises. He says so much by saying so little. I loved him.The message of hope in the face of adversity is profound and done beautifully here. It isn't hammered in. It teaches us not to judge on looks alone, but to look beyond it. An age old lesson, but done here so well that it feels fresh and new. As someone with disabilities, this film touched my heart; Timothy is truly what a great friend should be. If there was more people like him, we'd have far less problems in the world. The relationship between Dumbo and his mother is just lovely, and the song ""Baby Mine"" made me see how much I love my own mother. I feel for little Dumbo; my mother is my rock, and if I lost her I don't know what I'd do. He's a brave little guy, no doubt.It surprised me that the humans and circus workers didn't seem to hate Dumbo at all. It was all the elephants (and that one boy who took it too far). Your own kind can me much crueler than others.The animation is beautiful, especially the little details they added such as rain and flags blowing in the wind. I was pleased that the animators showed Dumbo and his mother rocking side to side after being separated; this is a tell tale sign of depression in elephants.The music is lovely. I've always liked the choir in these older Disney films. In the opening song, they mentioned my hometown, County Cork, which surprised me a great deal. The crow scene didn't bother me in the slightest, I actually found them quite funny. It's a product of the times, and they sing that awesome song. The Pink Elephant scene dragged on a bit too much for me, but the song was cool. I better mention that there's flashing lights in this sequence.The length of the movie is perfect. Any longer and it would have overstayed its welcome. What a lovely little film. A great introduction to Disney for children, and such a pleasure to revisit now as an adult."
87,Dumbo,9,25 February 2011,The cartoon returns...,"I was never the biggest fan of this one, having seen it to death as a child. ""Dumbo"" was in many ways regarded as a lesser Disney classic, never really treated with the same regard as ""Pinocchio"", ""Snow White"" or ""Bambi"". But as I continue to work my way through this studio's classics, I am more than pleasantly surprised to rediscover this gem.With a short running time of 64 minutes, which must barely qualify as film, this was the most cartoonish Disney feature of this era that I had seen, definitely not to the same higher brow animation standards of the afore-mentioned, but funnier and more enjoyable, without a doubt.The little engine that could humour and the overall concept, being more zany that its counterparts help this stand out and being a much more entertaining piece of cinema than I had originally given it credit for. Not the greatest animation in history, but fun none the less."
88,Dumbo,10,26 December 2010,You Don't Believe An Elephant Can Fly??? Watch This Animated Film And See For Youself.,"This is one of the most memorable cartoon film I saw as a young boy. It introduced me to a lovable character that I'll cherish forever. The character is an adorable baby elephant with blue eyes and ears which are longer in proportion to its body, which eventually enable it to fly. Jumbo Junior is its name. However it has the nickname of Dumbo.Plot: While circus animals are being transported, Mrs. Jumbo, one of the elephants, receives her baby from a stork. The baby elephant is quickly taunted by the other elephants because of his large ears, and they nickname him ""Dumbo"".Once the circus is set up, Mrs. Jumbo loses her temper at a group of boys for making fun of her son, and she is locked up and deemed mad. Dumbo is shunned by the other elephants and with no mother to care for him, he is now alone, except for a self-appointed mentor and protector, Timothy Q. Mouse, who feels sympathy for Dumbo and becomes determined to make him happy again.The circus director makes Dumbo the top of an elephant pyramid stunt, but Dumbo's ears causes the stunt to go wrong, injuring the other elephants and bringing down the big top. Dumbo is made a clown as a result, and plays the main role in an act that involves him falling into a vat of pie filling. Despite his newfound popularity and fame, Dumbo hates this job and is now more miserable than ever.To cheer Dumbo up, Timothy takes him to visit his mother. On the way back Dumbo cries and then starts to hiccup so Timothy decides to take him for a drink of water from a bucket which, unknown to him, has accidentally had a bottle of champagne knocked into it. As a result, Dumbo and Timothy both become drunk and see hallucinations of pink elephants (the famous Pink Elephants on Parade sequence).The next morning, Dumbo and Timothy wake up in a tree. Timothy wonders how they got up in the tree, and concludes that Dumbo flew up there using his large ears as wings. With the help of a group of crows, Timothy is able to get Dumbo to fly again, using a psychological trick of a ""magic feather"" to boost his confidence.Back at the circus, Dumbo must perform his stunt of jumping from a high building, this time from a much higher platform. On the way down, Dumbo loses the feather and Timothy tells him that the feather was never magical, and that he is still able to fly. Dumbo is able to pull out of the dive and flies around the circus, finally striking back at his tormentors as the stunned audience looks on in amazement.After this performance, Dumbo becomes a media sensation, Timothy becomes his manager, and Dumbo and Mrs. Jumbo are given a private car on the circus train.A famous song in the film ""When I See An Elephant Fly..."":I saw a peanut stand, heard a rubber band, I saw a needle that winked its eye. But I think I will have seen everything When I see an elephant fly.I saw a front porch swing, heard a diamond ring, I saw a polka-dot railroad tie. But I think I will have seen everything when I see an elephant fly.I seen a clothes horse, he r'ar up and buck And they tell me that a man made a vegetable truck I didn't see that, I only heard But just to be sociable I'll take your wordI heard a fireside chat, I saw a baseball bat And I just laughed till I thought I'd die But I'd be done see'n about everything when I see an elephant flyAfter its October 23 release, Dumbo proved to be a financial miracle compared to other Disney films. The simple film only cost $813,000 to produce, half the cost of Snow White, less than a third of the cost of Pinocchio, and certainly less than the expensive Fantasia. Dumbo eventually grossed $1.6 million during its original release; it and Snow White were the only two pre-1943 Disney features to turn a profit. It was intended for Dumbo to be on the cover of the December 1941 issue of Time, but the idea was dropped when the Japanese bombed Pearl Harbor, resulting in the United States entering World War II and reducing the box office draw of the film.Dumbo won the 1941 Academy Award for Original Music Score, awarded to musical directors Frank Churchill and Oliver Wallace. Churchill and lyricist Ned Washington were also nominated for the Academy Award for Best Song for ""Baby Mine"" 10/10 points. In short this is a gem of a film and definitely recommend for young children. Buy it on DVD.Email me: Vivekmaru45@yahoo.com for more info on movies and movie-lists."
89,Dumbo,9,15 November 2009,Such a sweet movie,"Seriously, anyone who doesn't think Dumbo is touching is just crazy!Dumbo is such a sweet little guy, even though he doesn't speak, you really feel for him.The downside to this movie is, it's over too quickly. I understand Walt however, Pinocchio and Fantasia were expensive and were not exactly box-office hits, so he had to keep it short and cheap, and anyway, it is great never the less.I can't believe my dad thinks this film is boring-It's just so sweet! It's sad in parts, yet there is humour, and parts just make you go 'Aww'.There's one scene I just can't stop laughing at-When Dumbo and his mouse friend, Timothy, get drunk. Really, it's too funny! But I won't spoil it, but I will say, wow, kids films back then could really get away with anything! So, Dumbo is a terrific Disney film. No doubt!"
90,Dumbo,,19 July 2004,A charming film from The Mousetro (SOME SPOILERS),"I saw Dumbo several times when I was really (I mean REALLY) young, and forgot about it till just a month ago, when I got it on DVD. This is one of the most touching, short, perfect films ever. Nobody should have to pass their childhood without seeing it.The story is incredibly simple. It isn't cluttered by subplots, it doesn't have more than one story line, it's just a straightforward fable of how a baby elephant rises to fame, but not before being ridiculed for his foolishly immense ears, named Dumbo, and worst of all being ostracized from his mother. But he is rescued by Timothy Q. Mouse, a fast-talking rodent who is the one guy who pities Dumbo. In the end, Dumbo finds his ears are perfect as wings. After the animators so perfectly portray his innocent joy, we see a great change in Dumbo. He suddenly punishes the clowns who made fun of him, shoots peanuts at the nasty elephants like a bombadier circling overhead. I know everyone who was punished for their horrid conduct towards the mute protagonist deserved what they got. But still, I can't help thinking: Is this really Dumbo? I would have expected him to just smile joyously and simply speed-dive into his mother. I just didn't seem like the kind of guy to punish wrongdoers. That's what most heroes do, they beat up the baddies, but Dumbo seemed more like the kind of character to mind his own business, content to be with his mother and not be picked on, not giving a hoot whether the rest of the world ran amok or not.Despite the last bit, I love Dumbo. The animation is very rounded, warm and welcoming. The cuteness of Dumbo knows no bounds. This is made even more noticeable when Dumbo's ears are revealed when he sneezes, as they were previously tucked back neatly. After everyone sees his ears, the scenes don't look quite so happy. After his mother tries to protect him from a redheaded brat, Skinny, she's labelled ""mad elephant"" and locked up. After the loss of his mother, all the layouts are dark and sad, reflecting how Dumbo feels. Even the circus' obligatory brightness seems in some way menacing, although the look isn't really different at all. The animation is very simple, not bothering with great detail, but just portraying a cartoon animal, without the added bother of fur, wrinkles and such like.The character of Dumbo is groundbreaking. It's a great achievement to make a pure, meaningful film without the title character uttering a single word. The medium of animation often expresses emotion better without verbal support. Add to that that the movie really emphasizes Dumbo as an innocent baby who isn't responsible for his long ears, and dialog would ruin the baby image. What makes the meanness of the outside world look even worse is the fact that Dumbo can't even say anything about it. Timothy is a great character. That's nothing more than what you'd expect, for mice are always portrayed favorably in Disney, for obvious reasons. You just love him for helping Dumbo when no one else will. He's also quite the talker, persuading the ringmaster to use Dumbo as his climax, and bringing a bunch of nasty Afro-American crows to tears with a dramatic rendition of Dumbo's tragic story. Which brings us to the crows, presumably cousins of the vultures in The Jungle Book. Both are outcasts themselves, both make fun of the outcast hero before accepting him with an excellent song and then helping him. Mowgli and Dumbo develop friendships with their feathered acquaintances the same way. No one could ever talk about Dumbo without mentioning the ""Pink Elephants On Parade"" sequence. A year too late to make the cut for Fantasia, but certainly a surreal, colorful, innovative sequence. It's one of the best animated sequences ever, with lots of strange shots, like when you only see highlights of two waltzing elephants. Timothy and Dumbo endure this nightmare after accidentally imbibing the clowns' champagne. The crows' song ""When I See An Elephant Fly"" is one I battled with for a long time, trying to get it out of my head. I failed, needless to say. ""Baby Mine"" is one of the most touching sequences in animation history. The eyes and and the trunk (!) of the two elephants express the mother and son's feelings far better than words. All Dumbo can see of Mrs. Jumbo is her trunk, which cradles him through the bars of Mrs. Jumbo's tiny cell window, as he cries.
Okay, enough of the sadness and despair, the movie! Dumbo is one of the great Disney movies, immortal. Short, simple, basic, yet spectacular in its own simple way. It doesn't try to be Fantasia or Pinocchio. It doesn't go for extravagance. It doesn't wanna be the immortal masterpiece. It just aims to tell a good animated story. Yet in its unambitious SIMPLICITY it manages to do most of that."
91,Dumbo,,25 December 2003,"A great movie, really...","A great movie! Cute, beautiful one! Actually I have seen it only after my thirties - but I have cried too, it's so touching... It's great movie about mothership, friendship and love with briliant songs and innovative ""pink elephants"". I just don't understand the comments about ""afro-americans"". I just don't get it - if crows are black it doesn't mean that they DO symbolize Afro-Americans and DO display them in wrong way! I loved the crows, they are cool! Please, go away with this great-movie-spoiling racist paranoia. Go get some Nazi propaganda movies from thirties and SEE THE DIFFERENCE. You would shame yourself after that for ever accusing the Disney!"
92,Dumbo,7,19 August 1999,A Disney classic that shows its age.,"This is a cute, poignant movie with a lot of memorable sequences and good songs.  However, I have to agree that it's surprising that Disney got away with the whole Pink Elephant sequence, even if it WAS 1941.  And the crows...I don't think I would quite call it racist, but definately stereotypical.  It's very odd to watch this movie in current times.  But all in all, a classic."
93,Dumbo,,9 July 1999,"Good, but...","Definitely a classic, but on re-watching it I took to thinking....In terms of plot-line, it's a pretty long run for a short slide, isn't it? You sort of wonder what happened to the movie about the flying elephant, when he only flies the last 10 minutes or so.  Granted, what would you at that point that wouldn't be boring, but it does seem to end somewhat precipitously.Also, watch the development of the plot: Dumbo's born, he's treated badly by the other elephants, so is his mother, he makes a friend, etc... All handled quite well.  Ah, but his fortunes turn around.  How?  Why, by getting drunk. Somehow that doesn't seem right.  The modern child for whom this movie would be suited probably is too young to understand much about drunkenness.. and probably shouldn't!  To be sure, this movie is from 1941, the audience and society and standards were different then.  Also, I'm not generally one to blow a PC-whistle, but I could probably have done without his being teased and then helped by a bunch of *genuine* Jim Crows (let's face it, that's what the movie made them).  Again, a product of its times.So, yes, it remains a good movie, but somehow misses something when I watch it now."
94,Dumbo,,17 November 1998,One of Disney's best,Up there with Bambi and Mary Poppins as one of Disney's best features.  It's funny and touching at the same time and the pink elephants are the best!
95,Dumbo,,27 June 2004,Microcosm,"Phase I Disney material.  By comparison to Phase III (Beauty & Beast, Lion King, Aladdin) this is edgier.  Sure, they punch our ""cuteness"" buttons, but this movie has more to it.  Only 'Hercules' has done such an reflection of the Disney machine at work.Something like a spoiler warning...This movie really sums up prewar America.  Anyone who thinks this is a sweet story is blind.  Consider:--Heavy racial stereotypes.  The crows are obviously Blacks (as is the gorilla) so Ralph Bakshi used that theme for his 70s satire.  Compare this to 'Remember the Titans' where the crows were the victims and the ""white boy"" was only a miscellaneous outcast.--Listen to the lyrics of the working Roustabouts.  Probably the most depressing Disney music until 'Song of the South'.--The frequent militarist themes and images, some directly taken from 'Triumph of the Will'.  Remember that Disney was one of the largest distributors of nationalist propaganda during WWII, one such mascot was Dumbo.--The circus is tyranny and the gossiping elephants (""proud race"") are Nazis.  So, Dumbo's escape and triumph becomes all the more patriotic. Orwell copied this for '1984'.--Having lost his mother, Dumbo gets drunk, hallucinates and has one heck of a hangover.So where does Disney invest itself?  The ""search for a climax.""  This was after a few financial travesties so Disney needed a savior.  The story itself was a freak to the writers and barely got to Walt as it was.  What makes this good?--Modern Disney musicals are constructed in the MTV fashion of flashy colors and cuts.  Up until 'Little Mermaid' the method of music was appreciative meditation.  Just examine the ""Baby Mine"" sequence, a far cry from anything we've seen in the last 15 years.--Because Dumbo doesn't talk, he is reliant on expression like few other Disney characters.  The only other one that pops to mind is the Golden Eagle in 'Rescuers Down Under'.  These represent the epitome of the Disney design team.  Notice how the art is focused on the eyes.  Now compare it to the repressed designs of the Disney princesses, it seems Disney is better at animals when they don't have to worry about them speaking.  From here we get 'Luxo Jr.' and Phase IV.--Early use of morphing animation during ""Pink Elephants"".  This is still effective after 60+ years.  Sure, Gerald Scarfe used it in 'Pink Floyd', but it's not until the recent advances in computer technology where morphing has become more common.  Now who will change our outlook on the process?--In the finale, Disney completes the circle by flaunting the publicity machine (something they've exploited ever since) and announcing 'Dumbo: The Movie'.  'Bill & Ted 2' used the same gag in its credits.With those in mind, this goes on my Top 10 Disney films and it has nothing to do with sentimental attachment.  Well, maybe it does.  If you don't cry during the ""Baby Mine"" scene, you really are a heartless Nazi.Final Analysis = = Learn from this..."
96,Dumbo,4,8 July 2012,Another Disney movie I found hard to like as a child.,"I think if I would describe this movie with one word it would be ""depressing"". It's hard to watch all these characters being so cruel to a little baby elephant who doesn't even have the voice to defend himself against it all. I disliked this movie as a child, because so much in this movie feels mean-spirited and upsetting. I remember thinking I was glad the movie was over, instead of actually being happy for the characters, since I was left with such a bad mood after all that had happened.I also found the Pink Elephant Parade creepy and it really serves no point to the plot. As for the songs, I didn't really like them much. ""Baby Mine"" was the only one I truly liked.The animation is great though."
