,title,stars,date,r_title,text
0,Dumbo,10,8 July 2004,Short and sweet.,"All the other elephants shun Dumbo for his gigantic ears, and his mother has been locked up for protecting him, so he's all alone in the world... until Timothy Q Mouse shows up.A beautiful piece of work. At just 60 mins, it is short and sweet. But it also contains some of Disney's best visual poetry. Dumbo's not saying a single word means his entire character is created through the physical. The entire opening sequence, till the gossipy elephants start talking, plays out without words, and its like the best silent movies. Simply beautiful.Mrs Jumbo rearing up and destroying the big top to protect Dumbo from taunting kids is an incredible scene. Dumbo's mother spends the movie imprisoned in a carriage labelled ""mad elephant"" - and surely one of the most beautiful, heartbreaking scenes i've ever seen plays out when Dumbo and his mother have contact only by touching trunks, through the bars in the window of her cell. A beautiful sequence begins: the beautiful song ""Baby Mine"" plays as she cradles him in her trunk, and when Dumbo leaves she can't see him, and she stretches her trunk as far as she can out the window to try and reach him, and... oh, its too much!The pink elephants sequence is as close to trippy Disney ever got - and its brilliant. One of the best, most inventive sequences in animation history. Great song, too.Some terrific songs: Look Out for Mr Stork, Casey Junior (the train song), Pink Elephants, When I see an elephant fly and Baby Mine.10/10. Timothy Q Mouse is a great character, the animation is so concise and perfect, great songs, the message that if you believe you can overcome your handicaps you will so inspiring and beautiful, and the movie so short and sweet it will forever retain its appeal."
1,Dumbo,10,29 December 2003,A perfect film,"A perfect film.  The design is beautiful and deceptive in its simplicity. While it may lack the overstuffed quality of `Pinocchio' or the abstract one of `Fantasia,' the style of `Dumbo' is elegant, vivid, and occasionally grotesque in ways that recall not only classic circus posters but also Paul Cadmus paintings and vintage `New Yorker' cover art.  In fact, the entire production has a hint of nostalgia about it; for all its dark story elements, the film presents a rosy-hued portrait of old America (with Casey Junior cheerfully pulling his traveling circus through green open fields) that must have seemed very comforting as audiences prepared for the unforeseeable terrors of another World War.  (A `Dumbombers for Defense' poster in the film's epilogue is the one joking reference to an increasingly unsteady world situation.)  In the midst of this cozy landscape, we find a simple, tender story about acceptance and mother love, with the characters of both Dumbo and Mrs. Jumbo finding a wonderful eloquence in their muteness.  These performances are true triumphs of animation.  The other characters, both good and bad, are painted with broad, memorable strokes. It's become fashionable to look rather harshly upon the Jim Crow sequence and all its uncomfortable associations, and it can be difficult for a modern audience to watch it without cringing slightly.  But it should be pointed out that the crows are not only the film's cleverest characters (both in terms of thought and language), they are also the only ones except Timothy to show any sympathy whatsoever to the little elephant; after all, they are outsiders themselves.  The sequence is a play on a stereotype, that can't be denied, but I would argue that it is an attempt to revise that stereotype into something positive and sympathetic.  The songs and score are flawless, and the show-stopping, nightmarish pink elephant sequence keeps things from getting too artistically conservative--and, just like the rest of the film, it still thrills us no matter how many times we have seen it.  10 out of 10."
2,Dumbo,10,26 July 1999,"Short, sweet, and a few pink elephants","Disney had spent vastly more money than he'd planned on ""Pinnochio"" and ""Fantasia"", and got little of it back.  ""Dumbo"", next off the rank, was made cheaply, quickly, without fuss.  The result is simple but handsome. However handsome ""Dumbo"" looks, the animation is not very detailed, character design is hardly adventurous, the colours are few but bright, and in an hour it's over.  It needn't be more than this, though: the story is far from complicated.  It is, I'll admit, a story that has made me cry more than once; and in this instance I don't feel that I've been cheated into crying, because there really is something poignant and heartbreaking about this ugly duckling variant.Like Hans Andersen, Disney has to pad the outfit a bit to make it fill the space available; yet, with the exception of the introductory bit with the storks, it doesn't feel like padding.  In fact the most gratuitous piece of padding is the most necessary.  I refer to the pink elephants sequence: a masterpiece of extended unreality (caused by such a tiny quantity of champagne!) which dazzles and sizzles and all but soars out of the screen. It's the sting in Dumbo's tail, and nothing produced since can match its verve."
3,Dumbo,10,23 September 2000,Disney's endearing classic,"One of Disney's best known and loved films. About a baby elephant born in the tough world of the circus who is ridiculed and shut out because of his large ears. Comforted by his mother until she attacks a trainer and is penned up in a jaillike wagon, Dumbo eventually learns that he can fly and becomes a star. A great film that deals with discrimination, self esteem, the importance of family and friendship. Features a great score which it won an oscar for and a nomination for song, the beautiful ""Baby Mine"" . The pink elephants scene is a classic. Wonderfully done, arguably Disney's best on a scale of one to ten...10"
4,Dumbo,10,22 February 2009,7.4????? Are you people insane???,"This is clearly one of the great animated features of all time. How it squeaks by with a mere 7.4 voter average while all sorts of contemporary crap does far better is a mystery and a tribute to the downward spiral in cinematic taste. DUMBO is my favorite of all the classic Disney films (a group which ends with JUNGLE BOOK, completed after Walt's death). Nothing since then has been able to recapture the magic. Walt may have been, according to some people, a fascist and an anti-Semite, but he was also a genius.Things that make this movie great: The animation (I used to work at a zoo, and while the real elephants did little talking or singing the animators captured their body language incredibly well.)""Pink Elephants on Parade"".Effective but not over-the-top heartstring tugging.The musical crow number (""When I See an Elephant Fly""). I'm disappointed to discover the voice actors (Including Cliff Edwards, ""Ukelele Ike"" and the voice of Jiminy Cricket) were white guys playing black --- I was hoping they were some cool unknown black combo --- but it's a terrific number anyway.The 64 minute running time. It starts, tells it's simple story, then knows when the hell to get off the stage. I wish more film makers had that ability."
5,Dumbo,9,23 November 2001,A wonderful film from Disney's classic era,"As a kid, I would watch over and over several Disney features: Pinnochio, Peter Pan, Bambi, Alice in Wonderland, Lady and the Tramp, and Dumbo. When I come back to those films now, I recognize that they are all marvelous films and gave Walt Disney much deserved success. It's truly sad how far Disney has fallen. All kids' flicks now are awful. I revisited Dumbo, by the way, on the same night that I first watched Harry Potter and the Sorcerer's Stone, destined to be one of the most successful films of all time. It is execrable, and it is simply pathetic how bad films like it are nowadays. I say, bring your kids back to Dumbo, Pinnochio, Bambi, and the like. They may not be as harmless as the kind of movie Disney and others shove out today. You shouldn't be afraid of your children showing emotion. I can remember more than anything being profoundly affected by the ""Baby Mine"" number from Dumbo, where he visits his imprisoned mother. Films like these will mould your children's emotional stability instead of keeping them at a safe distance and selling them toys."
6,Dumbo,10,27 May 2011,Timeless classic,"This is easily one of the most touching and entertaining films I've ever watched. From the heartwarming deliverance scene at the beginning, when the stork brings the newborn babies to all the animals in the circus, through the hilarious and trippy Pink Elephants on Parade sequence (which still holds well to this very day), to the heartbreaking scene when Dumbo's mother is in chains and she rocks him with her trunk from beyond the bars.True, I've seen it first at the tender age of 4 or 5, so maybe the nostalgia factor has it's weight on my affection for this film - but I still think it's one of the most sweet and sentimental films ever made (even at the ""old"" age of 30)."
7,Dumbo,10,12 October 2007,"Ahhh, good memories!","I used to have this on video along with ""Alice in Wonderland"" (both of them were taped off TV and were on the same video) and I remember watching them all the time with absolute and unshakable content and happiness. Peolpe have written reviews saying that it's pretty dark and creepy, especially the ""Pink Elelphants"" sequence but I never was (and I'm NOT lying!). I remember the ONLY thing that got to me a LITTLE BIT was when the clowns were chatting after the ""Dumbo the Clown"" act; the clowns with the high and squeaky voice (some of the clowns have the same voices) creeped me out a little 'cause I thought they sounded evil (Ha! For people who have watched the movie it's the voice that says ""This one's on Dumbo!"", ""We really rolled them in the aisles!"" and ""Let's make it eighty feet!""). As for the ""Pink Elephants"" sequence, I found it really funny and I still do. So anyways, absolutely no family should be without this movie 'cause it's a very sweet film with a really important message."
8,Dumbo,8,3 April 2006,The One...The Only...The FABULOUS...,"I first watched ''Dumbo'' when I was very young,and I always remembered of it being a beautiful and sad movie. ''Dumbo'' in a way,is about the rejection of being different from the others and how this can hurt so much the people who are victims of people's prejudice. The main character Dumbo,does not speak a single word and even this way, you can know all the feelings he is passing through. The illustrators did a great job showing all animal's emotions in this way.A funny thing is that since I was a kid, I always found the scenes were the pink elephants were shown a little bit of creepy. They look like the clowns who were mocking Dumbo, maybe that's why I never felt a good vibe coming from this part of the movie.This movie is a classic from Disney and everybody should watch, including adults!"
9,Dumbo,10,12 April 2001,"Excellent, but a little dark","I used to LOVE this film when I was little and then, like most other kids' films I forgot about it. However, the other night I was babysitting until 3.30am and to keep awake I invaded the family's video collection. On watching Dumbo, I was as moved as ever, but also reminded of what a scary and shadowy film it is. My brother had to be guided out of the cinema, crying with his hands over his eyes, when he saw it, and that says a lot for a kids' film. The use of shadows and silhouettes is widespread and the weather is largely rainy and stormy. I can remember being scared during the scene when the train is travelling through the stormy night and particularly when the men (all black, I notice) are building the Big Top. The Pink Elephants sequence is imaginative and impressive for adults but imagine watching it as a kid - it's pretty scary. It's strange to have a film where the main character, title character even, doesn't actually talk, but I suppose there's nothing for him to say, his actions and expressions say it all. The treatment of Dumbo's mother always gets me, particularly the beautiful and haunting ""Baby Mine"" scene. However, through all the sadness and sinisterness, the heart of the film shines through, and it's a beautiful one with a wonderful message."
10,Dumbo,8,28 November 2013,Pathos and liberation with a little help...and pink elephants,"Dumbo (1941)There's nothing new to say about this movie, I suppose, but I saw it for the first time last night at the age of 55. I've always loved the classic Disney cartoons (""Snow White"" in particular) and have not loved the more recent Disney cartoon movies (though I appreciate the animation and Robin Williams in ""Aladdin""). So I'm struggling with why this movie didn't bowl me over.It was supposed to! It's made in the middle of many American cinema masterworksthe same year as ""Citizen Kane"" after alland it's just a few short years since ""Snow White"" and one year after the amazing (if long) ""Fantasia."" (That film lost so much money, Disney made ""Dumbo"" short and on the cheap, which explains a little.)What gives? I think the movie ended up simply being ""cute"" and ""for children,"" I put these in quotes because these are good things. But they didn't work for me, sitting up alone watching it as a movie. It's great on many levels of course, including ""Elephants on Parade"" where the animation takes a spin into fantasy. But the story line is as thin as it is cloying, sad as it is obvious. It's perfect for kids of all ages, as long as they don't mind getting their heads messed up. (Kids handle it well in general, but many comment on how it deeply affects them.)One interesting thing to notice: there is a hint (that I can tell) of World War II affairs in the telling. The Ringmaster's voice is by German-born actor Herman Bing, a Nazi sympathizer who later committed suicide. His accent, famously pan- European, is toned down, but it's here. This is no social protest film, of course. Charles Chaplin, being a concerned artist type, made ""The Dictator"" the previous year. Disney, a famous patriot in the old sense (and Republican), later went on (after Pearl Harbor in late 1941) to be extremely active and generous making wartime films (propaganda films, mostly) for the government. The most famous, of Donald Duck having a nightmare about Hitler in 1943, shows what is not here to an extreme. In fact, ""Dumbo"" has become more famous for the crows being voiced by African-American actors, and a debate, easily discovered on-line, goes into how racist this may or may not be. The voices are certainly typecast in a way very common in Hollywood movies of the time. They have a huge role in the film, however, and an interesting one to dissect. It's also been pointed out that poor Dumbo is never empoweredhe never speaks, for example, but he does get drunk, poor child. Of course, he also flies. For real. And he doesn't have peanut allergies, thank goodness. That's power.So ""Dumbo"" is a brilliant trifle, a compact flexing of some great animation muscle. It is not a brilliant story but it's a very sad one for children who love their mothers (or miss them very much, as I do). It's not a very imaginative telling of the story, for the most part, or even a groundbreaking bit of animation, for the most part. But it is enjoyableyes, endlessly. It's delightful and fun and whimsical and even at times very touching, heartbreaking. Which is all it needs to be."
11,Dumbo,7,14 April 2013,4th out of 5 in the Golden Era,"Dumbo was released a year after Fantasia in 1941. This film is about a male elephant who was born with huge ears gets constantly made fun of by the other elephants in the circus, and the humans. After a boy goes too far into picking on Dumbo, his mother goes crazy, and gets locked up in a speedster place for crazy animals. Dumbo then gets put into an act where he falls a ridiculously high distance. Will he be able to shine in the circus? This film may not be as good as the previous three, it is still a good quality film. A bit on the short side, you way to know what happens next in the plot. The characters are all endearing; Dumbo has a clear personality (even though he does not talk) and you do feel sorry for him, the mouse that helps Dumbo is a cute and entertaining character. The crows are hilarious, and are definitely one of the best aspects of the movie, and the mother elephant is a typical mother who watches out for their kid.The songs are pretty good as well. ""Baby Mine"" is a slow, emotional, melodic tune, ""When I See An Elephant Fly"" is an upbeat track that makes you want to dance, and the score is very good as well.The animation is not as good as the previous 3 (because of its small budget), but it is still very interesting, and you could tell that they animated it, so it could stand out from the other films. The Pink Elephant scene is so cool. The way that they go about and move is so brilliant and is beyond words. This is ranked lower than the others because although it is a great film, it is a bit too short (a bit over an hour), and the fact that it does not leave much of an impact on you like the others do. I think that if the film was a bit longer, you would get a bit more invested into it.If you want to watch a short, entertaining family movie, Dumbo is the movie to go to."
12,Dumbo,8,9 December 2009,"""When I See An Elephant Fly""","Grimm's tale of the ugly duckling is brought to the screen by an animated baby pachyderm whose large ears make him the butt of the jokes of all the other circus elephants. But Dumbo who is accurately named because he utters not a word, makes believers of everybody. More than in most of his animated features, Walt Disney had a sharp eye for satire in this film. Note how the gossipy female elephants do harm to the young Dumbo's psyche with their wagging tongues. His only friend turns out to be mouse with voice by street wise Edward Brophy, who does a great job in vocalizing the street kid who learns to take life on the chin and as it comes.The crows here have come in for criticism by some who have said Disney was being racist in his characterization. My guess is because Cliff Edwards, a white man, was giving voice to the head crow. That's a pity because Edwards does a fine job giving voice to the best song from the score, When I See An Elephant Fly. It never reached the heights of When You Wish Upon A Star which Edwards introduced as Jiminy Cricket in Pinocchio, but it sold a platter or two back in the day. I have a nice version of it sung by Jane Froman on an LP vinyl record.It was in its music that Dumbo scored his greatest success. The lullaby that Mrs. Jumbo sings to baby Dumbo, Baby Mine, got an Oscar nomination for Best Song. Frank Churchill and Oliver Wallace's music got the film an Academy Award for best musical score. Personally I think When I See An Elephant Fly has had more staying power.But Dumbo itself has great staying power. It's a feel good film for kids of all ages and a testimony to those folks who never give up and make lemonade when life hands them a lemon."
13,Dumbo,8,22 January 2008,Timeless,"Some people complain that the movie isn't visually impressive or doesn't hold up to recent movies. You just can't compare them! It's OK that the animation and special effects didn't take precedence over the actual story or characters and they didn't try to build an entire movie around a breakthrough in visual effects (I'm talking to you, ""Happy Feet"").I've watched Dumbo with my 2- and 4-year-olds and they like it just as much (or more) as any new release. I think it's fascinating that the bulk of the story is told through music and the sweet body language of the baby and his mother. Of course there's some important exposition that has to be given by Timothy or the gossipy elephants but overall, the most powerful scenes are when no one says a word. ""Baby Mine"" will always bring a tear to my eye.A movie that I loved as a child and has touched a different place in my heart as a mother."
14,Dumbo,,31 January 1999,The Perfect Disney Cartoon,"This is the quintessential Disney cartoon: brief, engaging, and profound  storytelling at its finest. Where ""Snow White"" doesn't make the cut (begins with rapidly developing melodramatic plot, pauses for most of an hour to allow forest creatures and midgets to play cute, and wraps up quickly), ""Dumbo"" spins its wise lesson with elegant timing and charming characters. We all can use that magic feather once in a while."
15,Dumbo,9,7 July 2013,"""Dumbo"", the little elephant that could","I believe it's safe to say that we all have been in the same shoes as the main character of Walt Disney's 4th animated feature ""Dumbo"" (1941) at least once in our lives before. Anyone who had either seen this picture or had been picked on and/or bullied in school knows what it feels like to go through what the main character does in this film. The main reason why ""Dumbo"" has always been one of Disney's most timeless animated treasures is because so many of us can identify with the sadness and pain that the title character feels from all the unfortunate circumstances he's put under. Obviously, that isn't the only reason why ""Dumbo"" holds up well after all these years. Our main character is a baby elephant named Dumbo who is ridiculed by fellow circus animals and humans for his enormous ears. His mother Jumbo is the only elephant who is kind to Dumbo and willing to defend him. But when she gets into trouble for trying to protect Dumbo from harm, she gets locked up in a cage and Dumbo is now alone. That's when a circus mouse named Timothy comes in and becomes his only friend outside his mother. Timothy promises to do whatever he can to help Dumbo overcome his obstacle by making it into his strength. Right off the bat, I must say that it was ingenious to make Dumbo's best friend a mouse, given that elephants are supposed to be afraid of mice for whatever reasons. I loved how even though sad things keep happening to Dumbo, he's the only elephant in the circus that has a mouse for a friend. That was a very clever idea on the writer's part. I also found Dumbo's relationship with his mom to be deeply touching and emotional. The filmmakers were smart to keep the dialogue out of the scenes between Dumbo and his mom and let the heartwarming images drawn by the Disney animators do the talking. Remember a brief scene early on when Jumbo wraps Dumbo's ears into a blanket and gently rocks him back and forth with her trunk? That was a cute little scene. You couldn't make this part of the movie better with dialogue since it manages to work perfectly well as it is. Speaking of great scenes, how about that infamous pink elephants sequence? Argue all you like about how it contributes little to the plot and how a certain scene before it could send the wrong message to kids with Dumbo and Timothy accidentally consuming alcohol. That pink elephants scene is still a cool scene to watch. Considering the time in which it came out and all of the bright, colorful and surreal imagery being shown on screen, that scene was truly ahead of its time in terms of its content. In regards to the controversy involving the crows that help Dumbo discover his true destiny and whether or not they are racist, I honestly don't see what all the fuss is about. In my opinion, they were cool, free-spirited creatures who are just enjoying life. On top of that, the main leader of the group was voiced by a white person, Cliff Edwards to be precise and he did the voice-over work for Jiminy Cricket in ""Pinocchio"" (1940). So it makes the argument even less credible. Personally, nothing about these crows would've offended me if I was an African-American. If there was a scene that might have offended me if I were an African- American, it would be the Roustabouts song earlier in the film. During this song, it looks like African-American slaves are setting up the circus tents along with the circus animals. And I swear I heard these very words somewhere in the song ""We don't know when we get our pay, and when we do we throw our pay away"". They could be saying that they enjoy being hard-working slaves and they only enjoy living for that reason. To be fair, they're always shown in shadows and the lines (like the one I mentioned) seem to have a double meaning. I guess this only goes to show you how complicated race issues were and still are. In the tradition of the best Disney pictures, another one of the film's strengths is in its music and songs arranged by Frank Churchill, Oliver Wallace, and Ned Washington. Along with its wide range of music from softer music to circus music, the film's songs are still memorable to this day especially ""Casey Junior"", ""Baby Mine"" and ""When I See An Elephant Fly"". The music and songs have noteworthy variety to them and they are all handled very well. The animation was intended to be more basic than the three previous Disney films before it (""Snow White"", ""Pinocchio"", ""Fantasia""), but it's still well done in its own right. The animation compliments the simple story that is being told very well. There's no need to remake it and advance the animation further, since it works perfectly as it is. ""Dumbo"" was intended to be a simpler film than the other three Disney animated features both with its animation and its story. And yet, it manages to top its three predecessors because it has the best balance of everything that made Disney films terrific to begin with. Even with a brief running time of just over an hour, ""Dumbo"" is more evidence that a great film which lasts over an hour is preferable to a lousy film that lasts around two hours."
