,title,stars,date,r_title,text
0,Lady Bird,9,4 January 2018,Saoirse Ronan shines,Saoirse Ronan has the ability to get the viewer's sympathy like no other actress. Her sweetness just makes all she is going through so much more involving and moving. The subject matter is a young girl in high school discovering relationships with boys and struggling with her very strange mother played by the excellent Laurie Metcalf. Things like this have been done before but never quite so lucidly. Watching her deal with her gay boy friend then the douche bag boy friend then her difficult mother are played out in such a spontaneous manner with very well written natural sounding dialog. Makes you want a part 2.
1,Lady Bird,8,27 December 2017,eight for great,"Lady Bird is a good indie movie. The cast is great, especially the lead.
Thank you Greta, for making a ninety minute movie! I give it eight coz it is excellent. I take away two stars because of cliched identity politics and because of Lady Bird's Mom who keeps referring to hers and others social status."
2,Lady Bird,9,18 December 2017,Character Is The Thing,"How refreshing and invigorating to meet new people. Familiar and new all at the same time. Familiar because the extraordinary Saorise Ronan connected me to her soul, as soon as she appeared on the screen. Remarkable. She is, without question, one of the best actresses of her generation. She has exceptional support here, Laurie Metcalf as the mother determined to keep her feelings at bay, Lucas Hedges, providing one of the most moving, truthful moments in the film and allowing Saorise Ronan to give us a masterful class in empathy. Timothee Chalamet proves in a very short space of time that he is here to stay. His Elio in Call Me By your Name will be considered one of the great breakthrough performances in film history. Tracy Letts plays the father with irresistible humanity and then, of course, a heartfelt congratulations to the writer, director Greta Gerwing -"
3,Lady Bird,7,11 January 2018,Inspiring Film for Teenagers,"""Lady Bird"" is an inspiring film for teenagers and practically the directorial debut the unknown Greta Gerwig, who is also the writer of this sensitive coming of age story. Saoirse Ronan has wonderful performance in the role of Christine 'Lady Bird' McPherson, a teenager with typical adolescent problems. Troubled relationship with her mother and siblings; high-school pranks; romance; sex; disappointments with boyfriends and friends; financial problem; dream on going to college and improving life, all these elements are realistically explored by Greta Gerwig, maybe based on her personal experiences in Sacramento. The optimist conclusion with the growth of Christine is another plus in this original film. My vote is seven.Title (Brazil): ""Lady Bird: É Hora de Voar"" (""Lady Bird: It Is Time to Fly"")"
4,Lady Bird,,4 November 2017,Sweet coming of age story with quirks,"Greta Gerwig has been an ""it"" girl on the indie scene for several years. It may be a bit ironic that her most acclaimed movie would come when she stepped behind the camera with LADY BIRD (she previously co-directed NIGHTS & WEEKENDS, and co-starred as well). Here, Saorise Ronan is the stand-in Gerwig as a character named Christine, who like the real Gerwig, is a rebellious teen in Sacramento California who dreams of New York City.Christine has re-dubbed herself ""Lady Bird"" and is going to a Catholic High School and is going through all the usual growing pains. Grewig has made a name for herself with her quirky characters and there's more than a bit of that to wade through here. It takes some time to get past the notion that Ronan is giving her own performance here and not just doing a Greta act (similar to many a Woody Allen lead performance by 'substitute' Woodys). As fiercely individualistic as Gerwig is as an actress, Ronan gives Lady Bird a bit of a softer and more vulnerable side that is more effective than if Gerwig had performed it herself. Kudos to her for embracing it.Most importantly, Gerwig does an excellent job at keeping the movie rolling along at a brisk 93 minutes, with some scenes being literally seconds long - nothing self-indulgent here (although there is a scene or two that could have been allowed to breathe a bit). The cast, including several young actors is uniformly fine. Laurie Metcalf as her tough mother could have used a little leavening. As written and performed, she comes off a bigger harridan than is what was likely intended. Some of the offbeat mumblecore touches stick out as unnecessary, but, what separates LADY BIRD from so many of them (including, frankly, a number of Gerwig's movies), is that there is genuine heart and compassion here, not just ironic detachment. Further grounding things is a keen appreciation of middle class life with the scenes of shopping at thrift stores, window browsing for homes they can't afford etc. - or, as Lady Bird sardonically refers to it: ""Coming from the wrong side of the tracks."" Credit, too, for not ending in the conventionally expected way. Just a warm sigh."
5,Lady Bird,8,26 October 2017,A Meditation on Place and Family,"Lady Bird was very well-received at its local premiere at the Paramount Theater for the Austin Film Festival. I found it to be a sweet, charming coming-of-age film. It is a serious film, but with flashes of humor. Greta Gerwing wrote and directed the film which seemed to be partly autobiographical in that she grew up in Sacramento, CA at about the same time as her character. The film is a meditation on what it means to be from some place and what that idea of home means in shaping who you become. She has a love-hate relationship with her city, her family and her place in both. It is also very much a story of young girl struggling with her own and her mother's expectations for herself. The script is really charming with the best scenes being those of Lady Bird and her mother. Lady Bird is struggling with sexuality, family, friendship, religion and even her own name all at the same time. Like all of us, she is trying to find her place in the world. Saoirse Ronan is excellent as Lady Bird as is Laurie Metcalf in the role of her haggard struggling mother trying to hold her family together through difficult times. Recommended to those who like drama, particularly coming-of-age films."
6,Lady Bird,6,19 November 2017,Mothers and Daughters and growing up in Sacremento.,"Greta Gerwig, usually disappoints me - as an actress and now in her writing and directorial debut, LADY BIRD, a coming-of-age film about a seventeen-year-old girl growing up in Sacramento ""the Midwest of California"" (the best line in the film,) and the love/hate relationship she has with her working-class family and peers. Social distinctions figure prominently in Gerwig's cinematic world of ""ironic class strivers."" I keep wondering why I am left cold by her words and her characters and eventually understood that LADY BIRD is too self-consciously trying to be inclusive - inclusive of every contemporary issue - touching upon a diversity of characters and situations with momentary episodic flashes.The touch is light, illustrating concerns rather than delving into them, giving us tokenism - glossing over deep pain and longing with a CliffsNotes diminution.Saoirse Ronan is excellent as Christine ""Lady Bird"" McPherson - a nickname she gives herself to appear distinctive. I am sympathetic to the aspirations of a young, self- involved teenager searching for a path to glamour and excitement. Youth is an innocent time - one open to endless fantasies - reality has not yet penetrated the hermetic world of dreams. The ""firsts"" of the teen years - first kiss, first sexual experience leading to the loss of virginity, first self-awareness of one's own ethical and moral values, and the critical realization that the world is not always spinning for you alone - solely for your personal gratification.The film opens with Lady Bird and her mother - a wonderful performance by Laurie Metcalf - who is driving and listening to Steinbeck's Grapes of Wrath on audio tape - both simultaneously weeping, moved by the beauty of the spoken words; their mirrored responses reflect their enduring affection. And suddenly the mood is shattered and we see the other side of their relationship - a mother who works double shifts as a psychiatric nurse to supplement the family income so that her daughter can go to a private Catholic school; the burden of monetary expenses weighs heavily on her shoulders. The ever-present resentment that comes with sacrifice is often unleashed on her oblivious daughter in a torrent of sarcasm, humiliation, and disparagement.Greta Gerwig is at her best in the scenes between mother/father and daughter. A lovely tenderness exists which is often choked and stifled by the exigencies of financial straits.The underpinnings are there for a truly fine movie, but in the rush to cast a wide net, Gerwig compromises her subjects' humanity, placing a veil of bromides over what could have been profound interactions. Maybe next time. I hope so."
7,Lady Bird,7,29 December 2017,Good Directorial debut !,"When you hear all the fantastic praise that a new Oscar bait film is getting, you should probably watch it. Even though I'm personally not the target audience or demographic for this film I still ended up liking the film quite a bit.The biggest accomplishment and positive in the film is the directing by Greta Gerwig, which for a first time directing is an outstanding achievement. You honestly would not be able to tell if this was directing by an all time great or a newcomer. She has done an amazing job directing the film in this regard it has no faults at all. With this being her first film she has an extremely bright and interesting future ahead and I'm definitely now keen to see what she does next. The other main positive of the film are the performances which across the board are fantastic, however there are a couple of standouts. Firstly Saoirse Ronan who is fantastic in the film and brings such heart to the character of Lady Bird. For me personally this is one of her best performances that she has done and only increases her reputation. Hopefully this will open up the door for her to get bigger roles more often, she is brilliant. The other standout in the film is Lady Bird's mother played by Laurie Metcalf, she is again incredible in the role and brings elements to her character that I think everyone will recognise in their own mother. She hopefully will get some awards buzz and maybe even a nomination.Unfortunately though and I know that this is my own personal problem and fault that I feel this is film maybe a little overrated. This is partially to due my fault because well this isn't my type of film, I know thats not the films fault. I could never really connect to the story of the film but again thats my own opinion and fault, but I can understand how and why people really do connect with the story. Lastly the film is good is just nothing amazing or ground breaking in any sense so thats where I'm a little......not disappointed...... let down by the film because I was expecting a lot more considering the praise. Overall its 70% out of 100 or 7 out of 10 its a good film and its a brilliant starting point for Greta Gerwig's directing career. As well as bringing us great directing it gives us two great performances that will really leave an impression on you after watching it. However because I couldn't connect to the film that much it didn't hit me as hard as it should emotionally, but again thats my problem really not the films. Best directing Oscar Nomination?"
8,Lady Bird,10,10 January 2018,Seems to perfectly capture a time and place in a certain person's life.,"'LADY BIRD': Five Stars (Out of Five)An indie comedy-drama about a high school senior that's trying to deal with teenage life, while living with her overbearing mother in early 2000s Sacramento. The film was written and directed by first time feature filmmaker Greta Gerwig, who also co-wrote 'FARANCES HA' and 'MISTRESS AMERICA' (with director Noah Baumbach), which she also starred in. It stars Saoirse Ronan, Laurie Metcalf, Tray Letts, Lucas Hedges, Timothee Chalamet, Beanie Feldstein, Stephen McKinley Henderson and Lois Smith. It's received unanimous rave reviews from critics so far, and it's also been nominated for multiple prestigious awards as well. I really enjoyed it. The story is set in Sacramento, over the school year of 2002 and 2003. It revolves around a senior named Christine McPherson (Ronan), who has changed her name to Lady Bird. Lady Bird struggles to get along with her overbearing mother (Metcalf), and she applies to multiple colleges outside of Sacramento, against her mother's wishes. She also struggles to get along with the other students at her school, and romantic relationships with boys her age are especially a challenge for her. The story concludes with Lady Bird going to college, and you'll have to watch it to see where she ends up going.The movie is a great coming-of-age tale, that seems to perfectly capture a time and place in a certain person's life. Ronan is awesome in the lead, and Gerwig definitely proves she's a talented filmmaker as well. The film is funny, sweet and it touches on a lot of important issues, I think, to a young person Lady Bird's age. The relationship depicted between her and her mother is also really touching at times too. I definitely recommend it."
9,Lady Bird,7,7 January 2018,Metcalf gets the most praise in this fine fiilm about life,"Christine McPherson aka ""Lady Bird"" (Saoirse Ronan) is in her senior year in a Catholic school in Sacramento, California and desperately wants to go to a liberal college in the northeastern US. This causes conflict with her mother Marion (Laurie Metcalf).Lady Bird is someone who can be inconsiderate, selfish, insecure, good-hearted, ambitious beyond her abilities, naïve, fun, and able to redeem herself. In other words, she is a confused teenager on the cusp of adulthood and Ronan plays the part superbly.Like the recent ""Florida Project"", ""Lady Bird"" is a series of short scenes that collectively make a fine film. It has sharp directing by Greta Gerwig who also wrote the screenplay. There are also engaging sidebar stories including other characters that add greatly to the main mother-daughter conflict: the despair of losing a job later in life; financial burdens; periodic depression; the inner-conflict of being young, gay, and Catholic; the futility of social climbing; the belief that ""there"" is better than ""here"".The coming-of-age genre is so common that it's difficult to raise the bar. ""Lady Bird"" at least meets the standard and then some though it could have been more. In fairness, the two lead performances do stand out especially that of Metcalf. She shows so much push-pull with her daughter while trying to come to grips that her daughter will soon leave home. She also has the brilliant ability to let the emotions build gradually and then attempt (as we do in real life) to resist them until the attempt is futile. No wonder Metcalf is winning so many awards and award nominations. While she gives a rich performance, I believe the film would have been greater if she had been given even more screen time."
10,Lady Bird,9,15 November 2017,expert filmmaking and story telling,"Greetings again from the darkness. Joining the likes of Woody Allen, Mel Brooks and Ben Affleck, Greta Gerwig proves her significance and brilliance is most apparent behind the camera, rather than in front. Her first feature film flying solo as writer and director is without a doubt, one of the year's best. Surely she has benefited from having a very talented live-in muse and mentor and partner in Noah Baumbach, but this extraordinary film is clearly Ms. Gerwig's passion project  and it's a thing of beauty (character warts and all).Ultra talented Saoirse Ronan plays Christine, aka ""Lady Bird"". She claims it's her given name  a name she gave herself. Entering her senior year of Catholic High School in Sacramento, she's the typical blend of teenage insecurity, bravado and restlessness. Her never quite satisfied mom is played by Laurie Metcalf, in what is probably her career best performance, and definitely worthy of Supporting Oscar consideration. A brilliant opening scene finds mother and daughter sharing a cry, which quickly devolves into one of the endless stream of arguments that make up half of their relationship. Their scenes together are sometimes caustic, always realistic, and likely to hit home to many mothers and daughters watching.Lady Bird is convinced she must escape 2002 Sacramento and live on the east coast, where she assumes culture thrives. This is the age where every teenager is convinced an amazing destiny awaits them  not stopping to contemplate what talent they possess that might actually contribute to society. Lady Bird is an average student who seems to dream not of greatness, but rather of some vision of life where she will be appreciated for simply being herself. So much of what happens is grounded in the reality of high school life, friendships, and family. She jumps at the chance to be friends with the ""it girl"" who controls the ""in crowd"". Leaving her lifelong best friend Julie (Beanie Feldstein, Jonah Hill's real life sister) in the dust, Lady Bird finagles her way into Jenna's (Odeya Rush) inner circle of rich kids, including the cooler-than-cool Kyle (Timothee Chalamet, CALL ME BY YOUR NAME). He's the bohemian-wannabe type we've all come across. Her attraction to Kyle results in confusion over her relationship with nice guy Danny (Lucas Hedges, MANCHESTER BY THE SEA). The film touches on many familiar topics, and the script elegantly handles each piece of the puzzle and gives each character their due. Lady Bird's middle class family is going through some financial difficulties after her dad is laid off. Tracy Letts is superb as the dad who is beaten down by a life that's nearly passed him by, but he staves off his own depression just enough to provide the basic strength needed by his wife and spirited teenage daughter. Mr. Letts and Ms. Metcalf aren't TV sitcom parents carefully positioned as punchlines for clever kids, like what we typically see. The emotional bond between parents and offspring is perfectly awkward and deep. Mother and daughter have their shared escapes, while father and daughter share some secrets. There is also a complex sister-brother dynamic, as well as the common issues of school days  teenage girl self-respect, class warfare, teacher crushes, and the pressures of extracurricular activities. Lois Smith has a couple of outstanding scenes as a wise and observant nun who sees Lady Bird for who she is, and provides the necessary guidance. Welcome comedy relief is combined with an editorial statement on the ongoing reductions in funding for the arts, as the football coach (Bob Stephenson) is put in charge of the drama department.Ms. Gerwig's excellent (quasi-autobiographical) film defies traditional categorization. It's part teenage comedy, coming of age, family drama, and character study  yet it's also so much more. Have you seen much of this before? Absolutely, and it's likely at least some of this has occurred in your own life, though you may not always enjoy being reminded. What is enjoyable is watching the work of a skilled filmmaker and exciting new cinematic story teller."
11,Lady Bird,9,3 January 2018,Lady Bird Review,"Lady Bird is a film written and directed by Greta Gerwig. I just happen to watch the trailer my chance and decided to give a go for this film. After watching the film, I can say that I was quite satisfied watching this film.Plot: The film chronicles the life of Christine (Lady Bird) a student of a Catholic school in the years 2002-03.Story and direction: This film has most perfectly shown the way adolescents react to situations. The way the film has woven in the situations any adolescent faces is commendable. Lady Bird as a character has so many shades. We see her being naughty, stupid, funny and emotional. Then comes her friends. Jules is kind of that supporting friend you always have on your side no matter how wrong/right you are. Jenna is the kind of friend that you want to have because of her being so flamboyant. Then we have her so called boyfriends who were poles apart in their own different way. I being from a Catholic school could connect with the film more easily because I have been in that kind of environment. Even the teachers's characters were so beautifully woven into the story. I also liked the parents' character of Lady Bird. While the father who is mostly supportive in many of Lady Bird's ventures, the mother is the conscious one who is always sort of scared for her child. Even she reacting so rudely to Lady Bird, was a way of showing her love to her. And then the finale of the film, just put a good finish and a nice arc to Lady Bird. My only issue, and this could only be me, is that These kind of films are seen so often that one can predict as to what is going to happen.Performances: Sairose Ronan once again just delivered an applauding performance as Lady Bird. I loved her in Brooklyn (that came out 2 years ago), and still she proves that she is a force to be reckoned with. Laurie Metcalf was also great as the mother. Tracy Letts also delivers a good performance. Lucas Hedges and Timothee Chalamet were also so distinct in the roles they played. Beanie Feldstein also provided some great support to Lady Bird's character.Favorite Scene: It would be the scene where the sister calls Lady Bird in her room for putting the 'Just Married with Jesus' signboard on her car and also explains her that isn't love and attention the very same thing. That dialogue resonated with me. It's because that we seek love, that we do things that bring people's attention to us. And this dialogue also applies in real life to any person who seeks to be loved.Verdict: This film is perfect for all adolescents who are going through this phase. It will very easily connect with them. Kudos to Greta Gerwig and team. I am going with a 9/10."
12,Lady Bird,,10 December 2017,"A Beautiful Movie that makes you laugh, cry and think","In a revival year for movies, one with an abundance of notable gems, Lady Bird manages to stand out in the crowd. While taking on the coming-of-age angle, which has been done to death for 30something years, direct Greta Gerwig makes this one different. She brings freshness to a stale genre by releasing a steady stream of humor, heart, and honesty. Gerwig's first solo directorial effort features the winning young actress who is also quickly becoming a veteran actress Saoirse Ronan (Brooklyn, Atonement). Ronan shines, playing a Gerwig surrogate of sorts and showcasing a flawless Sacramento accent. Named Christine McPherson by her parents, she decides to instead go by the name Lady Bird. As she calls it, her given name (she gave it to herself). Mom (Laurie Metcalf) and Dad (Tracy Letts) are both perfectly cast joys to watch. Mom and Lady Bird flip a switch between sharing joyful moments to clashing in heated ones. Sweet and supportive dad does his best to help them both, even while fighting his own depression. Best friend Julie (Beanie Feldstein) is delightful to viewers and loyal to Lady Bird. In her search for her identity, Lady Bird tests out a new best friend and an ill-fitting musician boyfriend (Timothee Chalamet). She lies about herself to both of them, pretends to live in the rich neighborhood, lies about her parents, trying to seem cool. Classic high school move, one of the cliché moments. The movie isn't entirely original, but what makes it so special is that everything feels authentic, never crammed in to fit a template. The characters and problems could have come across as stale and vacuous, but they contain real depth and honesty, so they're always compelling. Lady Bird meets another boyfriend, Danny (Lucas Hedges, Manchester by the Sea), while rehearsing for the school play. He resists the temptation of sex with her, ""out of respect."" Their relationship comes to an abrupt end but not before he describes Lady Bird's mom as ""warm and scary."" While Lady Bird scoffs at this descriptor at the time, she later recognizes the truth in it. She spends so much effort preventing people from seeing her family for who they really are that she never truly sees them herself. There's something in this movie for everyone. We may not all be now, nor have ever been a pink-haired teenage girl in Sacramento, but we all know what it's like to feel unsure about who we are and who we want to be. Lady Bird covers familiar experiences, but not only the pleasant ones. It's not an ""aww"" fest. Gerwig's directs the way Lady Bird's mom parentswith toughness and care. She explores the humor and hurt with equal deft. Her movie is heartwarming and heartbreaking. It will make you laugh, it will make you cry, and it will make you think. Gerwig delivers a story extremely personal to her in a way that makes it feel personal to all of us. Lady Bird is a wonderous success and truly one of the year's best movies."
