,title,stars,date,r_title,text
57,Lady Bird,10,23 November 2017,Good old fashion coming of age.,"On this planet, specifically within the borders of the United States, countless people dream of lives that just aren't obtainable, or at the very least harder to obtain than said people perceive. In Lady Bird, the writing and directing debut for Greta Gerwig, a go to for Noah Baumbach, Christine McPherson dreams of a life in New York... where the culture is. She is constantly reminded that she would never be able to go because she is a bad student, and on top of it, out of state tuition cost ""a lot of money"". Christine, self labeled ""Lady Bird"", is constantly at odds with her mother, her brother, and most others around her. During a scene in which a woman is presenting a lecture on abortion, she says something so disrespectful, that she ends up suspended. This movie isn't that kind of coming of age story though... not like Thirteen or Edge of Seventeen. This is a story about mothers and daughters and hometown pride. The screenplay is subtle and exhibits small quiet scenes of discourse that never once cross over the derivative threshold of melodrama. Gerwig, basing this loosely on her life manages to provide a vision of pure art while maintaining the qualities that make high school movies popular and entertaining in the first place. This movie is about the relationship between two women, one growing up, the other already grown. It is always about the mother accepting the individuality of the daughter, and the daughter accepting that her mother is not out to get her. The story manages this central narrative idea while balancing the young love life of Christine, presenting her with two relationships that change who she is, shaping her during the course of the movie. The story balances these two male counterparts perfectly, thanks once again to Gerwig's directing and Chamelet and Hedge doing fine work. All in all, this is a great film, that must experience by any mother and daughter in a trying relationship."
58,Lady Bird,,22 November 2017,"Charming, entertaining, and incredibly well written and acted","It's hard to know what to say about Lady Bird. Currently it sits at 100% on Rotten Tomatoes with about 150 reviews, which is a testament to how truly likable the film is. It would be hard to see many people disliking this, if any. Despite its acclaim, it's a relatively simple coming-of-age film. We've seen many like this, and while there are many good, even great ones, Lady Bird is one that truly captures the difficulty of growing up and the gratitude that sometimes escapes us about the sacrifices others have made for us. It's simple, but a film with a lot on its mind, and it translates to the screen incredibly well. Both Saoirse Ronan and Laurie Metcalf deliver some truly powerful, genuine, authentic work, and I really hope both are able to get Oscar nominations for their work here."
59,Lady Bird,9,3 December 2017,Simple But Incredibly Effective,"Does this movie follow the same formula that every other coming-of- age film follows? Yes, it does. But what makes Lady Bird so special is the performances across-the-board, and the writing and direction by Greta Gerwig. Saoirse Ronan is a force to be reckoned with. She is only 23 years old, and is already a two-time Academy Award nominee. And I do think there is a strong chance that she'll gain a third nomination for her role in this film. Ronan brings such humanity and energy to this character. She's quirky and out there, but not just for the sake of being so. It works for the character, and Ronan plays it so well. I guarantee you; she is an actor who will be around for a very long time, and this movie reaffirms that for me. Laurie Metcalf is also fantastic as the mother. She has a great dynamic with Lady Bird that gives the movie so much of its conflict, as well as its heart..."
60,Lady Bird,8,16 November 2017,A beautiful Youth,"Ladybird is a movie directed by Greta Gerwig. It is a comedy about a young girl played Saoirse Ronan who moved to Sacramento with her family to live a new life. However she is struggling to adapt to strict Catholic school she is in and her family's financial difficulties. She is trying to establish healthy relationship with people around her, especially her mother. This is the first film that I have seen in a long time, where I didn't see a single trailer or a poster other than knowing Saoirse Ronan is in the film and apparently the film was very good. That's why in the plot summary I didn't say much because to say anything more would be to describe every single little details happened in the film. I always loved Saoirse Ronan and I think she is a very talented young actress with great potential. She was in Hanna, one of the most underrated actions in the decade and I loved her performance in Brooklyn and Grand Budapest Hotel. After the failure of the Host, she went to back indie root and played in more arty film. This is a pleasantly surprising good movie. When the film starts, you have the impression that it is a coming of age story, which it is, but as the film went on it goes deeper and even darker. It dealt with subjects like anxiety, depression and even sexual identification. However doesn't play off in a serious tone, after all it is a comedy, it felt normal and lighthearted. And that is something missing in our mainstream movies. We don't see a lot of movies that felt like we are watching something as if it was unfold to us in real life. It is mostly thanks to the amazing acting the cast offers. I would say this is the best performance Saoirse Ronan has to offer. Also the mother played by Laurie Metcalf was very good and even though she constantly conflicting with her daughter, you understand why she is frustrated and you can tell that deep inside she loves her more than anything else. And that is the biggest strength of the film: because it felt so real and lighthearted, you felt every emotion the characters felt; joy, anger and pain. You understand how and why everyone do the things they do. I am surprised how dark some of the subject matters got, well at least for me personally. Last but not least, I have to mention the clever editing used in the film and its beautiful cinematography. I don't have too much complaint with the film, but there are a few nick picks. One of them was the pacing. The film is only 1 hr 33 mins long. There some scenes felt a bit rushed. I wish the film could slow down at times. The biggest flaw in the film I felt is with the ending. I won't spoil it but I felt it could be executed better and I thought it dragged a bit. What is more, some of the characters arcs are not resolved, but it doesn't bother me that much. Lady Bird is a very surprisingly good movie. I had a great time with it and made me feel hopeful. It is one of the best coming of age comedy I have seen. Even with its minor flaws I would highly recommend it to people. And if you are a teenage experiencing hardship, go watch it, it will make you feel better. 8.5/10"
61,Lady Bird,9,10 November 2017,'Lady Bird' Spreads Her Wings,"Portraying a likable rebel is a hard thing to do on screen. You would have to set up why they are the way they are, and still be able to give them fleeting moments of empathy or just go all the way with no regrets. Lady Bird takes a stab at finding the balance from first time director Greta Gerwig in a relatively conservative scenery but does a lot to make her stand out in this hilarious coming of age story.Lady Bird (Saoirse Ronan) is Catherine McPherson's given alias when she becomes bored living her familiar life while in a Catholic High School in Sacramento. Her new persona makes her become more wandering and naturally gravitating to many different things around her like boys, new female friends and the dream of finding more like herself in a east coast college away from home.Saoirse Ronan does a great job as a rebellious yet empathetic teenager as her angst does feel like it comes from a genuine place. What I've always had issues in the past from coming of age films is they make the teenagers problems feel self inflicted, but instead her character is coming more from a place of needing to explore more in life. The director also gives a lot of great snappy dialogue with all the characters and having some truly hilarious moments (there's a scene where the kids are slow dancing to Bone Thugs n Harmony's The Crossroads that has me screaming).As for faults, there aren't too many, but are more so nitpicks within this films wings. While the film has a great first and third act, the second act has a couple of dragging moments. It's not often or super noticeable, but some of the films strongest points are around the outer shell.Lady Bird doesn't reinvent the wheel of coming of age stories, however it does move with a lot of charm. Saoirse is great in he lead role, a really strong script and has you on a ride with a character learning from their mistakes and understanding how their actions affect others. Rating: 9.3 / 10"
62,Lady Bird,8,12 December 2017,growing up here to go away,"Lady Bird directed by Greta Gerwig ( liked her in Maggie's plan) is a simple story about a simple senior high school girl Christine known as 'Lady Bird' ( played very well by Saoirse Ronan ) who wants to get out of Sacramento and live somewhere on east coast. Lady Bird's mom Marion (superb acting by Laurie Metcalf known for playing sheldon's mom in Big Bang Theory) , dad Larry ( good acting by Tracy Letts), brother miguel(actor jordan rodrigues) are a supportive family for Lady Bird who wants more from life. Saoirse Ronan did very well as Lady Bird who has a head on her shoulders and is confident that east coast has everything that Sacramento lacks. She lives her senior year with enthusiasm and looks forward to fulfilling her dream. She understands her dad's depression and appreciates her mom who is hardworking, affectionate and loving. Greta Gerwig's direction is commendable . Oscarworthy acting by Saoirse Ronan and Laurie Metcalf. Good screenplay."
63,Lady Bird,10,29 November 2017,Seems to perfectly capture a time and place in a certain person's life.,"'LADY BIRD': Four and a Half Stars (Out of Five)An indie comedy-drama about a high school senior that's trying to deal with teenage life, while living with her overbearing mother in early 2000s Sacramento. The film was written and directed by first time feature filmmaker Greta Gerwig, who also co-wrote 'FARANCES HA' and 'MISTRESS America' (with director Noah Baumbach), which she also starred in. It stars Saoirse Ronan, Laurie Metcalf, Tray Letts, Lucas Hedges, Timothee Chalamet, Beanie Feldstein, Stephen McKinley Henderson and Lois Smith. It's received unanimous rave reviews from critics so far, and it's also been nominated for multiple prestigious awards as well. I really enjoyed it. The story is set in Sacramento, over the school year of 2002 and 2003. It revolves around a senior named Christine McPherson (Ronan), who has changed her name to Lady Bird. Lady Bird struggles to get along with her overbearing mother (Metcalf), and she applies to multiple colleges outside of Sacramento, against her mother's wishes. She also struggles to get along with the other students at her school, and romantic relationships with boys her age are especially a challenge for her. The story concludes with Lady Bird going to college, and you'll have to watch it to see where she ends up going.The movie is a great coming-of-age tale, that seems to perfectly capture a time and place in a certain person's life. Ronan is awesome in the lead, and Gerwig definitely proves she's a talented filmmaker as well. The film is funny, sweet and it touches on a lot of important issues, I think, to a young person Lady Bird's age. The relationship depicted between her and her mother is also really touching at times too. I definitely recommend it.Watch a new episode of our movie review show 'MOVIE TALK' at: https://youtu.be/xsOj7IhB5us"
64,Lady Bird,9,28 November 2017,Life Can Be Many Things at Once,"I've always had a complicated relationship with Greta Gerwig as an actress. On the one hand, there's something very off putting about her, as if she's always being weird on purpose to turn others away before they have a chance to reject her. On the other hand, there's something fascinating about her that makes me want to return to her again and again.Watching ""Lady Bird,"" her wonderful, biographical coming of age film, made me understand Gerwig better. Saoirse Ronan plays the Gerwig surrogate and manages to both channel Gerwig's odd idiosyncrasies while at the same time create a completely unique and original character. The story picks up as Lady Bird, as Ronan's character prefers to be called, navigates her final year at a strict religious high school and contemplates going off to college and escaping the stifling environment of working-class Sacramento. Complicating that escape is the contentious relationship she has with her mom, played marvelously by Laurie Metcalf, who never misses an opportunity to criticize her and reminds her that she won't amount to anything even as she encourages her to make something of herself.""Lady Bird"" is the best kind of movie. It simply gives us a full- blooded character, full of complexity and contradictions, and asks us not to agree with her or side with her or even necessarily like her, but rather to spend some time with her and see if by the end of her story we can understand her. Ronan's performance is a minor miracle of acting, as is Metcalf's, and it will be a crime if both aren't recognized during awards season.Speaking of terrific performances, there are two others in the film to note, one by Tracy Letts as Lady Bird's dad, and Lucas Hedges, as a conflicted boyfriend. ""Lady Bird"" is a reminder that there are many different ways to define success, and that life, and the people that live it, can be many things at once. Grade: A"
65,Lady Bird,8,22 November 2017,Character study that will be familiar to many of us,"""Lady Bird"" (2017 release; 93 min.) brings the story of Christine McPherson, a/k/a Lady Bird, ""my given name since I gave to name to myself"". As the movie opens, Lady Bird and her mom are driving back to Sacramento as they are listening to an audio tape of Grapes of Wrath. Lady Bird laments ""I wish I could live through something"" and then lets herself fall out of the car, breaking her wrist along the way. Now in a cast, we get to know Lady Bird's daily life as she enters her senior year in high school at the all-girls Immaculate Heart of Maria. Lady Bird also has to deal with her overbearing mom. It all makes her want to go to college on the East Coast... At this point we are 10 min. into the movie but to tell you more of the plot would spoil your viewing experience, you'll just have to see for yourself how it all plays out.Couple of comments: this is the directing debut of noted actress and writer Greta Gerwig (Frances Ha, Mistress American, Maggie's Plan, and most recently sensational in 20th Century Women). Here Gerwig writes about something very familiar to her, as she grew up in Sacramento (but she refuses to call the film auto-biographical): the struggles of a teenager on the cusp of the liberating (?) years of going to college and setting out a life's journey more within her control. Even though the movie is just an hour and a half, it is jam-packed with non-stop plot developments, but the over-arching theme is clear. While billed as a comedy-drama, the movie is more drama than comedy, indeed the movie is bitter-sweet, but in the end more sweet than bitter. Gerwig provides outstanding direction to her two lead performers, Irish actress Saoirse Ronan (as Lady Bird) and Lauren Metcalf (as her tough-love mother). I can't help but feel that the movie is also Gerwig's love letter to her home town of Sacramento (a place I've never visited myself), making it look very warm and inviting. Bottom line: ""Lady Bird"" is a wonderful 'little' movie, and in that sense the complete opposite (and perfect counter- programming) for yet the latest salvo of superhero action movies from DC Comics (""Justice League"") and Marvel Comics (""Thor Ragnarok""). To each their own, but I'll take ""Lady Bird"" any day.""Lady Bird"" received immediate critical acclaim upon its premiere at the Telluride Film Festival earlier this Fall, and surely will be receiving a number of Oscar nominations early next year. The movie went wide this past weekend. The Tuesday evening screening where I saw this at was attended poorly (exactly 4 people, including myself), but positive word of mouth will hopefully boost better attendance in the days and weeks to come. If you are in the mood for a character study that will feel very familiar to many of us, you cannot go wrong with this, be it in the theater, on VOD or eventually on DVD/Blu-ray. ""Lady Bird"" is HIGHLY RECOMMENDED!"
66,Lady Bird,9,31 December 2017,It took a while before...,I considered stopping watching the film several times because I was waiting for a moment when everything lights up and it takes boredom out of the process of watching a film. It happened at the 34:11 minute mark. After that it was like watching another film. It brought tears to my eyes several times after that moment.
67,Lady Bird,9,27 December 2017,As good as advertised,"I thought for sure this movie was being overrated. Nope. Great characters and great dialogue. Often that's more than enough. In this case, every moment felt real...the humor and tension all sprung from that place. While the film struggled a bit to find its ending point, that's probably because the director had the same problem I did: she didn't want it to end."
68,Lady Bird,8,8 December 2017,A Well Made Coming of Age Movie,"Lady Bird is definitely deserving of the praise it is getting. This movie was emotional, smart, and relatable. I wasn't really interested in seeing this movie at first because I thought I wouldn't be able to connect or relate to it, but I'm surprised to say that I connected to this movie a lot more than other coming of age movies I've seen. The best thing about this movie was Saoirse Ronan's incredible and realistic performance, and her eccentric but interesting character is one of the best of the year. Greta Gerwig has a bright future in Hollywood if she can keep making movies as great as this."
69,Lady Bird,8,7 December 2017,"Well written, directed and acted","Let me start by saying that, clearly, I am not the target audience for this movie. This is a movie to be seen by High School and College age females and their mothers.That said, I enjoyed LADYBIRD for what it was - a quirky, independent coming of age film with strong acting, a quirky central character and a strong, peculiar point of view (and voice) driven by writer and director GRETA GERWIG.So, let's start with Ms. Gerwig - she has been the Independent film world's ""IT"" girl for quite some time with such small off-beat films as FRANCES HA and HANNAH TAKES THE STAIRS, Gerwig has cornered the market on quirky, one-of-a-kind characters that Diablo Cody was known for 10 years ago. And that is an apt comparison, if you liked Cody's JUNO, then you'll like Gerwig's LADY BIRD. Much like that 2007 Oscar nominated Indy, LADY BIRD is quirky, interesting, strong in dialogue and character and low in plot. This doesn't mean it's bad, it's just meandering and takes its time getting to where it wants to go, if, indeed, it ever gets there. Gerwig's direction and writing is sure- handed - she knows exactly what she wants and how she wants to go there. I'm convinced that Gerwig will get her Oscar for this film (for Original Screenplay like Cody in JUNO) and, perhaps, just might get a Best Director nod for this as well (much like Jason Reitman got for JUNO).Speaking of Oscars, I decided to go see this film as I heard that SAOIRSE RONAN was a shoo-in for a best actress nomination (like Ellen Page Received for JUNO) and I couldn't agree more. Her work as an actress throughout the years has grown stronger and more confident and her performance as LADY BIRD is her strongest work yet. She portrays a complete character and, more importantly, a complete person who is relatable, yet unattainable. I was entranced by her character and her performance.LADY BIRD's quirkiness is counter-balanced by Laurie Metcalf's work as LADY BIRD's no-nonsense, ""get to the core of it"", unsympathetic mother. This was the surprise of the film for me. I didn't think that Metcalf had this kind of performance in her. Someone, please, get her an Oscar nomination for this work/role. As of right now, I think she is my frontrunner for Best Supporting Actor.Also lending strong work is Lucas Hedges as LADY BIRD'S boyfriend (that's 3 strong performances in a row for Hedges, following an Oscar Nominated turn in MANCHESTER BY THE SEA and as Frances McDormand's son in another Oscar favorite, THREE BILLBOARDS OUTSIDE EBBING, MISSOURI) and another Indy darling, Tracy Letts as LADY BIRD'S father.I'm glad I saw this film in the movie theater as the pacing is slow and the acting takes it time, so - as a captured audience - I remained transfixed to the screen. If I was watching this at home, I'm afraid, I'd have started looking at my phone or some other distraction.But, if you are a teen-early 20's female or a mother of a teen/early 20's, bring a hanky, you're gonna need it.Letter Grade: B+8 (out of 10) stars and you can take that to the Bank (ofMarquis)"
70,Lady Bird,8,1 December 2017,"Despite all the possible traps of a coming of age film, Lady Bird is excellent.","Lady Bird Gets out of its Own Way to be a Great FilmLady Bird is a coming of age story of Christine ""Lady Bird"" McPherson, and it's a well done slice of life. Her mother is overbearing and abusive, a bit of a cliché', but because the character is in the hands of the adept Laurie Metcalf, it works. And Saoirse Ronan is nearly perfect in the starring role. In fact, all the acting is top notch. Moreover, the script works. Clearly, the author, Greta Gerwig , took the time to edit and craft dialogue carefully so that it is natural. At the beginning of the film, the animosity between Lady Bird and her mother was over the top. But as the film and the characters developed, the dialogue made more sense. Her mother was unhappy and overly critical, but it was real. The mother isn't a pleasant character, Lady Bird is a bit too dismissive and dad (great acting by Larry McPherson) is caught in the middle. Yes, mom is annoyingly cloying, and Lady Bird is inconsiderate. And that is the way mothers and daughters are toward each sometimes. The boys in the film are also developed enough to not be stereotypes. It's amazing how a woman can write such realistic male characters. I would never think a woman could do that! The music mainly stays out of the way, and while some scenes go over the top, overall, it succeeds. Rating: Pay Full Price Good acting makes up for a few trite moments."
71,Lady Bird,9,3 November 2017,Honest storytelling with terrific acting,"""Lady Bird"". No, this film is not about Lady Bird Johnson! However, if you're a fan of films like ""The Big Stick,"" ""Juno,"" ""Little Miss Sunshine,"" and ""The Way Way Back,"" then writer/actor/producer Great Gerwig's solo run at directing/writing is going to be right up your alley. Saoirse Rona (""Brooklyn"") stars as the reluctant yet blooming teenage who's at ends with her overly critical mom (the always amazing Laurie Metcalf - HBO's ""Getting On""), while he dad (equally reliable Tracey Letts ""August - Osage County"" writer) sits quietly by. Since the story is a coming-of-age event, the excellent Lucas Hedges' (""Manchester by the Sea"") and Timothy Chalamet (""Interstellar"") each have a lesson to teach ""Lady Bird"". And, since every young female needs a BFF, Beanie Feldstein (""Neighbors 2: Sorority Rising"") fits the bill just perfectly. Gerwig presents a believable, honest, enjoyable and at times heartbreaking story that will surly touch viewers. There are no gun battles, CGI effects, loud explosions, superheroes or animated cartoon figures here to dazzle. Instead, for a pleasant 1 1/2 hours, the audience is given an opportunity to step into the McPherson family life, and the life of fellow Sacramento California youth, to experience all the various trials and tribulations youth and families must endure during this thing call life. With an indie feel, ""Lady Bird"" could both join the ranks of the film mentioned above and lead the category into Awards Season."
72,Lady Bird,9,3 December 2017,Fantastic movie!,What a great little movie about real people with real problems in real scenarios with very real emotions. There's a lot to get behind here from the mother daughter dynamics to the high school friendships to the coming of age story. Great performances where everyone gets to have little moments that define them and their role and you're left with a sense of a time and place and person that you rarely see anymore. Just a fine little story that worked on almost all levels. Well worth checking out and Gerwig shows some real promise for the future.
