,title,stars,date,r_title,text
27,Lady Bird,9,10 January 2018,A Realistic and Off-beat Depiction of Teenage Life,"It's easy to look at films like Lady Bird and think of it as being a pretentious piece of cinema, but there's so much explored under the surface here that makes almost every one of those arguments invalid. I may be slightly biased in terms of enjoying dramas like this, but I genuinely feel that many people will be able to relate to at least one aspect of this movie. This is the definition of an indie film making its way into the mainstream and I must warn that it's not going to be for everyone. Here's why I think you may just fall in love with this movie under the right circumstances.Following a young woman as she awkwardly makes her way through her senior year of high school, Lady Bird explores popularity, family issues, jealousy, and numerous other issues that teenagers face on a daily basis, so if you go into this film having already experienced those years of your life, I guarantee there will be a section of this movie that you can relate to. This is what makes movies like this worth watching, at least in my opinion. It's really just a slice of life about a woman who goes by the alias ""Lady Bird"" throughout the majority of the film. There are many off-beat sequences and characters throughout this film that may turn many viewers off, but I believe they're saved by a tremendously committed performance by Saoirse Ronan.Ronan's performances have always been highlights of every movie she chooses, and Lady Bird is no exception to that statement. Her interaction with her friends, family members, classmates, and teachers all felt incredibly realistic. There are moments where her lines of dialogue do feel scripted which took me out of a few moments, but her delivery is always incredible, so that makes up for the fact that you may feel like you're watching just any old indie film. Her performance makes this film soar, but I think the real star of the show is the editor.The way this film's put together almost felt like a master had been at work for years on a passion project. The editing choices and the overall flow of each and every scene are truly what hooked me on this film more than I thought I would've been. Quite honest, the editor of this film played his own role in this movie, making a possibly boring aspect of the story unique to watch. The use of certain songs being played over and over again also became its own character in the story. Although this may not make it on my list for best films of 2017, I can truthfully say that Lady Bird is one of the more technically impressive films, even if not for effects.In the end, Lady Bird didn't blow me away in terms of storytelling, but the way the film is put together impacted me greatly. That, along with terrific performances and a solid exploration of the psyche of teenagers, really had me applauding by the time the credits began to roll. Personally, I felt as though there were many aspects to love about this movie, but I can't see everyone having the same reaction as I did, especially average moviegoers who aren't used to out-of-the-box filmmaking.As far as the story goes, many independent films have tackles this premise throughout the years, but it's all about how your film is presented and how it emotionally impacts its viewers, and I feel as though Lady Bird does that beautifully. The re-watchability isn't very present here, but it's a nearly flawless one-time viewing experience. Highly recommended to film fans."
28,Lady Bird,2,27 November 2017,Totally Overrated,"I watched the trailer and saw that it received 100% on rottentomatoes.com so I figured it must be worth watching, but when I walked out of the theater I felt disgruntled and wanted my money and time back. The movie reminded me of 'Garden State' (2004) in that it was trying to be quirky, deep, and epic all at the same time, but was just another forgettable film. It really fell flat for me and the script/dialog was sometimes awkward and/or did not make sense. I'm surprised IMDb only listed one 'goof'. There were a couple of funny moments and the soundtrack wasn't bad -- those are the only nice things I can say about it."
29,Lady Bird,10,3 January 2018,YOuth is wasted on the young.,Ladybird was not what I expected. Yes it's a coming-of-age of a young lady and the conflicts with her dominate mother. But it's has a deeper sense of loss of innocence and how youth is wasted on the young. Often young people are in a hurry to grow up. When in reality we should live in the present and not worry about the future so much. Because in the end it all works out. Good acting and emotionally compelling story.
30,Lady Bird,8,4 December 2017,Small Town Girl Makes Good,"Having been a product of Sacramento I can speak with some authority on the vibe and allure the city/town offers. The casting was superb, the detail mindful and the dialog real. The fast pace of the film was a contrast and appreciated yet real time in Sacramento lags. Lady Bird and her mothers relationship is all too common during the teen years of angst and the coming of age battles one fights are displayed truthfully. Anyone with attachment to the city must see this film, you'll realize that sometimes the grass is not always greener and appreciate what you had when it's gone."
31,Lady Bird,8,27 November 2017,A great comedy and moving drama for 2017,"In one of the funniest films of the year, Greta Gerwig writes and directs about the travails of a teenage girl in Sacramento, California. Christine 'Lady Bird' McPherson (Saoirse Ronan) hopes to make her own path in life despite warnings from her mother Marion McPherson (Laurie Metcalf). With her father Larry McPherson (Tracy Letts) struggling to keep a job, the expenses of college weigh on Lady Bird. She would like to go to a college on the East coast far from Sacramento but her mother would prefer she stay close. The two of them do not always get along and their arguments escalate so far that Lady Bird throws herself out of the car in the first stunning scene of the film. With her arm in a cast, she attends the senior year of high school at a Catholic school because her adopted brother Miguel (Jordan Rodrigues) saw someone get stabbed in public school.Miguel went to Berkeley but has moved back into their parents' home with his wife Shelly (Marielle Scott) to bag groceries. Lady Bird doesn't always fit in at the school but she and her best friend Julie (Beanie Feldstein) find happiness on the outskirts eating the holy wafers and gossiping about boys and masturbation. Lady Bird meets Danny (Lucas Hedges) while auditioning for a musical and they soon fall in love. She attends his family's Thanksgiving dinner upsetting her mother but seeing what life is like on the wealthier side of the train tracks. However, another boy Kyle (Timothée Chalamet) catches her eye and when Lady Bird stumbles onto Danny making out with another guy in the boys' bathroom, it ends their relationship quickly. Danny struggles to come out to his family and begs Lady Bird not to tell anyone. Check out more of this review and others at swilliky.com"
32,Lady Bird,8,11 November 2017,Gerwig and Ronan team up to present incisive portrait of West Coast Parochial school rebel,"I remembered Greta Gerwig from ""Frances Ha"" which I didn't really care for so I was more than surprised to discover that not only can she direct (as evidenced by her efforts here with Lady Bird) but is a talented screenwriter as well (yes, she also wrote the screenplay!). Her story is set in (of all places), Sacramento, and stars the consistently strong Irish-American actor Saoirse Ronan as Christine ""Lady Bird"" McPherson, an off-beat adolescent in her senior year at a local parochial school, hoping to get accepted by a good school on the east coast (as opposed to a state university which her parents can afford).Christine calls herself ""Lady Bird"" in order to stand out from her peers, and her mother Marion (played by Laurie Metcalf in a potential Oscar-winning performance) can't get used to the new appellation. The conflict between the two is the highlight of the film, as Christine's mother is hard on her daughter at almost every turn, wanting the best for her but insisting on good behavior. Christine, on the other hand, resents her mother's interference in her life and consequently struggles with her self-image. Gerwig's portrait of the wayward adolescent is spot-on, as Christine exhibits that perfect mixture of arrogance and wisdom, typical of gifted but confused teenagers.Gerwig is intent on eschewing the usual clichés of coming-of-age narratives. What impressed me the most was her sympathetic treatment of the parochial school priests and nuns, entrusted with educating kids who are not exactly what you would call devoted Catholics. You wouldn't expect a priest (Father Leviatch) to be conducting auditions for a Sondheim musical (in this case, ""Merrily we Roll Along"") but that's exactly what he does and later bemoans the unenthusiastic audience reaction, exclaiming that they ""just didn't ""get it""he's also the same priest who conducts a group therapy session exhorting the students to be the ""first one to cry"" (and of course, it's Father Leviatch who is the first to emote!).There's also another hilarious scene with the football coach (another priest!--Father Walther) who subs for Father Leviatch (who eventually resigns due to depression). The coach directs Shakespeare's ""The Tempest"" as if it's a football game and the beleaguered drama students all must cope with the coach's crazy approach.When Christine is suspended after falling afoul of a teacher who promotes a pro-life stance (relating that her mother was considering an abortionand this particular teacher wouldn't have been born had her mother gone ahead with her initial decision), the Mother Superior, Sister Sarah Joan, confides to Christine that that the anti-abortion teacher is really a blow-hard and she actually found Christine's comments (that led to her suspension) to be amusing. Hence, Christine gets off lightly with Gerwig emphasizing the humanity of the nun in charge.There are multiple twists and turns in the plot that keep the story fresh throughout. When Christine discovers her first love, Danny, is gay, she stops speaking to him out of anger. But later she forgives and hugs him, after he reveals that he'll probably be rejected by his family if he comes out of the closet. Similarly, the theme of forgiveness is also played out in Christine's relationship to her best friend, Julie, with whom she has a falling out over her new relationship with Jenna, a ""bad girl"" to Julie the ""good."" After Christine falls for a second boy, Kyle, she again endures disappointment when she discovers that he's already slept with six other girls and is no ""virgin"" as he had told Christine earlier. This leads the emotionally devastated Christine to reconcile with Julie, and in another delightful twist, they end up dancing together at the Senior Prom!Last but not least, Christine's father, Larry (a low-key but highly effective Tracy Letts), despite having lost his job, provides emotional support for Christine along with helping her fill out financial aid applications. Much to her mother's chagrin, Christine is accepted by a college in NYC and her mother isn't talking to her as she jets off to her new life at the university.An overdose of alcohol (which lands her briefly in the hospital) perhaps is the trigger that helps her to grow up and realize that her mother loved her all along, and she is now ready to start her freshmen yearbin New York as a full-fledged adult!With the usual ubiquitous glut on the market of coming of age stories, Greta Gerwig manages to infuse her tale with a rich tapestry of intuitive observations of life, making her freshman effort an extraordinary winning one, deserving of all the accolades already heaped upon it."
33,Lady Bird,,31 December 2017,A charming film about real life,"This film tells the story of a high school girl who tries to find herself in the world, amongst her peers and the adolescent turbulence.""Lady Bird"" is a charming film about real life. The characters are believable, and in fact I can relate to multiple characters in the film. The story does not feel formulaic. There are no outrageous drama or overly cliched characters, but the story just keeps me interested in it. The ending is a nice resolution, wrapping up and referring back to various moments in the film. I like it."
34,Lady Bird,9,30 December 2017,COA at its best.,"When I saw the trailer for this film I knew upon seeing it i'd enjoy it, however I didn't anticipate just how much of an effect it would have on me and how relatable it was. I decided to watch it as a pick me up and have continued to rewatch it a bunch since. The dynamic between Ladybird and Marion is so genuine and I found the portrayal of the opinionated strong-willed mother and daughter butting heads paralleled my own life in a way I needed to see on-screen to fully understand. In that way the film taught me about myself and I'm sure many other viewer felt similarly - I think anyone watching will find something they relate to as there are many heartfelt subplots that tie into the main plot. I tend to like coming-of-age films even though many of them are cringey. For example, Lady bird is similar to The Edge of Seventeen (which I enjoyed without having many standards for it) except Lady Bird actually stands out for its character development and integrity, cinematography, and resolution. Although I've just seen it I'd had to say this is my favorite film of 2017 and one of my favorite films I've seen in a long time. It sticks with you and for me personally, it was exactly what I needed exactly when I needed it."
35,Lady Bird,8,28 December 2017,Lovely movie and great story telling,"A lovely movie i truly enjoyed all the way through. I love Gretha Gerwigs directing in this film, and the story telling is amazing. You truly feel that the movie has a story to tell, more than just a teen tired of her boring life and parents. A great and enjoyable coming of age movie.
The directing reminded me a bit of the same style as Woody Allen type movie which only made me enjoy the movie even more. I am excited to see what the future brings for Greta Gerwig!
Saoirse Ronan is yet again brilliant. Her performances are always so captivating and keeps you entertaint all the way through. Truly an Oscar worthy performance."
36,Lady Bird,10,26 December 2017,Life Happened,"We're introduced to a mother and her daughter, both loving, laughing and enjoying each others company then suddenly turns into an argument, full of stubbornness and Why-can't-you-accept-this sort of situation, and the daughter (Christine ""Lady Bird"") jumps out of the car while it's still moving in full speed. Watching this was like taking a trip down memory lane, nostalgic music, looks, atmosphere etc. I can't really put a finger on what it is I like so much about it. I just felt the whole film was so relatable, and it was almost like it was a film about my life by not really at the same time. It's about seeking the identity, finding out who you are, exploring and finding your own way. I guess this was why I liked it so much, I could really relate to the character of Christine ""Lady Bird"", her doing everything to both stand out and fit in at the same time, learning everything the hard way. And I just loved the scene when she turns 18 and goes to the store to get a pack of camel cigarettes and a play girl magazine, waiting for the guy working the cashier to ask for her ID. Been there done that. And another scene where she pass her driving test and thanking the instructor or water you call that guy. Hilarious and yet again relatable. Actually everything in this film was relatable.
Writing this review made me realise that what they captured so good in this move was LIFE, all the up and downs, and with that found I'm ending this because that's what the film really is about LIFE and why it was so damn good!"
37,Lady Bird,10,23 November 2017,"One of the best coming-of-age films, and one of the best of the year!","I really enjoyed LADY BIRD. One of the *best* films of the year! I totally related to the story especially the protagonist relationship with her mother and friends, and the dream of moving away to college! I watched LADY BIRD in a packed theatre with people of all ages which was fantastic to see because I've rarely seen a packed theatre for an 'independent' film! There were laughter and tears throughout. I think Gerwig has made a film for the ages. Her script is really strong and her direction too. The acting is remarkable especially Saoirse Ronan (never puts a foot wrong) and Laurie Metcalf who plays the mother so darn well! The supporting call are really great too-Beanie Feldstein, Tracy Letts, Lucas Hedges & Timothee Chalamet. This film *deserves* lots of awards love for sure! 10/10"
38,Lady Bird,8,3 November 2017,"A Hilarious, Poignant Coming-of-Age Comedy","Greta Gerwig's directorial debut is a very funny and entertaining film about a rebellious young woman who is a senior at a Catholic high school in Sacramento. She wants to attend college on the East Coast, preferably in New York City. I have always been a fan of Gerwig and her work, and I can say that her filmmaking skills are incredibly strong here as far as directorial debuts go. The screenplay is full of wit and emotion. While the film is very light in tone, the characterizations present through the narrative as well as the film's juxtaposition of its main events pertaining to Lady Bird's (the nickname of the protagonist) final year in high school give the script considerable weight and power.Saorise Ronan gives a hearty and very authentic performance in the lead role, and the supporting cast is generally very strong. The film's tone feels playful but also enjoyably sassy and thoughtful. As a result, the film feels far more potent than just about anything in the teenage/coming-of-age genre. While the film's pacing in its final scene feels slightly awkward given its contrast of pace with the rest of the narrative, the film feels fully satisfying in its entirety despite running a lean 93 minutes. Additionally, some of the plot devices that help form the narrative and plot line of the film feel rather predictable. However, that ends up being only a minor complaint because the humor, heart and bite of the writing helps drown out any sense of clichés that a viewer might feel. Overall, I thought this was a great and very funny coming-of-age comedy that I had a lot of fun watching. I look forward to seeing what Greta Gerwig does next with her undeniable talent. Definitely recommended. 8.5/10"
39,Lady Bird,8,3 November 2017,Lady Bird (2017),"This film received very high praise from early screenings and it wasn't hard to see why. Saoirse Ronan is a star, absolutely blowing everyone away in Brooklyn. Then you have Greta Gerwig, a force in a few Noah Baumbach films, with a highly anticipated directional debut. Was incredibly hyped for this one all the way through. It feels short because the film just flies by but its rather excellent. Very satisfied with the turnout for this one.The film is about Christine McPherson (Ronan) who has given herself the name ""Lady Bird"". She is a high school senior in a Catholic school who struggles through what a typical girl of that age goes through. She faces the trials and tribulations of dating boys, losing her virginity, trying to be popular, feuding with her best friend and mother, and ultimately trying to figure out what to do with her life. Things are tough for her and she examines her relationships with friends and family to ultimately come to the best decision for herself.The film sounds like a typical film plot. In many ways it is. Yet everything about the film is done so well in the expert hands of novice filmmaker Greta Gerwig. The dialogue is sharp, hilarious, and witty. The character development, interaction, and acting are all strong. Saoirse Ronan is at the very least sealing an Oscar nomination for best actress and might even go on to win it. It seemed like such an effortless performance for a girl who completely disappears into the character idiosyncrasies of Lady Bird. Its a wonderful coming of age film that hits all the check marks and does so very effectively.I can't think of any complaints. The film feels so real and identifiable. Its exactly what you want and is a very impressive debut from Gerwig. The film has a nice touch at the end and does what it needs to do to remain funny and touching. I don't mind a good coming of age comedy every year (Edge of Seventeen taking the cake last year). I expect this to be an award contender for at the very least Ronan's performance and Gerwigs writing and directing.8/10"
40,Lady Bird,,15 November 2017,One of the best ever coming-of-age comedies.,"""I wish I could live through something."" Lady Bird (Saoirse Ronan)Nothing in the constantly funny and stunning coming-of-age film Lady Bird will surprise any audience. It's all been played before: conflict with mom, loving dad, high-school romances, gawky and hip girl friends, amateurish school play, agony about college admission, and nuns who restrain and nuns who nurture.She has indeed lived through ""something"" up to her waning adolescence, but as in the case of her hometown, Sacramento, she has to look back at it to see that she has lived there fully and uniquely. Right now, before graduation, the city is to her ""the Midwest of California."" The real difference from other growing-up stories is first-time solo writer/director Greta Gerwig and Saoirse Ronan (who plays Christine ""Lady Bird ""McPherson). Together they craft a lovable, flawed heroine with such a sense of herself and her future that she is unafraid to taste life in its entirety, blessed or broken. Forget Julia Stiles in 10 things I Hate About You. Bird is better.As in most films where a young girl is taught in a Catholic high school, the nuns are the looming moral force for restraint and also dream, embodied in the principal, Sister Sarah Joan (Lois Smith), a realist who knows Lady Bird is a creative and independent spirit. So, too, in a different way is Lady Bird's mother, Marion (Laurie Metcalf), whose tough love is constant, but whose love is there if only Lady Bird would see it. Mom's agony at the airport when Bird goes to college is as anguished a mom/daughter parting as you will ever see in a comedy.Moments of humor are plentiful and low key, e.g., when Sister Sarah's reality check with Lady Bird, ""Math is not your strength,"" is met with Bird's ""that we know of, yet."" While Mom's realism is minute by minute, Sister Joan gives hers out slowly with equal portions of quiet love.While actress Ronan has already tasted life from an adolescent heroine, Hannah, to a young adult in Brooklyn, Lady Bird could be seen as a retro acting gig. Bird is so strongly mature yet naïve that this role defines Ronan's wide-ranging ability. So, too, great Greta, a directorial/writing genius who should outstrip Woody Allen by the time he fully matures."
