,title,stars,date,r_title,text
102,Lady Bird,6,1 December 2017,Decent Coming Of Age Story,"I saw ""Lady Bird"", starring Saoirse Ronan-The Grand Budapest Hotel, Hanna; Laurie Metcalf-The Big Bang Theory_tv, Uncle Buck; Beanie Feldstein-The Female Brain, Neighbors 2:Sorority Rising and Lucas Hedges-Manchester By the Sea, The Grand Budapest Hotel. This is a teenage girl coming of age story that covers most of the plot points you have probably seen before, but it is executed decently. Saoirse plays a 17 year old girl in Catholic high school in Sacramento, California in the early 2000's-I think I remember seeing a sign saying 2002 or 2003. She longs for adventure and wants to go to college anywhere but where she lives-she wants to go to New York, in particular. The main problem is money. She lives in the poor side of town and she is not making good enough grades for a scholarship. Her mother, Laurie, is a nurse working double shifts to cover bills. Beanie is her best friend at school and Lucas is her first boyfriend. Saoirse and Laurie are close-they talk about everything-even though they do get into disagreements. It's rated ""R"" for language, teen partying and sexual content-brief graphic nudity-and has a running time of 1 hour & 34 minutes. Oh yeah, I feel I must mention that the brief graphic nudity is from a men's magazine that Saoirse is looking at. It's not one that I would buy on DVD but I'm not the target audience. I would wait until it comes to cable. If you are more inclined to these types of movies, you may enjoy it more than I did."
103,Lady Bird,6,27 November 2017,Good not great,"We went into Lady Bird without overly high expectations despite the critical acclaim, so we weren't disappointed. The film is well put together and the acting is excellent. The issue we have is with the plot, or rather lack thereof. We couldn't get invested in the story. Whatever happened to a beginning, middle, and end?"
104,Lady Bird,5,24 November 2017,Meh,"I hated it. It was like watching an episode of Blossom. The only good part of the movie was Lucas Hedges, and he's barely in it. I thought I was going to see a cool, funny indie movie after seeing the trailer. But it was just a poor teenage girl in catholic school movie. I'm not a poor teenage girl in catholic school, so I could not relate."
105,Lady Bird,5,30 December 2017,"Wrong Side of the Tracks ... but still ""rich people's problems"" version of Coming of Age","Aw, I admit it. I'll watch anything with Saoirse Ronan in it ... such a fine actress, possibly the best of our time. And while I love a coming of age story, the drama in this family setting seemed unrealistic and contrived. Sure dad lost a job and they never moved out of their house on the ""wrong side of the tracks"". But this young woman could go to college. Something of which millions of people can't even dream. Mother-daughter arguments over which college to attend fall a bit flat when we live in a reality where so many can't attend. It started to sound a bit like silly ""rich people's problems"" so I sort of didn't feel super attached to any of the characters (except maybe the mom).I liked the eccentricities of Ronan's character Lady Bird. But I feel the story line could have been much more compelling. Glad I streamed this film instead of pay for it in a theatre ;)"
106,Lady Bird,6,24 December 2017,disappointing,"I thought saoirse ronan was wonderful. but many elements of the film just seem way off. 
first, it seems derivative of ""20th century women,"" and annette bening was much better as the mom than laurie metcalf. 
major points in the film were told rather than shown: the nun says that lady bird is a good writer, but we have no direct experience of her writing talent; the yellow lined papers say that the mom is insecure underneath her anger, but we have no direct evidence of that. the dad is depressed? we are told that, but he doesn't look depressed at all - just an amiable, kind-hearted loser. compare to sam elliott in ""off the grid."" lady bird says, ""i know i'm a liar""; but there is little if any footage of her mastering her lying and cheating.
what's with the name, ""lady bird?"" it evokes lady bird johnson, who would seem to have nothing in common with our protagonist. 
why does she want to go to an east coast artsy school? we never see her reading, watching art films, writing poetry, etc. 
she is arrogant (to apply to columbia), she lies, she cheats in class. shouldn't these be problems to overcome? 
if the film is an homage to sacramento, why no freeways? sacramento is dominated by highways 5, 99, 80 & 50. compare to la la land, in which the freeway does have a role. 
what's with the hispanic brother? not explained or used as a plot device, so it just seems random. also, i thought i read in the yellow, lined sheets, ""after i had your brother at age 40"" - though i may have misread as the sheets were visible for about 3 seconds. but shouldn't the brother be adopted or be explained to have a different father?
why does kyle say, unprovoked, ""you're not the first girl i had sex with; i've slept with 5 girls before you?"" i get why it hurts her, but, come on, who says that?!? he is presented as a musician and quiet reader whose dad has cancer. is that motivation to be a total jerk?
perhaps i went into the film expecting too much, but this is no ""juno."""
107,Lady Bird,4,2 December 2017,"never achieved escape velocity, it's a little movie, the microcosm remains just that.","the main character jumping out of a moving car at the beginning of the movie set expectations too high for this nice beginner director movie. The mother/daughter relationship was okay, and there were things in the middle of the movie that started to really get my attention, such as the back stories of some of the characters. The family dynamics were good and you found out certain things subtly, such as the late motherhood, the obviously adopted brother, the kind but depressed father. The bathroom as a place of mother/daughter communication was cool but the idea that a middle class ranch house only having one bathroom in Sacramento is silly/unnecessary. Also, the disjunction between the mother's professional role as a psychiatric nurse and her vaguely crazed behavior at home doesn't make sense, it's too different, way past the ""wounded healer"" syndrome of most people in psychology/psychiatry, believe me, I know these fields, all to well. Otherwise, it's kind of a standard ""coming of age"" high school transition to college movie with nothing really much happening to a middle class, somewhat privileged white girl/woman. There is something done well with the idea of place memory and belonging, however, that did hit home, this is seen in the car scenes transposing mother and daughter, although most scenes were not well framed or imagined. The general sense is that the movie is almost there, but it's really not that great, you want it to be better, in the mode of ""Boyhood"" ""13"" ""The Last picture show"" Some good bits but just barely worth your time in a big screen movie theater. And much of the acting was good-ish almost better than it needed to be."
108,Lady Bird,5,18 December 2017,Wait a minute...,"Saoirse Ronan has an interesting aura, but that doesn't keep this from being a mediocre story about uninteresting teens (and an unlikable mother). We needed two apologies the audience never gets: Her first boyfriend never says he's sorry he was unfaithful, but instead asks Lady Bird to cover the fact he's gay.
And it should've been the mother to write or call Lady Bird to apologize for not seeing her off to college--instead we get Lady Bird saying thank you to her overly critical mother. The acting was fine--Tracy Letts was good as a sympathetic dad.
Sacramento looked great. But the story does not deserve all the great raves. So just a warning--you might be disappointed."
109,Lady Bird,9,6 January 2018,An Incredibly Personal and Entertaining Story,Http://nickkaminskysblogspot.blogspot.com/2017/11/review-lady-bird.html
110,Lady Bird,1,26 December 2017,Steaming Pile of Dog Skat,This movie is very boring with poor character development such that I never care about any of the characters or their issues. This is the archetype for the overrated circle jerk indie film that is not worth watching.
111,Lady Bird,1,3 December 2017,the most boring movie of the year!,"I have no idea how this movie got this high of a rating as I kind of felt that the movie is one of the most boring movies I've watched in 2017. It seems that the trailer has all the good scenes. I'm mainly talking about the ""idea"" of the movie & the flow. I am NOT referring to the performance by any means."
112,Lady Bird,3,10 December 2017,Really?,"This is not the type of movie anyone would recommend to someone they like. Therefore, the jagoffs on this site seem to think it's okay to recommend to strangers. I don't go to your house and take a dump in your bathroom sink and leave. This is what it feels like with these ""glowing"" reviews of one of the most self-indulgent, explanation of the Millenial jerks who populate this world today. Christine ""Lady Bird"" McPherson is a talentless, subpar student who is determined to propel herself out of the duldrums of Sacramento, California in hopes of a more enriching life in college on the east coast. The reality is, she is stuck in middle class Hell. With a Dad who battles depression and a mother who battles...well, the world. Of course this sad movie needs to saddle itself with quirky brother whom we spend a TON of time wandering how this relationship transpired since the guy is a Mexican. Oooooo...clever. See, Lady Bird is a Catholic school girl delinquent who thinks she has the small town world figured out. Though she is woefully hobbled by...her own naivete, she has no other reason to leave town other than...? She isn't talented in anything. Has no ambition. And quite honestly is annoying. Saorse Ronan plays the titular character, and she does well. But the shining performance HAS to go to Laurie Metcalf. The overbearing yet cautious mother who refuses to allow Lady Bird breathing room. The massive problem with Greta Gerwig is that she wants it all. She wants the ""Sixteen Candle"" scene where Paul Dooley sits at the edge of the couch telling Molly Ringwald how they forgot her birthday (in this movie, they switch it, where her father celebrates her birthday). But they also want you to get a taste of Millennial angst. Here's a hint to Gerwig...no one cares. You're annoying. Everyone in this movie is annoying. Except Metcalf. To that extent, she is, of course needs to win the Oscar for rising above poor over-treaded material. If you've had the slightest sense of a teen movie...this is it. Every single cliché you can think of. The morons here who believe this is unique...Jesus, watch any adaptations of S.E. Hinton. It's far more accurate. You know..because we haven't seen that 2-pump chump joke in comedy before."
113,Lady Bird,2,27 December 2017,Ladybird really wasn't that strong of a character,"Gerwig really had to create a VERY passive cuck dad character to use as a comparison for labeling the mom and daughter as strong. Ladybird really wasn't that strong of a character... which makes this 'coming of age' story boring. And on top of that, the story was basically comprised of just a bunch of random events that felt like it was taken from the vague memory of the writer's poor recollection of their senior year. All opportunities for the Ladybird to develop any sort of drive or gumption were just tossed aside as we basically just watched her walk through the scenes of the movie.But on the bright side, A+ for the acting. Saoirse Ronan was very believable and Laurie Metcalf is always a joy to watch."
114,Lady Bird,6,4 December 2017,Enjoyable enough but rather surface,"I left the theatre after watching Lady Bird basically feeling nothing - not moved, saddened, hopeful, annoyed, just...nothing. I really like coming of age movies or books so had high hopes for this one, but I felt like it skimmed the surface of some interesting themes or ideas rather than actually exploring them and making something out of it. I would have liked to know more about the main character's mother, father, brother - all hinted at interesting hidden feelings or secrets, but the movie never actually went there to explain or add context to anyone's actions or reactions. It was also hard not to feel like Ronan was not just doing a Greta Gerwig ""omg I'm so awkward and I have no idea that people find this charming"" impression. I found a variety of scenes in the movie confusing (in the sense that I guessed the director was trying to evoke emotion or create a plot but it didn't really achieve it IMO):-why was the mother so weirdly mean to the daughter? that didn't make a lot of sense to me. If the mother had some deep issues buried, the one sentence about her mother being an ""aggressive alcoholic"" didn't really make me care enough about it to warrant her controlling behaviour -Christine (sorry can't bring myself to actually call her LB) expresses an interest in moving to NY for the ""culture"", but what about her life or behaviour suggests that she is at all interested in anything other than boys or getting out of her town? what is she hoping to achieve there? what DOES she want to see or do? -the director doesn't handle the whole ""I'm going to ignore my best friend and try to be friends with this popular girl instead who is inevitably going to be nasty to me and so I'll return to the original friend"" plot line very well - again, it's an interesting idea to explore, but there didn't seem to be a lot of reasoning as to why Christine went in that direction. She didn't seem at all interested in being popular/regular and so why the random action? -she also didn't seem to especially care about having money or not, and no one was really mean to her about it, so it also didn't make a lot of sense to me that her and her mother would want to go and check out the open houses of really expensive houses - if they had a deep shame of not having a lot of money, they didn't make me care enough about it, and it didn't seem to make sense for either characterI did like some parts, the best friend was funny and a good actress, and there were some comedic elements, but nothing that made me really laugh. I felt that the director tried to cover too many themes and ideas and didn't really hit home with any of them.Overall, a 'meh' experience for me, and seemed more style over substance."
115,Lady Bird,4,6 January 2018,When Hollywood tries to be quirky,"My apologies to the director of this movie because I am very supportive of fellow ladies that make films, but this review is not going to be very heartwarming. ""Lady Bird"" follows a teenage girl in Sacramento, CA, on her journey into adulthood. This is the premise of the movie and as though it sounds like many coming-of-age log lines you've already heard, this movie is nothing like them - because it doesn't follow up to the expectations it rises.A coming-of-age movie has to do at least one of the following things - firstly, be ""relatable"". The demographic audience of this genre watches these kind of movies because they want to relate to the anti-hero, the underdog. It's very hard to do that when the main character is an entitled, bratty girl who lives in S a c r a m e n t o. This fact was supposed to get watered down by financial issues of the family or the fact that she is ""weird"" and unpopular - but it just wasn't convincing enough.This brings me to my next point, which is acting. I'm sure that the director saw something of herself in Saoirse Ronan but Saoirse is just not this character - she doesn't look 18, she doesn't look OR act quirky/weird, she is simply too good looking and put together to play this role. If we don't believe all these things in the first place, we're never gonna buy the acting...Oh, the acting. I don't want to stay on this subject for too long - the cliché dialogue itself is enough to make the viewer roll their eyes but a good actor can even make this fly if they just say the words... but no, every and each sentence about a small-town girl with big dreams you've all already heard a million times before had to be super-emphasized. The story is clear. A girl doesn't feel like she belongs. She tries to be something that she's not. Some big grown-up things happen in her life that make her realize who she really is and she accepts that.
However, this has just been seen too many times before. Just last year, The Edge Of Seventeen succeeded in transferring the charm of a high-school weirdo to the big screen. But, this movie just doesn't do it - it's just not believable, at moments awkward to watch (not an emotion you want the viewer to feel), unrelatable, not even pretentious - it's just basic and nothing, it's nothing, it didn't make me feel anything, it wasn't even so bad that I would turn it off. So, again, if the director ever reads this - don't worry, you still did a better job than me and yes, I'm sure that making your first feature is hella hard, but this is just my honest opinion that I hope you can take something out of it..."
116,Lady Bird,6,7 December 2017,Perfectly fine,"Who can deny Saoirse Ronan is winsome? Who uses ""winsome"" to describe anyone anymore?Lady Bird is a fine film, replete with good acting and a paint-by- numbers, coming-of-age storyline every middle-class white person could find relatable, or at least relative. There's relative poverty, relative lies, relative places, and relative relatives.The biggest lesson learned is that if you pay attention to the world around you, someone else might interpret that as love for the world around you, or at least the aspects of the world around you to which you pay attention are ones which you love, because why else would you pay so much attention to them, regardless of whether or not you are paying attention to them consciously?Coming of age for Lady Bird includes a first weed, a first bone, and a first scratch-off. We get a prototypically gay young man, introduced as the strong singer who's afraid to touch mammaries. Perhaps greater screen time would have revealed he also enjoys architecture, queery theory, and feather boas.Having never lived in Sacramento, I nevertheless imagine I would also want to move to New York as a way to solve all of my problems. Change comes from within, unless you're full of wanderlust, without which we would wistfully remain stationary, only exploring inwardly who we are, who were were, and what will happen next."
117,Lady Bird,5,29 November 2017,"An extremely overrated (still entertaining) film, but we still have no explanation for the eponymous name.","Lady Bird (2017) Oh, Greta Gerwig's Quirky coming-of-age tale, So sincere yet sweet, Parents, girlfriends, boys, college. Changing in Sacramento. Still, why the nickname? Why appear a long trailer, Although a great one? Scenes in a blender missing Crucial, instructive segments. (Somonka is a Japanese form of poetry that is essentially two tanka poems, the second stanza a response to the first. Each stanza follows a 5-7-5-7-7 syllable pattern. Traditionally, each is a love letter. This form usually demands two authors, but it is possible to have a poet take on two personas. My somonka will be a love& hate letter to a film?) #Somonka #PoemReview"
118,Lady Bird,6,1 December 2017,Over-rated,"I base my assessment of a movie's 'greatness' on the story, acting, photography, and music. The acting was excellent. Saoirse Ronan's acting is captivating. The story is well, it's been done before so many times. It was entertaining at times. Maybe I have watched too many movies for over 70 years. The photography was average and the sound was at times very amateurish. The music - well, it didn't add to the experience. I would never compare this movie to a Woody Allen movie, never."
119,Lady Bird,4,27 December 2017,I really could not care ...,"Since I am not a woman or a teenage girl from Sacramento, I just could not relate to this movie at all.Really Greta, what on earth made you think the masses of movie watchers of the world would or could care about your supposedly unique upbringing in the tiny demographic of Sacto, CA?You most certainly did not have amazing and unique experiences as a teenager. In fact, most all of us have had similar and probably more interesting experiences when we were teens.The acting and cinematography were very good but those two things do not make a movie great. It needs an interesting story, one that appeals to more than just teenage girls. Sorry to say, but you might want to stick to other scripts -- avoid writing your own."
120,Lady Bird,9,15 January 2018,a perfect story of leading how to get lost,"Greta Gerwig ..! I think she is one of the most brilliant writers of the 21th century. Frances Ha was the very first surprising experience, then Mistress America was a stunning movie to be the next.. and now this; Lady Bird. She has such a unique, authentic way of her own that you can recognise the characters she create even not knowing that the story belongs to her. These are girls who are experiencing ""finding oneself"" in different periods of life and in different ways. Yet, these are not simply lost girl stories, what makes them different is that these characters are not scattered by the wind, they are fully aware of the need of getting lost and they are the ones choosing how to, they lead the ""getting lost"". Lady Bird, in particular, is a stunning story of a young girl so vulnerable yet so strong. There are ups and downs, comes and goes, yet you can always feel that lead. Moreover it is a impressing mother-daughter story. Although there are no big tragedies one can always sense that strong sense of breakdown.besides the perfect story, the actors and actresses are also amazing, and Saorise Ronan is simply fascinating! It was a true breakthrough performance!"
121,Lady Bird,4,14 January 2018,Ehhhh,"I came into this movie expected something to wow me noting the great reviews it received. To be honest, I thought it was a little flat. Someone who every year sees and blogs about the Oscar contenders, I just don't this one was in the same ball park as others. Don't get me wrong, I do reward Greta Gerwhig for a job well done in her debut--but I simply don't see the film in the same light as others. I love Laurie Metcalf in this film and think she should definitely get praise for her performance. Ronan's performance was take it or leave it for me. Just cannot relate to the film, did not leave me wanting more."
122,Lady Bird,8,14 January 2018,An honest depiction of seeing that childhood magic stripped away.,"Ladybird's personality is the perfect mix of quirky, emotional teen and honesty. I'm surprised the a story that is centered on a relationship between mother and daughter resonated with me. Add another classic to the list of classic coming of age movies."
123,Lady Bird,9,13 January 2018,Good film with great performances,"Lady Bird is definitely one of the best coming of age films made recently. The Edge of Seventeen from 2016 could be put in the same category but this one is still better in my opinion. It will really hit close to home with everyone who live and grew up in a place where not much happens and can't wait to leave it and enter the world of excitement to try to live to the fullest someplace else.The thing that sets Lady Bird apart from most coming of age stories is that it feels much more realistic. The characters are wonderfully written, you really care for them, feel what they are feeling and you sympathise with them. The struggle of teenage years and how difficult these times are for the parents as well, falling in love and getting heartbroken for the first time, applying to colleges in a family that is struggling financially are all themes that Lady Bird covers with great authenticity. Saoirse Ronan shines in her role and is proving once again that she is one of the best young actresses working today. The supporting cast really deliver as well.If you love stories about young people growing up, you like films that make you feel something and are full of witty dialogue and real characters, you should not give this one a miss."
