,title,stars,date,r_title,text
8,Loveless,7,24 September 2017,The end of the world is already here,"The case when the movie causes physical pain. If to characterize the film, I can say this: ""You're asking if there will be an end of the world? But it has already come!"".On the one hand, the film shows a rather trivial situation, when the family is in trouble, there is no peace. Boredom and dullness. On the other hand, Evil is clearly shown as a form of total dislove. No one loves anybody: neither the mother the son, nor the husband wife, nor the man of man... Poor, lonely people are everywhere and forever."
9,Loveless,10,30 December 2017,Soaked in pathos,"In many ways this film is so Russian that unless you are Russian or have spent a considerable time in Russia you may miss many of the subtler parts of this film - recurring motifs - but this does not detract from an absolutely intelligent and realistic film.Heavy on symbolism I remained enthralled throughout, a deeply original and emotive work that will resonate in the mind long after viewing. A Masterpiece.It deserves no less than the maximum 10/10."
10,Loveless,8,3 December 2017,The love for films in the rest of the world,"Filmmakers around the world has always recreated cinema in their own way, contrasting with the films made in Hollywood, that in a certain point become the same, that is to say, are made with the same ""mold"". The foreign cinema, specially from Europe, America and Asia has acquired his own identity, but with pass of time we can say that this films are made with the same ""mold"", but obviously, one different from Hollywood's.I think no one can deny the much contributions that Hollywood has made to cinema, since the beginning of this art they have improved the way we watch and consume movies and how these are made. This have its consequence, the over exploitation of films, especially of a specific genre; in the 50's were the musicals and now are the super-heroes movies but international filmmakers (and from Hollywood itself too) always find another way to tell a story. In 20's were the Russians and Germans, then the Italians, with artistic movements that change films forever and then in response to the repetitive stagnation of ideas in Hollywood, the Nouvelle Vague (the ""new wave"" of french cinema) made his own contribution. They were the beginning of the foreign cinema that now is still alive and for me is better than many of the Hollywood films.""Nelyubov"" represents that, the actual foreign cinema that is the son of that foreign films from the 20th century. This movie sometimes reminds me to movies from Luis Buñuel or Jean-Luc Godard, and a lot to Michael Haneke's ""Caché"", we can say are similar in some aspects, but I think they seem to be made with the same ""model"" because they represent the same: the voice that says that the cinema is not only Hollywood.This movie is incredible, is so beautifully and carefully made; is awesome how it takes his time to express and show how the characters are and what his title means, you see the two main characters and their lack of love, how that transform their lives and most important how it determines another person's life, in this case the boy. After we saw everything about both parents and how they try to find love far from the other (being his son the only link between both) a situation when they need to be together appears.The film change totally from this point and in the searching of the boy we check that the parents can not be together and we wonder what will happen at the end. I thought they were going to find the boy, it was surprising the end, letting you some questions and reflections. Andrey Zvyagintsev, the director of the films does an spectacular job, it manage very well the rhythm of the movie, that sometimes seems slow but like I said, it takes his time and in the end everything was necessary. The shots, that don't show many movement and the information that the movie gives to the audience is pretty careful.The cinematography is great, with a tone that shows the coldness and unhappy life of the characters. The music is another aspect to mention, is very good, Evgueni Galperine & Sacha Galperine does an amazing job, and the performances are also amazing, both when they cry, fight or smile (the latter the least we see).In conclusion, I think this film is one of the best of the year and I expect to see it in the award season that's coming, is well done in every aspect and is part of the current foreign cinema, that pays homage to his predecessors."
11,Loveless,8,26 November 2017,A portrait of the dark side of human relationships!,"This movie surprised me. I was expecting something different when I started watching it but in the end it left me with a horrible melancholy and a hole in my chest. I do not recommend watching this movie on a Saturday evening while it's raining outside because chances are, you're going to get even more depressed. I love the photography and the colors, it definitely adds a certain bit of despair to the story. I believe that was exactly what the director intended: to pass this feeling onto the screen and he does that with the way he plays around with the colors. If you're watching this movie in hope of getting a happy ending then don't because all about this movie is tragedy. The characters' lives are full of tragedy and so are their respective endings. I had to notice, also, that there's a political criticism during the movie. The war, the ending of the world, it's almost like this movie carries a sense of hopelessness. The film's last scene is one that I won't forget for the next days because even in the end, the characters cannot find peace and both of them return to their own lives with the people who are now their loved ones but they are still left with an emptiness and we get the feeling that they will never be truly over it. There's no happy ending here, there's no big story in the middle of this.. Just the events of an unusual family who mistreats their son and end up having to deal with the consequences of their errors. I questioned myself what the final take meant when the barricade tape is revealed. Was this ending always meant to be? Or is it just there for us to remember that things change and at the same time, they stay the same? (the father doesn't take care of the baby but instead, ignores him). I don't know the answer but this is a fascinating movie."
12,Loveless,5,20 August 2017,Loveless,"Andrei Zvyagintsev's film ""Loveless"" is about a middle class couple getting divorced because they understand that their marriage is loveless. The beginning of the film is promising  the son overhears his parents talking that they want to give him up to the orphanage after their divorce because he is an obstacle for their further happy life.However after the child disappears, the film becomes completely pointless and uninspiring. It contains a lot of meaningless conversations, not very exciting sex with plain looking people, and all this occurs against the boring background of drab and colorless Moscow apartments.Towards his characters director is clearly loveless; they are entirely uninteresting to him, but unfortunately they become uninteresting not only to the author, but also to the viewer. The director obviously skimped on the actors because he thought that for the depiction of such humdrum personalities good actors were not needed. The result is flat, lifeless, paper-thin characters. The course of events is mundane and very predictable. The sole protagonist  the son  vanishes so quickly that we do not have time to get to know or love him. It is especially important to note the mediocre camera-work. The centric composition is ordinary and inexpressive. Lighting is poorly thought out. The only beautiful shots are of the frozen lake and the rest of the footage is very banal. This is quite surprising, because cinematographer Mikhail Krichman is the same one who worked on Zvyagintsev's previous, much more visually expressive films. At the end of the film we see a television broadcast of events in Ukraine. Russia and Ukraine  loveless and divorced. However, this association looks contrived. The heroine wearing a tracksuit with Russia imprinted upon it, is a prototype of Russia, tired and not loving its children. But this metaphor by Zvyagintsev seems calculated, inorganic and senseless. The film looks very inexpensive and as if done in a hurry. Andrei Zvyagintsev, who previously proved himself to be a high level master with the film ""Leviathan"", is disappointing in this picture. In ""Leviathan"" there were brilliant acting performances, amazing locations and profound thoughts. ""Loveless"" unfortunately only manages to arouse epithets with a suffix LESS.Read more at: http://indie-cinema.com/"
13,Loveless,2,11 October 2017,One dimensional characters in a one dimensional story.,"First of all I like to state that I'm a huge Andrey Zvyagintsev fan. Since his debut with Vozvrashchenie in 2003, on which he rightfully won the Golden Lion on the Venice Film Festival and with it's his followup movies The Banishment (2007), Elena (2011) and Leviathan (2014) nothing seems to be able to harm Zvyagintsev's brilliance in movie-making. Until now. Loveless is truly an overrated movie which is way to long, the story itself could have easily been told in 90 minutes instead of more then two hours. Sometimes long movies contribute with characters to develop, but in this movie the characters remains shallow, the boy that disappears has no depth in his character role what so ever so it's very hard to feel the ""pain"" of his disappearance. And also because the main two actors, husband and wives, show lack of depth in character it's pretty hard to get some kind of connection with the actors. But then you also have this tedious and most terrible aspect of this movie: quality of acting, or rather, a lack of acting quality. The only thing you see from the this wife character is anger, frustrations, as well when looking at her husband. You only see anger and frustration and fear, fear of how colloquies would react on work when he would state that he has been divorced. Literally everything in this scenario points out towards the same direction: the parents are all egocentric, self-indulgent angry people who have only interest in themselves or in the maybe consequences when divorce is imminent. The victim is without a doubt the child. It's so one sided and lacks so much nuances that the characters are becoming, for me at least, a characterization of the evil self destructing ego. A stereotype you might state of the egocentric side of humans. But life itself is anything but one dimensional and because of the one dimensional characters in this movie makes this movie hard to watch, let alone a movie to take seriously. A pity, because I'm a real fan of Andrey Zvyagintsev, I've got all of his movies but I'm not eager to add this one to my movie collection."
14,Loveless,10,25 December 2017,A masterpiece.,Loveless is a very adult themed movie. Its truly one of the best movies I have seen in a long time. The story is very difficult to take and its not exactly the happiest movie. Its a breath of fresh air compared to the trash that is being produced nowadays.
15,Loveless,,3 December 2017,One of the year's most heartbreaking movies,"Russian Director Andrey Zvyagintsev's 2014 LEVIATHAN was one of the best movies of that year (it was nominated for Best Foreign Language Film). It took a relationship drama and made it into a stunning commentary on government corruption. LOVELESS is more intimately told and focused, but, it certainly isn't without larger concerns. A married couple, Zhenya (Maryana Spivak) and Boris (Aleksey Rozin) are going through a divorce yet still living together in a Moscow apartment they are jointly trying to sell. Both are having affairs. Literally lost amongst this is their son Alyosha (Matvey Novikov). Right from the start we hear the parents bickering over custody of the boy - NOT over who wants the child, but, who gets 'stuck' with him. Unsurprisingly, the boy becomes a runaway. In a normal movie, you'd think that their son's disappearance would draw them closer as they search for him. Not in Zvyagintsev's LOVELESS. Far from it. Their search seems more a social obligation than one out of genuine emotion. It's a cold detached point of view, and one matched by a stern police office on the 'case'. The only dim rays of hope are provided by a private advocacy group that looks for runaways. The movie is set in late 2012 and there are mentions of the Mayan Calendar's End of the World prediction for that year, adding to the downbeat mood.The acting is strong in a low key manner. Zvyagintsev's Direction is clean and precise with well thought out camera compositions. The minimal score is spare but effective. And, while Zvyagintsev does attack the system as directly as he did with LEVIATHAN, the image of Zhenya running on a treadmill outdoors in a freezing Moscow wearing a bright red jumpsuit emblazoned with the word ""Russia"" (in English) in large letters can't help but beg mention. It may be difficult to say one 'enjoyed' a distressing movie like LOVELESS, but, it earn your admiration."
16,Loveless,10,22 November 2017,Excellent look into modern day egoistic marriage,"To me, this film is about selfishness and inability to accept responsibility for one's actions. This is such a relevant topic not only in Russia but pretty much everywhere in Europe. People are so convinced that the only that matters in their lives is their personal happiness and nothing else. And if you have made a mistake in your past, someone else, not you is responsible for this mistake.The film starts with a very typical argument between exes that is filled with accusations from both sides. It is clear that the married couple who are in the middle of the divorce have never been happy. They have let someone else decide that they had to get married and have been quite unhappy and unfulfilled since. It is their parent's fault, their society's fault, it is their child's fault that they are unhappy. They actually believe that it was not their own doing and their own choice. And now that they are stuck in this situation they are both seeking the easiest way out, and that does not include their son. The father's attitude is extremely common among Soviet men, that it is mothers responsibility to take care of the child, and in 99% of cases that is exactly what would happen. Except, in this case, the mother is also selfish. She does not want the burden of bringing the child to her new lover. So her blame and bitterness are clear to everyone, including the child himself. I can not imagine the pain of the child and what it could do to someone's psyche. Knowing that you are not loved and not wanted, that you are in the way of your parents' happiness. So it is no wonder that he decides to run away.Even though it should be every parent's worst nightmare, this is exactly what they both wanted. To get rid of him. But of course, this does not result in happiness either. Now they have even more things to blame for their miserable lives."
