,title,stars,date,r_title,text
253,Moana,9,27 November 2016,"Moana is a Great Adventure, Magical at Times and at Worst a Little Over-The-Top","People want diversity in their animated movies, female main characters and some deviation from the formula. Disney has answered the call. It's commendable of them and I applaud them for it. We don't get to do much travelling to exotic locales like in some of the older Disney movies. In Moana, we get to travel to Polynesia and although some elements of the plot are familiar, the movie has a different flavour to it and I enjoyed it. Was the rest of the movie as fresh as the environment the movie was set in? The answer is both yes and no, I'm not trying to be secretive but just like any other movie, there are bright spots and things that aren't quite perfect.*Minor Spoilers Ahead* We get a short introduction from Gramma Tala (Rachel House) on how the islands came to be. Te Fiti is a goddess who sprang from the ocean and began to create life. It wasn't long until other life forms wanted her power for themselves. A demigod named Maui (Dwayne Johnson) traveled to her island and stole her heart. When he tried to make his escape, he was confronted by Te Ka, a monster made of lava. The two battled to a standstill and the heart was lost. This left Te Ka in power and even 1000 years later, he still exacts revenge by draining fish from the oceans and swallowing up islands. It's a cool story but the problem is that she's telling it to a bunch of small children who begin to cry and run around frightened. All except one, little Moana (eventually being voiced by Auli'i Cravalho) who is already a little adventurer at heart. She's drawn towards the sea and despite the objections of her father Chief Tui (Temeura Morrison) ventures out to the beach to pick up shells and help a baby turtle make it across the beach. The waves begin to literally begin to play with her (it's an adorable scene) and part to reveal more shells for her to collect. Her father stops her but even as she grows, she always still feels the call of the ocean and tries to balance her responsibilities with her longing for adventure.There's so much to talk about with this movie, I already touched on how beautiful the atmosphere is. The animation is beautiful the whole way around. From the island life to how the water moves and interacts with the characters, to the character design (the coconut pirates were particularly awesome), it all looks great. You expect this from Disney (between their work and Pixar, they represent the gold standard) but it's worth noting all the same. It's definitely one of their better looking movies and although the rest of the movie is up to the task, I don't think it would have been the same without the efforts of the animators.The next thing to mention is how great the music was. I didn't love every song (""Shiny"" wasn't bad but it wasn't my thing) but when the movie really hit the right spot with the musical numbers, it took me back to the Disney movies I watched when I was a kid (The Lion King, Aladdin just to name a couple). There were some pretty powerful songs in here that were not only fun to listen to but were also very emotional. My favourite was ""You're Welcome"" which is when Moana is introduced to Maui and he thinks she's come to him as an adoring fan. Who knew that Dwayne Johnson could sing? I had a big grin on my face for the whole song. I think kids will love the music and adults will get something out of it too.The characters are new and well developed but they aren't without familiarity either. I think this is where some people will have problems with the movie. Moana is technically like some Disney princesses and her journey isn't without some familiar elements. This is something I didn't take a big issue with, sure it would be great if it was something that we hadn't seen before but I don't have a problem if you can follow the formula but put a new twist on it. Moana is a great role-model for the kids out there, balancing her duty with her enthusiasm for adventure and although Maui comes across initially as very self-involved, he's actually pretty vulnerable and there was a reason for doing what he did.I want to finish up with the voice acting, which was also pretty great throughout. This was an especially strong debut performance for Auli'i Cravalho. She not only was great in the musical bits but I felt like her performance had a lot of emotion in it. She had a character with a lot of conflict about what she was doing and through her performance, she made the audience care about what happened to Moana. Dwayne completely nailed it as Maui, it almost felt like him just showing off his newly found range. The guy honestly just keeps getting better as an actor. The supporting actors were also good, I didn't like his song but Jermaine Clement just has a voice that's perfect for animated movies, he does fine work. Rachel House and Temeura Morrison were noteworthy in their respective supporting roles.I didn't love everything about this movie but the aspects it got right, they were ultimately pretty great. Anything that makes me think of the older Disney movies I grew up with was doing something right and I was left reminiscing more than a few times. I didn't love the ending but it did end on a nice hopeful note and they over-played the chicken sidekick. I liked this better than Frozen but not as much as Inside Out. If you have kids, they're going to absolutely love this movie, I give it an 8.5/10"
254,Moana,8,27 November 2016,Moana: Disney Animation Studio's Highest Technical Achievement,"My main desire to see Moana was simply for the incredible animation promised in its trailers. Many will find that this is clearly where Moana shines. If you are simply looking for two hours of engrossing eye candy, then this is your movie. This particular CGI animated film looks immensely better than any previous Disney Animation Studio effort including this year's Zootopia and Pixar's Finding Dory. When viewing Moana, I would highly suggest getting a close seat because you will notice great detail in the animation (especially with character design) and have a better viewing experience overall up close and personal.Sadly, being a typical Disney Animated film, we as viewers already have an idea on what is going to happen by the end of this vigorous tale. Don't get me wrong the journey is worth the viewing but, this isn't the place for a Disney movie to suddenly shine with its plot. However, Moana does have neat folklore and a nice backstory to make up for its predictability. As the film progressed, I was excited to know more about the setting where Moana lives and her community's backstory.The original songs that are featured strengthen the film and coincide with the story in fantastic ways. I think the effort and time put in the making of these songs gives Moana more credibility as a well presented animated film. However, not every song amazed me for one song in the middle of the film did sway me and came off as a bit cheesy. Another tiny disappointment regarding music was Disney's attempt to popularize one of the main songs used in the film by getting a pop star to do a radio friendly rendition that appeared in the credits.Much of the comedy (including one sad joke referencing Twitter) threw me off a bit as I did not find myself laughing during this flick for I was too engrossed in what I was witnessing visually. Moana's chicken Heihei would go on to get the most laughs in the theater almost every time he appeared on screen. Kids and mostly the parents found this hilarious but for me the chicken and most of the jokes set up were not very entertaining. I would have preferred Moana's cute pig Pua to accompany her on this adventure instead of trying to obtain cheap laughs with this dumb and unfunny chicken. These few complaints however do not get in way for what is clearly Disney Animation Studio's highest technical achievement.I think as a sole adventure/musical/drama, Moana ""sails"" great on its own. If it wasn't for Zootopia's great message and overall creativity (and the hard relentless effort put into Kubo and the Two Strings), I would place my bet on Moana for the Academy Award for Best Animated Feature."
255,Moana,9,27 November 2016,A great film. I like.,"Moana is, without a dought, one of the best films of 2016. Another film from legendary Disney directors Ron Clements and John Musker (Little Mermaid and Aladdin) and starring Dwane ""The Rock"" Johnson and newbie Auli'i Cravalho, Moana, Disney's newest princess movie, is a win. The Rock's Maui steals every scene he is in. His great performance enhances his comedy, especially in his musical number ""You're Welcome"". In addition, I didn't know Dwane could sing! But, the best thing about this film is the animation. Moana is so beautiful it rivals Good Dinosaur and Totoro. It's obvious they spent a long time on every single coconut. Yet, every good movie has it's downsides, and Moana is no different. The movie had a few too many inappropriate jokes not done well. A lot of the songs were pretty unmemorable, though I remember liking most of them. All in all: 9/10."
256,Moana,9,26 November 2016,Great movie for kids!,"Saw this with my wife, 3 year-old daughter & mother-in-law & we all loved it. The packed theater of mostly kids & parents seemed to love it & gave it a good round of applause at the end! It is what it is people...a Disney Princess movie with some good laughs, great songs & an overall good family time. For those who didn't like it, I'm not sure what you were expecting with an animated Disney Princess flick. My wife & I were singing the music the rest of the day. Moana had (for what its worth)likely the best song ever sung by The Rock, and he didn't sound half bad. Ms. Cravalho, as Moana, was excellent & has a beautiful voice...move over Elsa & Anna, make room for Moana! The animation was gorgeous, the writing was cute & amusing, the plot was entertaining enough, it's hard to find much to complain about. I'd give it a 10 except it wasn't scary enough for me as I love scares but hey, it was a Disney Princess movie for gosh sake! :)"
257,Moana,7,23 November 2016,A Satisfying Magical Resurrection of A Long Lost Culture,"Faithful to the tradition of Disney's renaissance era, Moana takes audiences of all ages on a journey with a resourceful young woman who learns her place in the world. Parents will love the tribute toward Polynesian culture, while kids will love the fantastical journey made complete with a fresh color palette. Other than an inappropriately placed gag about urination, Moana has established itself as yet another family-friendly hit by the Disney studio within their CGI renaissance.The wide range of animation styles explored here starts with a two- dimensional storytelling of what Polynesian religion believes brought the islands into existence. In what appears to be a moving tapestry, a wise, grandmotherly voice-over tells us of Mother Island, who raised islands out of the sea and then rested among them. That is, until Maui the shapeshifting demigod stole her heart. Along his path away from Mother Island, he lost the heart, as well as his fish hook that allows him to shapeshift.Then the animation style switches to the traditional computer animation, where an elderly storyteller is speaking to her grandchildren about the story. The one seated in the middle of the pack, the heroine of our story, immediately goes out onto the seashore, where the miraculously animated living water leads her through conch shells to the heart of Mother Island itself: the ocean called her to restore peace to the land.Then this toddler grows up to become Moana, daughter of the chief who wishes to sway away from their traditional ways in order to explore the world. She's a typical kid's movie heroine we've seen countless times before, and her motive to defy authority is not a good message for our kids, but the empowering musical voice by Auli'i Cravalho plenty makes up for that.Her grandmother pushes her to follow the calling by the ocean to find Maui the demigod so that she can help him retrieve his fish hook and return the heart to Mother Island. It follows out of the tradition followed by her people, as they are not voyagers; but their long-forgotten ancestry says otherwise. Therefore, Moana goes out on the quest, with a google-eyed, dim-witted chicken as her sole companion.Then she meets Maui himself, voiced with a lovable laid-back nature by Dwayne Johnson. He adds the familiar heart and soul expected from any Disney feature, as his tattoos move individually to express his true feelings.Now with the demigod on her voyage, Moana travels elsewhere to find his hook and get to Mother Island. Such stops include an underwater world of fantasy that houses a giant gold-crazy hermit crab. He is not one of the more tolerable portions of the adventure though, as his modes of dialogue includes rambling without a clear punchline to whatever joke he's attempting to deliver, and an out of place song sung in the style of Paul McCartney.This is among one of the other songs that simply sound odd in melody. Even so, there are several hits in the score, including Moana's single ballad, ""How Far I'll Go,"" and the catchy ""We Know the Way,"" both of which are guaranteed Oscar nominations. Yet none of these songs will catch on as one of Disney's iconic tunes. In addition, anytime the characters are not singing, they are blatantly telling us through not-so-subtle foreshadowing what will happen later on.Another thing that is difficult to grasp about Moana is the big ""so what"" of its celebration towards pagan religion. While yes, we should never be afraid to learn about other cultures and their backgrounds, depicting their gods as truth is not the answer to learning about who these people are. I would like for Disney to someday make a big leap in exploring and faithfully retelling the way those of another culture live their day to day lives, as to make up for their poor treatment of non-White races in the past.I cannot see Moana becoming a celebrated classic like Beauty and the Beast, The Lion King, or The Little Mermaid, nor can I see it largely influencing pop culture like Frozen or Zootopia, but it is still a fresh adventure for the young and young at heart to get the ideal expected Disney experience."
258,Moana,8,23 May 2017,"Formulaic, but well-executed","The basic plot of ""Moana"" does not contain many surprises for anyone who has seen more than a few children's films. The film not only gives us a young hero, but refers to her as ""the Chosen One"", making it impossible to overlook the film's few deviations from the standard Joseph Campbell formula. That probably sounds like a fairly minor critique, but I feel the need to point it out anyway.Dwayne Johnson is a charismatic individual, so it's a shame that most of the roles he gets do not measure up to his talents. In this film, he plays an arrogant demigod whose physical presence and immaturity do not conceal his compassion and insecurity as well as he probably thinks they do. He's probably the best thing about this movie, getting one of its best songs and a whole lot of clever lines and gags. Our hero, Moana, is a young Polynesian girl who wonders if there might be something beyond the coral reef that her father, the village chief, forbids anyone to go beyond. Will she venture beyond it someday and embark on a grand adventure that will save her people and bring her face-to-face with beings and lands she had never imagined, possibly with the accompaniment of a cute animal sidekick? I'll ask again: Have you ever seen a Disney film?I mentioned that the songs in this film are good, and they're probably the best in any Disney film in recent memory. (This Lin-Manuel Miranda guy might be going places.) Actually, it might be the best Disney animated musical since the 90s. The animation is colorful and vivid, and the script wisely leaves out the love interest character that was obligatory in these movies for a while (although it calls attention to itself for not featuring a princess, which is unnecessary.) If you are a Disney person or need something to show the kids, you could do much, much worse. I just like The Rock."
259,Moana,8,11 April 2017,Disney's New go-to Form for Their Princess Movies,"This is how Disney should portray their princesses. Don't get me wrong, there will always be a place for that damsel-in-distress or ""I must find a man"" mentality from Disney movies... but really, we don't need any more of those. Moana is a strong-willed progressive female who shows us how a ""princess"" (daughter to the chief) can be her own person and not rely on some buff brave man to come and save her every time. A good change of pace from the older Disney movies where women had a very conservative attitude about them. Not necessarily saying that that's bad, if you have that mind sent, but its refreshing to finallysee it in a huge blockbuster Disney movie, especially with the changing attitudes of the world today. My only complaint is that there isn't a lot of character development in the film. She starts out brave and a leader, ends with some more knowledge about sailing and is more brave and more of a leader. Don't get me wrong, I love her character, but it would have been nice for more development."
260,Moana,7,2 April 2017,Your typical Disney movie.,"Moana is a big budget movie by Disney, with hawaian Auli'i Cravalho as Moana, the protagonist of the movie, and Dwayne Johnson as Maui, a legendary shape-shifting demigod, who plays a good cop bad cop routine. This movie has a lot of singing and the classical Walt Disney's rain of gags that splashes your face every second. Usually, in a Disney's movie , there're more hits than misses. In Moana, there's still more hits than misses, but there are more misses than normal. The singing in the movie is alright, with Cravalho providing a stunning singing performance and with an OK Dwayne Johnson, who sadly you realize since the first song he is not a singer. The idea for the story is actually amazing (Which reminded me of The Village, by Shyamalan, about a girl forbidden of abandoning the little island where her family lived, even when she had the most adventurous soul on the island. This idea provided a lot of possibilities to the screenwriter. But when the idea starts to develop, then the movie cuts down to size in terms of quality. The screenplay is kinda cliché and after watching the first half hour, you know how it's gonna end. The screenplay might be the biggest flaw. Still, the animation is really, really good, and there are a lot of great jokes. It will be a lot of fun if you get your kids to watch it, and anyone in the family would enjoy it, because of its light-hearted premise and the family-friendly but smart sense of humour. It's a good film, but it might be one of the weakest of Disney's catalogue, which is near to perfect anyway. I think you should watch it, you will have a good time."
261,Moana,8,20 March 2017,Stunningly beautiful,"Like much Disney animation, it's plagued with forgettable (very un-polynesian) songs I could have done without (with the singular exception of a very-listenable tip of the hat to David Bowie). And the story isn't the strongest - deriving from past Disney and more than a little Miyazaki (which isn't necessarily a bad thing...)But visually, this movie is breathtaking, perhaps in league with Bambi. There are some points where the motion study is so natural and fluid you ALMOST forget you're watching animation, truly ""the illusion of life"". And despite its non-western mythology and absence of white folk, I think old Uncle Walt would have approved. Disney uses Pixar technology, and they've got skin and hair and smoke and clouds nailed. Still some problems with water and especially fire. Textures are looking very natural, the tropical colors clean and saturated. Oh, and there are some points where the motion study is so natural and fluid you ALMOST forget you're watching animation."
262,Moana,8,17 March 2017,A breeze of fresh air,"This movie is a must watch. it is not very different than other animated movies, where the main character tries to achieve the goal, with some obstacles, frustrations then success. the whole beauty lies in colors, details, movements, songs. I think it is brilliant, and watching it will simply make you feel better as if you have traveled to paradise..."
263,Moana,8,11 March 2017,I liked it,"The songs were fun, The characters were interesting, and the visuals were beautiful but the movie was a bit slow at the start and the twist was kinda clichéBut overall. I enjoyed the movie."
264,Moana,9,11 March 2017,Better Than Expected,It made me cry more than once. A great inspirational movie for girls. This movie didn't look very good before I had seen it. Upon watching it though it has great messages about girls being the hero and families/ community. It has had good humour that actually did make me laugh out loud. The songs weren't as good as classic Disney but there were an handful that were really good.
265,Moana,9,10 March 2017,Finally A Disney Princess Of Polynesia,"Watched Moana featuring the Voice Talents of newcomer Auli'i Cravhalo as Moana, Dwayne Johnson(San Andreas) as Maui, Rachel House(Hunt For The Wilderpeople) as Tala , Temura Morrison(Star Wars) as Tui , Jermaine Clement(The BFG) as Tamatoa, Nicole Sherzinger(Men In Black 3) as Sina ,Alan Tudyk(Rogue One) as Hei Hei also voice cameo by Troy Polamalu. The film was enjoyable the Dynamic between Moana and Maui also I really, really enjoyed this take on Polynesian culture and how awesome the Ocean also just enjoyed the layered characters and Adventure . it Musical Score by Lin-Manuel Miranda(The Electric Company ), Mark Mancina(Planes Fire And Rescue ) and Opetaia Foa;i(Amataga) also Amazing Direction by Ron Clements(Hercules) & John Musker(Treasure Planet) Finally A Disney Princess Of Polynesia 9/10"
266,Moana,7,9 March 2017,The Vidiot Reviews...,"MoanaThe best thing about growing up on an island is that it prepares you for if ever you get deserted on one.However, the princess in this animated-musical sees no benefit to island living.The daughter of a domineering chieftain, Moana (Auli'i Cravalho) yearns to stray beyond the coral borders of her Polynesian community, but her father forbids voyages abroad for fear of sea-monsters.When she uncovers the real reason behind the leviathans and of her tribe's seafaring legacy, Moana and her pet rooster set sail to capture a shapeshifting demigod (Dwayne Johnson) and liberate an island deity from captivity.Although it does not stray far from the typical Disney princess story standards  an animal sidekick, an overprotective father and a bevy of songs - it does however do a commendable job incorporating those criteria in an amusing fashion. Incidentally, shapeshifting is most useful when you can't find a washroom. Green Lightvidiotreviews.blogspot.ca"
267,Moana,7,9 March 2017,7.8 Fair enough. Obviously not Pixar. Haha...,"I appreciated how it paid homage to earlier Disney films; whether that is picked up on or instead called ""cliché "" , ""cookie-cutter"" or too ""annoyingly musical"" is up to the audience. I like musicals and classic Disney so that won the movie over for me.But, it did fall short on what could have been even better scenes or more story. Overall: Refreshing story about a legendary character that hasn't been told; Maui, not Moana. Some cool and memorable songs. But the story left me wanting more and in a sort of disappointed way. *Non-plot related spoilers ahead* -The Kakamora coconut pirates were interesting, but had could have used even just one more scene later. -Would have been nice with scenes of Maui's backstory rather than just talking about it.-Environment. Didn't show as much island. Which is okay. Also comparatively, in Frozen the environment became mostly snow and Moana mostly ocean. But there are beautiful environmental scenes there."
268,Moana,10,5 March 2017,This movie was most excellent!,"This movie was really enjoyable. The songs were well written and helped paint the pictures of the movie so well. I would recommend this movie to anyone looking for a good movie to watch with their families. The actors that they chose to voice the characters were well thought out. The amount of hard work that has been put into this was really good. All in all, I was rally happy with how this movie turned out. I was not expecting such a great movie. I know that have that so much but I can not stress how much I love this movie. This movie is now one of my favorite Disney movies. I love the fact that this was written around a Polynesian Island family. This will be a favorite of many for years to come. I give this movie a 10/10."
269,Moana,9,5 March 2017,Interesting story,"I liked it. Is a good movie for family and you find interesting facts about the polynisian people. Moana character is nice and in combination with Maui demigod is great. Maui is funny, full of muscle and tattoos and have a chemistry with the polynisian princess. Moana have two ""sidekicks"", a pig and a cock, HeiHei, who are very funny and you will enjoy them along the story."
