,title,stars,date,r_title,text
170,Moana,9,26 November 2016,The Different Kind of Lovable Disney Princess and A Sure Classic Animated Movie,"Well it's been a long time since the last animated movie of Frozen (also by Disney) that I was truly entertained with such film that had a lot of songs. While that movie I watched by myself, I had the pleasure of my wife's company watching this one. And I knew from the first few minutes that she would love this movie till the end (proven by her various emotions during the duration of the movie). This movie was very very good in term of story and the quality of the animation which made the characters look soooo much alive. I could picture Grandma in real life and also Maui (who I pictured would look like Dwayne Johnson). The songs in this movie were mostly gorgeous with the one sung by Auli'i especially nice (I think it was titled How Far I'll Go). This is a movie for all audience. I am very sure children would be entertained by the funny scenes involving Heihei (the dumbest chicken we have seen, LOL), while the more adults would be happy to see the adventure and the moral of the story. It is mainly about a girl trying to find out her real destiny and doing everything she can to fulfill it because she felt it was her responsibility. It was a different kind of princess than the usual Disney princesses (this was mentioned very cleverly by the writers through Maui when he talked about this in the first few scenes of him together with Moana in the ocean). Another thing that was a bit different from the previous Disney movies such as Zootopia or Jungle Book, was the fact that in this movie, the animals do not speak.In addition to those, the relationship built between Moana and Maui, plus the strong presence of Grandma made the whole movie truly felt like a complete Disney style animated movie. Well done Disney team, you have done it again!For those of you who have not watched this movie, please go there and see it. And please do not be late, as there was a very great short story presented before the movie started. I am very sure those working people like me, would appreciate such a lovely story. Oooh and another thing. Apparently there was also an end credit scene which I did not know of. So if you have not seen it, do not leave your seats till the very end. I understand it would show something that people who watched Disney's animated movies could relate to.For my complete review, pls have a look at michaelnontonmulu.blogspot.co.id"
171,Moana,10,26 November 2016,"Finally, Disney's BACK!!!","It's been FOREVER since I walked out of a Disney movie all dreamy and amazed...there's always been something off...the music, the story, the animation. Moana just got it all, I walked out with the biggest grin on my face!! I feel like finally, Disney got his act together and remembered what we loved with the Lion King, Aladin, Beauty of the Beast... The animation is AMAZING. The sea, the colors. The islands, the land, the flowers, the colors. Yo don't know where to look, everything looks amazing. The story is great, authentic, based on a great culture. There was research involved and you feel it. The characters are awesome, authentic as well, strong. Yet super funny too. And the songs are diverse and catchy again!! I just LOVED the movie, I've been twice already, bought the soundtrack...well. Disney's back :) I strongly recommend it."
172,Moana,10,26 November 2016,Must See Disney Original,"First things first.Disney once again gives us an original short prior to the feature called Inner Workings. It picks up where Inside Out left off, whereas we get to see how the human mind/body works. I'm not entirely convinced kids, especially younger kids will appreciate this one, but it hits a powerful chord with every working adult. Boring, Boring, and Glum resonates to the point where I laughed almost as much to keep from crying as I did from the pure humor.As for the newest Disney Original feature film of Moana, words like beautiful, delightful, funny, exciting, thrilling, action packed, innovative, charming, mesmerizing, emotional, and inspiring leap to mind. While for the most part, I'm loving the sequels the company has been doing, Moana recaptures the magic and wonder of Disney original stories and makes me extremely happy this is the course they'll be pursuing again. I'm a fan! The largely Pacific islands cast with the exception of Dwayne Johnson as the voice of Maui, Nicole Scherzinger, and Alan Tudyk is unfamiliar to me. However, the perfection in the casting is undeniable. The characters these actors create are comforting, warm, three dimensional.The musical score, includes songs by Lin-Manuel Miranda (of Hamilton fame) perfectly accentuates and punctuates the story elevating the level of entertainment. Plenty of toe tapping and seat dancing to be had. While none of the songs will most likely reach Let I Go proportions, I defy you not to laugh, hum along and get You're Welcome stuck in your head. Others have tried, maybe even come close, but no one tops Disney/Pixar animators when it comes to water animation. No one. The overall animation is also out of this world. There's great us combined 2D and 3D animation to make the story pop, especially the mythology sequences. The research done to capture the vivid colors and textures of the Pacific Islands flora and fauna gives Moana an unsurpassed tactility. I wanted to jump on the next plane to see islands myself.I thoroughly enjoyed myself and can't give Moana anything but a 10 and look forward to adding it to my personal movie collection to enjoy for years to come.ALERT for you folks that dash out as soon as the credits roll. Stick around to the end. Enjoy the closing credits music because there's a final scene when all is said and done that will make you smile."
173,Moana,9,25 November 2016,Another return to Disney's classic formula,"Moana was the only other animated film besides Zootopia that I considered a must-see film for this year. I was really drawn in by its premise, which I thought was a spiritual predecessor to Lilo and Stitch (a movie that I consider a must-see as well). For the most part, I wasn't disappointed, as the story does capture the feel of what seemed to be obligatory in a movie with this kind of premise. The characters aren't as complex as they are in Zootopia, but they do feel closer to what some people consider those from a true Disney musical. The characters present me with one of my main complaints of this movie: I am still not certain of what Maui's motivation was to rejoin Moana. It's not a surprise that the animation is Disney's finest yet, with more colors than I can count and effects that I have never seen before in a Disney film (the way it blends CGI with hand-drawn effects, such as Maui's tattoos). The songs are at worst tolerable, but at their best, they seem like ones from a Disney Renaissance film, even if there are so many of them. Speaking of the Disney Renaissance, this film has solidified the existence of the Neo-Renaissance that began, as many Disney buffs like to consider, 7 years ago. It doesn't have the ambition of Zootopia, however it is amazing in its own way and should please those who have a passion for Disney's musical formula. All I can sum this up with is go watch it."
174,Moana,7,31 July 2017,Fairly Generic Disney,"It's nice to see a spunky female heroine of color at the center of a Disney film, and it's also nice that the story doesn't remotely involve her falling in love with anyone by the film's end, but this movie still couldn't completely shake off its patina of generic Disney message. The animation is pretty, the music is forgettable (with the exception of the rousing Oscar-nominated anthem ""How Far I'll Go""), and the story is moderately engrossing. This was nominated for Best Animated Feature at the 2016 Academy Awards, but it's no where nearly at the same level as some of its co-nominees, namely ""Kubo and the Two Strings"" and my personal favorite, ""The Red Turtle.""Grade: B"
175,Moana,7,29 June 2017,Colourful and pleasant but predictable and not particularly memorable,"Once again we are told that to be happy we must follow our dreams despite the advice of our elders, which always works out well in Disney movies, but is an overly simplistic and potentially dangerous message with which to continually indoctrinate children. ""Moana"" is colourful but not very original entry into the Disney 'Princess' franchise (despite the self-referential declination). The sidekick chicken was amusing and, unusual for the genre, not much of a merchandising gimmick. The Rock as Maui was fine as the loud-mouth counterpoint to Moana's typical 'coming of age' girl character but neither of them brought anything new to the canon. Maui's ""Your Welcome"" song (both the music and the imagery) was a standout in an otherwise bland score. The parallels with ""Star Wars (1976) are obvious - all of these types of stories tend to follow the 'hero-myth' trajectory, but this pair is pretty close (a youth who wants to leave, adults resisting, disaster strikes at home, an older mentor who dies and returns as a guiding spirit, a worldly, self-centred companion who flees only to heroically return in the nick of time, a surprise reveal about the nature of the 'enemy'). I'll admit that I'm the wrong gender and 50 years too old to be in the target audience for this kind of movie, but I enjoyed it enough to give it a reasonably high rating."
176,Moana,,24 June 2017,"Okay, but too many cooks made some significant weaknesses","I'm pretty sure most kids - and a lot of parents - will probably enjoy ""Moana"" a lot. Technically, the movie is first rate, with animation that is very colorful, detailed, and breathtaking. There are some very good (and exciting) action sequences here and there. And many viewers will be taken by the title character, who is intelligent, brave, and resourceful.However, there are some major weakness in the entire package that significantly lower the movie from the label of modern day classic. For example, the script has some holes. For starters, if Moana has lived on a small island for many years, why doesn't she know about the chiefs monument on top of the mountain? Or know about the cave hidden by the waterfall? Another problem is that the movie, at 107 minutes in length, is much too long for its own good. While the movie never gets to be boring, the padding is very evident. And the songs, while not terrible, are not very memorable at all.As I indicated in my summary line, I think these weaknesses came from the fact that too many people were working in key roles - look at the fact that there were four directors, and even more people working on the story. If there had been one clear vision, maybe the aforementioned problems would have been reduced significantly. I'll give the movie this: It's a step up from the overrated Disney movie ""Frozen"". Maybe Disney is slowly improving."
177,Moana,,10 May 2017,Very excellent and entertaining animated musical.,"My wife and I watched this at home on DVD from our public library. This IMDb main page has a sufficient synopsis of the story so I won't repeat it in what I am writing.I just want to comment on the production values. The looks and motions, walking, running, swimming, etc of the animated characters is probably the best I have seen. The faces of the human characters have exaggerated features, like slightly too large eyes, big legs, etc to definitely place them as intended animated figures. But otherwise they move, talk, and sing very realistically. The water, trees, sky, etc are very realistic.High schooler Auli'i Cravalho is the voice of Moana, only child of the King and destined to be the leader one day. When very young she is ""chosen"" by the ocean to make a journey and restore order and beauty to their islands. Ms Cravalho already was a singer in high school activities and sings her songs very nicely here.She is required to enlist the help of Dwayne Johnson as demi-god and shape-shifter Maui. He is reluctant but Moana is very persistent.Overall a very entertaining hour and a half."
178,Moana,4,10 May 2017,"Stunning Animation, but not much else to offer","I may have liked this movie more if I would have watched with the sound turned off. The music was horrendous, the characters were boring, and the plot was sub-par at best. And what was with the androgynous crab? I felt like I was tripping on acid while watching Liberace perform as Boy George. Not really my cup of tea.With that said, the animation was breath-taking, and the cast did a great job with a not-well-written script. I love The Rock, but even he couldn't make this movie live up to my expectations. Watch Tangled, then Moana and you'll see why I give this movie 4 out of 10 stars."
179,Moana,8,29 April 2017,A brilliant spin on the classic Disney story,"Moana was a film that took a unique spin on the classic Disney princess story. It was an unique twist to use real life Polynesian culture to convey this Disney story. It was a beautiful telling of an unknown story. Both Cravalho and Johnson were great in this film. They were both able to show humorous sides but also very funny sides. I thought Johnson was especially great as he showed a sorta arrogant and downright jerky side. It was a different take on some of the previous roles we have seen him in before. Some of the others actors such as, Rachel Hale as Gramma Tala and the unknown voice of the chicken. They were very funny and great additions to the story I thought the songs were done quite well. ""How Far I'll Go"" was obviously the feature song but personally I enjoyed ""Your Welcome"". I thought every song did what it was supposed to and really added to the story line. The plot of the story whiles being the classic Disney story it was done well. It added the unique Polynesian culture and some great side stories.All in all, this was a very well done movie. It was a welcome addition to the Disney princesses classics and deserves the right to have a sequel."
180,Moana,8,24 April 2017,Moana the Ocean Princess!!!,"I can definitely see why this movie broke all kinds of Disney Box Office Records because it is pure magic, action and adventure everywhere with Moana being brave next to Maui being very strong so this is definitely a family movie to watch over and over again!!! The characters and the story are all very funny with all of the above emotional moments that every Disney Movie has being that there are References made from all kinds of the other Disney Movies that are in this one."
181,Moana,9,23 November 2016,"Don't Care for Animated Film or Disney, but this is an exception.","OK. I am a fan of Dwayne Johnson, ever since his days as a wrestler with the WWE, called The Rock. IN this movie,the songs were great. The setting was beautiful. And the story not too complicated. Newcomer Auli'i Cravalho was great with her voice acting and wish her the best of luck in the future. If you stick around for the after-credits scene, there is a very cool but funny pop culture reference to a classic Disney animated film. Instead of spending money on that over-rated snooze-fest "" The Edge of Seventeen"" take the family out to see this film. This is type of animated film, that will make you laugh and make you cry. This movie is great in showcasing a new side to Dwayne Johnson. Apart from the villain being underused, this movie is great. 9 of 10 stars!"
182,Moana,10,22 November 2016,SHOVES culture into the audiences faces :-) MUHUHAHAHAA,"*beep* yes. Way to go Disney.This was in no way watered down culture used simply as a backdrop, like they did when they cancelled ""Kingdom of the Sun"" and turned it into Emperor's New Groove. (Removing all of the strong overt Inca/Quechua plot elements, gods, and songs) Or even to a degree what they did to Mulan.Moana aggressively shoves culture at audiences. Moreso then even things like Aladdin. There are multiple long strong sequences in their full on native languages. Can you imagine if Aladdin had overtures in Arabic? Or Mulan in Chinese? They would feel like completely different films. The characters in Moana behave within their religion and value system. It was so impressive. The only anachronisms were a few odd jokes from Maui. But it's remarkably in the time period and well done. The richness is on display, not hidden.GOOD MORE Disney. MORE LIKE THIS"
183,Moana,8,23 November 2016,You'll go have Mo Funna if You See Moanna,"It wouldn't feel like Thanksgiving without a Disney animated feature to grace the silver screen. And this weekend the animation studios are at it again with another masterpiece sure to be nominated for best animated picture of the year. The name of the movie this time is Moana, a tale of Polynesian mythology wrapped up in a nice, Disney magical package. Will this movie net Disney the best picture of the year award, or is it just another filler until Pixar's next work? Robbie K happy to bring you another review this holiday season. Let's get started. LIKES:  Fun, new setting  Comedy  Soundtrack was kickingWe all know Disney makes fun films, but Moana's fun comes in form of the beautiful settings of the Pacific. Stepping away from the castles, this film will enchant you as you set sail on the majestic oceans and the mythical creatures that inhabit them. The world is colorful and dynamically shaded to match the tones of the film, which give the film a little energy to spice things up. No surprise, the animation is fluid (as always) as realistic movements (both living and nonliving) are captured in this breathtaking CGI. While I didn't see it in 3-D, this film's design would have popped out more with the special effects, therefore earning a recommendation to give it a try if you wish. But a Disney movie isn't just about the scenery, oh no you have to have characters that make you laugh and you can latch onto. Moana continues this trend, with the lead character (Moana) being the ever inspiring, girl power rocking, role model that most leads are. In terms of laughs though, Maui has you covered on this field. Dwayne Johnson delivers in the film, his bold, brash, and loud delivery matching the charisma of the demi-god. The hero has plenty of silly qualities to him, clever one-liners, slapstick antics, and a dancing tattoo which kept me laughing through most of the film. Throw in an idiotic chicken and anthropomorphic ocean and the you get a unique team for tickling your funny bone. My favorite aspect of this movie though has to be the soundtrack. This movie finally took a step back into the Disney renaissance world. A fantastic orchestra work sets the stage for adventure, bold brass instruments blaring and drums pounding as the boat coasts out into the wild. Other scenes have a more elegant touch to them to match the touching moments, rounding out the emotion of the film in a complete package. But many will fall in love with the original music our cast composes, bringing the upbeat, inspirational tone that will have young and young at heart hitting repeat over and over again. The soundtrack was perfect for this movie, and yours truly loved the islander twist to spice the tunes up. DISLIKES:  Not as exciting as other adventures  Unnecessary scenes  Missed potentialWhile Moana was fun and beautiful, it wasn't the most thrilling tale to grace the library. The film lacked suspense for me, never finding myself at the edge of my seat fearing for our heroes. Perhaps it was the obvious foreshadowing, or the fact that very little of the threats seemed deadly, but more cuddly and silly. Plus, the character development was a little lacking at times, so there didn't seem the looming threat of Disney killing a favorite character. Without the excitement, the adventure did grow a bit dull in terms of thrills, but fortunately the fun and animation make up for it. An even stronger dislike was how unnecessary some of the scenes were in the film for me. A few of the moments, were impromptu sequences meant to instill a sense of urgency, an effort I appreciate. However, the urgency had already been established and these scenes added little to the overall emotion or plot of the story. Unfortunately, the biggest sting was entering one ""supposedly"" dangerous island that Maui builds up. It had such build up and potential, and then they dropped it. This island could have been a very unique and dangerous world that added some edge and diversity to the film in regards to bizarre flora and fauna. Yet, they quickly skimmed over this part to get to an obnoxious character (the conflict with him rather lackluster), which left me a tad disappointed. Sadly, no other creatures or beasts appeared from the depths to enhance the adventure, nor any major challenges to gradually enhance the skills of our heroes. The bottom line of this dislike, is that the editing was slightly off track for this reviewer and could have been expanded upon to add more depth and excitement to the film. The VERDICTMoana is another fine example of how awesome Disney is at animation. Beautiful visuals bring alive a unique world that will make you crave to be on the majestic waters of the pacific islands. In addition, it's a very fun movie that contains both laughs and music to instill the positive energy that Disney films love to do around the holidays. Despite all of this though, it wasn't the most exciting adventure for me and I really would have liked to see more of the mythology brought into the tale to further develop our lovable characters (and more of the cute pig too). Still, this film is worth visiting in the theaters for all ages and will spread some early holiday joy over you and those you love. My scores:Animation/Adventure/Comedy: 8.5 Movie Overall: 7.5"
184,Moana,8,22 November 2016,"With the return of John Musker and Ron Clements, who made some Disney's classics, we are reminded why the House of Mouse has long been the pinnacle of animated storytelling.","Generally, I shy away from musicals for only a handful of songs I like and the rest I suffer through. However, there is always an exception made for Disney. For even though the magic and replay value of their 90s songs has long been gone (I still do not understand the love for ""Let It Go""), they still can pull tears out of your ducts and remind you why, even if you are way past their targeted market, the reason you fell in love with the company as a kid.Noted Actor(s)Moana (Auli'I Cravalho) | Maui (Dwayne Johnson) | Gramma Tala (Rachel House) | Chief Tui (Temuera Morrison) | Hei Hei (Alan Tudyk)StorylineFor a generation, Chief Tui has forbidden his people to explore the world beyond their island's reef. Something his mother Tala understands the reason for but doesn't agree with at all. Especially as the island begins to no longer be the resource-rich home it once was. Enter Moana. She, like her father when he was young, has a sense of adventure in her, something no matter how many times she is warned, her dad can't force out of her. So, as she sees her home dying, and her dad preps her to become the chief, she takes her people's fate beyond the reef and seeks out Maui. A demigod who, according to legend, thanks to him taking the heart of Tahiti, released a darkness onto the world which is why Moana's people are facing the peril they are.HighlightsIt Will Make You CryDeath and rejection are a huge part in modern animated stories, and not just within anime. Disney, as long as I can remember, would always have a dead parent or a misfit somewhere in its movie. This one is no different but, arguably, it isn't like before. Just take Maui for example. His backstory of how he became a demi-god is heartbreaking in a way. That on top of the reason why Tui doesn't want his people venturing past the reef, and what Cravalho through her voice, and the various animators and writers, bring to Moana's story. For while there is this little small part of me which wishes to compare this to Musker and Clements past work, which in some ways they nod to, this film reminds me of something. It reminds me of why people like Floyd Norman love working at Disney and why we, from pampers through our adult years, laugh, cry, and create more and more fond memories of their products.It Will Make You Laugh*Okay, if you are a kid, or can appreciate humor made for children, between Maui and Hei Hei you'll find quite a few chuckles here and there. The ocean also plays a role in the laughter as we see it interact with Maui, Hei Hei, and especially its interactions with Moana.On The FenceIt's FormulaicIn fact, Maui even jokes about it. A young princess, though technically chief's daughter, with her animal, Hei Hei, going on an adventure. But while the story seems familiar, and at times may remind you of The Little Mermaid in terms of Moana's relationship with her dad, Maui's tattoo companion reminding you of some of the animation in Hercules, Moana kind of looking like a slightly older Lilo, and I could go on, the familiarity ultimately helps you connect with the film. For as you pick up on what perhaps is Clements and Musker tipping their hat to their past work, it reminds you of what those movies made you feel and it makes you connection to this new movie of theirs even stronger. Sort of like how, for some, the new J.K. Rowling movie I'm sure brings up old emotions from reading, or watching Harry Potter.Overall: Positive (Worth Seeing)While it is formulaic, and also the songs may not be instant classics, it is funny, it has depth, it has a sense of culture, and honestly as Disney tries to diversify and stray away from its classic princesses, it continues to be a step forward. Reminding you the house of mouse need not depend on Pixar for it remains the juggernaut of the industry it damn near built. A title, and role, even with the occasional hiccup, it seems it may never lose even with its founder long passed."
