,title,stars,date,r_title,text
39,Open Season,6,30 June 2014,"Quite a good entertainment, but not more than that","The story is nice, looking at hunting activity from the perspective of the ones being hunted. It is also being developed well with having additional complications. But the whole thing doesn't seem to hold together. The funny stuff doesn't really get funny. Martin Lawrence and Ashton's Kutcher's effort for crazy voices did just a little to help the movie to be funny. One strange thing I notice is that only Elliot, the one-antler goofed up mule deer that is the animal which stands on his rear feet beside Boog the Grizzly bear. It's quite normal to see bears and smaller critters like rabbits, squirrels and skunks portrayed standing on their rear feet because bear do that in reality. But concerning Elliot, he is the only other big animal who does that, while the other mule deer, including his love interest Giselle, stands on all four legs."
40,Open Season,1,1 October 2006,Hollywood does it again...,"Thinking this would be a creative, well-written and original story, I trudged to the theater to view this film, even though I had great skepticism. Why did I do that? This film was nothing different than Finding Nemo, The Wild, A Sharks Tale, Toy Story, etc. Same thing, over and over again. When will something new finally come out? And I am so disappointed with the message it sends. I just love how the Libs in show business like to make hunting and hunters the ""bad guys"". They depict hunters as ""Shaw"" in the film, a poaching creep who shoots just to kill, not for sport and for the true ethics of the sport. When will someone do their homework and see that hunting is the best for of conservation out there; keeping ""Boog"" and ""Elliot"" from being smashed by cars and starving to death because of over population. This film makes the younger generation fearful of hunters and I was disgusted."
41,Open Season,4,17 October 2006,Overall a stolen plot,"alright,this was an OK movie.But the idea of talking animals has been wildly overused.Also,the movie had somewhat of a ""Shrek"" theme.Its the 'im not going to be your friend' but then at the end of the movie the mood changes to 'oh ill be your friend i love you' But while it did have its funny parts (the otter using a chainsaw/right after i saw the Texas Chainsaw Massacre) (the Scottish squirills) (""well need your nuts!"" ""And your acorns too!"") Don't worry,for those of you who saw those lines don't worry,because it was probably,like many children movies,overly advertised on TV and sold cheap toys at Burger King and McDonalds.But like I mentioned before,the movie did have a Shrek kind of feel to it.*as said by myfilm83"
42,Open Season,4,16 December 2006,"OK, Shrek-like story...","1st watched 12/15/2006 - 4 out of 10(Dir-Jill Culton, Roger Allers & Anthony Stacchi): OK, Shrek-like story about a couple of animal misfits who link up with the rest of the animal kingdom in the backwoods to fight against the human hunters when it's open season. The story starts off as a pet-like grizzly bear named Boog(voiced by Martin Lawrence) has it easy living in the garage of a kind of circus-like handler of a outdoorsy show for the parks department. Ashton Kutcher is the voice of a deer who arrives mounted on the car of a hunter and Boog lets him go. Boog then gets released by his handler to the wild and the Shrek-like imitation starts with the two trying to be Shrek & Donkey on a trek to get back to Boog's original home. There are some funny scenes with Kutcher being his goofy self in a great role for him and some classic uses of normal objects as weapons in the fight scene against the hunters, but not enough to sustain the full-length movie. The music(another attempt at Shrek-imitation) is also pretty lame. This movie will definitely not last too long or be recognized as much in the annals of animation history, in my opinion."
43,Open Season,4,24 July 2009,Leave Open Season closed,"How could Roger Allers, (oscar nominated director of the Lion King) make a movie like this. Open Season is just a rehashing of Bambi, The Jungle Book, Ice Age, Madagascar and several others. Not a molecule of originality exists here, and it addition to being plot less and pointless, it's not even funny. I found myself chuckling a bit, but seriously this is a waste of time money and talent. Talking animals has become such an overused archetype that it's pretty gimmicky today. Open Season takes that to extremities, the only thing that could be worse is probably Open Season II. To all parents out there, do not choose this as a family watch, your children will hate you for it."
44,Open Season,7,12 May 2007,Doesn't compare,"This animated film is not bad, maybe even quite good but it doesn't compare to any of the many other Disney films such as Finding Nemo, The Incredibles or Shrek. The animation was quite...interesting, different from many other films. The voices were fine, the plot was reasonably thin but it still kept me entertained for the duration of the film.I suppose they did well enough not to use fish in another animated film so they were successful on choosing animals that I don't think have been used in any (or many) other animated films.My suggestion to you is that if you see this film in blockbuster then get Shrek instead but if this is all you can get then don't worry, it isn't bad."
45,Open Season,,27 March 2007,It's Snot What You Think,"Get by the left coast hatred of hunters and firearms and you're left with the mildly entertaining animated feature, Open Season. It's all blandly amusing to the wives and kiddies in the audience, and for me, a man who supports hunters' rights, yet has never hunted, there's a feeling that my time could be better used, but why bother. I'm with my family.The thing I got most out of Open Season was the feeling that the makers of this harmless scat wanted to play with the big boys at Pixar and Dreamworks. There's something about a technical breakthrough at Sony that made the characters pop out on screen more, but the story is so weak that the critters get deflated.I was wondering if I disliked Open Season because I don't care for Martin Lawrence and Ashton Kutcher. Gary Sinise can do almost no wrong, but Debra Messing has to be seen instead of just heard. Probably the only character that made me laugh out loud was the Scottish squirrel, Billy Connelly. I kept seeing him in Mrs. Brown, flapping about in the surf, and the two images, both with nuts assaulting your senses, kept me chuckling.How's that for weird! Anyway, Open Season is a guaranteed money-maker, so grinching about it is pretty much pointless. If you do rent it, watch for the blue porcupine that keeps purring, ""Buddy?"" That's what made the wife and kid chuckle.Compare that with my Billy Connelly story and you'll have a whole new sense of the weirdness of your humble movie critic."
46,Open Season,6,26 January 2007,Fun family cartoon with a nice sense of kiddie depth,"Fun, well paced family animated film may borrow nearly everything from previous cartoon entries, but still manages to present some resemblance of freshness with it's skewed take on animal instincts. Giving these animals their sarcastic human counterpoints is hardly a new idea, yet in this country woods setting the antics do not feel as derivative as I might have guessed. Perhaps it is the left-leaning attributes of these filmmakers: the redneck-bashing, pro-environmental message guided by our sarcastic furry friends that keeps the movie somewhat engaging for the chaperones. Not without it's share of heart, Open Season will be completely predictable for adults, but sadly remains more witty, fun and vibrant then Pixar's last somewhat confused entry ""Cars"". While certainly not on the technical level of artistic competence that seems to be dominated by the Pixar clan, the visuals employed here are beautifully serviceable, never overdoing any of the poignant nature rendering so as to overwhelm the basic morality tale in glitz. Voice acting as well seems completely serviceable, with lead Martin Lawrence in particular rising above your typical cartoonish cheese to deliver many genuine moments as the title character Boog, a gigantic, domesticated bear who is having a tough time making his way in the wild after being brought up in luxury. Asides from the consistent, heartfelt humor, this gentle concept goes the extra mile with an engaging theme that again puts imaginative children into the perspectives of a different set of fun-loving, morally-abiding, trouble-bringing animals."
47,Open Season,10,14 November 2006,Loved it!,"I took my 2 year old son to see this. We live on a small post in Germany, so its rare that we get any good kids movies. So anyway, we almost missed it because my husband never set the clocks back, and we raced to the theater. Thank goodness we did! My son, who never sits still, didn't budge once. He even laughed! I thought it was great and had a good story line. Even my husband, a 27 year old red neck deer hunter, laughed so hard he was tearing. This movie was not violent like I've found other kids movies to be. And I know some people have been saying its racist, but I didn't get that at all, so I doubt a 3 or 5 year old will. I cannot wait for this movie to come out on DVD as I'm sure it will be one that will get played until the disc skips."
48,Open Season,7,23 October 2006,Decent movie - okay for my 5 year old,"It had its moments. I took my 5 year old son to see it. I was a little concerned because it was PG, but it wasn't bad. The worst swear word I heard was ""crap"", so not too bad. Scary for about 5 minutes when the bear is hiding in the hunter's cabin. Typical toilet humor, which goes great for the 5-10 year olds.Overall, it was a good movie. Some funny stuff for the parents who have to take their kids to it. I liked the Braveheart references. The rabbits were particularly funny.Although the ads make it look like the movie is about the animals fighting the humans, that is only a tiny piece of the movie. It is mostly about a fish out of water story, which makes it a bit dull because we've seen a lot of those."
49,Open Season,9,17 October 2006,Animals are taking over the world!!,"Wow...don't you just love talking animals. This movie was so cute and funny. I especially loved Boog. He was so adorable. I also loved that little porcupine who kept saying ""buddy."" This movie is definitely great for a child to see with his/her family, or even for three girl friends to go and see. I don't think anyone could be too old for the humor in this movie. Furthermore, I liked the whole idea of what it may be like if animals could take charge. Maybe then, some idiots in this world could get what they deserve. No, but seriously, I did like the whole idea. Sometimes, I wonder if our world would actually be a better place. Animals are just such loving creatures unlike many of us. lol"
50,Open Season,7,3 October 2006,Non epic cute fun,"I read the reviews on IMDb before I saw this movie, and was pleasantly surprised. Not just because my expectations were so low, but found it to be quite enjoyable altogether.It is naughty enough to entertain adults with its mild sense of black humour (if you like rabbits, prepare to be offended), and cute enough to charm the political correct. The animations themselves are absolutely on par with the best out there, and one scene where the animals race down the wild river is quite remarkable.It is, of course, totally predictable, and brings home nothing new or extraordinary. It delivers exactly what you would expect. Just shut off your brain, enjoy the colorful animations and occasional laughs. Well worth a look..."
51,Open Season,3,10 October 2006,Totally pathetic animation film,"Open season is one of the worst animation film from last years(if not the worst).This movie is a copy of Madagascar,The wild and Over the hedge.But it seems that the animated movie with animals is a new cliché because coming soon,there are movies like Happy Feet,The barnyard and Ratatouille which are more animated movies with animals.This movie was extremely boring for me and I watched my clock all the time.I don't recommend this pathetic animated film;maybe for little children(from 1 year to 5 years old)the movie is fun.But for older children and for adults this is pathetic and totally boring.Rating:3"
52,Open Season,4,7 December 2006,below par animation and script,"We've come to expect better animation these days. Cinema released animation had better be A grade in story and jokes if it doesn't deliver in art. Almost all the good jokes in this film were shown in the trailers, which wisely avoided showing much of the humans, which is where the art really failed. Hoodwinked was way better than this, and hoodwinked was only average. Martin Lawrence and Ashton Kutcher don't make a good double act, and Debra Winger must have done this with a bad hangover. Billy Connolly was fun, and Patrick Warburton has one of the best comic voices in cinema. These two lift the film if not out of the script's hole then at least to the rim of it."
53,Open Season,6,10 November 2013,Certainly not Pixar,"Wild deer Elliot (Ashton Kutcher) leads domesticated Grizzly bear Boog (Martin Lawrence) to the outside in search of candy. They ransack a convenient store and then the next day, they disrupt a park show. Boog's trainer park ranger Beth (Debra Messing) has no choice but to release Boog into the wilds right before Open Season. The two has to lead the other animals in the forest to fight against the hunters.Sony Animation is still unable to catch up to Pixar in terms of technical quality or story writing. It's a good enough movie but in no way in the same league as Cars which opened at around the same time. The characters lack the cool or interesting look. The story is functional but isn't inventive enough. Animals and hunters in the wild seems like scratching the surface of the imagination process."
54,Open Season,,18 July 2013,Maybe it's a moonburn. Check it out,"'Open Season' is an adequate family entertainer. The colourful and lively visuals make it pleasing to the eyes. The characters are likable too. However, the film has nothing new to offer. It certainly doesn't stand out among other recent animated features. The story itself has been told and repeated numerous times. It's your typical 'coming of age' back to the wild plot. The comedy at times feels overdone and some of the characters are clichéd. The voice acting, especially by the supporting voices, is very good. Billy Connelly's voicing of the squirrel was terrific. In the end, while 'Open Season' is no classic, it's not a bad film and it has more than its moments and is cute enough to be a decent popcorn entertainer."
55,Open Season,8,22 April 2013,Most spoiled bear you will ever know !,"Two comedians give life in this animated film to a bear named Boog and Elliot a very naughty deer. Beth is Boog's mistress she takes care of him, gives food a shelter in a garage where it is treated exactly as a pet and he in turn provides some entertainment for the locals. Everything changes when he meets Elliot. He is intentionally hit by a car and placed on the hood by a hunter. Boog helps him escape but Elliot can not forget and goes at Boog's home to thank him and plans to stick with him. He can not accept that and get's rids of him. Then he make his appearance at one of his shows and behind the scenes gives the audience a frightening scene but of course is not what it seems but even so people get scared and run. Then Beth decides it's time for him to go in the wild but as he is accustomed to city life can not live in the forest and how it is with Elliot make a pact with him, that shows the way to the city on condition they become partners. It turns out that Elliot was lying and does not know the way, it goes on random through the woods where Boog meets the other animals who make fun of him but when they hear that there are a few days and start hunting season everyone allies to ban the hunting. Beth find out what is happening and decide it's time to bring Boog home but he realizes that he can not leave his friends and decides to stay with them in the woods. A funny movie overall. I liked it when the two stormed into the candy store and ate everything they found but hilarious is Elliot who is more agile than the big bear Boog and offers several humorous scenes. And Ashton's voice fits perfectly."
56,Open Season,8,14 December 2012,"Cute, Funny, Great Message","This film is very cute, it makes me laugh, and has a great message. Boog (Martin Lawrence), a grizzly bear, is unwillingly taken out of the comfort and warmth of his garage. He is far away from his owner Beth (Debra Messing) and is stuck in the forest with a very annoying mule, Elliot (Ashton Kutcher.) Boog is trying to find a way to get back to his garage and owner, but hunting season is just starting. Will he be able to make it back to the safety and comfort of his home in one piece? Well, you must tune in to see. I like this film because of the comedy, the background music and the plot is very easy to understand. I think the talent does a really great job with the voice-overs and fit the part well. I love animated films and think the animation in Open Season is really good. My favorite part is when Boog is trying to catch some fish because he is hungry. So when he goes to the river to do his fishing, the fish slap him right in the face. Boog is left standing there extremely humiliated. My favorite character is Elliot, because he has a free spirit, funny and he keeps me laughing. Here are few of the people that make this film possible and do a good job. The directors are Roger Allers, Jill Culton and Anthony Stacchi (co-director). Some additional voice-overs in this animated film are, Gary Sinise (Shaw), Billy Connolly (McSquizzy), and Georgia Engel (Bobbie). A message I found in this film is that you can't always depend on someone else to take care of you. One day they might not be there to protect you, so you have to look out for yourself. Boog is used to Beth taking care of him, but once he enters the forest he has no idea what to do. I recommend Open Season for ages 6 to 13; they will definitely get it a kick out of it. It's good film for the family to sit down and enjoy it too. I give this film 4 out of 5 stars. It has a good message, the animation is great and it is an enjoyable film. Make sure you get a glimpse of the forest in Open Season. Brianna Hope Beaton, age 13, KIDS FIRST! Film Critic."
57,Open Season,7,18 April 2012,They should have stopped here,"My first review on this site as a registered user was Open season 2. I had, of course, previously seen Open Season 1 and then just a few weeks ago saw Open Season 3. Seeing all of them now (and the 1st for the second time) I can now exclaim that they should have stopped at this movie.I was okay with it for the most part. The things that bugged me most was just the bear giving in and becoming friends with the annoying animal that almost ruined his life multiple times. I do understand the message, however I found it kind of odd and didn't make the movie as good as it could have been.Anyway, it's still better than the second movie and definitely better than the third movie. Thus, I rate it 7/10."
58,Open Season,5,19 April 2008,"Blurry not Furry, not Funny:  Don't bring small children","This movie couldn't decide what it wanted to be, a ""feel good"" Disney-type movie, an NRA bashing social commentary, an adult-oriented humor piece, a cartoon, a photo-realistic animation...and so if fails on all levels.It's supposedly pro-animal rights. But the animals themselves are bashing each other. It's supposed to be anti-violence (anti gun-toters) but shows animals blowing up trucks into fireballs and glorying in it, as well as enjoying inflicting pain on a human who is literally already down. Too violent for small children and the animation is off-putting because, as I mentioned, while one of the characters (the Eskimo policeman) and the scenery are realistic (sometimes breathtakingly so), the other characters are cartoony, so the violence doesn't have the innocent ""cartoon violence"" quality of old-time Bugs Bunny and Elmer Fudd flicks.Hunt elsewhere for quality entertainment, especially for children."
59,Open Season,6,23 May 2007,"Good, but I feel there are lots of problems indeed...","This could be MUCH better - this film is good, but it is well and truly annoying. 1. Parts of the plot are unoriginal (two characters make a promise and another one breaks the promise for just about no reason). 2. Boog is irritatingly stubborn. 3. The deer apart from Elliot and Giselle could easily not appear (they are INCREDIBLY cruel to poor Elliot). 4. Billy Connolly could be funnier. 5. This film gets slightly boring after a while. I like Elliot and Boog's owner. Oh and the baddie is very annoying as well, for one thing I constantly think he needs a shower when I see him up on screen. Oh and there are too many dirty loo jokes which could have SO easily been replaced by different ones.Boog is a bear living the life of human luxury. His future changes when he meets Elliot, a one- antlered deer..."
60,Open Season,6,2 May 2007,"Buddy, It Wasn't That Bad (SPOILERS)","SPOILERSI really did not want to see Open Season, and had no interest in it. I saw it anyway, and it was way better than I thought, especially with the 5.9 rating. The reason I am giving this a six is that some scenes were too annoying and crude. Some scenes also had me laughing for ages. Who can forget the porcupine and his ""Buddy?"" That was probably my favorite character. I mean, ""buddy"" never gets old, despite the fact that it was used fifteen times throughout the film.Here is the plot of this film. Boog is a pampered house bear who lives with a ranger named Beth when he saves the life of a mule deer named Elliot from a hunter named Shaw. They become friends. Elliot wants to save Boog from his home, despite the fact that he happily lives with Beth. Then, during a nature show, a riot occurs, thus putting Boog and Elliot in a National Forest three days before Open Season, or hunting season. Elliot and Boog try to find Beth, but they learn how rowdy the forests are, with Scottish squirrels, ninja fish, and porcupines. Then, Open Season comes. Shaw with other hunters hunt down the animals, but not without a fight. The animals gather supplies and attack the hunters. Beth then comes in a helicopter. Boog then decides to stay in the forest with everyone else.Overall, this is a fun movie, but it was actually a lot like Over the Hedge. Besides that, this has great computer animation, a solid cast, some fun scenes, a porcupine who meets a ""Buddy,"" and a bittersweet ending, like a lot of these movies have. This also, of course like a lot of these movies have, a soundtrack. Not a score, but a soundtrack, like Shrek has. Anyway, this is one of those films that is not for everyone, but have fun with it and have a good time.6/10 Recommended Films: Over the Hedge, Shrek, and Shrek 2."
61,Open Season,6,7 April 2007,"Ironic, isn't it?","The movie wasn't making fun of hunters so much as fools and conspiracy nuts. Like people who see ""libs"" behind every movie they don't like, say. LOL! Okay, it's not Ice Age or Shrek but it's still very funny. And does anyone think that hunters *wouldn't* be villains from the perspective of of your basic talking deer or bear? Elmer Fudd ring any bells for anyone? This theme is venerable in American animation.Open Season is definitely worth checking out if you like modern animated satire at all. It's different enough from others of the genre. Where else have you seen a duck put the bite on a hunter with his own dentures? Some of the cgi is quite impressive, too.But what is it with the darned rabbits?"
62,Open Season,9,12 December 2008,It was totally Fun and Awesome,"The movie was totally fun and awesome. Amongst the animals, Boog is Very funny and cute. Shaw looks like a pucca villain. When, Boog and Elliot were destroying the shop, that scene is totally funny. Even, Elliot is very funny. The last scene was totally awesome and cool. When, Boog is hiding in Shaw's house, that scene is totally thrilling and funny. When, Boog is going for toilet near the bushes, that scene is Totally Funny. When, Boog is seeing the forest and that time he worries that he lost everything, that scene is totally funny. When, Boog breaks the dam And the water releases, that scene is totally funny and awesome. When, Elliot is tied in a rope, that time he talk to Boog with fear, that Scene is totally funny. When, Gordy drops Boog into his house that Time Beth and Gordy will be talking and Boog disturbs their talking, that time Boog is very funny. When, the animals are fighting in the last scene, that time they were awesome and cool. When, Beth is travelling the helicopter with Boog and Elliot that time the background music is cool and the nature which comes in the scene is very beautiful. When, Boog asks Elliot that where is Timberline, that scene is very funny. Even, the nicknames of Boog and Elliot are very funny. I should really appreciate the creators of ""Open Season""."
