,title,stars,date,r_title,text
19,Open Season,3,25 March 2007,Even Wathcing With Open Minded I Still Find This To Be Rather Boring.,"I'm a fan of animation and will watch absolutely anything and everything. So I'm long awaited for this film cause in the trailer it seem so cool and funny. Oh boy, this film totally let me down badly. I think I laugh one time during the movie and fell a sleep twice.Synopsis: Boog a domesticated bear was release into the wild few days before the open season. There he fined himself force to befriend with a deer and another animal if they all wish to survive the open season together.I don't think I'm too old for this and I always open minded when it comes to cartoon but this it was merely boring. I don't want to be judgmental but it feel like the movie was created just to rival another animal movie like Over the Hedge, it like just for the business part rather than well thought movie. The story is a total riff-off from various movies, the worst part is they don't even hide the fact that well. The character doesn't even have originality. And everything seems so abrupt and cut short.I don't really mind about some of the humor it has but I was wondering where was all the humor gone this is practically humorless, maybe it also because they already shown all that in the trailer. The animation was all right and nothing great compare to most high profile studio animation. And the animal was too alike that it doesn't really work well on screen, the cuteness is gone.The used of big star was a total unnecessarily cause every character has the voice change that you can't even recognize them. Overall I was very disappointed by it. It has a very shallow abrupt story, compare to Pixar cartoon this feel like an amateur work.Recommendation: If you've Seen Trailer, You Have Seen Everything. Not Worth Even Rental.Reason To Watch: Trick To Watch, Force To Watch By Your Son/Daughter.Reason Not To: The Story Is Too Abrupt and Brief. Boring.Rating: 3.5/10 (Grade: F)"
20,Open Season,5,27 September 2009,"All looks, no personality","That sums up Open Season perfectly. The film was designed to be shown in 3D, and they make sure you know it by making crap fly out at the screen every few seconds. This has been a bad habit of 3d movies from the beginning, and one that doesn't show signs of stopping if the upcoming ""A Christmas Carrol"" is any indication. But it's not all bad. The story behind Pixar's Up was so absorbing that you actually forgot it was in 3d. Coraline was even more effective with 3d, completely absorbing you into its surreal, stylized world. But I'm getting waaaay off-topic. Open Season's 3d effects are in-your-face and obnoxious. There, done. Moving on...The film's visual style is minimal. Many of the animals seem like they were designed by Pablo Picasso, as they come in all sorts of bizarre, deformed varieties. Many of the animals introduced for no reason other than to summon a cheap laugh. Boog - one of the main characters - is annoying, whiny, arrogant and unconvincing. In other words, he's easy to hate. Elliot on the other hand... I expected this Ashton Kutcher-fronted character to be terrible, but he's actually a redeeming factor of the movie. He's very funny and has all of the best lines. The two tourists and their dog are funny as well. The villain is, well... pretty light. Don't expect anything more than a gun-totin' redneck. But at the very least he does create actual tension in one scene where Boog is hiding from him. It's when this film tries to become serious and deliver life lessons that it falls flat."
21,Open Season,10,1 April 2007,One Of The Best Animated Movies Ever,"""Open Season"" uses more adult and over-the-edge-humor than any other animated movie in the last few years. The characters are great. Much better than some animated side kicks we've seen this year. Ashton Kutcher, Martin Lawrance and Billy Conelly did a great job and also the music in this picture is very well chosen. The animation is brilliant and some shots will clearly blow your mind.This movie isn't just for kids. Adults will have quite a few laughs, too.Many people say that this movie is just like every other animated movie we've seen so far and the storyline seems familiar. But you could say the same about every damn horror movie or chick flick. Even if every animated movie had the same story, you still can find differences. And Open Season is a movie of it's own. So don't bug me.All in all you GOTTA see this movie."
22,Open Season,4,23 February 2012,"A decent, but uninspired effort from Sony Pictures Animation","I've just gotta say that I'm just a little disappointed in this movie. It's not bad or anything, but it would've been so much better. The computer animation has some nice colorful backgrounds, but it seems to be suffered by it's shallow character animation. The characters are either uninteresting or annoying except McSquizzy because he gave me a few chuckles here and there. The story, while having it's moments, is just painfully predictable that uses the same old ""buddy"" cliché from other animated features. The humor has it's funny parts, but then it gets very tiresome it would make you snooze throughout the film. The strongest aspects goes to the adequate music score from Ramin Djawadi and the voice cast in this film. Martin Lawrence and Ashton Kutcher did great and so were a few cameos including Patrick Warburton and Billy Connolly. Open Season is far from being the worst animated feature of all time, but with a better story and better characters, it would've been better.4/10"
23,Open Season,10,20 February 2016,Best film in animation history!!!,"Funny cast includes Martin Lawrence, Ashton Kutcher, and Debra Messing. Plot includes the sugar-crush, the songs, and more!!! Patrick Warburton adds to this cast of actors, plus we get other stars. So, if you rent a movie, or just buy one, buy this one (or rent it), I don't give two lamb shakes. Hahaha. Very funny!!!! Cool beans. Rock-n-roll, man!!!!! We love cartoon flicks, and music videos!! If you don't like Open Season, then do not blame me. Blame yourself. I love rocking out to soundtracks, do you? When can I see the two sequels? Only time will tell. Boog is a funny bear. And his buddy Elliot is a great mule deer. Please be kind-- rewind. Just joking. We don't rewind DVDs, I mean we do sometimes. We only rewind if we miss a moment or two. Sweet!!!"
24,Open Season,2,26 January 2007,Absolutely horrible!,"I always thought that high-budget, 3D-animation movies, would never fall so down to be desperate efforts to make money without a story, without humor, without good actors, without anything. Heck, even Martin Lawrence playing a lead role, didn't discourage me of going to the theater. But I was wrong. This is a sad, sad film. The acting was very poor. It's hard to say this for an animated film but it's true! Martin Lawrence just cannot act. It's true! His character was unBEARable (pun intended)! Ashton Kutcher's buck was sort of OK, I guess, but the rest of the cast should consider some serious voice-acting lessons.And what was supposed to be funny in this film? The plot was so boring, I almost fell asleep! Come to think of it a brief smile for ONE moment was all it got from me. Forget about laughing. Only one scene worthy of a single smile is what it would get from you. The 3D animation was done pretty good and I feel sorry for the guys that worked on it. They didn't deserve being part of this bull*&!% of a movie.Consider staring at the wall for an hour and half, before watching this movie. Hey, at least staring at wall is free!"
25,Open Season,,23 January 2007,Ahem.,"You know, this is really getting tiring. The collective brain cell of non-Pixar animation studios needs to adapt to a few simple facts: --A buddy movie is not the required format for an animated film, and should that format be used, the concept that the buddies are in fact homosexual need not be presented to the four-year-old target audience in a ratio greater than one joke out of four.--The remaining three jokes out of four need not involve bodily functions, indeed of any kind.--Casting animals as protagonists in a story is a time-honoured tradition, although traditional animated deer spend less time making genital-related comments to squirrels, and more time weeping over their deceased parents in a doe-eyed fashion. However, the use of animals in a film does not directly necessitate animating all the human characters in a way designed to put aforementioned four-year-olds off the species for life. Politically speaking, it might be deemed disingenuous to sidestep the carnivorous habits of many of the furry friends while condemning hunters as immoral.--Female skunks are a cheap shot.That is all."
26,Open Season,5,21 October 2006,Suffers by comparison - 56%,"Ever noticed how similar some films can be to each other, almost to the point where you think they're identical? The obvious examples, and the films which spring to my mind, are the lava-themed disaster movies (in every sense of the word) ""Dante's Peak"" and ""Volcano"". Given the current trend and insatiable audience desire for animated movies, this retreading of earlier plots is even easier to spot  I know people who still get confused between ""A Bug's Life"" and ""Antz"". Although there is nothing technically wrong with ""Open Season"", it does suffer due to it's unfortunate release date which is extremely close to ""Hoodwinked"" and ""Barnyard"". However, it reminded me of yet another domesticated-animals-in-the-wild movie ""Madagascar"" but trust me, this isn't necessarily a bad thing.In the heart of America's natural wilderness lies the sleepy hunting town of Timberline where the star attraction, besides blasting the local wildlife, is the grizzly bear Boog (Martin Lawrence). Boog's life is pretty easy as he's waited on hand-and-foot by girly park ranger Beth (Debra Messing). After a chance encounter in town with hyperactive dear Elliot (Ashton Kutcher), Boog incurs the wrath of hunter Shaw (Gary Sinise) and is forced from his comfortable home into the wilderness beyond with Elliot for company. During his quest to return home, Boog discovers that he just isn't cut out for life in the wild, especially when Shaw and the other hunters gather for hunting's open season.Strictly by-the-numbers it may be but ""Open Season"" isn't a bad little film. It's pleasing enough for younger viewers but there's still plenty to raise a smile for adults too. However, the problem is that the more movies of this nature you see, the less enchanted you become with them. Allow me to explain: the last movie I caught at the cinema was ""Cars"" and even then, it was only because there was nothing else to watch. It just didn't appeal to me and I'm a huge fan of Pixar. I should never have doubted them as ""Cars"" was a superb film, full of colour and fun and imagination. This, by contrast, felt uninspired and very artificial  it looked like a cartoon whereas ""Cars"" looked almost real at times, at least in terms of landscapes. Even the characters didn't really appeal, partly the fault of the voice casting which also failed to match Pixar's excellent standards. Lawrence, possibly the least appealing leading man since Doug McClure, is actually the best of the bunch but given Kutcher's annoyingly high-speed delivery and precious little support from the rest, it's perhaps not that surprising. Even Billy Connelly was wasted as the freedom-fighting leader of a bunch of acorn-hurling squirrels. They may as well have painted his face blue and called the character ""Braveheart"".All of this sounds harsh and it is because ""Open Season"" isn't a bad film, as such. It's technically accomplished, fantastic fun for the kids and worthy of consideration for a family movie night. However, with standards improving all the time, it does fall quite a way short of the spectacular heights that Pixar have taken the genre to. Time and again, they show how to make an animated film that truly is for the whole family and they make it look easy. So far, only ""Shrek"" has mustered much of a challenge to them and that was quite some time ago and only because Pixar's weakest film (""A Bug's Life"") was out at the same time. The sad truth is that this is trailing the front-runners by quite some way but despite chewing on the dust thrown up by ""Cars"", this is an adequate way to treat the kids to an hour and a half in the cinema. Still wished my nephew hadn't come along  I wanted to see ""The Departed"""
27,Open Season,6,29 September 2006,Over the Hedge better? what did you think,"I sat with my boyfriend, the room was packed with kids, when the movie started, the theater grew quiet. Somehow I thought the movie was....violent for some reason and the humor was adult humor. Nowadays, people try so hard to make it for kids and adults. Or maybe it was my mood that time, but I laughed more in 'Over the Hedge'. The development in characters were much better in OTH than this one. It was just same old same old plot where you have a self centered character who teams up with a chatty and annoying buddy that soon will lead you to decide that believe that you have to go back for them. Sorta like Shrek in a way and Emperors new groove (but those two were a lot funnier). There were random parts like the lady and the dog, that came out from no where. Rabbits that were abused...its just...all over the place! Anyhow, its a kids movie...it just didn't seem to tickle my funny bone though. And...the movie ticket was expensive nowadays, 9.50 per person."
28,Open Season,9,17 October 2006,"underrated, not disappointed","Although the group I went to see this movie was actually trying to get into Jackass 2, we were not disappointed. I laughed out loud at quite a few parts, especially the ones with Elliot the one-antlered deer (voice of Ashton Kutcher). He brings the same zany personality to Elliot that he does to Kelso in That 70's show. Martin Lawrence was good also, but wasn't his usual slapstick comedic self. The real scene-stealer, though, was the crazy redneck hunter Shaw (voice of Gary Sinise). Although this was a kids' movie, and I suppose Shaw was supposed to be the ""bad guy,"" he actually came off as the funniest character in the movie. So, this fall, instead of wasting 10 bucks on a poor sequel like the Grudge or the Texas Chainsaw Massacre, take a shot with a movie that's sure to entertain: Open Season."
29,Open Season,1,27 October 2006,Shakes head wistfully,"I've come to expect Hollywood to fill their wares with their liberal viewpoints, but anytime they take a political viewpoint and build a cute story around it with a target audience that hasn't reached puberty yet I see it more as propaganda than entertainment. I will grant you that it's clever and witty propaganda - but that just makes it worse. Quick name a few movies where the hunters are good guys. Not easy, is it? It's easy to find hunters as bad guys though. A few obvious and animated ones (just to keep the list short) are this movie, Rescuers Down Under, and Tarzan. Maybe instead of vilifying hunters we should focus on responsible game management which includes hunting as part of it. Don't start dishing crap that responsible game management is not appropriate for children to understand and then turn around and preach animal rights. The Lion King at least mentioned the 'Circle of Life' but they left man out of it. There are millions of people in the US alone that engage in safe, responsible hunting and hunting is included in science-based game management programs everywhere. Most money for conservation programs comes from hunters and hunting-related businesses. Hunting is pretty mainstream - quit demonizing it. I know that most of you will think I'm making way too much of a fuss out of a children's movie, but children grow up with half-formed opinions that are rooted in all sorts of things they were exposed to as children. Then they start voting based on those half-formed opinions. Rant over."
30,Open Season,5,30 September 2006,Definitely bargain matinée fare...,"Saw this movie at the local IMAX in 3D, late Saturday morning matinée. Nine year-old daughter and girlfriend went with me. Other than very good 3D animation and the last, all too short, ten minute or so, animal rebellion episode, this movie was BORING.Martin Lawrence (Boog) does as well as he can with what he was given. Ashton Kutcher's Elliot character became downright irritating within his first ten minutes. The one bright spot and really funny portrayal was that of Billy Connolly as McSquizzy, the chest-puffing, Scottish brogue speaking leader of the squirrel packs. Also Patrick Warburton's portrayal of Ian, leader of bucks, was pretty good also. Being a Seinfeld fan, I immediately noticed the squint-eyed, blank-stare of David Putty in Ian. Nice casting on that one.This movie just seems to drag and drag along until the final rebellion sequence. Also, the dufus buddy theme has worn all to thin in these animated movies. At times, it seemed like this was Shrek 6.Seeing this movie in IMAX/3D certainly is a plus, because it keeps you from noticing how slow this movie goes.My five rating is due to the IMAX/3D being so good. Otherwise, it would be a two."
31,Open Season,1,21 September 2007,A waste of time.,"As the standard of animation continues to rise, its a shame that the quality of the features produces spirals downwards! Open Season is a prime example of how great animation doesn't make a good film. The film is completely let down by its voice actors.Boog is obnoxious and selfish, and in no way likable. Its not Martin Lawerence playing the character, its simply him turning up and being himself. Same goes for Ashton Kutcher who voices Boogs friend.The jokes are few and far between and the entire thing is a disgrace, acting as a quick buck for Lawerence and Kutcher.The studios should give some real thought to hiring professional voice actors, rather than actors, who at best have limited talent as it is."
32,Open Season,2,21 January 2007,"any spoilers? what, there is something to spoil in this movie???","yep, i can hardly remember anything about this movie, except there was a bear and some other animals. and yep it was greatly animated! in desperate search for the beginning, end and a plot you may see all of them clichés summed together in a cheap manner: Austin powers, typical Disney-like plot-try, a very, very, very bad try to rip off Shrek and HIS sidekick...it generally lacks - everything, but mostly the story. as if the Sony *MARKETING* guys made ""brainstorming"" picking the ""best of laughs"" - spicing it up with ""national"" kinda bias: Irish, Austrian, etc. whatever... and gave it to cg people.wrong. terribly wrong."
33,Open Season,5,22 October 2006,An above-average (for the genre) film with good pacing and a few very impressive moments,"Obviously, Bencich's screenplay is not one of the great works of film writing, but let's take a moment to appreciate it for its virtues. The film has better pacing than almost any other film of the time in this genre, and the key scenes are well-established and strangely engrossing.True, there are flaws in the film. A few of the actors and actresses have a kind of gross/scary look that seems to somehow be the result of the decade itself, and the score is maddeningly repetitive. Still, the good elements at least measure up to the bad ones.I was a little disappointed (as I imagine many were) that Debra Messing wasn't given more to work with. Even though she is given top billing and the titular character, she doesn't have any real dramatic moments until the end of the film.I have to say that the best actress of the picture was Caitlin Cutt in her small, but pivotal role.Though I wouldn't call Open Season a masterpiece, I would recommend it to any fan of the genre."
34,Open Season,,8 January 2010,A classic example of a bad movie,"This movie is bad, not ""cult"" bad, not ""so bad it's good"", not even ""funny"" bad, just plain old boring bad. It is so stupid and tiresome that the commercial breaks (we saw it on cable) were a relief.The main premise -- a domesticated animal trying to adjust to the wild -- is unoriginal but holds the potential of decent sitcom style laughs. Unfortunately the promise is unfulfilled, as you see most of the jokes coming from a mile off and the humour is aimed at the lowest common denominator. Some are repeated so many times that you cannot help but groan.Most of the characters are one-dimensional (the rest are more accurately described as zero-dimensional), they are nothing more than walking stereotypes, afflicted by both idiocy (no thinking skills whatsoever) and schizophrenia (behaviour and motivations change wildly from one moment to the next).To summarize: there is no plot to speak of, there is no acting to speak of, no suspense, no believability, no feelings for the protagonists or the antagonists (except annoyance), nothing notable or memorable.Not for lack of ambition, mind you. Open season takes every cliché, every situation, every lame joke that ever (dis)graced the screen, tries to cram all of them into 83 minutes and doesn't even attempt to tie them together into a coherent whole.Out of the 6 people that watched it, 5 (me, wife, father-in-law, 12yo girl, 8yo boy) found it stupid and boring while 1 (5yo boy) liked it.So if you are in the 4-5 years-old demographic, you'll probably like it. Otherwise, there are better ways to kill your time."
35,Open Season,10,23 October 2008,Perfect Movie! Perfect cast! Perfect everything!,"A lot of times, we have our point of views on movies and stuff that don't always agree with the other person or it may do depending how you see it, but I can't argue with this. On September 29 2006, Sony Pictures has brought us the first animated feature and that film is Open Season. Successful or not, I don't care what people say. I believe in movies and movies should be love with respect! The story starts out about a 900 pound grizzly bear named Boog who was raised in the small town of Timberline by a pretty park ranger named Beth. His life takes a turn when he encounters a fun-loving one single antler mule deer named Elliot who is full of energy and high spirit. The movie follows them on their adventure through the woods, but a hunter named Shaw is on their trail from preventing them to get back home.The film has a lot of adventure, humor and good heart at the end, but it never fails me to see how awesome it can be. It's nothing like you ever seen! In my own views, animals are NOT meant to be hunted! They're not some winning trophy you can get for doing a good job no, they're just like people! People with thoughts and feelings. If you love watching animated movies, you'll love Open Season! Everything they have is absolutely perfect in it!"
36,Open Season,6,13 May 2007,The Third Act Makes the Film a Notch Better,"A grizzly bear named Boog, domesticated by a park ranger, Beth, helps deer friend Elliot escape from the mullet-sporting hunter, Shaw. When the Elliot decides to return the favor to help Boog escape from Beth he finds that Boog is very happy with his domesticated home. After a misunderstanding, Beth is convinced that Boog is reverting to his wild nature and releases him in the woods just as hunting season begins. Boog has no idea how to survive outside of his garage home with his beloved Beth. Elliott and Boog develop a strong bond not only between themselves but also with the wild animals and attempt to drive the hunters out of the forest.Out of countless animation films released in 2006, I was looking up for this but it was kinda disappointing that it's much more of a kiddy flick than for teens or adult, although there were some inappropriate jokes for the children.The animation in the film was okay, not as good as Pixar's and the action sequences in the film is great but that only appears mostly at the third act of the film, which made the movie a bit better. The other part of the film is just boring but might be fun for the children.If you're somewhat older than a child, you probably won't like this film but children will like it, since, well, it's another animation flick from one million others released in 2006."
37,Open Season,7,17 February 2007,"solid,very funny animated comedy","""Open Season"" is a very entertaining animated film.i like the eclectic mix of characters.i really liked the dynamic between the 2 main characters,A domesticated bear named ""Boog""(voiced by Martin Lawrence)and Elliot(Ashton Kutcher)a displaced mule deer with no family.i also though the dialogue was very good in this movie.there are some great one liners.there is also an abundance of action,(some of it very funny) and there are also some dramatic moments.dare i say it,this movie treads very close to being hysterical in some scenes.also,the choice of actors for the voices is brilliant in this movie,especially Lawrence and Kutcher.for me,""Open Season"" gets a solid 7/10"
38,Open Season,6,10 July 2017,Open Season: The start of a new journey.,"In 2006, Sony Pictures Animation decided to make there move and make there first animated movie! Open Season. To be honest, it's actually a good start for the company. The movie is actually not that terrible! There is adult jokes in the movie. For instance, in the beginning when Ranger Beth was going to show that domesticated bear Boog was going to do, Boog see's some hunters while driving down and Boog decides to slap his butt in front of them. Extremely unnecessary, but funny too! It's a great movie for mature kids! 6 out of 10!"
