,title,stars,date,r_title,text
63,Open Season,10,12 February 2007,Elliot!,"He's a deer , he's my favorite. He's the one played by Ashton Kutcher. Did They choose a name for a deer? I have the game , I rented the DVD. Who would Elliot end up in a dump? Elliot is so silly , I like to print him on the internet! Elliot is inverted for the down antler for my logo. He's so silly , I feel in deer! Elliot is just a deer with comedy and crazy. Let's Go Crazy! Elliot. You silly deer. Ashton Kutcher is the best actor to play Elliot , he would even say ""Dude , Where's My Antler?"" and then Elliot is so cool , he will even say ""Deerabunga!"" , It is a 3D character since Marty the Zebra and Franklin Fizzlybear. Ashton Kutcher was so having fun at the premiere and what happened? His Remaining antler fell off. He would have to shed and grow his antler back. Elliot will say ""Call Me The Incredible Mister E!"". He has a favorite quote , ""I get it , you're like a pet."" , Elliot sings the sing in tune of the Teddy Bear Pincic Song. Uh-Oh-Uh-Oh , I Wanna Lose Control! Take Me Out , I said you need to know Elliot got crashed into the door since Punimart was closed. Elliot is a deer , my mom would laugh even louder."
64,Open Season,10,10 February 2007,Great family feel good film,"This film is Great, no other word for it it will have the whole family cheering and laughing there is not as many adult jokes as Shrek but the jokes that do happen are so funny and silly it doesn't even matter! i went to see this film after it had come out for a bit and thought oh god there is nothing else on but was highly surprised. and ended putting this down as one of my favourite films of all time now. i normally go for a intelligent film such as the wind that shakes the barley but this light hearted animation was a great change. on a personal scale i give this film 10 stars and perfect for half term to keep the rug-rats busy and maybe the older rats to :-) thank you and i hope you found my review useful."
65,Open Season,9,5 February 2007,Wasn't another one of those corny animation things,"I was expecting another hoodwinked because in hoodwinked they showed seriously EVERY funny part in the trailer, and then since you watch the trailer ten thousand times because you want to see the movie so bad that the actually movie isn't funny at all because you saw it all in the trailer. And I thought that maybe this was another one like that but it was hilarious and very clean except for I think about 4 or 5 ""dangs"" which was more than I wanted but less than I was expecting. I love the entire thing although it was too short, but if it was longer we'd probably think it was dragged out so maybe it's better off short. but it kept us laughing during the entire thing. Ashton Kutcher was great for the part of Elliot and I love Billy Connolly. Everyone was great though I didn't really ""know"" any of the others actors/actresses. Grab a friend, get some goodies and have a BLAST!!!"
66,Open Season,8,28 January 2007,A very enjoyable kid's movie!,"I'm very surprised at all the negative reviews of this movie. I took my 4-year old grandson to see it, and we both thoroughly enjoyed it! The negative reviewers must not have kids--or else are judging this movie by adult standards. I recommend this movie highly to anyone with young children. On the way out of the theater my grandson had two questions: 1) Can we buy the movie now?, and 2)Can we see it again? The DVD comes out tomorrow, and I'll certainly buy it for him. The animal characters--particularly the bear that lived in the garage, and the one-antlered deer that convinced the bear to return to the wild--were likable and funny! My grandson laughed (and almost cried) at different parts of the movie. And thank goodness it had a happy ending!"
67,Open Season,9,4 November 2006,"Great fun, and best animation I have seen","I saw the movie today with my kids (8 year old twin boys), although I saw the Norwegian version (not my native tongue) so I cannot comment on the voices of the originals. Which seems to be the biggest gripe on the message boards.I thoroughly enjoyed it, in fact for me it is the best animation I have ever seen in my life. The plot is pretty much the same variation that we have seen from Madagascar through The Wild to... well you know what I mean. The ol triumph over adversity including obligatory journey.Where this differs for me is the quality of animation, the scenes involving water were just mindblowing, the movement of the coat of the bear, and for me the motion of the helicopter blades was out of this world.I know that sounds a bit anal, but visually it truly is spectacular.The gags were good quality and the interplay between the two main characters starts full of energy and progresses nicely enough.The obligatory 'crew' of supporting characters worked well and provides good comic relief.Oh yeah and the kids loved it too!"
68,Open Season,7,30 October 2006,One of the better cartoons lately,"This movie was done pretty well to be honest. I figure since Eddie is making the Shrek series, Martin Lawrence had to get on board with making a cartoon. Eddie he is not and honestly, he does not try to be. Ashton Kutcher is completely obnoxious and you can tell he wanted to stretch the bounds of good taste if he could get away with it. Anyone who creates a show called Punk'd and considers it a runaway success needs to stretch the boundaries whenever he can get away with it. He definitely can be seen as the obnoxious character he plays and Martin Lawrence has calmed so much over the years, you can see the mellowness in his character. I rather enjoyed going to this one and it was a heck of a lot better than ""The Wild""."
69,Open Season,6,22 October 2006,Open Season is amusing enough for anyone who loves animation,"Martin Lawrence voices a domesticated bear and Ashton Kutcher voices a hyperactive deer. They cause havoc at a closed convenience store in Timberline and are sent back to the woods. When open season begins, they defend themselves against hunters, especially a bloodthirsty one voiced by Gary Sinise, with the help of beavers, ducks, skunks, rabbits, a herd of other deer, and an army of squirrels led by a Scottish-tinged one voiced by Billy Connolly. What starts as fitfully amusing becomes hilarious by the time the animals vs. hunters sequence begins. Not up to Pixar standards, perhaps, but still worthy for the whole family to watch and get amused by. Additional voices by Jane Krakowski, Georgia Engel, Jon Favreau, Patrick Warburton, and as the bear's motherly ranger, Debra Messing."
70,Open Season,7,20 October 2006,Want some fun?,"This film i thin was purely made for fun, i know its a comedy and your thinking ""isn't that what all of them are made for?"". Well not in this kind of way. I mean, it obviously was never going to be a shrek or a Monsters Inc, this was just going to be a kids idea of The Godfather (which here i will count as the best film ever). This is because of the huge amount of toilet humour and slapstick, funny voices and just downright silliness.So, if i was going to rate this on greatest movie kind of meter, i would give it a 5, looking at the unfinished graphics and the unoriginal comedy. But, as i rate for enjoyment, or something along the lines of that, then i give it a 7. Not bad i say."
71,Open Season,8,16 October 2006,Thoroughly enjoyed,"I thoroughly enjoyed the movie. Sure, there was a little raw humor but it was not over the line. And truly, without it, the movie might have been a little boring for adults. Elliot was great. Loved his one-liners. I took two little girls and their mother along and we all laughed throughout the movie. One thing I've noticed in many movies is that the trailers contain all the good stuff and the movie has nothing more to offer. Not so with ""Open Season"". I will buy this one so I can watch when I need a good laugh. I read some of the other comments - all I have to say is - don't over analyze - just enjoy!Stands out in comparison to other kids movies."
72,Open Season,9,15 October 2006,Favorite animation,"This is definitely my favorite animated comedy. When I watched it at a local movie theater, everyone was laughing, the adults as much as the kids. There was no back-door, off-color humor for the adults to snicker at and pass meaningful glances over, it was simply funny: good, clean fun across the board. My 3-year-old granddaughter made it through the entire movie, usually she can't do that. She laughed a lot, although, part of that was from getting caught up with the laughter in the the audience. It was probably the visual funniness that she was able to latch onto within the movie itself, a few times she also caught the funniness of some dialog, evidenced by things she would say. It was visually funny, the words were funny, it was a great movie that I could see again and again. I had no idea it was out in 3D, and now hope to see it at an IMAX.Most of the animals were equally funny. The ending is priceless, too. Another review mentioned Looney Tunes, and I can see a comparison, a bit. The animals make these little ""aside"" comments now and again, maybe a lot, I don't know, but one of those times is when the dachshund makes a comment to the audience about its owner that just brings the house down, so tongue in cheek it is, it takes a second to absorb the surprise, and then it is funny to remember for weeks. The dachshund's comment reminded me of something Jack Benny might have popped out with impromptu if he were alive. And if Johnny Carson were alive, he would fit into this movie REALLY well as one of the animal characters, maybe as an animal that got tickled over things, not that Carson would make the movie better, my point is that such a character could fit into this entourage delightfully. To me, it lives up to that kind of quality. Many of the reviews, though, appear not to reflect this high regard, and I find it hard to understand why everybody doesn't agree that this movie is stellar. In comparison, Over the Hedge was not so memorable. I recall it being acceptably funny, but it quickly faded into a distant memory. Open Season will be with me vividly for years, even if I don't get to see it again. I would say that a comparable regular movie would be Mr. Deeds."
73,Open Season,8,13 October 2006,"You Can Take A Bear Out of His Domesticated Home Life, But You Can't Take the Domesticated Home Life Out of the Bear!","Meet Boog. He's a tame grizzly bear living the good life. He's got a roomy garage for a home complete with food, water and toilet. He and his owner, park ranger Beth, put on a show for the young ones, who simply adore him. Everything was going great, until one day a gruff and crazed hunter named Shaw roared into town with a dead deer strapped to the hood of his truck. Open hunting season was just around the corner, but Shaw had decided to start early when he mowed down the innocent creature who now only had one antler. Boog took notice of the deer, who turned out to be alive. He introduced himself as Elliott and proved to be quite the talker. Boog decided to help free Elliott, which he might later regret. Later that night as Boog slept soundly in the garage, Elliott came by and gave him a rude awakening. He coaxed Boog into coming into town and together they ransacked the Punimart, pigging out on candy bars, squishees and junk food. Needless to say, the town sheriff wasn't too pleased about this chain of events and wanted Beth to take Boog back into the forest, but she just couldn't *bare* to let that bear go. The next day as Boog was preparing for his next show, Elliott showed up to cause more trouble, which resulted in he and Boog having a fight. From behind the curtain, it looked as if Boog were gruesomely mauling Elliott. Well, enough was enough. Beth sadly had to airlift Boog, via helicopter, into the forest in a secluded spot above the falls to avoid the hunting grounds, and left him.Boog awakened to find himself in a strange place, far from home. But what was worse, is that he ran into Elliott. It would appear the two would have to work together, because Boog wanted to go back to his home in Timberline and Elliott said he knew how to get there. And so, they trek through the forest and sure enough, after going in circles a few times, they were finally on the right track. Boog had a run-in with a few territorial squirrels while Elliott butted heads with his old herd; after a day of traveling, Boog and Elliott formed a bond and as soon as they returned to Timberline, they would be partners in Boog's show. But then they came to a familiar site: the same beaver dam they had passed the previous day. Clumsy Elliott had been leading them in a circle again. To make matters worse, Shaw drove up in his pick-up and had a loaded rifle in his hands. Boog tried to run across the beaver dam, but it just couldn't support his weight and gave way, washing the bear, the deer, the hunter, the beavers, the ducks, the skunks, the porcupine and all the woodland creatures down the waterfall and into the lower valley: hunting grounds.Boog called off his friendship with Elliott and went off on his own. By nightfall, he came upon a log cabin, so he went in, not knowing this was actually the home of Shaw. Boog helped himself to the food in the fridge and sat in Shaw's chair, glad to be domesticated again...until he saw the many mounted heads on the wall. Macabre hunting trophies. There were beavers, ducks, skunks, even a lone antler--Elliott's. Boog left Shaw's cabin and soon came across the road. Looking down the road, he saw...Timberline! He was almost home. Unfortunately he also saw pick-up trucks loaded with hunters carrying loaded guns. Open season was tomorrow. Boog had to do what his heart told him, so he raced back to the woods to warn Elliott and the others of their approaching doom. They formulate a plan to stand up and defend what was rightfully theirs. So, they acquire supplies from a camper and when dawn approached and the hunters gathered their rifles, the animals launched their attack. Spraying them with skunks, hurtling various items at them, and, blowing up their pick-ups with a propane bomb dubbed ""Mr. Happy"". The bewildered and bewitched hunters ran. The animals basked in the glow of their triumph, when suddenly a helicopter touched down and out came Beth, destined to bring Boog back home. But these few days in the woods had taught the bear a thing or two, and showed him his rightful place, so he decided to give up his previous domestic life and live in the woods with his new friends. And so, Boog and Elliott became firm friends, and the woodland animals became their allies, and they all lived happily ever after...as for Shaw, long story short: fell in mud, got covered in leaves and debris, a hippie couple took him to be Bigfoot and took him home, tied to the roof of their camper. He won't be harming any innocent critters for a while.Open Season...I found it to be very entertaining. It was funny, it was the perfect length. Not too long and not too short. Martin Lawrence (Nothing to Lose) is the voice of Boog, Ashton Kutcher (The Guardian) is Elliott, Gary Sinise (Forrest Gump) is Shaw, Debra Messing (Will & Grace) is Beth, we've also got Jane Krakowski, Jon Favreau, Billy Connolly, Patrick Warburton, and Matthew Taylor. All were very good in their parts. The story was good, it was good at developing the characters, and the CGI was done very well. If you're looking for a good animated film to take the kids to this fall, and you like this current talking animal genre, then Open Season is for you! Open Season, from 2006. I recommend it!"
74,Open Season,7,13 October 2006,Don't know what others didn't see.,"I don't know what other people are complaining about. This movie was pretty funny, much funnier than The Wild or Madagascar. It wasn't the best, but it still had some good parts. It is not 100% original. The idea of Boog and Elliot trying to find ""something"" (don't want to spoil anything for you) is like Shrek and Donkey. There were some original parts in the movie. The animation could be a little bit better. The characters were drawn nicely, but I can't say much for the environment. The voices were done pretty good. Also, I don't think the character development was enough. There seemed to be a few dead spots in the movie where it didn't really contribute to anything.All in all, go watch this movie. Although I didn't get to see the last 15-20 minutes because I was theater hopping with my friend (the movie we really went to see was about to start), I thought it was good enough for a review. Trust me, this is much better than the recent The Wild and Madacascar. I gave this movie a 7/10 because it was a fun watch."
75,Open Season,10,7 October 2006,wow,"This movie was funny...i was impressed i thought it was going to be dumb or boring, but it was not..and BTW....how the hell is this movie racist..just because they have a black man playing the role a bear does not ME ANYTHING..i think your the racist person how wrote the comment..i mean really shin color has NOTHING to do with ANYTHING..i think you'r dumb,....if you ca actually PROVE that the movie was racist then call SONY PICTURES and email them and say hey..I'm dumb your movie is racist and you know what they will say to you. well they wont say anything all they will do is LAUGH cause thats what i did after i read the comment they will tell you to F*** off cause your dumb"
76,Open Season,3,13 March 2009,The known characters,"In modern television we seem to be seeing the same characters over and over again, for comedy. That's all right with me because these characters are the only one that actually sell. Now for movies it is different. In movies the character can be as weird and unreal as the writers want him to be because that kind of character might actually be real for the script. Now, when I first saw Open Season I actually found it funny, and interesting. It was recently shown on TV, and when I saw it I felt like watching Madagascar. For those who have not seen Madagascar it is about a zebra in a zoo who dreams about living in the wild, while his best friend the lion enjoys being ""spoiled"" by the workers of the zoo. Open Season had a different setting, but the exact same ideas. Boog was being kept as a pet, and was being again ""spoiled"" by his owner and loved it. Along came Elliot, and gets him into trouble which makes him end up in the wild forest. Just about the same idea as Madagascar. Then they end up in some kind of war against the hunter or so, which is just the same idea as Over the Hedge, as well as ant bully. If the writers of Dreamworks are lacking ideas maybe they should slow down on their animations about animals.I still want to congratulate the writers on funny jokes, and say that without Ashton and Martin this movie would have been much worse than it actually is."
77,Open Season,10,9 October 2006,Oscar WORTHY,"I have seen this film. I have also seen the Godfather. This film was faaaaar better than The Godfather. I can't believe how ignorant you people are! You are ruining it's chances of being in the top 250 movies of all time. The graphics were impeccable, the voice talent was amazing, Props to Mr. Kutcher, the dialouge was some of the best and more natural dialouge that I have ever seen on the big screen. And it had plenty of well placed fart jokes. Usually, fart jokes are really over done, and can sound cheezy, but these were very naturalistic. I appreciated that. Props to Mr. Kutcher. On the other hand... The Godfather is a slow, boring, and horribly shot movie. the acting is...Meh.... and the editing is God awful. The movies only saving grace is the guns and the gun sound effects. Those were top notch. So, as I said, put ""Over the Hedge"" in the top 250 films of all time. Because whether you like it or not, it's gonna win some Oscars."
78,Open Season,7,30 September 2006,interesting,"this movie looks really interesting with its different elements in it of a group of animals. That are having a ball; I heard a lot of things about this movie being good, but you will have to go to the theatre and see this for yourself. There is bear in this movie unless I am wrong, which feeds into the plot of the film. There are a lot of other animals in it as well that have celebrity voices so take this into account when you hear the characters. Just like the voices you hear in the movie Curious George, same kind of concept. This is an excellent family film by far and something that even Lizzie Maguire and her friends can enjoy."
79,Open Season,5,24 December 2006,A clichéd mish-mash of previous animated films,"Open Season is a clichéd animated film about a bear named Boog, who is a pet to a female hunter. One day, an annoying deer by the name of Elliot comes into Boog's life and the two of them cause havoc in the city at night.Boog is then sent to the wilderness where he and his new sidekick have to adjust to their new life. Worst of all, Boog has no clue whatsoever of how to survive in wildlife.Sound familiar? Try Shrek and Madagascar and nearly every other talking animal flick out there.The only good thing about Open Season is the amazing CGI animation by Sony Pictures. This is their first attempt at a CGI animated film. They were successful with their animation but their script was filled with flaws.For one thing, it tried too hard to be like Shrek. The relationship between Boog and Elliot is reminiscent to the one between Shrek and Donkey.There have been way too many movies with talking animals in the past two years: Madagascar, The Wild, Ice Age 2, Over the Hedge, the Ant Bully and then we still have Barnyard, Flushed Away and Happy Feet, although Happy Feet actually looks quite entertaining.I think it is enough with the talking animal genre. Maybe animators should come up with a new idea, like aliens or more human related films as seen in Monster House.Talking animals are getting boring. But it is not going to end because from next year more animal talking movies are coming including: Ratatouille, Bee Movie, Cat Tale, Kung Fu Panda, American Dog, and Madagascar 2. And worst of all, if Open Season makes more than 85 million, another Open Season will be made! Seriously, this film was made for kids under 10. It may have its crude moments and sometimes funny lines but only children 10 and under could really appreciate this."
80,Open Season,4,2 February 2007,It's Craptastic!,"If you liked ""Shark Tale"", you'll love this abomination. Pretty much written by committee, this movie takes no chances when telling the same clichéd ""buddy"" story... only this time, it's set in the woods during hunting season! A few chuckles, but otherwise bereft of any real humour or wit. Might keep the kids entertained, but a real snoozer for adults.Main voices are provided by Ashton Kutcher and Martin Lawrence (at least it's not Will Smith!), so this should tell you something of the mentality that produced this picture. Not quite as bad as the aforementioned ""Shark Tale"", but certainly nowhere near the quality that you've come to expect from studios such as Pixar."
81,Open Season,3,11 January 2007,"Boring, no humor found","The animation and graphics are very nice in this movie. The characters look funny, the artists dealing with the graphics did a great job. Very good soundtrack, also. And that was all. The game was more entertaining, and I usually don't like this kind of games. The story and the lines were just plain boring. I could't find any jokes in this movie. (In Barnyard I did find a joke (one).)The characters deserved a better script. This is my opinion. They tried to let all the funny part on the animation and on the situations they face, on their accent (scotish and french accent should be funny) and on music. Recommended for children under 12."
82,Open Season,3,2 December 2006,not what I was expecting..,"After getting free tickets to the premiere of 'Open Season', I was expecting to see a great animated film, like Shrek and Monster's Inc. I ended up coming out disappointed. If you're taking your 5/6 year old kids, they'll probably like it. About half way through the movie I was expecting it to have a twist or something but my friend and I were pretty much bored through the whole movie. It's definitely not a family movie, and I suggest to keep it to the under 10s. Overall, I'm pretty glad the tickets were free. Watch something a little more worthwhile, but that's just my opinion. If you're not so much into comedy, then it's OK. Not hilarious, but cute... .... ... ... ... ... ... .... ..... ."
83,Open Season,4,27 October 2006,A friendly grizzly just wants to find home.,"An interesting and funny animated comedy that really doesn't measure up to a slew of the most recent movies of this same type. A 900-pound domesticated grizzly named Boog(Martin Lawrence)(voice)is taken and let go high in the woods by his caretaker Beth(Debra Messing)(voice). It happens to be three days before the opening day of hunting season; and one hunter, Shaw(Gary Sinise)(voice), in particular wants to make a trophy of Boog. The emotional grizzly has a new partner, Elliot(Ashton Kutcher)(voice), who is hard to shake. The two have to survive open season in order to get back to Boog's garage home. Typical prepubescent potty humor; the small amount of adult humor slips by most kids. Other stars lending their voices are: Jane Krakowski, Billy Connolly, Gordon Tootoosis and Georgia Engel."
