,title,stars,date,r_title,text
57,"Synecdoche, New York",7,18 July 2012,Well...,"To be completely honest, I didn't liked very much this movie aft first.In my opinion, the first part of the movie is incredibly tedious and almost unwatchable (And I could understand perfectly well why so many viewers found this film to be pretentious and boring) I guess that all what happened at the beginning was a necessary introduction of the characters and the story before the things start getting weird, but personally, I could hardly tolerate that part of the movie. It is when the whole deal about the play which imitates the life of the main character begins, I started to find this film interesting. It is from this point than the story turns much more complicated (With many parallels between the fiction and the reality and surreal situations) at the same time; I consider this to be the most fascinating part of the movie, with a very interesting use of symbols and motifs, until a perfectly satisfying conclusion, which fits perfectly with the overall tone of the whole film. The direction style of Charlie Kaufman in this movie is pretty solid, keeping a good level of ambiguity between the reality and the inner world of the protagonist; however, I think that what makes this movie work so well is the excellent performance of Philip Seymour Hoffman, which disregard of the fact that I found his character to be someone likable or not, he made it believable and realistic, with all the virtues and (many) flaws that could define someone as a person. In many ways, I admire Synecdoche, New York as a daring cinematic experiment (such as ""My Winnipeg"" or ""Inland Empire"") though it is very easy to see why the opinions about it tend to be polarizing. But that's precisely the point of making films like this, in order to create something different and unique that could be either loved or hated. My final impression is more in the positive side, but I do admit that this isn't exactly something very easy to watch or enjoy."
58,"Synecdoche, New York",7,28 December 2009,I want my mind back!!! Good movie,"I really wanted to give this movie a higher rating than 7 out of 10, I really did, a movie that was so sublimely filmed, so wonderfully scripted, so delightfully acted! It really deserved an 8-9/10. You really got to know which characters to hate, which characters to love, and which characters to feel sorry for... But the movie was just far too long. It dragged on too much and just got too surreal, and confusing. BUt that is actually what i really enjoyed about the movie, it made you think. It was more about symbolism than what you see on the scree, and this is why I really wish i could find a reason to mark it higher than a 7"
59,"Synecdoche, New York",1,28 May 2009,Kaufman presents a dead bird,"Charlie Kaufman can't tell jokes. Well, so what, you might say; according to some, nor could Shakespeare, and what of that? But then, Shakespeare never wrote a play consisting of nothing but jokes.Of course, Kaufman the writer has been badly let down by Kaufman the director (although no more or less badly than he was let down by Spike Jonze or Michel Gondry, than whom he is at least no less talented)  so it's hard to say where exactly the fault lies; but while watching this film one comes to the slow and dazed realisation that what it's attempting is humour.For example: Caden (Philip Seymour Hoffman) is raging about his daughter's getting a tattoo at an early age. Claire (Michelle Williams) takes off her shirt to reveal that her back is entirely covered by a bright red tattoo of Satan, which she says she got at the same age. Caden, who has been sleeping with Claire for several years: ""Well, I've never seen THAT before."" It's a joke right out of ""The Simpsons""; one can imagine Homer Simpson delivering the same line. The difference is that in ""The Simpsons"" the line would have been funny, and we wouldn't have blinked, sat in puzzlement through whatever happened next (one ceases to care after a while) and perhaps even made it through the closing credits and out into the street before realising that this line was supposed to be funny. Kaufman presents jokes to us the way a cat might present a dead bird, then stalks off to bask in his own cleverness while we're struggling to work out what our reaction is meant to be.Not one of Kaufman's jokes, conceits, or visual touches, not the one-liner about the tattoo, not the unexplained Zeppelin that weaves its way through the scale-model New York tenements, not the miniature portraits you need magnifying glasses to see, not the laboured basic premise of the film, has any impact or life. Anyone can come up with these ideas: philosophy postgrad students are already able to generate thought experiments of this kind by the dozen, and often tell them better. And, alas, the film is like conceptual art. Once I tell you what it's about you might as well not bother to watch it. You've already got the gag. And it's not funny."
60,"Synecdoche, New York",,30 May 2009,I don't understand this film at all,"This film is about a play director who creates an alternate New York in a huge theatre.I probably will never understand why ""Synecdoche, New York"" have such raving reviews and positive comments. To me, ""Synecdoche, New York"" is pointless, confusing and boring. It is overlong and slow, and I had to get up from my seat and exercise in order to stop myself falling asleep. So was Cotard living a dream, or directing a play, or is he delusional? I just do not understand this mess.Maybe the film is full of metaphors or messages, but I did not get a single thing. It surely goes down as one of the most time wasting film I have ever watched."
61,"Synecdoche, New York",4,30 May 2010,Kauffman. Where did you go wrong?,"I have been a huge fan of Charlie Kauffman's work for a long time. Each adventure into his mind has brought forth great wonder and great introspection for me. In Being John Malkovich, he delved into the idea of the human soul. In Adaptation he showed how impossible it is to have originality in your creative endeavours and how life is more outrageous than movie. In Eternal Sunshine of the Spotless Mind he let us face how we remain deeply entangled with those who have had so strong an affect on us that we wish it away. And whether or not that is the right thing to do.Which brings us to Synechdoche, New York.There are lessons to be learned throughout the film. Life, death, the roles we play to each other and the lies we tell ourselves. However, these lessons are not trickled in our ear, they are smashed into our brains with a heavy mallet. There is little to no joy in this escapade, no magic or happiness. I understand Hoffman's character is a man who does not feel these emotions but no one else does. The film spits bile at the idea of love being anything more than life's cruelest joke. Kauffman's on screen visions have hardly been cheery watching but they have still been injected with something otherworldly which sometimes filled your heart with warmth. Synechdoche New York does not.I feel this was mainly down to one thing. Charlie Kauffman should stick to writing. It is what he excels at. How a man could turn a film about staging a play of your own life ad infinitum within a giant warehouse into maudlin, pretentious navel gazing is beyond me. The narrative is over-burdened with stories that go nowhere and have no point existing. Kauffman doesn't seem to realise what a great central premise he has and that he should stick to it. His wandering becomes aimless and tiresome well before the halfway mark. This only makes the moments of genius within (of which there are) all the more painful as you feel you should have earned them far before they are given.I feel disappointed beyond reason. What could have blown me away has merely left me feeling cold. I hope the next time I see a Kauffman script on the screen this is not the case, since like I said, I am a fan of his work."
62,"Synecdoche, New York",10,24 October 2008,Absolutely brilliant. A masterpiece.,"Synecdoche, New York is one of those rare movies that make you re-evaluate your life and that can change the way you see the world.The script is sincere, heartfelt and brutal in its uncompromising preoccupation with the most painful elements of our existence. Having said that, the movie is far from depressing and is in fact hilarious. The humor is balanced out by moments of what I can only describe as pure cinematic poetry, the likes of which I haven't seen since, well, since Kaufman's previous film, Eternal Sunshine of the Spotless Mind.The cast is unbelievable; there are so many great actors in this movie, and they all do an incredible job. Philip Seymour Hoffman delivers what in my opinion is the best performance in his career (excluding Capote which I haven't seen and cannot comment on). Samantha Morton and Michelle Williams also stand out among this remarkable ensemble. And Sadie Goldstein, who plays Hoffman's four-year-old daughter, is just so adorable!The score is also phenomenal, and the end credits song was so beautiful it broke my heart.All in all, this movie has had a huge emotional impact on me and is definitely the kind of movie you have to see more than once. I give it my highest possible recommendation."
63,"Synecdoche, New York",9,30 December 2008,"Wry masterwork of the human condition echoes Beckett, Buddhism, other","Roger Ebert felt this strange, darkly humorous, philosophical film justified his departing from conventional review format; i.e., not bothering with synopsizing the plot, naming the characters and who played them, etc.in other words, writing a review like the ones we've been doing here for years. ""Synecdoche"" is Oscar-winning screenwriter Charlie Kaufman's directorial debut, and the film he's written and directed here is a masterpiece. The odd title incorporates a Greek literary term that means one thing standing, in a turn of phrase, for many; and, as well, a group of like things representing, generically, one. But it's also meant to evoke Schenectady, N.Y., where the action begins with theater director Caden Cotard (Philip Seymour Hoffman) staging a somewhat chancy, innovative production of Arthur Miller's great ""Death of a Salesman."" (In which, tellingly, Willie Loman as a tragic figure represents a mopey ""everyman,"" while in classical Greek tragedy and its Aristotelian theory, tragic embroilment was supposed to be a monopoly of royalty and the gods. Thus even here, synecdoche is invoked.) Plot: Loosely, a freak plumbing accident leads to medical visits that gradually reveal Caden to be dying ... perhaps ... and of what? ""Can't tell."" He also happens to receive a MacArthur Genius Grant, so, in the wake of his abandonment by his wife Adele (Catherine Keener) with their daughter, Olive, he sets off to do something great, large, monumental with the money. He leases cavernous warehouse space in New York City and sets out to stage his life. Here's where the film really takes off and its thematic vessels start to fruitfully overflow. It seems Caden's fatal disease(s) allow him to live to ripe old age after all, as he outlives his parents and, eventually surveys a life in life and art. Actors are chosen (or successfully nominate themselves) to play himself and his associatesloves, lost loves, their other loves, etc. The one who confidently puts himself forward to play Caden was, if you were paying attention, hovering around at the margins of the scenes earlier in the film. Was he supposed to represent Death? Or, rather, the constantly monitoring consciousnessuniquely human self-consciousness, the inner ""double,"" that isthat raises the question of how authentic we are (""playing ourselves,"" second-guessing, correcting, affecting, posturing, even as we live ourselves)just as Caden keeps chastising one actor to find the medium between how he naturally wants to do something and an overreaction to Caden's direction of how he wants him to do something. The film gets a little preachy, and is certainly didactic, toward the end, when, among other things, Caden points out that one moral is, everyone is the lead in their own ""play,"" the center of their own subjective world, and so no one should be slighted. There is also kind of a counter-existentialist statement of the unknowability of the connections, ""strings,"" our choices have to millions of other events (""events"" rather than ""outcomes,"" because we often can't even trace the causation, if any, and certainly can't predict it). But, in thwarting an attempted suicide in the course of the action, Kaufman veers away from a despondent nihilism with the notion that this life, infinitesimal and tragically sad as it often is, is all we have. Caution: In case you haven't already realized, be careful not to take anything in the film too literally, as Caden's diseases appear to turn out to be a metaphor for universal mortality (not mention the plagues and minor annoyances of organic, physical existence): we're all dying, of course, even as we can never truly, actionably comprehend and believe it. As I watched the film, I wondered how other, younger members of the audience could truly identify with it, with its depiction of the accumulations of losses and disappointments throughout lifeones that I have experienced, such as an adult daughter blaming me for an estrangement engineered by others; the regrets and recriminations that arise from love, possibly true love, tried, trifled with and lost. (Samantha Morton, here at her most beautiful since playing the Earl of Rochester's protegé in the Johnny Depp vehicle ""The Libertine"" reminds us of one of our such wistful, unrequited loves, with her big boobs and disarmingly teasy flirting.) Adele's ridiculously miniaturist paintings offer another symbol of the tininess of our lives and, often, the smallness of our ambitions, cruel pettiness of our actions. Yet from within one of her images comes another synecdoche, of the common humanness of the genders, in spite of their nearly completely alienating, hostility-breeding differences, so that, Tao-like, each contains the seed of the Other, as Caden and Ellen Bascomb/Millicent Weems (Dianne Wiest) metamorphose into one another at the end. One who lost a daughter; one who never had the one once dreamed of. (Robin Weigert, ""Deadwood's"" Calamity Jane, is almost unrecognizable here as Caden's daughter Olive, as an adult and a German, dying of blood poisoning from her full-body tattoo ... serving as a nice stand-in for a hostile fantasy in which my adult daughter could die as a result of her grotesquely large gauge ear hoopsperhaps a friend casting a line on a charter fishing expedition might accidentally hook one and fling her out to sea. Or, wearing her old, weightier, lead-imbued, Chinese-made Goth ear studs, her sense of balance might be altered and she could teeter off the curb into the path of a Greyhound bus.) Anyway, this is a film almost religious in its a-religiousness, its ultimate humanism. It is as if the best of Bergman and Woody Allen (and a soupçon of Alain Resnais, ""Mon Oncle D'Amerique"") rolled into one, chopped up, and arranged through the profound, kaleidoscopic expository genius unique to Kaufman, akin to the involuted forms of his ""Eternal Sunshine of the Spotless Mind"" and ""Adaptation."" See it."
64,"Synecdoche, New York",,10 December 2008,Death of a Playwright,"I'm thrilled by this film: all the wonderful narrative devices that I find delicious and engaging, and this time turned to have an effect on the viewer that is not to be lost lightly. He's wonderful.But I'm amazed at the writers who seem to have missed the significant structural arc. Without this shape, it is merely a tragedy with an interesting, introspective dialog, annotated by enabled poetic images (like the daughter's death from sick tattoos). Without this shape, its not unlike a ""Love Liza"" mapped into ""State and Main,"" which was a rather easy to read mapping of the ""state"" of the play into the main of life. Without this shape, you loses all the hope, all the rooting in life. You lose, I believe, everything that makes this uniquely useful as a scaffold for a whole new imagination. Without this one thing, you loose the layering all the way down into the soul of the writer, because the layering stops at the screen.The thing I am talking about is ""Death of a Salesman.""If you were Kaufman, indeed any American screenwriter today, one of your touchstones has to be this play. Its important because it opens a new dimension on the internal dialog made visible outside the page. It introduces us to a whole new vocabulary of writing by a writer imposed on an ordinary life in such a way that the writer's life is visible, surfing on the ordinary waves of waking and sleeping.We are presented with a director, Hoffman, staging an unusual ""Death of a Salesman."" He inserts himself in the thing, and the thing (and his body) become the (I should emphasize the singular) synecdoche of the world. Its a matter of his life and entire world being written and directed by himself, constrained by the shape of Lohman. If you step through the play, and layer folded imagination on it (with presumably more skill on the art and music design than Kaufman) you will have this.It makes it matter that it is his first film as director. Also that it is perhaps Hofman's twentieth film in a folded role made large enough by Kaufman as Arthur Miller. Moreover that he compresses the last two acts into a suspended death, one of dense concentration of vitality. The cloud of women that he writes in to surround him is the thing that stellates this layered sky. Its built on a redhead of course, the one who serves as a gateway to his world.Here is one flatting of the plot: A theater director is staging a novel version of ""Salesman,"" working out minute novelties while he enters the play with his life in a way that the entry is explicit. His own life at 31 is characterized by ""why""so he builds a play city around the apartment of his wife (numbered 31Y) who he imagines has left him. ""Imagines"" here is not separate from life, nor the visceral truth of the play. His wife is a similar soul, creating images of her life in a way (extreme miniatures) that requires an engagement of the viewer similar to what this film requires. There's a marriage counselor who has written books that are conflated with the play(s).Its a fantastic construction, ""fantastic"" in both senses. Its as highly structured as ""Irreversible,"" and as literate, as layered as ""Vanya on 42nd st,"" as touching as, say a Tarkovsky. This matters. I don't know yet whether it is among the best two films of 2008.Ted's Evaluation -- 3 of 3: Worth watching."
65,"Synecdoche, New York",2,18 February 2009,"Kaufman, the director...","SYNECDOCHE, NEW YORK is Charlie Kaufman's first film as a director, and his sixth as a screenwriter. Kaufman has supplied us with some of the most delightful mind-benders in recent years, and if not just layered with surrealism they all have a wonderful heart. His latest is another trip into a landscape of oddity, with serious and not so serious questions around life and all it's hidden treasures. Earlier, his film's may have had some unreasoned or unexplainable outcomes, but they've been managed by a fresh breath of air in different directors, most successfully Spike Jonze (and to mention George Clooney and Michael Gondry). This time he takes direction in his own hands, and he puts a characteristic, dirty palette and sets a depressive tone to it, so nobody's to blame Kaufman for resting on his laurels. With the Kaufman foundation, there's everything I love about him, but throughout I got the feeling of Kaufman putting himself in a tight corner during this. His soloing management becomes a knot of unanswered questions, loose ends and mind-trips all too weird to mention. Think about David Lynch, he is a great director, no doubt about that, but make him film a apple, and suddenly it's all a masterpiece. Why? Because it's Lynch, and well, he's probably the single most important and most successful surrealist in cinema history. Kaufman is surely one of the most original screenwriters Hollywood's ever seen, but when handpicking from his own arsenal, all by himself and with nobody to artistically co-operate with, Kaufman goes into overload."
66,"Synecdoche, New York",2,16 January 2009,"I'm sorry, are we talking about the same movie here?","I seem to be in the minority here, but I absolutely hated this movie. And for the life of me I cannot understand why this received an average of 7.9 out of 10 on IMDb. One of the earlier reviews cited this movie ""flirts with pretentiousness"" - well I didn't see any flirting going on; this movie reveled in it. Honestly if there were any good take-home messages about love lost or regret I completely missed them in the sheer ridiculousness of the storyline. The movie was so over-the-top sentimental it really made it unbearable. And the characters were so unlikeable and unbelievable that it just made the movie a complete waste. It's not that I don't appreciate subtlety or poignancy or movies that take a long time to develop - this just was not one of those movies. So if I can convince even one person not to waste his or her time on this snooze fest, I've accomplished something. Avoid this at all costs."
67,"Synecdoche, New York",5,1 December 2009,clever but unsatisfying,"It's hard to know what to say about this one. It starts out as just a bleak movie about a depressed guy with mysterious ailments, and for a good chunk of the movie it looks like that's all there's going to be. Then odd surrealistic elements start popping up and time comes loose from its moorings. And eventually the central concept of the ultimate play is introduced.All this weird stuff is kind of interesting, and kind of intriguing, and there are some really clever ideas mixed into it all, yet the movie seems aimless and far too depressing. Not that depressing is bad, but in a way it doesn't mesh with the surrealism.I think Kaufmann just had too many ideas he wanted to stick in. The central play is a really great idea that sometimes works and sometimes doesn't, but I feel it would have worked a lot better if that had been the entire focus; in other words, make a fairly straightforward movie with a weird but almost plausible mechanism rather than pile weirdness on top of weirdness. Kaufmann's goal seems to have been to out-weird his previous screenplays, and he certainly succeeds there, but it just loses focus. And you can argue that a self-indulgent, unfocused movie is perfect when it's about a self-indulgent, unfocused play, but ultimately it seems like Kaufmann is just saying, I'm messed up, the world is messed up, and I'm just going to toss the whole mess at you and let you manage it as best you can.Sure, it's art. But Kaufmann has in the past been great at combining art with entertainment, and here the entertainment has been tossed out in favor of a statement that is never clear. And by making a less entertaining film, Kaufmann has managed to simply highlight where he fails as an artist."
68,"Synecdoche, New York",5,26 October 2009,One weird and incredibly depressive ride; but a failed one,"Well, first, I've got to say, for his first job as director, Charlie Kaufman handled it pretty well, although I'd say he still lacks the ability to know when the pacing is not working. He got some pretty good performances on this film, and handled the whole technical aspects of film pretty well.Sadly, the job should've gone to Spike Jonze, as he would be able to filter out the madness and stick to what a film is supposed to be.Charlie Kaufman seems to be stuck into filming ""meta-fiction"", into adding little bits of witty, nonsensical humorous dialog, surrealism and recursive references (this guy playing this guy who plays this guy, or this guy inside this guy). So this time it's a play inside of a play, going on almost on real time with no purpose. Oh I get it. Clever.But Charlie Kaufman gets lost in it. He leaves the whole ""Adaptation""/""Eternal Sunshine"" reality to go to David Lynch territory here. Now don't get me wrong, I love ""Eraserhead"" and I'm fine with him going a bit surreal or non sensical, but he just throws the absurd on screen for no purpose. He messes with time, with reality, with the main character's disabilities, for no purpose, only to have it there. What was the point of Philip Seymour Hofman not controlling his tears or the way he takes soup? It was there for the kick of it. Because it is ""weird"". There was no clear connection to the whole point, and people are not going to be able to read Mr. Kaufman's mind, and we are not stupid if we cannot ""see it"". The whole film is a justification for the plot and ideas he wants to represent, not the contrary. He forces the whole surreal state into the audience and begs us to buy it, or to try to understand it. It doesn't work that way! Lynch knows it. Kaufman doesn't. Kaufman seems to throw his audience into confusion on purpose. A film should not require two or three viewings to ""get it"", no matter who wrote it or what his purpose was - unless he wanted us to buy more tickets. Or the DVD. But, all in all, the whole idea of what Kaufman meant to do was neat in a way, and buried in a gigantic mess of a film there are a few good messages, good scenes, a solid acting, and some 2 hours of entertainment. I wouldn't say I lost 2 hours of my life seeing this, because it pretty much served its purpose as a film, even though it was sad and depressing as hell - kudos on the whole ""pathos"" thing. But he could do better. I hope he does, when his next movie comes out, maybe 10 years from now, considering how fast he works, or how much work he is in need now to pay his bills."
