,title,stars,date,r_title,text
0,"Synecdoche, New York",10,29 November 2008,One of the Most Deeply Affecting Movies I've Seen in a Long Time,"It's virtually impossible to summarize my feelings on ""Synecdoche, New York."" This astonishing brain teaser from the mind of Charlie Kaufman affected me deeply, probably more than any film I've yet seen this year. I can't say it's necessarily enjoyable, because it's full of uncomfortable, brave truths about what it means to be human, and it goes places most movies don't dare to. But watching it is a bracing experience, and it's encouraging to know that there are still filmmakers willing to use film as a means of challenging their audiences and picking at scabs that most people would prefer to remain solidly in place.I can't begin to tell you what ""Synecdoche, New York"" means, and it wouldn't matter anyway, because I think it will mean different things to different people. A basic summary goes something like this: Philip Seymour Hoffman plays a morose, depressed theatre director who's convinced that fatal diseases are lurking around every blood vessel, and who decides to stage a monstrous, ambitious theatrical work that will leave him remembered after he dies. Soon, the work as he's staging it becomes confused with the life he's living, so that he finds himself directing a version of himself through a story that seems to be made up as it moves along.If this sounds like an act of mental masturbation by a pretentious intellectual with too much time on his hands, rest assured: ""Synecdoche, New York"" is not one of THOSE films. I didn't become impatient with Kaufman or his characters, like I have with some of his previous projects. In fact, this film made me uneasy because of how much of it I DID relate to. The conclusions it draws are that we are all alone in this big universe, life doesn't necessarily have any meaning other than what one brings to it, and there is not a higher power who is going to make sure our passage through the world makes sense. It was a bit of a wake up call to hear these beliefs, beliefs that I happen to share, stated so boldly, for while I'm confident in what I believe, that confidence doesn't make the beliefs themselves any less scary.But depressing and nihilistic as those beliefs might sound, the film is life affirming in its own way. It suggests that too many of us spend too much time trying to make sense of the world and not enough time living in it. We pull back in loneliness and fear when faced with things bigger than ourselves rather than turning to those who can actually help, namely the other human beings with whom we share our time on this planet.""Synecdoche, New York"" will not likely find a big audience, as most people will either not want to work at understanding it or won't like what it has to say. But if you're willing to go into it with an open mind, you might just find yourself amazed.Grade: A+"
1,"Synecdoche, New York",8,20 December 2008,"A thought-provoking, challenging Kaufman experience.","syn⋅ec⋅do⋅che: a figure of speech in which a part is used for the whole or the whole for a part, the special for the general or the general for the special 'Synecdoche, New York' marks Charlie Kaufman's directorial debut. A monumental event on its own right. It is a maddening venture, a staggering project to face life's greatest of mysteries. Kaufman takes us on a soul-searching journey, one that he is taking every bit as much as we. It is a trip unlike any I have ever seen, and to say that I enjoyed it would be a very difficult thing to say. But 'Synecdoche' seems to be pointing towards something very profound, as undecipherable as it may appear. A flawed masterpiece, and a risk Kaufman seems willing to take.There's nothing easy about 'Synecdoche', it is one of the most difficult films I've sat through. It's the sprawling story of one man's life, a tragic life. Philip Seymour Hoffman gives a harrowing performance as his character attempts to create a play of realism and honesty. And even as he dives head first into his work, his own life is in a perpetual state of free fall. A wife who leaves him, a daughter out of his life, relationships that crash and burn. His play, inside a warehouse where he has reconstructed New York City for people to live our their ordinary lives, becomes a fruitless and maddening descent into unhappiness and destruction.What is 'Synecdoche' about? Is it one man's search for meaning in the midst of meaninglessness? That in order to appreciate the preciousness of life, we must accept the inherent chaos. Existence is what we make of it, and it is the choices we make that shape and define who we are and the lives we lead. Every choice brings with it a million different consequences, some seen and others that go unnoticed.Kaufman tells us we are one in a world of many. We each play a starring role in the story of our life. People we meet every day, those we know and love. Never will we truly know them, their thoughts, or why they do what they do. And maybe it's not up to us to decipher what we will never understand. We must look inward, not to others, to find peace and insight.If life is a play, the world is our stage. We only have this one shot, no second chances. We try to control our projectories, cast roles that need to be filled. In the end, what does it matter? Will the world miss us when we're gone? Life is what you make of it. 'Synecdoche, New York' dares to search for meaning, reconcile paradoxes to which there are no answers. But that doesn't keep Kaufman from giving it his best, as tedious and heart-wrenching as it may sometimes be.More reviews: rottentomatoes.com/vine/journal_view.php?journalid=219276&view=public"
2,"Synecdoche, New York",10,5 December 2008,Phenomenal,"To start, let's make it clear that this movie will not be for everyone; I don't think any form of authentic art is. There is no flaw in this truth or in the people who do or do not find themselves moved by the art in question- it just is.I do believe there are people who more intuitively and naturally reflect inward, on death, on life- the meanings of all these things; it is a natural state for them. And I believe there are people as equally blessed and cursed to not think very deeply on these matters. I think this film will find a comfortable home in the hearts of the former. Now, of these ""inner seekers""- I believe you have all variations of folks- those that seek deeply and find beauty, connection, and great joy. There are those seek deeply and find isolation, grief, and deep wells of sadness. There are those who find some semblance of balance between the two. I myself lean more towards connection, and subsequent joy because of that I found this movie to be profoundly moving- on almost a primordial level- and I believe- in a hopeful way. Don't get me wrong, I cried many times during the movie and didn't want to leave the theater when the film was finished. I held back the wells of whatever it was that was welling up in me until I got to my car and then unloaded some body shaking tears. It wasn't sadness, though it was something else. I don't really know yet. One thing I do know is that all of Kaufman's films seem to affect me in this manner. After the initial viewing- I know distinctly how the movie has affected me emotionally- I can FEEL it. I am not capable of defining that feeling, or explaining why that feeling has erupted (it is clear to everyone that his plot and content are generally all over the board and it usually takes several viewings to pull any real intellectual analysis from them)- but I certainly am conscious of something new and fresh happening inside my emotional hard wiring. I find that a phenomenal feat in the face of a sea of art which relies on very standardized ways of pulling it's consumers in emotionally. Do you remember how you felt after Eternal Sunshine of the Spotless Mind? I remember walking out and feeling very hopeful about the nature of love- in a whole brand new way. Not in the contrived, standardized Sleepless in Seattle kind of way not to judge that- but there is something amazing about an artist who can make you feel things you are not sure you've felt before. That, to me, is authentic art. This really isn't about valuing one thing more than another- just offering great respect to someone who has taken your mind and heart to places it hasn't been before. It is nice to visit those old comfortable haunts, but this well, like all of Kaufman's films- will take you somewhere entirely new- if you are predisposed to that kind of wandering."
3,"Synecdoche, New York",9,8 November 2008,"to call it a disappointment might almost be a compliment, but I dare you to see it","Note: This works MUCH better on a repeat viewing, practically a masterpiece, and one of the perfectly sad comedies ever made... though the last ten minutes is a slog (perhaps intentionally, as it's near the end of the tunnel... but it's still unbearable).Over the course of my teenage years I've seen Being John Malkovich through Eternal Sunshine (those two the M-word, masterpieces, with Adaptation and Confessions of a Dangerous Mind near-great, and Human Nature a fun minor work), and he's always given something to chew on for the brain. He's an incredible wit, maybe too incredible, like something that could combust with the amount of ideas and ruminations and skill at defining what's important to us as people and what we want out of art. Synecdoche, New York could be seen as his life-summation of what concerns him as a writer. And to call it art is simple, because it is: it is, alongside the something like Inland Empire, the most challenging work to come out of American cinema. To say that either one is flawed may come as something as a given, but for Kaufman it's somewhat more troubling.This is a big film of ideas, crucial, life-affirming (or life-damning) thoughts about love and death and loss and forgiveness and, essentially, the process of trying to recreate and recreate and recreate this. But at the same time the intellect to engage full-tilt by Kaufman the writer, the director couldn't engage me as a viewer emotionally - at least at first. This changed on a second viewing - I'm reminded of Woody Allen's assertion on multiple viewings of 2001 that Kubrick was much ahead of him on what he was doing - but on a first impression I have to wonder, with everything going for Kaufman the satirist, the original, the sad dramatist, what the movie's audience really is. Like the play that is rehearsed for decades that Cotard never brings to his audience, what can one take away from Synecdoche, New York as far as connecting with the characters, or just Cotard?Maybe it reveals something about me just talking about this; indeed this is probably the film of the season, if not just the year (Dark Knight fanatics take note), that you will want to talk about after it ends. As far as puzzling works of art go it's great for a good argument, especially if one is familiar with how Kaufman's work has been leading up to this point. It's not exactly that the film is ever so confusing that one will want to walk out - there is a logic, in a sense, to the life imitating art imitating life imitating art etc etc aspect that makes sense. When Kaufman, as director, makes his film this time about as hopeful as Franz Kafka rewatching the Zapruder film on a loop, even the scenes and moments that *do* feel somewhat powerful emotionally (i.e. Hoffman seeing his daughter in a nudie-booth, or the final scene on the bed with Hoffman and Morton old and in bed with the house, once again, on fire) don't hit their mark - again, at least at first. It's almost as if seeing the film again it becomes deeper, more resonant; like any work of art at another point in one's life, it could change, and if one gives it the chance it does. Certainly the cast makes it worthwhile to watch: Hoffman is what he is, brilliant at transforming physically as age goes by as Caden Cotard, and at delivering subtle moments of humor amid his health-decay; ditto in her own right to Morton, who ranges from bubbly and lustful to anrgy and dejected (Michelle Williams, too, shows this range); even a bit part by Dianne Wiest is appreciated. They all help to give life to what is a big, somber meditation on (quoting Douglas Adams) Life, the Universe, and Everything.And yet, expressing my (initial) disappointment over the length (at 124 minutes it feels twice as long) or the music (did Kaufman order ""kill-myself-piano-tunes-you'll-love off of ebay for this?) or the personal problem of connecting emotionally with some of the characters as they (intentionally) don't really grow, shouldn't, I hope, diminish recommending Synecdoche, New York for anyone who wants something to challenge them, provoke thought and discourse, to engage and disrupt brainwave patterns. Perhaps there should be some disappointment; like life, and the art pulled out of it with pliers, it's not always a pretty sight, especially near the end. But it is a unique journey I was glad to take, and I hope every few years or so to come back to it, and see if it changes me, or if I've changed, since seeing it last."
4,"Synecdoche, New York",10,18 October 2008,Kaufman's Most Ambitious Film,"I got to see a screening of this in Boston, and let me admit to the fact that I consider this film a masterpiece. It is a rare entry into the market: an ambitious film, a gamble that, sadly, makes me question how much success it could garner in the mainstream box-office.Charlie Kaufman, however, is not a screenwriter/director who inherently aims his sights on the box-office or the mainstream (anybody who questions this has to question Being John Malkovich). Instead, his greatest strength is a boundless creativity and insight into the qualities of humanity, and Synecdoche, New York is no exception. Rather, it is the apex of Kaufman at his most insightful, his most ambitious, and (as his directorial debut) his most hauntingly beautiful.The plot itself is a contradiction of simplicity and complexity: to say that it is about Philip Seymour Hoffman trying to put on a larger than life play is an accurate statement, yet it completely fails to capture what Synecdoche, New York tries to convey. It is not a conventional film, but instead it is ambitious: a mixture of conventional narrative and surrealist cinema, one where the beauty of the film does not solely lie upon the plot, but the way every minute quality of the film ties together to form the tapestry.The actors all do their parts brilliantly. I am hard-pressed to find any performance that was weak or, for that matter, standard of the Hollywood formula. Hoffman is brilliant in a role that utilizes his physical and acting gifts, and he takes the character through the spectrum of its possibilities. All the other actors also performed brilliantly, although what struck me as wonderful about the acting choices are that the majority of the actors present are not ""glamorized"" for the screen. Rather, the blemishes, the age, and the imperfections that make them ordinary are ever present in the film, making Synecdoche, New York seem beautiful in a strange, ""dirty"" way. Much like a city, its majesty lies not in grungy street corners or clogged rain gutters, but in the whole image that is comprised of such small, necessary imperfections.And that, ultimately, is why Synecdoche, New York is such an ambitious, beautiful film. It is not a perfectly crafted standard screenplay, nor a perfectly executed piece of cinema. At least, Kaufman's work is not perfect under the current criteria of modern cinema. Synecdoche, New York is a gamble; a mixture of images and music and dialogue and acting that follows Kaufman's heart and his meditations on several ideas: namely, those on life and death and the connections all around us. It is dark yet funny, evocative and haunting. It is perfect in being a work of art that tempts us to find explanation, yet ultimately needs none compared to the feelings they evoke in us.Viewers who are looking to see the difference between ""art"" and ""entertainment"" need only see Synecdoche."
5,"Synecdoche, New York",10,11 October 2008,Brilliant and bizarre!,"What a trip. You can't expect a conventional picture from Charlie Kaufman, but this was super weird! So weird that half the people left the theatre before the end, either confused or offended by what they saw. Poor Charlie witnessed the whole scene and I suspect it really got to him.The film's very much Spike Jonze in style, but grander and more ambitious than Malkovich and Adaptation. The first hour is hilarious, next half an hour is still good and you're struggling not to lose threads, the last half an hour gets really messy and tends to drag a bit. It might be due to Charlie's inexperience as a director, or it might be intentional and a means to express one of the points of the film (futility and dragging of time), or the topics simply grew too difficult to deal with, but it seems to me that the last part could have been made a bit more compact for a stronger impression. Seven to ten minutes less would have helped, if that was possible.Perhaps Jonze would have done a better job in terms of pacing and craftsmanship, but the content is still really strong. The film had been five years in the making and you can feel the issues that Kaufman wanted to address brimming over. Illness, death, transience, love, relationships, passion, devotion, art, theatre, identity, hope, so many topics dealt with in a painfully sincere way. You both laugh and get emotionally affected all the time along with being confused by the twists of the plot and the grotesqueness of the imagery. You get many 'this is so true' moments that you completely identify with and then you suddenly get struck by a completely surreal scene. The film certainly reinforced my impression of Kaufman as a bastard son of Woody Allen and Tom Stoppard.The cast is wonderful. Philip Seymour Hoffman has to be singled out for his magnificent performance. I have never been much of a fan of his and I was somewhat bothered by the idea of him as a lead in the next Kaufman movie. I didn't think he had a presence for that, but did he prove me wrong! Appearing in virtually every scene, the man has carried this film on his shoulders. He has created a completely lovable and ludicrous character and conveyed Kaufman's ideas splendidly.Catherine Keener is as fun and adorable as ever! As a fan, I was really overwhelmed by this experience. I saw it two nights in a row, and spent hours discussing it with friends. The film is a bit difficult to comprehend instantaneously and Kaufman himself insists it requires a second watching. It is an amazing picture, rarely thought-provoking, and I can't wait to see it for the third time."
6,"Synecdoche, New York",10,11 January 2015,Life itself,"Charlie Kauffman's Synecdoche, New York feels impenetrable, abstract, and removed yet I was moved to tears by it all. Why? It felt ""brutally honest"".Set in Schenectady, New York, the film follows Caden Cotard (Philip Seymour Hoffman), a neurotic theatre director, as his life disintegrates. As things slip away Caden wins the MacArthur fellowship, and vows to create an original play, a work of ""brutal honesty"". Caden, however, lives in a bubble of his own thoughts, removing himself from his loveless marriage, making connections with those around him cold and awkward, and constantly he is searching for lost time. In his play we see Caden, examine the regrets of his life, and reflect intensely on what he should've said versus what actually happened or what he believed to have happened.Kauffman handles Caden with a great deal of intimacy, allowing for a connection where there should be none, as Caden is so self-absorbed. Camera angles for Caden are nearly always close or portrait, any transitioning shots or establishing shots are also almost exclusively from Caden's point of view. The cinematography and set design mixes magical realism into the movie and gives a dream like quality to everything.After plot and direction, things like acting and pacing become a bit harder to judge. How do you critique an actor that seems to be playing himself? If the pacing is designed to depict life, is the pacing of life intangible? Or is the medium of film unable to fully encapsulate the ""pace"" of life? This is all designed to force a personal response, and I can see people having varying opinions on this film, from boring to engaging and pretentious to being exact. Tone of the film would be generally be considered depressing, but to me there is something life affirming about it, as if to say I am not the only one he feels the human condition so intensely. The closing scene of the film reminds me of a rich life lived, and the absence of this richness is stark and shocking.Thematically there are so many ideas explored in this film. ""Ce n'est pas une pipe"" to how much can artist influence interpretations of his art to what is the human condition and how do you live a good life. Over a week later and I am still trying to warp my opinion to fit round the film.A comic I read recently describes most how the film feels to me: ""Life and death have been in love for longer than words can describe. Life sends countless gifts to death, and death keeps them forever."""
7,"Synecdoche, New York",9,6 November 2012,Trapped in the simulacrum between life and death,"One thing right ahead: Screenwriter Charlie Kaufman's directorial debut is an extremely uncomfortable film. It is likely not to make much sense the first time around, that you are too busy taking it all in and your efforts to understand it get derailed. Many will end up repelled by the experience and don't feel the desire to return to it. Subsequent viewings however should help to value the gargantuan task Kaufman has undertaken and to look forward to further visits to that strange place called ""Synecdoche"". Make no mistake: This is no love story, much less a happy one, not a tale about someone succeeding or get rewarded by any kind of redemption. There are images which seem too trivial to be part of a cinematic masterpiece, and you'll wonder about the surreality of some scenes and the layers upon layers that stack up. But getting into the film and getting out of it again only can be accomplished with difficulty. And that's a good thing.On the surface ""Synecdoche"" is about theater director Caden Cotard (understatedly played by Philip Seymour Hoffman) whose life more and more slips out of his hands and literally rushes by in the film's narrative. An unexpected award gives him the chance to attempt something big, and so he builds a simulacrum, a life-size replica of New York, casting people to play roles in it in order to replace the persons of his life. But the simulacrum is not enough, and while he tries everything and then some in his struggle to find a sure footing, a proof of his existence between life and death, he turns out to be nothing else than the ultimate victim of his limitations. Caden's story is about the loss of himself in the imitations he created, yet miraculously this sad life eventually becomes part of something larger by just fading away. For watchers will notice a deliberately designed circular structure of the film... One could even argue that Caden might just be a character in a film, and longing for a life outside. Up to you! Make sure to watch ""Synecdoche"" more than once. And maybe at some point you'll learn to smile along with this postmodern masterpiece."
