,title,stars,date,r_title,text
123,"Synecdoche, New York",8,17 November 2008,Synechdoce answers here!!!,"Maybe I'm pretentious, but I feel that I'm one of the only people who understood this film. Synecdoche. Half overwrought forced symbolism and metaphor, half ultimate existential truth. I feel that many of the critiques of this film barely scratch the surface of what Kaufman was getting at because the viewers anchored themselves into the VISUAL ride that had no straight forward through line and was therefore overwhelmingly random and ultimately frustrating; but the story isn't in the visual, it's in the spiritual, and it conferred every truth about the human experience. ""Show don't tell"" : the filmmakers axiom. Maybe the film was self indulgent, but I dare say it was rightly so and HAD to be because the subject matter so all encompassing that the only way to give it an interesting platform and avoid proselytizing was to visualize it to a bizarre extreme.Question 1. Hazel. Didn't she seem desperate to you? Like maybe she's one of those ticking biological clock women who leech onto any seemingly available man in an attempt to fulfill her woman's duty before time runs out. She lives in a burning house. I believe the burning house was a convention that represented time running out on her desire to have a family. Adele and Caden are an ""old"" couple. As we all know marriages grow cold despite genuine love still being present. Adele admitted in therapy that she imagined Caden dying because she wanted a new start. Later in the film I believe Hazel made the comment about us all being on our own and having to continue on our path in search of what ever fulfills us no matter what. Adel, having ended her course with Cotard as a wife owed it to herself to continue on her individual life path. I think Kaufman was saying that marriage is NOT the end all be all that we make it out to be. We don't stop changing, we don't stop yearning and needing to grow. Adele stayed true to herself and kept it moving. Good for her. I think Caden never got over Adele and was somewhere subconsciously hoping and preparing for her return, hence the upkeep of her apartment.With Olive it reminds me of a line of a John Meyer song called ""daughters"". the line goes : 'girls become lovers, who turn in to mothers"". Olive grew up, became aware of her body as all women do, and did with it what she wanted. As a father Caden will never stop seeing his little girl as his little girl, even as he watched her dance naked in a peep show booth covered with tattoos. A comment on general human perspective and how our cemented images of people resist change despite glaring truths before our eyes. There was also a scene where he mentions the tattoos to his new wife and she takes off her shirt revealing a huge back piece. What does he say? "" I've never even seen that before!"" That's because with our lovers as well as any person we're close to, we tend to see them as we want, rarely as they are. Hope Davis, the therapist, seems to have it all under control, seems to have surmounted the psychological and physical struggles us mere mortals endure, not so. She had the same sores on her feet as Cotard alluding to her grappling with the exact same problem. She is Cotard, she just knows how to play her ""part"" better than any of us and pretends to be above it all. I think her books reappear at the end as a reminder that none of us are above it, our exteriors vary but our inner worlds are the exact same. I think the ""real world"" ended after his wife left and he began dealing with his illnesses, that's when he began searching and grasping and all the events metaphoric of his emotional mental journey after that point.As far as the relationships between the characters used as standings for main characters and said main characters, I think it was a comment on how when we move on from one relationship we often seek a literal replacement for what we lost and end up dating someone remarkably similar to the person we just broke up with. Hence Hazel falling for Cotard's stand in."
124,"Synecdoche, New York",7,16 November 2008,"Interesting, but it doesn't work","It's not like Charlie Kaufman has written just great scripts in the past, with Human Nature and Confessions of a Dangerous Mind, but I had hoped that, when directing his own script for the first time, he would be able to make the definitive Kaufmanesque artwork. Alas, maybe he needs the structure of another director to rein in his mad ideas. Or perhaps, like Human Nature and Confessions of a Dangerous Mind, Synecdoche, New York is just a misstep. It's not terrible or anything (and neither are his two other lesser films that I've already mentioned twice), but it just doesn't work. The movie involves a play director (Philip Seymour Hoffman) who gets a genius grant. Always having put on the plays of others, he now decides to write his own play, about his own, miserable life. Not just one part of his life, but his whole life, from birth to death, encompassing every daily event. Soon the play is about a director putting on a play about a director putting on a play. The idea is fascinating. Unfortunately, the execution is poor. Like Adaptation, Synecdoche comes from Charlie Kaufman's inner insecurities. This one is completely internal, and doesn't take place in any recognizable reality. There are bald symbols at every corner, like a house that is perpetually in flames. Kaufman rarely gives any real clues about these symbols, which leads to them being analyzed and then just dismissed as self-indulgence. Kaufman never gave me an in with the picture, so I just never cared about what was going on. And much of the time, Kaufman's sense of humor is lacking. Some of the more jokey material, like the arrogant, self-promoting psychologist played by Hope Davis, gets dropped as the film progresses, right about the time it's becoming pretty funny. I did start to like the movie better when it was dealing with the multi-layered universe Hoffman had put himself in. That mind-bending stuff is quite entertaining."
125,"Synecdoche, New York",1,1 April 2009,"Synecdoche, N.Y. 1/2* Winner of Weirdest Film Yet","I've seen some awful films in my years and this one is way up there. This is artistic brilliance? This is more like artistic nonsense.The 1/2* represents the fine performance of Philip Seymour Hoffman. This man never fails to amaze me. He could make a film wrapped around in toilet tissue and succeed.The problem with this film is that it is weird. Very weird.A man's wife leaves him and takes their 4 year old child to Berlin of all places. He searches for them but never finds them.In the meantime, Hoffman is a director. We find him directing ""Death of A Salesman."" What an appropriate play to be a director. Willie Loman would have gone faster had he seen Synedoche. Then, we see Hoffman directing an autobiographical play about his turbulent life. Hoffman, it is true, pulls out all the various emotional stops in his performance, but the film is over-wrought with preoccupation of illness, death, and general misery and we look into our inner psyche. (You need a psychiatrist for this one.)"
126,"Synecdoche, New York",10,14 April 2009,Extraordinary,"Charlie Kauffman deserves a Nobel Prize for this. Forget the Oscar. He's in a different league here.This is one of those movies that you cannot be ambivalent to unless you're sleepwalking... it has an unmistakable power to force you to think, feel, and process life differently than you're used to. This movie has power. Life as art, art as life, and all of the unknowns which dominate everything man does coupled to all the unrequited moments with their longings and hurts only serve as the matrix for this remarkable and beautiful film. I say ""'only' the matrix"" because beneath the trappings of the superficial are the endless invisible layers: the shadowings, and ""what-ifs"" that comprise the alternate universes within universes surrounding us, the Russian Doll withins the withins receding as fractal images each another within to itself that are the true grist for Kauffman here. This is a deeply introspective work. I can understand how those who are seeking only the eye candy of a fast-paced car chase would not get this movie. Likewise someone who is young and who has not yet experienced those longer currents of wistfulness that can only come with aging may not be able to fully get this movie. If there is one thing vital about aging, it is that richness of depth from long encounter with experience.As personal as this movie is, as it revolves around the protagonist and his relationships, Kauffman holds out that there is a tinge of madness to the introspective vision, and to the creative process. Both his character's name, and a name found on a mailbox are identified mental delusions: one, Cotard, named for a nihilistic sense of decay, one, Capgras, for a disturbing notion that all those near and dear have been replaced with substitutes who although they look the same and act the same are not the originals. Both of these delusional illnesses dominate plot in SNY. From the strange hypochondria he exhibits almost daily, to his psychosomatic manifestations, to his belief that he is losing autonomic functioning and must somehow through biofeedback training use his mind to take over bodily functions, to his concern with his bowels------emerges a portrait of a person extremely neurotically involved with their body, and all that can go wrong. In one scene he urinates and his urine is very dark brown, almost black. Did he imagine this?---or did it happen? We're never sure. All we know is that this is a person who is unsure of being alive on the planet, not comfortable with himself or anyone else. Kauffman lays bare the uncertainties of life as a knife reveals the tissue and blood within the body, and with all the concern one might have when no medical assistance is available for a serious injury. And under all this is that ultimate certainty that the bowels will stop working, the kidneys not filter properly, the cells of the body not replicate as once, and decay set in. His hypochondriac delusions are founded on reality . . . maybe not so delusional after all. And will others ultimately replace those we now know? The lover have a different face, different body? The doctor once fat and Caucasian become thin and Asian? This is how life moves. And Kauffman suggests to us that mental illness is maybe only a state of prescience, of time dislocated from the process of knowing. Everything about this movie has to do with perceptions being skewed toward ultimate uncertainty. Nothing stays the same, is reliable, or can be counted on to be quite as one remembers it or expects it to be based on prior experience, and final earthly wisdom remains just as uncertain. Strangely enough, I was reminded of Stanley Kubrick's 2001 and Keir Dullea's character toward the end, in the French Provincial setting --- I think, after many years, that scene finally makes some sense to me after watching ""Synecdoche, New York."" Just don't ask me to explain how.I love this movie. I believe that a separate award for Kauffman for this movie be given by the Film Industry: genius. It's that good."
127,"Synecdoche, New York",10,4 April 2009,Eternal Sunshine of Charlie Kaufman's Mind,"Charlie Kaufman is my hero. He has been without a doubt one of the best modern writers since the film Being John Malkovich (1999). Now, after his directing debut Synecdoche, New York (2008) which he made based on his own script, I believe that Kaufman has taken the unique position among the best, most creative, ambitious, visually interesting directors of our times. Synecdoche, New York is a fascinating film, deep and profound, dramatic and funny, sophisticated and innovative, complex yet clear. Kaufman was able to gather a dream cast of extremely talented intelligent actors and each of them gave a performance they should be proud of. As a matter of fact I did not expect anything less from the man behind Being John Malkovich and Eternal Sunshine of the Spotless Mind (2004). Before I watched the film I knew I would be confused, lost, maybe even infuriated sometimes but it is great to get lost in such incredibly complicated but outstanding work of Art with a capital A. Yes, of course Synecdoche, New York brings to mind the great movies of the past. Woody Allen's Crimes and Misdemeanors, Stardust Memory or Deconstructing Harry, which in turn reminds so much of Ingmar Bergman's Wild Strawberries were the first I remember. I also think of Synecdoche as Fellini's 8 1/2 sans Nino Rota's music. So what? All artists come to the point when they have to explore the old but forever burning themes of the human existence on their own. What is life? What is its meaning? How unique every life is? How each of us, every single one is a main hero of our own story and how unique every story is? What is the purpose of Art? Why and how love dies? Is it possible to survive and forget it? Why are we given the short gift of life since we will be inevitable losing the game to the dealer that always wins? Why is our imagination so strong and limitless while our physical weakness is so humiliating and frustrating? All of these questions have been explored and meditated upon since the humankind exists but how original, ambitious, grandiose, profound, tragically optimistic and incredibly sad and sober the first film of Charlie Kaufman is. Bravo to Charlie  first and foremost  and to Philip, and Tom, and Catherine, and Samantha, and Emily, and Dianne, and Jennifer, and Michelle, and Hope, and everyone who have become the part of this mind-blowing cinematic and artistic event. My special thank you goes to Jon Brion, the author of original music for the film."
128,"Synecdoche, New York",10,2 April 2009,Review,"Brilliant. I don't even know where to start. Synecdoche is the craftiest, most sublime, and beautifully poignant movie possibly ever made. It leaves you with a very real sense of what it is to be human, at the same time stripping you of your fantasies and leaving you humbly alone to ponder on it all. The movie starts out in a mash of emotions and disconnectedness from any of the characters but yourself. Part of what is so brilliant about this movie is that you have no idea until almost the very end that you are literally a character in it and that only at that moment you have a clue as to what you've actually been watching. Right out of the gate you quite un-caringly find the main character Caden at the beginning of a confounding illness that threatens his life amidst his rather uninteresting and humiliating string of bad relationships with women. The man is definitively alone as he tries to make sense of his life. Writer, Director Charlie Kaufman works absolute magic as he twists what your watching into exactly what he wants you to feel. Just like Caden, at the beginning we don't care about anyone but our selves, you wonder why your even still watching it. When his first wife leaves for Germany with their daughter we feel the required amount of emotion to drag most of us through to it's end. The movie parallels not only life itself but your experiences watching it, Caden's life, the life of the film, the life of the piece Caden is ignorantly trying to create and your reactions to it. Kaufman plays with your attention, emotion, expectation, curiosity, and very humanity to bring you something akin to the biggest revelation of your life. What is all this human stuff about? What is it to grow old, lonely, degrading, having someone at it's end direct your life right to the point of death itself? It's not till the very end you grasp anything the movie is offering (of which I have left much out), yet when it happens it grips your very soul with a profoundness that has not been previously experienced as a result of any movie. Somehow depressing and consoling it stirs compassion and understanding for your fellow human in a depth not recognized before. F%$king brilliant."
129,"Synecdoche, New York",8,15 November 2008,A folly,"In this behemoth, this collection of characters in search of a story, hip screenwriter Charlie Kaufman delivers a directorial debut of enormous ambition. But while earlier writing-only efforts like 'Being John Malkovich,' 'Confessions of a Dangerous Mind,' 'Adaptation,' and 'Eternal Sunshine of the Spotless Mind' are brilliant provocations, this time Kaufman's just enamored of his own fancy. Playing the role of director as well as writer he lacks the perspective or self control needed. The wearying result stars Philip Seymour Hoffman as a depressed schlub theater director called Caden Cotard whose modicum of public recognition doesn't save him from a host of problems, psychological, physical, and marital. And he thinks he's going to die--a thought harped on incessantly that signals the film's other chief weaknesses besides its self-indulgence: its tendentiousness, and, ultimately, its sentimentality. Given a Macarthur ""genius"" award just after his painter wife has taken their little daughter and left him to live in Berlin, protagonist Cotard plunges into a giant, quixotic project that goes on for decades and is never finished. He fashions an outsize stage that's a microcosm of the world--or his world anyway. Perhaps this is the point of using ""synecdoche"" (the rhetorical term for using a part to stand for the whole) in the title. But more likely the word is just a rather childish play on words, since the action's set in Schenectady, and Caden's boxes-within-boxes excess is far from rhetorical elegance: it's not 'synecdoche,' it's a clumsy life-size replica. Kaufman's recreating of Caden Cotard's neurotic, dazed life and his overblown stagecraft gradually emerges as not so much a revelation about the artistic struggle as a compendium of what could be outtakes from every depressed schlub role Hoffman has ever played--all jumbled together without anything to connect them but throwaway displays of cleverness and bizarre, unfunny humor. Despite its ponderousness and ambition, the film never finds a consistent tone.In the first section, which one may long to return to when the tedious repetitions of the theatrical production set in, Caden is suffering a series of Jobian torments and lives in what appears to be a state of justifiable hypochondria. He gets boils, jitters, has a seizure, his pupils don't dilate properly, he's prematurely arthritic, or thinks he is. Worst of all, he's miserably unhappy and afraid of dying. Meanwhile his blithe indifferent wife Adele Lack (Catherine Keener) goes off to Berlin with little Olive (Sadie Goldstein), a child who suffers from green stools, fitting with her name. Caden sees a series of puzzling or bizarre physicians, but just gets more ailments--some of which may be purely psychosomatic. The focus on odious bodily fluids and other disgusting aspects of human decline here is almost (but not quite) worthy of Hieronymous Bosch.Caden has had a critical success with a production of Arthur Miller's 'Death of a Salesma'n in which the principals are played by young actors--in a self-conscious effort at the Alienation Effect, or to make the audience think about aging. But Adele chides him for not doing something completely his own--thus maliciously opening a Pandora's box of overblown ambition and fanatical verisimilitude, for Caden's effort is to copy everyone he knows. And like computer files, they clone themselves every time they seem to have been canceled out.A number of women resemble Hazel (Samantha Morton), a sweet would-be thespian who buys a house that's perpetually on fire. One of these is Claire Keen (Michelle Williams). Time passes unawares for Caden; Hoffman's makeup shows him getting older by decades. Olive grows up in Berlin as a figure of the local decadent hip culture, covered in tattoos by her best friend, Maria (Jennifer Jason Leigh), who becomes her lesbian lover. Caden's effort to get through to Olive is frustrating and dreamlike. He winds up scrubbing his ex-wife's toilet and kitchen when she's not there. Adele's celebrated paintings, which are said to be marvels of truth and reality, are tiny, and viewers in galleries must wear jeweler's magnifying glasses headsets to walk around and view them. This curious detail is one of many examples of how Kaufman's writing blends the surreal and the comic, and defies the viewer to distinguish between the actual and the dreamed or imagined. Emily Watson and Dianne Wiest round out the interesting female leads, who seem as coldly manipulated as any of Lars von Trier's.Caden's life is marked by a cruel absurdity worthy of the early novels of Nabokovand a smiling Nabokovian doppelgänger appears--Sammy Barnathan (Tom Noonan)--who doesn't resemble Caden at all (he's tall and thin), but qualifies to play him because he has followed him around for 20 years. But Nabokov would have rounded things out elegantly with a mock-detective story finish, is in 'Lolita.' Instead, alas, 'Synecdoche' becomes more and more repetitious and maudlin, the theatrical event Caden is staging becomes increasingly conceptual and uninvolving, and things clunk to a mechanical finish, weighed down by its own ambition, not to mention its tendentiousness and free-floating gloom.This is material that Pirandello explored--thus making it more early modern than post-modern, in fact, though Kaufman often gets the latter label. It also touches on themes that occur in the films of Jacques Rivette. Above all one thinks this whole fantasmagoric production might best have been handled by Fellini. But he already did it, and the result was '8½.' Kaufman hasn't Fellini's visual sense or virtuosity in staging complicated crowd sequences. His actors just pop up awkwardly here and there in clumps.Kaufman and Michel Gondry are two talented cinema artists whose invention needs to be held in check or given a structure, and (surprisingly, perhaps) they collaborated brilliantly in 'Eternal Sunshine of the Spotless Mind.' Working on his own as both writer and director in 'The Science of Sleep' and 'Be Kind Rewind,' Gondry grows too whimsical. Here, Kaufman simply has become too self-indulgent, and lacks the passion and empathy of a Werner Herzog in pursuing his quixotic striver."
