,title,stars,date,r_title,text
188,"Synecdoche, New York",10,1 March 2009,"The end is built into the beginning  Synecdoche, New York","We all go about our lives creating a world around us. To us, we are the stars of a film; our surroundings are the set; and the people touching our lives supporting players and/or extras. Philip Seymour Hoffman's Caden Cotard watches as the plays he directs onstage succeed and garner praise while the life he lives with wife and daughter falls apart around him. As a God, crafting the activities and molding the characterizations of a cast, his own humanity is lost and hidden behind an insecure and scared shell of a man. We do audition the people we hold dear; they must pass a test before we allow them in our lives. Some go on to play bigger roles while others get fired for not doing their job. We raise our children and build them into what we feel a child should be, shaping them to grow up and succeed. It is all carefully orchestrated in the movie of our life, but until you realize that the extras in your story are the leads in their own, you will never be truly happy. Each one will become more famous and sought after, bringing their show to Broadway and Hollywood, hitching a ride on a new director's coattails, while you stay, stuck and alone, going through the motions in your abandoned back-lot, eternally in Synecdoche, New York.I didn't quite know what to expect when delving into this film. At first, it all seemed pretty much rooted in a reality, a slightly heightened one, but still accessible. Cotard was living a life of convenience with his regretful artist wife Adele, (Catherine Keener), and their annoyingly hyper daughter Olive. We begin to catch glimpses of the deterioration of his surroundings as words start to confuseOphthalmologist sounds like Neurologist which sounds like Urologist; when speaking of suicide, ""How would you do it"" sounds like ""How did you do it"", etcand eventually all footing is lost when Samantha Morton's Hazel buys a house on fire. It appears to be a gag as she speaks of being afraid she might die in the flames, yet as the film continues on, the home is constantly burning, possibly showing her role as devil to Cotard, the ever-alluring vixen he so wants, but can never build the courage to be with.The acting is brilliant across the board, from the large roles to the small. Jennifer Jason Leigh's mysterious Maria becomes a fully fleshed creature, a destructive force in Cotard's life while only being on screen for maybe five total minutes. She takes away his wife and then his daughter, becoming a surrogate for himself in Berlin, the place he was not allowed to follow them to. She, in effect, becomes the first cast member in the life of Caden Cotard; the stand-in for him as he must stay back to work on his MacArthur grant producing masterpiece. The story becomes more and more surreal at this point, Seymour Hoffman's portrayal becoming more eccentric and crazed with nervous ticks and medical problems cropping up one after another. Time begins to fold in on itself as the years pass by, but seem as only days or weeks to him. A wife and child gone for a year yet he only misses them for a week, thinking they will return once the show overseas has completed. The real world and that of his play, reinterpreting it, meld together into one.More and more layers are created as we get Emily Watson cast as Hazel, in the play being written, while the real-life Hazel (Morton) goes on continuing her journey with Hoffman's Caden. Even Cotard himself begins to play the character of Ellen, a housekeeper for the real-life Adele, who then becomes a character cast with Dianne Wiest in the story. Probably my second favorite move by Kaufman, having a character created for a fictional person, to then eventually be played by Caden again, revisiting the role for which he originated, a person who does not exist on any plain whatsoever  genius. I say second favorite, though, because I absolutely loved the character of Tom Noonan's Sammy Barnathan. He is ever-present throughout the entire film, seen in the background, watching intently. From the first scene, standing across the street as Hoffman gets his mail, to the shadowed blur in front of the camera as he creeps out from behind a tree when Hoffman meets his muse in actress Claire, (Michelle Williams), at a park bench. He is always there, watching and waiting, until the time comes that Caden needs an actor to play himself. How can he give notes on his own character if he cannot see what he is doing? The only way to improve is to put him into the elaborate play himself, to watch his insecurities and greed firsthand, to acknowledge the error of his ways. However, he is so vapid and egomaniacal that he becomes jealous of the characters themselves.Only when Wiest's Millicent Weems takes the job of playing the real Cadenthat's right, the REAL Cadendoes he finally get a break to put his whole self into the part of Ellen. He decides to hide inside his own play, all those he loved dead and gone, while Wiest tells him the story of her own life as an actress, eerily similar to his. It all spirals out of control, as Cotard himself can't remember what happened in his past to bring him to where he has ended up. By the time the ending comes, you really won't know if anything you've seen actually happened. However, the final cue, the final note, if you will, given to Hoffman's ""real"" Caden Cotard as Ellen Bascomb, couldn't be more profound in its simplicity. He has needed to be told what to do at every step of his existence, so it is only appropriate that he is told when he can finally take that much-deserved rest."
189,"Synecdoche, New York",8,25 February 2009,Remember part of me is you,"Is this a great movie? Sure. Would I want to see it again anytime soon? Hell no. First of all it's deeply confusing, even by the standards of a Charlie Kaufman movie. It's also exceedingly sad throughout, starting low and going lower, from blue to black to bleak. But most importantly, it's really very long. It feels like a one-hour movie with a two-hour ending, but maybe that's ""because the end is built into the beginning."" An out-of-luck playwright and a henpecked husband, Caden Cotard (Philip Seymour Hoffmann) receives a prestigious scholarship, the kind Hoffmann's character in ""The Savages"" never got. Of course money changes everything, and of course it's for the worse. Endowed with the means to live his dream and produce the ultimate drama, Caden embarks on a journey from which he will not return. Working all departments, he is creating something so vast it will eventually swallow everything. Slowly, but irreversibly the production spins out of proportion and control. Scope and set are ever expanding. Casual comments turn into story lines and backdrops into locations. Onlookers and bystanders become part of the play, until everybody is in it and no-one is left to watch. The play becomes Caden's life, until his life is finally nothing but the play. It's the play to end all plays, the true Truman Show, a theater of the world as envisioned by Pedro Calderón himself. Quote Caden in his directorial persona: ""You're in the scene, you're not just filming it."" No doubt this is a masterpiece, but it's also Charlie Kaufman's darkest and most depressing movie to date."
190,"Synecdoche, New York",6,9 December 2008,Borderline nails-on-a-chalkboard oddity from 'genius' scribe Charlie Kaufman',"SYNECDOCHE, NEW YORK (2008) ** Philip Seymour Hoffman, Catherine Keener, Michelle Williams, Samantha Morton, Hope Davis, Jennifer Jason Leigh, Emily Watson, Tom Noonan, Dianne Wiest. Borderline nails-on-a-chalkboard oddity from 'genius' scribe Charlie Kaufman's equally off-beat mindset (and his directorial debut to boot) about a schlumpy playwright (Hoffman) whose introspection of his failed life in general causes grist for the mill of meta proportions when his deemed MacArthur grant allows him to pursue his ultimate story: a play in real-time about himself! Precious and at times frustratingly too obtuse but still fascinating in the long run largely to its impressive ensemble."
191,"Synecdoche, New York",7,21 November 2008,Not as good as I expected it to be,"Just saw this today, and it just wasn't that gripping. If you've seen the trailer, you've seen the film.I'm giving it 7 out of 10 stars because it was well-executed and risky.Now I will simply repeat my point in order to have enough lines in the review to be posted.Just saw this today, and it just wasn't that gripping. If you've seen the trailer, you've seen the film.I'm giving it 7 out of 10 stars because it was well-executed and risky.Now I will simply repeat my point in order to have enough lines in the review to be posted.Just saw this today, and it just wasn't that gripping. If you've seen the trailer, you've seen the film.I'm giving it 7 out of 10 stars because it was well-executed and risky.Now I will simply repeat my point in order to have enough lines in the review to be posted."
192,"Synecdoche, New York",7,11 November 2008,Kaufman's 8 ½,"Granted, not as much fun to watch as Fellini's famous quasi-autobiographical opus, but it's essentially the same thing: Man involved in the lively arts hits a creative block while attempting to deal with the women in his life, in realistic and surrealistic episodes of varying degrees covering his entire life.All of Fellini's 8 ½ is here:- the sickness, the women, the creative process, the enormous set, the dreamlike spells of surrealism, the existentialism, the bits of wild humor, the stark drama ... only Kaufman substitutes grit, grime, ugliness, repulsion and paranoia for Fellini's glitz, glamour, beauty, charm and euphoria.It's about a quarter of an hour shorter than 8 ½, but feels twice as long  and there's no Barbara Steele, of course  but Philip Seymour Hoffman and the rest of the cast are fantastic."
193,"Synecdoche, New York",,19 August 2015,Can't figure out why people love it...,"I saw this movie and after about an hour and 5 min I stopped. I have read reviews about this movie, felt like worth watching, but in the end I got too confused over what's going on. Let me just start by saying that I giggled maybe twice during the first hour... Other than that, I can't think of a reason to give this movie a 7.5 rating. Now let me explain what I got all confused about: I could barely knew anything about all the characters involved in the movie, The directing made the film even MORE confusing for me, a lot of things happened but I couldn't care enough for them because the movie was pretty much salad filled with things happening and I found myself asking myself about 5 times: ''W-what ?...'' In conclusion, this movie get a 4/10 rating. While I got all confused and wasn't entertained by this film, I still found myself being able to stay and try to watch until the end."
194,"Synecdoche, New York",10,12 June 2013,10 out of 10 is a rating that I seldom tag to a film. But this film has earned it.,"When I initially watched this movie, I glanced over important details and failed to direct my attention in its entirely to the film. At the time, the editing sequences felt pretty unnatural to a casual cinema viewer like myself, and consequently I couldn't perceive the film for what it was because of a profusion of scanty distractions. However, my second viewing could only be described as an epitome of mass distinction and magnificence. The only adjusting I had done during the viewing was fortifying my intention to focus on what was really going on in the movie. Ultimately, the focus was notably rewarded. I gained a lot of great impressions with this movie. This film is essentially an abbreviated capture of life. Don't be deferred by this movie even if it doesn't settle with your regular tastes. Instead, absorb it as you would anything else. Be awake, observant and you will be more than satisfied."
195,"Synecdoche, New York",9,6 January 2012,"Synecdoche, New York (2008)","Kaufman has always split me down the middle. He's a wonderful writer at times, but sometimes his vision hasn't had the best representation (I found Eternal Sunshine of the Spotless Mind incredibly overrated). Due to the very mixed reviews, I was able to approach this film with no idea of what to expect. At times confusing, at times obvious, but always interesting Synecdoche, New York, is one of the most honest depictions of life put to film. Kaufman handles the complex narrative structure very well. There are some fantastic scenes, where we see a play within a play, and that play reflects more of real life than life itself. Hoffman learns to look at himself but also those around him. Hoffman tries to recreate his own life, but it becomes a never ending process. Perhaps one of the (minor) failures of the film itself. I found this to be touching and truthful, but it certainly isn't going to find universal acclaim."
196,"Synecdoche, New York",10,19 September 2010,Kaufman speaks honestly,"Some people who dislike Synecdoche, New York, consider that this film is self-indulgent and pretentious. Some also describe it as nothing but an artistic masturbation. I reckon that the seemingly uncontrollable surge of symbolism, the inexplicable connection between a symbol and another, and the hazy theme of the film have a major part in generating the negative reception. Nevertheless, the aversive outlook is a misjudgment of the film and could mislead potential viewers. In my opinion, Synecdoche, New York is far from so-called artistic masturbation. In fact, this film is truthful in its narration and delivering of its ideas. It is not trying to be complicated and artsy in order to be complicated and artsy. It is neither a shenanigan from a naughty artist who already has a big name with the object of pleasing himself.Those who have seen and enjoyed Kaufman's previous works can understand that he likes to scrutinize his own mind (and ours in process). We can see how he longs for the understanding of his mind, which he seems to believe holding the key to understanding the world or maybe to coming closer to the truth. This explains the themes he often uses in his works; the concept of soul in Being John Malkovich, the adaptation of the mind to the well-constructed representation of reality in Adaptation, and the meaning of identity and being in Eternal Sunshine of the Spotless Mind.Unlike in his prior work, Adaptation, Kaufman doesn't try to ""play"" in Synecdoche, New York. I don't refer to his using of his alter egos in Adaptation, but to the way he plays with his ideas (Btw, I love that well-executed playfulness of his in Adaptation). In Synecdoche, New York, he doesn't leave the second half of his script to Donald Kaufman (although that's how he stays faithful to the main theme of Adaptation). He also doesn't bail on ideas he has put forward in order to wrap the ideas with the main idea he intended to make. This time, Kaufman is very patient in exploring and dwelling in his labyrinthine mind without taking a glance at the seduction of his playfulness (maybe a little bit). It is a long and painful road he's taking. However, this road doesn't lead to any certain conclusion. Yet, it is neither a journey into the abyss of nothingness.Synecdoche, New York is purely philosophical but without neglecting the aesthetic value and entertaining elements for audience to enjoy. It seeks to find the ultimate reality by using established philosophical notions (especially post-modernists' ideas about ultimate reality and meaning). Nevertheless, it doesn't merely borrow the notions. It puts them into a test and shows us how they work. It focuses on a process of how the ideas of schools of philosophy emerge. We can see how Caden (powerfully played by Hoffman) tries to recreate reality in order to see and understand the meaning of his life, but more importantly the nature of meaning itself that raises questions such as: can we really hold it with our minds? Is it something that exists only in the horizon of endless ocean? Or does it really exist? Which one is real, meaning or the signifier? Which one is the first, meaning or the thing that represents it? And how can a signifier of certain meaning produce several meanings that generate new meanings in order to repeat the same process? In the end, after bopping around from one metaphysical idea to another (from the belief that a sign constitutes a meaningmetaphysical presenceto the impossible existence of meaning, from the idea about the world that represents nothing but the representation of signs with many layers of signs to the idea about interpolating signifiers into other signifiers that causes the lost of meaning ), this film, in the same perspective with Derrida, asserts that ultimate reality and meaning may exist but to find them is an eternal search.I know that it is reductive to sum up a movie that is emotionally powerful and schools of philosophy that have rich histories and ideas just in a few sentences. And i'm aware that my perspective and short analysis on this film may not be true but it's just one of possible ways to see it. Moreover, these metaphysical and philosophical understandings are useless if one cannot enjoy the film and feel captured by it.However, if you are not familiar with postmodern philosophy you are still able to identify with characters' confusion, agony, and anguish. Synecdoche, New York is so powerful in transferring its dark, gloomy, and mysterious emotions that will leave you with almost unbearable feelings. You will feel exhausted but grateful for it. This film will stay in your head for days. You will feel that this film talks to you in a strange language that you can't fully comprehend. Yet, you are sure that you completely understand it although it is hard for you to articulate your understanding.10/10"
197,"Synecdoche, New York",7,12 July 2010,Art imitating life imitating art.,"A theater director (played by Philip Seymour Hoffman) recreates his world in a life-size replica for his upcoming play.A dark, complex and all-consuming study of the artistic stage world and how art and personal problems consume, intersect, and collide.If you get past the lulls, there's some great acting to behold with poignant messages about life.An original, dramatic roller-coaster that takes you on a journey that is signature Kaufman, meaning it's best to be open-minded before viewing.7/10"
198,"Synecdoche, New York",9,7 June 2010,Beautiful. Art in its purest form.,"Words cannot describe the depths that this movie has reached, not only within the layers of meaning, but within the human soul. This brilliant piece of film MUST receive more than one viewing to fully understand.Taking place in Schenectady, New York, it encircles the latter half of Caden Cotard's life as he attempts to make a theater piece unmatched by any other. He incorporates elements of his own life into the piece, and begins to blur the line between what is real and what is part of his masterpiece.The movie is absolutely surreal. A LOT is for artistic effect, such as an impossibly large warehouse, a burning building that someone lives in, or others. But they all make sense and contribute to the intricate plot in some way.The first time you watch this movie, you will most likely understand very little. However, either watch the film again or spend some time on this board, and it will all come together to form a completely unforgettable cinematic masterpiece."
199,"Synecdoche, New York",10,6 May 2010,Could be the best film I've ever seen,"This was an absolute masterpiece. Charlie Kaufman is what you'd get if you threw Woody Allen, Spike Jonze, and Sam Mendes in a blender. Synecdoche New York is a beautiful, enthralling, grand film that was one of the most phenomenal that I've ever seen.I'm not going to tell you the plot because it is quite simply too much to put into a IMDb review. Very original, and I found myself drawn to all of the characters. That doesn't happen very often these days. Too often we get a 3-D mess, completely without character development or story. So it was good to see a film with a lot of green screen that had good characters and a good story.The acting is great. Hoffman turns in his usual Oscar worthy performance here. We also have Catherine Keener, Samantha Morton, and Michelle Williams as the female leads, all of which outstanding. Besides Hoffman, the two performances I found Oscar worthy were Tom Noonan's and Dianne Wiest's. Noonan is really underrated, he's a great actor and he's one of the best parts of the movie here. I would've loved a 'Best Supporting Actor' nod from the Academy for his role.Words can barely describe how good this film is. It may require multiple viewings, as was the case of some friends of mine. But don't believe the bad reviews here, Synecdoche New York is a great film."
200,"Synecdoche, New York",10,2 January 2010,One of if not THE best cinematic masterpieces ever.,"Having not really understood much of the ""arty"" side of films for a long time i have recently gotten into this genre more and more and must admit i like it a lot, (the title alone is enough to spark interest in even the ""slowest"" of film minds, being a mainstream film buff mostly i class myself as one of the ""slower"" film minds)....Philip Seymour Hoffman plays his role with perfection and delivers a masterpiece of breathtaking performance...backed up with powerful performances by the rest of the cast.Some parts of the film are still a mystery to me i.e the burning house Hazel lives in?....but i'm sure if you look hard enough there is some reference to it. And the relationship between the Ellen character and Caden himself are baffling if not confusing to anyone....but again the links are there if you look hard enough...this is another one of those films you just have to watch several times before all the links fall into place and the movie makes sense. Recently i've watched a couple of movies in the same vein i.e Art-house films and would rate them more than any mainstream big budget movie.All in all a must see for anyone with the foresight to enjoy movies for exactly what they are and not for the flashy special effects or massive leading cast that most movie goers enjoy. Hooray for Charlie Kaufman and the cast for delivering such a wonderful piece."
201,"Synecdoche, New York",7,28 October 2009,Heeeeeers Charlie!,"Charlie Kaufman is a great writer of enjoyable multi-layered movies that try to break with convention and keep the audience on its toes. I found Synecdoche a bit predictable, however, and not up to the level of his best work as a screenwriter.The Woody Allen-like angst ridden hypochondriac male protagonist is becoming a bit of a Kaufman cliché, as is the estrangement of male-female relationships and the difficulty of male-female communication. See Being John Malkovich, Adaptation and Eternal Sunshine of the Spotless Mind for more of the same.So, much like Woody Allen, the content of the film is no surprise. It was exactly like I expected. Surely for CK this is a bad thing? He used to be Mr. Originality...I must say that I do agree with other reviewers that the first hour is brilliant and for a while I thought I was going to adore this film. The problem is that the film takes place over decades, and in order to get in as much time change as possible, the messing about with time that occurs at the beginning of the film accelerates to an almost unmanageable degree by the second half of the film, making it disconnected, formulaic and boring. The film is so (intentionally) self-referential that it becomes self-indulgent, mirroring the play Phillip Seymour Hoffman's character Caden is directing to such an extent that it becomes just as pointless, with the ending really too predictable. It is telling that the really ambitious part of the film, then, doesn't really work. Its also really depressing. Depressing and boring is never a good combination, the good will built over the first hour almost gone by the time the credits come to our rescue.The acting, however, is uniformly superb, especially the always great PSF and one of our true British stars, Samantha Morton. Even the girl from Dawson's Creek is pretty good. But I think Charlie needs firstly to get a collaborator to work with who can harness his frankly absurdly prodigious talents as a writer, and secondly stop making films that appear to be about caricatures of himself - maybe I'm wrong but it seems that way, and we've seen it all before. The seven I gave it is as much for trying as anything, but the film falls some way short of its lofty ambitions."
