,title,stars,date,r_title,text
93,The Disaster Artist,7,9 December 2017,Good Comedy,"As a stand up comic myself, I was very pleased to see so many stand up comics in this film. They acted well. I've always wondered why so many stand ups of yesteryear (i.e.: George Carlin, Dennis Miller, Bob Saget, etc.) who were themselves onstage couldn't quite transfer that ability to screen acting well. I think that it's a rather easy transition after you've had your soul drained out of you onstage.Anyway, it was a pleasant element, as were the jokes in the script. James Franco is to be commended for acting poorly so well. Even his physical acting when his Tommy character was ""acting"" in his movie was absolutely horrible. Nailed it. It's probably difficult for an experienced, talented actor to discard everything that he knows about his craft for weeks at a time.If you're familiar with film making, you're going to laugh when you realize that Seth Rogen's SCRIPT SUPERVISOR character seems to be taking over the role of director as Tommy's incompetence is exposed.It also had surprisingly touching and sympathetic moments between Tommy and his closest friend near the end.There were a few lulls in which I wasn't laughing and getting somewhat bored, but overall I was impressed."
94,The Disaster Artist,10,6 December 2017,"My favourite movie of the year, so far!","Oh hi, IMDb user... how's your sex life? Sorry, I just couldn't resist. 'The Room' (2003), is, without a doubt, one of the worst films ever made. Tommy Wiseau (who wrote, directed, produced and starred in it), had a vision that nobody else could understand. A vision so unique, that it just did not make sense. We see aspiring young actor Greg Sestero (Dave Franco) struggling in acting class, feeling ridiculous and having no confidence to act in front of people, afraid that they will humiliate him. It is there that he meets a strange looking man with long black hair, odd fashion sense and an accent so bizarre, it sounds like a cross between American, French, and maybe Russian(?). That man is Tommy Wiseau (James Franco), who feels no shame in performing however he can in front of an audience, despite his over-acting and messing up the lines. These two seem to form an unlikely friendship. Greg admires Tommy's confidence and willing to go the extra mile to be a movie star. Tommy decides to take the time to teach Greg how to ""express himself"". They decide to head to Los Angeles to fully achieve their goals to become actors, but everywhere they go, they get rejections from all over. Greg meets a girl, and Tommy feels strongly about this, as he fears he could lose his only friend. After a plethora of rejections, Tommy and Greg come up with an idea that they should just make their own movie to prove what they have got. So Tommy gets writing, and comes up with... ""The Room"".This movie directed by James Franco - based on Greg Sestero's ""The Disaster Artist: My Life Inside The Room"" - is mostly about friendship. I found myself caring for the close bond that Tommy and Greg have. It's heartwarming to see Tommy - who probably struggled to make friends throughout his life - find someone as caring as Greg, who looks out for this strange human being. James Franco does a great job making Tommy Wiseau seem sympathetic and down-to-earth. I actually found myself feeling sorry for him at one point... never thought I could, but wow!Dave Franco does a terrific job at playing the troubled actor, Greg. The guy that always has to help Tommy stand on his own two feet and support him, no matter what everyone else says. If you're an aspiring filmmaker, this is definitely the film for you. It reminds me a lot of Tim Burton's 'Ed Wood' (1994) and/or Disney's 'Saving Mr. Banks' (2013), about the somewhat troubled production behind some films. Tommy Wiseau is kind of an odd inspiration, but one thing you got to give to him... he was never afraid to give up. He did what he could, and in a way, he did achieve it. 'The Room' will always be an inspiration for bad movies, and after seeing James Franco's biopic, Wiseau should definitely look back and be proud of what he's done. Now, let's go eat, huh..."
95,The Disaster Artist,8,5 December 2017,"Great fun, but so much potential to have been a Kaufman-esque masterpiece","I love The Room (despite the weird nebula of disturbance it leaves in my mind afterwards) and Greg's book The Disaster Artist (many moments of which had me burst out in laughter). Having anticipated the movie so much, I couldn't help but smile all the way through - the performances are brilliant, and the little nods and references to various aspects of the film and book are great. Tommy is as amusingly accurate as can be (its never going to be 100% successful, Tommy is completely unique). Its so much better to watch with others who are aware of The Room - you can feel the difference in reactions from people in the theater as to who 'gets it' and who doesn't. I wanted Franco to push more of the randomly odd moments of the book but I can see that its a tough balancing act in terms of portraying his character. Franco does well to instead underscore the film with this sense of inner turmoil. In less sensitive hands Wiseau could easily become a cartoon target of mockery, but Franco gently invites you to consider his humanity, dreams and insecurities. This gives the film a much stronger backbone, especially when dovetailed with his relationship to Greg. But I couldn't help but find myself in that weird, murky and unsettling place again when exposed to 'Planet Tommy'. So there's as much tension as comedy - seeing the horrible conflict of encouragement/support vs honesty, opportunities vs loyalty, altruism vs expected reciprocation, tradition vs originality, believing in yourself vs listening to criticism (or, your own perception vs everyone else's). It was a VERY ambitious and tough film to pull off considering the overall complexity, but overall they did a great job. I would have LOVED the film to have gone even more meta to see more of the actors and filming of this film, intercut. E.g. the Francos talking about their discovery of The Room, seeing more outtakes of the actors laughing their heads of when trying to recreate scenes etc. If there had been scenes of James Franco writing bits of dialogue for the film, some rehearsals etc, trying to become Tommy, it could have become an insane masterpiece (sort of like Synecdoche New York crossed with Adaptation)."
96,The Disaster Artist,9,3 December 2017,It's ironic how this movie is so good as it celebrates a movie so bad.,"Just like what Tim Burton did for Ed Wood when he made a movie about the filmmaker's attempt to make what will become known as (until the Room) the worse picture ever conceived, Plan 9 From Outer Space, James Franco takes his love of what The Room is and became interested enough about the man (or rather men) behind it to want to make a movie about it.I've seen the Room, let me tell you, it does not seem that interesting. With acting so bad it makes the movie dry and bland to the point where you can't help but to laugh at how bizarre the whole thing is. When I saw it I did ask the question: ""How the hell did this get made""?James Franco gives us the answer (or as much of it as he can), as he directs himself as Tommy Wiseau and his bother Dave plays Greg Sestero in a inspiring story of a man with a lot of money who befriends a kindred spirit in a young actor, and they decide to lean on each other in order to follow the Hollywood dream, but when the dream becomes a nightmare they decide to go at it themselves by making a movie... that's a nightmare on it's on.If The Room did not have a big enough cult stasis I can already see it increasing thanks to The Disaster Artist. How ever famous it was before Franco's well crafted journey into a the mind of a man who stands on the edge of genus and instability, is about to make it Infamous. It was indeed a great role for Franco as both director and actor. With the support of all his friends through small parts and cameos like Zac Efron, Hannibal Buress, Josh Hutcherson and of course, his hetero life mate, Seth Rogen.  I hear Oscar buzz in his future, which I get, his transformation into Wiseau is amazing, and if the academy can love a picture like LA LA Land than they should love The Disaster Artist, cause it's just such a pure story about two people who love the biz.http://cinemagardens.com/"
97,The Disaster Artist,8,3 December 2017,The Disaster Artist (2017),"The Disaster Artist I saw The Room a few years back and love it, to the point of obsession. No doubt, its absolutely terrible with a ton of flaws in production, acting, and script. Yet there is something endearing about it, that makes it ridiculously entertaining. I own the damn Bluray because I love it so much. Definitely my favorite ""so bad its good film."" When I heard about The Disaster Artist I was so infatuated with an adaptation of Greg Sestero's book. I loved all the trailers and was anticipating this for a while. Safe to say, The Disaster Artist is actually really good. Very entertaining, funny, and well acted.The film is an autobiographical take, focusing on the beginning of the friendship of Greg and Tommy Wiseau. Wiseau is definitely a mysterious figure and the two soon become friends because of their love for acting. Down out of luck in Hollywood, Wiseau decides to make his own film (with a mysterious fund for the film) and while the film production wasn't without turmoil, the end product turns out to be one of the worst films of all time. And yet, the film becomes a cult hit and a success despite being terrible.I think Franco's filmography is streaky to not very good (although admittedly I've only seen stuff here and there) but this most be his best work. Franco captures most of the embodiment of Tommy Wiseau and is so magnetic with his awkward mannerisms, ideas that don't make any sense, and his foreign accent. The film is very funny, you will get the humor and enjoy yourself even if you haven't seen The Room. However if you've seen it you will really appreciate what goes on in this film.The film has a few cameo appearances which are cool, stay tuned even after the credits. The film also boasts an incredibly catchy late 90' early 2000's soundtrack and the attention to detail of the recreation of scenes and sets of The Room is almost perfect. This film actually made me want to re-watch The Room and re-experience the wonders of unintended genius of Tommy Wiseau. Franco has done a wonderful job with this film, and even though its about the worst movie ever, the film about the making of it is rather fantastic.8/10"
98,The Disaster Artist,6,2 December 2017,The Room Goes Outside,"I give this movie a 6.7, for me personally there wasn't enough story or behind the scenes moments that made me feel like it was something special, although the acting does work and Franco does a great job as Tommy I was left feeling like I was watching a parody movie. Being that; my biggest problem was not James Franco's performance of Tommy but that Tommy wasn't playing Tommy, to me no one can play Tommy but Tommy. All those scenes that showed Tommy's life; I just kept thinking to myself wow I would just most rather see Tommy do it to see him live it! Otherwise there wasn't any real big surprises in the movie, and in the end I would have preferred to have read the book instead. When the primary movie is over they do a side by side of scenes from the Room and scenes they shot with actors portraying the scenes from the Room that were done to be exactly the same; and to me that's how the movie felt, I know its a biography style movie but when you are already familiar with the 'real' actors you get a kind of knock-off feel throughout. In the end this is probably one of those instances where people who have read the book (me not being one of them, but I am currently more interested in doing so) would probably say the book is better. There wasn't any serious arches in the movie but it was still enjoyable to see, but probably not as much fun as seeing the Room in theaters with a large crowd, it was basically an ad for the Room where I would have preferred seeing the Room in a sold out theater instead. The movie moves along though not to be entirely negative it keeps a calm straight line with the audience but for me it was definitely a watch it once and probably not again, I don't think it has much ""re-watchability"" and I ultimately was hoping for more back story or candid moments to come to light. 6.7."
99,The Disaster Artist,7,10 December 2017,Wiseau Serious,"If you are aware of the broader catalogue of James Franco's filmmaking decisions, you should appreciate him as the lead of ""The Disaster Artist."" As a director, Franco has made bold and ambitious decisions that would (or should) be considered senseless by even the best of filmmakers. Great stories like ""As I lay Dying"" by Faulkner, and ""Child of God"" by Cormac McCarthy make for absorbing and introspective reading, but are almost untranslatable to screen. Franco throws himself heedlessly and enthusiastically into these projects with every intention of honoring his adored authors. The results have stacked up to a litany of adaptations that are generously called pretentious, and more often considered self- serving passion projects by an ill- equipped visionary. One could see why Franco found a kindred spirit in the tragically inept creator of ""The Room"", Tommy Wiseau.""The Room"" is an un-spoilable movie. There isn't a coherent plot to ruin. It is infamous for all the reasons a filmmaker would hope their film wouldn't gain notoriety. Incomprehensible melodrama, atrocious acting, baffling editing, and otherworldly dialogue are all slapped together in a film that should be unwatchable. The reason it has gained a loyal cult following and become endearing is an unmistakable sincerity. Each frame shows a filmmaker hopelessly baring his soul while making every mistake in the book. Had this been a contemptuously produced project by a creator who truly didn't care, we might feel affronted for the gall. With Tommy, the audience may laugh at him for the duration, but they also ardently thank him for the experience. We can hardly conceive of a picture made with so little self-awareness and so much innocence. ""The Disaster Artist"", based on the book of the same name, is the first-hand account of ""The Room's"" creation by its 2nd lead, Greg Sestero.Greg (Dave Franco) is a 19-year-old dreamer from San Francisco in 1998. He struggles to utter syllables in his local acting classes and hopes to be part of the movies in some capacity, appropriately naïve for his age. It is there he meets the enigmatic and marvelously eccentric Tommy (James Franco). Greg overthinks every line in his rehearsals while Tommy fearlessly gives zero thought into every line he bellows. The sheer confidence of Tommy is attractive. Based on the reaction Tommy gives to Greg's attention, you'd think it was the first person that ever showed him interest. Tommy orders everything on the menu when they go out, and drives a $50,000 car with literally no backstory. When they toy with the idea of venturing to Hollywood to follow their dreams, Tommy reveals he already has a place, unused for months, in the heart of L.A. for no logical reason. Money is never an issue. It's as if Greg conceived an imaginary friend that came to life before he was finished thinking through the details. Once in Hollywood, the duo quickly find that wanting the dream isn't enough to gain traction in the cynical city. Months pass without the promise of work and still nothing comes to light to explain who or what the hell Tommy is. He maintains lies about his age and citizenship, making for hilarious moments where he thinks he's got everyone fooled. The depths of Tommy's pockets grow in scope when he decides to write, produce, and direct his own film having exhausted all other prospects. Acting in the lead role, of course.The production of ""The Room"" is the most entertaining act of the movie, but it's not its heart. We find that Tommy deals with challenges with less maturity than his teenage (now 23-year-old) co- star. The lovable qualities of Wiseau start to teeter when his childlike jealousy and frustrations mold him into a much less sympathetic character. I suppose it's all necessary so that we can feel justified in our glee of laughing ""at"" Tommy and not feeling too guilty about it. Supporting actors on the project like Seth Rogan, Aria Gaynor, Josh Hutcherson and Alison Brie get to make all the side comments during production that we all said to each other in the theater when first seeing the finished project.It may not be a high compliment to say that Franco is more suited to adapting a book based on ""The Citizen Kane of Bad Movies"" than Steinbeck, but he deserves something for the well-executed effort. Franco goes full method in his approach to portraying Wiseau, all while directing himself, directing himself, and treating the character with dignity. For those who can't appreciate the low- stakes juggling act, ""Leave your stupid comments in your pocket!"""
100,The Disaster Artist,,5 December 2017,"First see the Room, then Franco's brilliant docudrama about its making.","""The Citizen Kane of bad movies"" In front of the camera and behind it as director of The Disaster Artist, James Franco deserves the artistic praise his subject, Tommy Wiseau, would never receive. Wiseau produced, directed, wrote and starred in The Room, arguably the worst movie ever made.Because it's natural to be curious about the dedication and lack of talent it would take to make such a cult classic (packed at midnight in many art houses around the country), Franco has given his measure of dedication and talent to produce a first-rate biopic that sugarcoats not at all the zany set and principals producing such a risible work.Although Franco's imitation of Wiseau is sometimes too slavish, generally he catches his charmingly witless energy in the search of becoming a filmmaker. With the help of his best friend, Greg Sestero (Dave Franco), Franco and his brother make the making of The Room believable and affecting.Because, you see, although Tommy has no talent for artistic expression, he has a drive to be successful that transcends his limitations. Indeed, pursuing a dream, even while lacking the resources, is an end great in itself. Tommy is helped, coincidentally, by a mysterious fortune no one can ever trace. Yet, he uses it to fulfill his dream of being a filmmaker who creates a classic, albeit one that may be the worst ever made.He can be legitimately called the modern Ed Wood, a producer of schlock like Plan 9 from Outer Space, the reigning clunker until The Room arrived.""Why is he having sex with her bellybutton? He knows where her vagina is, right?"" Sandy Schklair (Seth Rogen)"
101,The Disaster Artist,1,11 January 2018,Horrible movie,"Probably the worst movie I have ever seen. You've been warned. James Franco is utterly annoying and unbearable in this movie. I don't get the joke. The film is proof that if you get a bunch of respected critics to like something, everyone else is guaranteed to agree like a lemming."
102,The Disaster Artist,8,28 December 2017,Stunning performance by Franco,I wasn't familiar with the story of The Room until reading about The Disaster Artist but still thoroughly enjoyed it. James Franco's performance as the bizarre enigmatic Tommy Wiseau is stunning. Highly recommend.
103,The Disaster Artist,7,21 December 2017,A Good Film About Making A Bad Film,"The Disaster Artist tells the true story of eccentric, wannabe filmmaker Tommy Wiseau's (James Franco) attempt to make his own professional movie, and of his relationship with young, wannabe actor Greg Sestero (Dave Franco). It's not at all a spoiler to say Wiseau was successful in that he did get his film, The Room, made and that it did experience a theatrical release (in one theater). The Room, (released in 2003), has achieved cult status since its release; now considered by many to be ""the best worst movie ever made"".The first question that should arise is, ""Can you really enjoy The Disaster Artist without first seeing The Room?"" The short answer is ""No"". The Room is a bad movie for sure. I personally didn't enjoy it as much as its many fans do because it's not quite bad enough to be hilarious, at least not for me. For me, it's just bad. (Though I did chuckle at it at some points throughout.) However, seeing it before watching TDA will help you appreciate a lot of what's going on behind the scenes in this film. That being said, if you absolutely can't suffer through The Room, then you can still find enjoyment in TDA, because, unlike the film it's based on, it is very good.TDA is the best film James Franco has been attached to in recent memory. He transforms himself into Tommy Wiseau. It's an excellent performance and one that deserves the praise it's getting because he disappears into it so well. Also, Wiseau is so odd that any imitation of him may have easily come across as parody. That seems to be the last thing on Franco's mind. Wiseau's lack of tact and inability to empathize with others could easily make him seem like an arrogant jerk. But he's portrayed here more as someone who's odd behavior is simply misunderstood; his abrasiveness stemming more from passion than from ego. It's a bit of a tight-rope walk for Franco. While we shouldn't necessarily like Wiseau, we at least need to be able to appreciate his motivations, and connect with a man pursuing his dreams-Franco does this very well. He does not do it alone though. In order to avoid just scoffing at Wiseau, we need a more grounded character to bridge a connection. James' brother, Dave Franco, plays Greg, an aspiring actor who is at first intrigued and fascinated by Wiseau, even accepting an invitation to move to LA with him so they can both pursue their dreams of becoming famous Hollywood stars. After last year's underrated Nerve, and this year's turn in TDA, Dave Franco is showing some solid potential beyond the immature young guy roles we're used to seeing him in. His performance obviously isn't as showy as his brother's, but that's exactly why it works. Someone needs to offset the wackiness and bring a balance to the film. While James is getting a lot of awards attention for his performance, I feel Dave should be in the best supporting actor conversations. It may be that he's simply in the film too much to be considered a ""supporting"" role. Either way, if he keeps digging into more roles like this, he could easily make a real impression on audiences beyond being ""James Franco's brother"".The rest of the cast is a real who's who of cameos and supporting turns. The film opens with several real-life actors and filmmakers sharing their opinions on The Room. Then as the film goes on, every time you turn around a popular actor shows up in just about every role. It's like everyone wanted to be a part of this film. Just to name a few: Seth Rogen, Paul Scheer, Ari Graynor, Alison Brie, Jacki Weaver, Josh Hutcherson, Zac Efron, Megan Mullally, Hannibal Buress, Jason Mantzoukas, Lauren Ash, Charlyne Yi. Even Melanie Griffith and Sharon Stone show up for small but effective parts.As for the film itself, if you're a fan of movies about making movies, like I am, you'll love TDA. Pulling double duty as both the star and director (it only makes sense considering who and what the film is about), James Franco creates a wide canvas for his characters to play on, beyond just watching a bunch of people making a movie. I'd argue that the first act could have been a little bit tighter, but the film never gets to where it's dragging or stalling. All the actors are given a chance to shine. The script is solid. On the technical side, from cinematography to music, nothing will over-impress, but its all serviceable and suits the material well. There is some appreciation for the technical crafts after the film ends when side-by-side footage is shown of The Room and precisely re-created scenes for TDA.The Disaster Artist probably won't crack my top ten list for this year, but I certainly enjoyed it and intend to see it again at some point, perhaps as a double feature with The Room. Other than being fully prepped for awards season, I can't say its a film that must be seen in theaters. It's small scale seems well-suited for home viewing. If you're a fan of The Room, or just want a glimpse into the world of making indie movies, or even if you're just a fan of the actors involved, The Disaster Artist should earn a spot on your watchlist. 7.5/10"
104,The Disaster Artist,6,17 December 2017,Hollow,"There was an odd buzz surrounding this film, that in my opinion was totally unmerited. It just scratches the surface of the story and embellishes some things. I'm someone who is not a fan of The Room because, well it's really bad. That being said I really wanted to see what Franco had to offer here as far as unpacking what the hell caused the debacle of a film. Really Disaster Artist was an empty look and borders on biography and parody. I found the end to be very very overdone and from what I know, entirely fabricated."
