,title,stars,date,r_title,text
56,The Holy Mountain,8,21 August 2014,That Rainbow Hallway Is Unforgettable Imagery.,"When I first saw ""The Holy Mountain"", I said to myself I'm definitely going to see it again before I write a review on it. It is an Art film in every sense of the word, and never have I seen a movie of such provocative imagery that was hard to get through on the first viewing. And I've watched Pier Paolo Pasolini's ""Salo, or the 120 days of Sodom"" (1975). Watching it for the second time, I could finally give it a rating and absorb every prophetic sentence and scene only Alejandro Jodorowsky could execute so well. It's goal is ambitious and admirable and I loved how Jodorowsky managed to provide an ending statement so impressive, it was like Charlie Chaplin's speech in ""The Great Dictator"" (1940).A thief who has a bizarre resemblance to Jesus Christ, lies on the ground. After being strung up on a cross by children he befriends a footless, handless dwarf and both go into a city to make money from tourists. Some locals use the thief's likeness for the crucifixes they sell, by casting an impression of his face and body. The thief soon eats the face of his wax statue and sends it upwards with balloons, symbolising eating the body of Christ and offering ""himself"" up to Heaven. Shortly he notices a crowd gathering around a large tower, where a large hook and bag of gold has been sent down in exchange for food. Wanting to find the source of the gold he ascends the tower and breaks in, finding both the alchemist (Jodorowsky) and his female assistant.After a brief fight with the alchemist, the thief defecates into a container. The excrement is transformed into gold by the alchemist who says: ""You are excrement. You can change yourself into gold"". The thief immediately rejects the gold after being shown himself in a mirror, and the alchemist decides to take the thief on as an apprentice. We are then introduced to seven people who will accompany him on his journey, they are regarded as the most powerful humans on earth but like himself, mortal. These seven consist of a cosmetics manufacturer (Venus), a weapons manufacturer (Mars), an art dealer (Jupiter), a war toy maker (Saturn), a political financial adviser (Uranus), a police chief (Neptune) and an architect (Pluto). All are gathered together and instructed to burn their money and wax images of themselves. Once finished, their plan is to ultimately ascend ""The Holy Mountain"", to gain the secret of immortality from the masters who live there.Though my favourite of all Jodorowsky's works is ""El Topo"" (1970), ""The Holy Mountain"" at the time definitely feels like his most personal project. The only flaws I can find with this movie is the length of inevitable exposition when it comes to describing the seven people. A few scenes that come off unintentionally (Or maybe they were?) hilarious, never destroying the overall message and given the directors filmography, part of it always feels that you are suppose to find it unsettling and funny either way.Final Verdict: Other than that, the film is part eye-candy, part surrealist delight. I don't think I'll ever forget half of what I saw, and it's message never comes off forced and is explained more thoroughly as the narrative proceeds. I cannot help but find a movie of this calibre only comes once every couple of decades. 8/10."
57,The Holy Mountain,7,25 February 2014,your face will contort in confusion,when i began watching it my first thought was. 'ok... something isn't right here. did the reviews [7.8] somehow get screwed up?' then after the initial... lets call it (confusion coupled with mild shock) there was nudity introduced and that kept me watching a little while longer. now keep in mind i don't even like nudity in most films unless its appropriate and given the circumstance it blended in seamlessly.the (confusion/mild shock) continued and even perhaps increased as the video continued. it was about half way completed and 2am. i paused it and went to bed.i woke up and fed the cat etc. etc... sat down and realized this video had been paused and continued watching it. about three quarters of the way through i think i may have understood something. thats right... i had been watching this throughout without a clue. finally satisfied i had figured something out i felt obligated to see it through to the end.i then read a few of the reviews from the highest rated then a few from the lowest. it cleared up some of the confusion. i may watch 'holy mountain' again. why i feel the need to understand or even quasi understand it... i don't know.
58,The Holy Mountain,10,12 January 2014,"Brilliant! ""Seek and ye shall...""","I experienced more raw, refined and direct emotions with my entire being watching ""The Holy Mountain"" than I did by watching many hundreds of other movies... my entire organism participated in this experience: my body, heart, mind, plus whatever other faculties may lie beyond their realms.It's a great movie for Seekers of all levels, all Paths, all orientations, faiths and disciplines.Something about ""The Holy Mountain"" reminded me of the movie titled ""Eraserhead"" (1977); perhaps the level of successfully utilized bizarre imagery. But ""The Holy Mountain"" does not exploit the bizarre for the benefit of the bizarre alone, nor does it feature the bizarre just for feeding and fueling the Spectacle. There's complex feelings and teachings within every visual detail of the compositions, and within every twist and turn of the plot.Something about ""The Holy Mountain"" reminded me of the movie titled ""Circle of Iron"" (1978); it also is a story of Seeking, of being on the Path for spiritual self-realization; transcendence... but ""The Holy Mountain"" definitely goes deeper, and addresses the Seeker~Viewer from multiple, well-informed points of departure all at once.I found the music wonderful. I found the voices of the characters... superb, matching a genuine presence they conveyed that most modern actors today have a hard time rendering. In this respect the movie matches many movies of the counter-culture and the underground created during the revolutionary of the sixties-seventies. Most of the people in ""The Holy Mountain"" are so real that it's hard to distinguish if they are just regular people pretending to be actors, or actors so deeply aware, so brimming with artful dexterity that they appear to be just regular people. Echoes here of ""Zabriskie Point"" (1970), in the sense of having actors who are totally real - so real, that the movie might as well be a staged documentary. ""Obscured by Clouds / The Valley"" (1972) also comes to mind easily because of this quality (and for the them, a journey of discovery and Seeking): and for those who were disappointed that ""The Valley"" did not show enough naked flesh, there's plenty of honest nudity it in ""The Holy Mountain"": probably more than most viewers can handle.The photography is very high quality, and so is the editing. To be honest, I wanted the movie to be longer. And as soon as it ended I wanted to watch it again!"
59,The Holy Mountain,10,22 March 2013,Fresh n Breezy,"The point of the film is that instead of seeking solace in a higher power, or coveting religious, sometimes mystical symbols, you should put your trust in your friends and enjoy your surroundings. Simple. The film is an overload of quasi religious imagery to highlight the absurd hierarchy that exists in most organised religion.Its a very beautiful film and is, in a way, a rejection of 'El Topo', which presented religious myth in a more outwardly serious way. I think Jordorowsky needed to shrug off the shackles of El Topo which was taken very seriously by many, and just put things in perspective.and i don't really want to write ten lines of text, IMDb."
60,The Holy Mountain,8,7 November 2012,Quite a revolting epic expedition,"This is the 2nd most bizarre film to me, after Un Chien Andalou. An alchemist leads 9 people, representing 9 planets in the universe, on a spiritual journey to the Holy Mountain to conquer immortality. Alejandro Jodorowsky drills his surrealistic skill to mock lost mankind and their sinister religion, politics, industrialization, modernization through mystical symbols and sexual imageries. Inner part of the tower, toads' play, giant sex toy, Christ idols factory, ultramodern weapons, in fact the whole setting----an outstanding vision from the director. Every shot depicts a satirical explosion to shiver our mind. Quite a revolting epic expedition that elegantly ridicules modern society in all possible sarcastic ways :p___8/10___NB: the movie might not suit to all for its high (unique!) amount of sexual content and almost incomprehensible style___:/"
61,The Holy Mountain,10,3 September 2012,A movie which deals with a lot of thing and never been detached.,"Well. what can I say about this movie? Good is not enough.Bizarre, weird, surreal, anti religious, anti capitalistic, anti communist, anti materialistic, surreal, sick, cute, sarcastic. Every single shot means a lot. This movie rules. This is so special. And most of all, it sings the song of humanity and hope and love. If you like to watch some bizarre images, okay go on, you will not be able to get the movie, but you will like that for sure. If you want to understand this movie, and give this movie a proper view you will be amused with so many surreal and symbolic shots. You will get so many messages. The good thing is, there is enough space for you to think these things in your own way. I can differ with you about some things, but there is no absolute theory. This is the beauty of viewing multiplicity of this movie. The movie Starts with a Christ like man with a creep stranger. The journey starts. And revolve around the world and universe in search of immorality. In this journey, they collect people from different planets. The world is like a glass, and through their eyes, everything is so naked. What a sarcastic view! At the end, did they were able to get what they wanted? Actually, the question is id they need hat they want? The holy mountain is a mind provoking movie. Strongly recommended for every mature people."
62,The Holy Mountain,9,27 June 2012,What did I just watch?,"My entire perception of reality and what the medium of cinema means has changed since watching Alejandro Jodorowsky's sacrilegious mind trip The Holy Mountain. It's a bizarre avant-garde film that uses strange and sacrilegious imagery to evoke reactions of fear, disgust, wonder, and mysticism in its viewers. The film begins with a Christ like figure wandering around a destitute city. He then finds his way to an alchemist who forms a band of men and women who will seek immortality and utmost holiness from the Gods who supposedly live atop the Holy Mountain. It's an intense audio visual experience that absolutely blew me a way.While watching The Holy Mountain I had no idea what was going on and trying to decipher all the images in the film is a near impossible challenge. But what I did know is that I was watching a masterpiece. I could feel it in the grandiose way the film was presented and the profound subject matter at hand. One set after another absolutely floored me in it's innovative design unlike anything I've ever seen before. Jodorowsky's use of color is profound and the simple yet ingenious things he does with the camera are beautifully spectacular.The Holy Mountain is a beautiful film and a disturbing film at the same time. It has a thick air of mysticism about it that strikes wonder and confusion into the viewer like a knife. If you sit back and allow The Holy Mountain to take you at its will it will invoke intense emotional reactions in you, but you won't even understand why. The very end of the film takes an incredibly bizarre and unforeseen turn that I never could have expected. It ends so abruptly and when the credits began to role I found myself getting a little misty, and I had no idea why. This is a profound film that does unexpected things to the viewer. Watch at your own risk because The Holy Mountain just might change your life"
63,The Holy Mountain,10,4 April 2012,"Look beyond Jowdorosky's craziness, and comprehend his intellect.","I had watched ""The Holy mountain"" a few years back and I've forgotten why and how I came across this film, for the ""why"" i meant, ""The Holy Mountain"" was made 20 years before I was born, and there, really wasn't any reason for me to watch it except for my boredom. But I am glad to have watched it, for it exposed me to the insight of art, ""The Holy Mountain"" became a definition of ""Art"" for me, and besides being ""the"" definition of ""art"" for me; ""The Holy Mountain"" had me questioning on the modern perception of ""sanity"", I used to have, and in fact many people still defines ""insanity"" if the action a person action or the thinking that person has, that does not relate to us or compromise with society, as an act of ""insanity""; To think of it , even in retrospect , people have been defining ""insanity"", aforementioned. The definition of ""sanity"" should refer to a rationality of an individual; After watching ""The Holy Mountain"", I find the conclusion to the story, rational; The journey until the conclusion, surreal. The film and its imagery still lingers on my mind on a regular basis. You will need some exposure to Christianity in order to understand the surface of the story, and anything beyond that, is up to your interpretation - my summary will consists of minor spoilers and some of my own interpretation; For the first 20mins , there is no dialogue, Jowdorosky bring us to a tour, a tour showcasing human's ""insanity"". During the tour, a scene with soldiers and man dancing in each other arm, struck me with a thought, is ""insanity"" conditional? Is it okay for people to be irrational for the sake of finding peace and sanity amidst chaos and insanity? After the tour , the main character(The Thief) a Christ-like figure, ventures into the surreal realm of the Alchemist. The Thief deemed the Alchemist as an adversary and attacks him, The Alchemist exhibits his powers and remove an alien substance that was seemingly the cause of The Thief's violent nature; The Alchemist then says to The Thief: ""Do you want gold?"" and The Thief replied ""Yes"", The Alchemist then made The Thief defecate into a container - Yes , you will watch him literally shitting, naked.The Alchemist then had The Thief go through a hellish process, sweat and tears are flowing out from The Thief, in order to transform the excrement into gold, an idiom for ""working"", maybe? and he said to the Thief: ""You are excrement. You can change yourself into gold."" . The quote made sense to me, humans sort of is, an excrement and we're working hard to turn into something worthy. The Thief is then introduced to 7 powerful humans who will accompany The Thief on his journey, and each of their introduction conveys an emphasised sin, personifying Christianity 7 deadly sins. The Thief, The Alchemist and the 7 sins then embarks on their journey to The Holy Mountain to obtain immortality,and will they attain immortality? Not spoiling it for you. I believe that Jowdorosky's conclusion to the film, is an important underlying message, but revealing that message will spoil the essence of the film, I'm not spoiling it, so watch it yourself!I recommend this film to people who likes surreal imagery, because every frame is wallpaper worthy; people who have an open sense of humor, because religion mockery is always funny; and lastly, people who are bored out of their mind."
64,The Holy Mountain,,12 January 2011,A Feast for the Eyes {Alexandro Jodorowsky},"I first saw this movie in Paris on release in 1973. I had experienced Jodorowsky's oeuvre already as I had seen El Topo a few times and adored that movie. This prepared me for The Holy Mountain as I had become oriented to the meandering tempo of his story-telling techniques. I saw him as a mystical relative of Carlos Casteneda with a distinct flavour of Bunuel's Simon of the Desert , Exterminating Angel, etc. I saw this movie again tonight {37 years on} and I was also aware of the influence of Pasolini and Fellini. Although movies are always considered to be collaborative affairs - in Jodorowsky's case so much of the production has his imprint - costume, choreography, camera, dialogue, acting that he is extreme from the point of view of the ""auteur theory"",The tableaux, the processions, the Day of the Dead played out in every conceivable way. The care which was given to the symbolization of the saturating imagery, - I can only say that its all very Mexican. What makes this film special is the mastery of fantasy, that the ARTIST/pataphysician Jodorowsky offers his audience , in phantasmagoric detail, that is presented always from the spiritual point of view. It is a conceit, and there is no plot - only an attempt at revealing ""another way of seeing"". If this is what you desire then this movie has a HUGE amount to offer This movie is for those that value an intelligent sacrament to the Power of Life . Seek it out . It will certainly challenge your imagination. As Jimi Hendrix expressed it ""Are you experienced?"" -- {Posted 19 January 2011} - The middle section of the movie {the zodiacal tour of the governing Planets and their all-pervading influence}. This section departs from Jodorowsky's usual presentation as it has narrative flow. One feels the influence of Bunuel's Discreet Charm of the Bourgeosie in a parodic exaggeration which could easily be termed the Indiscreet Charm of the Bourgeosie. This is the astrological Morality Procession from which the Magus sources 7 disciples {each corresponding to another Planet}. The two best known {to the modern mind, at least} Venus and Mars are both fleshed out and thought out in the most thorough manner. Venus, portrayed in a Kabbalistic palace, the rooms beautifully laid out, richly furnished, colored in strong primaries. Basically, the featured Don Juan character exploits the woman workers, who all crave sexual contact and have erotic yearnings towards him {in a surreal joke, if they are successful, they are promoted to secretaries}. There is also the falseness of cosmeticized appearance and the disguise of Death with the use of Dadaistic machinery - aka.The Cult of Beauty. Mars features an amazonian beauty who in contradistinction to Venus has crowds of male secretaries and is constantly manufacturing armaments and engineering conflicts {Dick Cheney-style} in order to make more money {the weapons are presented in a humorously surreal way}. Jupiter, the pre-eminent Planet is portrayed as a decadent, materialist, who runs an art factory and drives a stretch-limo, where he has sex constantly, while his workers make art with their bare buttocks, covered in paint, and then stamped onto paper, - Andy Warhol style.The interesting sex-aid type sculptures that are exhibited in Jupiter's gallery have a kinetic interactive appeal that showcases Jodorowskys plastic talents. Saturn, the dark influence, has the exploitation of children, at first shown innocently cavorting in circus setting, - this Planets influence is in the corruption of the child with toys of war and brainwashing techniques ""Know Thine Enemy"". Uranus, here in a welter of imagery, the capitalist vision is in the economy of numbers - if you kill enough people , there is less pressure on the economy and so more for the plutocrats to appropriate. It has an interesting scene with a jersey clad python. Neptune, features the Chief of Police, riots, demonstrations, mutilations, castrations, cruelty, barbarism in a fascistic orgy of totalitarian excess. Pluto, is illustrated as a modern building with spiral stairways and children in Mickey Mouse ears, - there is the proposal that the poor should not be offered homes with comforts but instead, shelters with no comforts and that no resources other than the most basic should be wasted on them. These then become the 7 reprobates that the Shaman leads to the Holy Mountain of redemption and/or salvation. This movie is a slow accretion of layer upon layer of thought provoking imagery. The audience is asked to contribute their intellect in a polemic of visionary ideals."
65,The Holy Mountain,,12 April 2000,Psychedelic with a twist,"Probably the strangest movie I've ever seen. The first 30 minutes are extraordinary in their images, use of symbols and archetypes. It's sometimes difficult to know what the hell is going on, and what the hell Jodorowsky is trying to tell us. But hang on! All will be explained near the end of the film. The final twist makes The Sixth Sense ea. seem like beyond predictable."
66,The Holy Mountain,,2 November 1998,Destruction of the mind and all that resembles it.,"Few films I've experienced manage to be as surrealistic and frightening as the first 30 minutes of _The Holy Mountain_.  We follow a Christ-like figure through parades of flayed and crucified lambs, frogs and lizards dressed as priests and conquistadors trampling a model Maya (?) city, a hall full of life-size plaster replicas of the main character (who remains nameless, I believe); eventually he is pulled from this chaos by a guru-figure, played by Jodorowsky himself.After much ado, a group of sorts is assembled for a quest; this is where the plot starts to bog down the beautifully surrealistic moments of the opening. There is a point to the plot and a few surprising twists, all informed by Jodorowsky's unusual viewpoints and eclectic bits of random religious, philosophical and occult traditions._The Holy Mountain_ pushes past the concept of avant-garde into the realms of the psychedelic, the transfigurative.  It's a movie so powerful, so strange that it STILL hasn't been released in the United States on video (look for import laserdiscs from Japan - it's worth it)."
67,The Holy Mountain,1,20 April 2011,The Holy Mountain (1973),"""If you watch this sh*t, we'll show you tities"", this movie seems to say.This is the kind of movie only a sex-crazed teenager would watch, if he had no internet connection. It goes something like this. Crap. Crap. Utter crap. Tities! Crap. Crap. Boring crap. Tities! Crap. Crap. Despicable crap. Tities!There is no plot, there is no story, there is only a relentless deluge of disgusting images, designed to provoke strong reactions (or at least that's what the director thought, I'm sure). I only watched for 5 minutes or so. Then I realized I've seen this kind of crap before and it wasn't worth it.Whatever you do, avoid this movie. At any cost. If a friend comes to you and says: ""Hey, I found this great movie, let's watch it""... drop everything you're doing and get out of the house. Get out. Leave!The Holy Mountain. If the producers refused to make this crap I would have given them a medal. But as it is... I give them a 0 (zero)."
