,title,stars,date,r_title,text
27,The Holy Mountain,7,18 April 2008,Hurz,"It must have been some kind of perverted fascination, that kept me watching this work. I won't say movie, because The Holy Mountain defies this definition. It is like Fantasia on a very bad trip, without the beautiful music but with tons of creative imagery.It goes from simply strange to disturbingly revolting back to bizarrely funny and hypnotizingly symbolic. And after that, it does all those things at once. You need a VERY open mind or you won't even begin to feel anything remotely positive towards Jodorowskis piece of art. And art it is.There once was this German comedian who performed in front of some art critics. He sang a very simplistic song about a wolf and a lamb. Than he screamed the word Hurz. And continued singing. That's not art in its common understanding. Hurz doesn't mean anything. It implies a deeper meaning where there is no meaning at all. It distracts from the real intention of the artist.What is the real intention? To fool the audience.This movie is 109 minutes of Hurz. You can over-interpret the symbolism and search for a meaning until your brain hurts. But you will never know the directors intention, because there is no way to tell what is earnest commentary on society, religion or similar important matter and what's just complete and utter nonsense.You think, you found the meaning? You were fooled! You think, there is no meaning? You were fooled!Hurz!"
28,The Holy Mountain,10,12 August 2006,Speechless,"People hear about this movie and its crazy plot and are usually disgusted. Don't let this get to you. Yes, it can be hard to watch at times but it's metaphorical language will begin to grow on you.If you have heard about the extremely sexual premise of many scenes and the esoteric set designs and acting, you heard correctly. There are points in this film that make you wonder how the director went about casting people into these rolls. ""The Holy Mountain"" will open up your mind to new ideas and philosophies. It may even make you more interested in subjects of taboo. Alejandro Jordowsky's other film, El Topo, is great, but not as edgy and wonderfully strange as ""The Holy Mountain"". Pick it up A.S.A.P."
29,The Holy Mountain,,30 May 2001,Holy Hill of Beans!,"This film really is - to use one of Jodorowsky's favourite metaphors - excrement, but I will at least give it some credit for some innovative art direction.  But come on! Everyone's calling it brilliant but no one can really say what it's about.  That's okay, a lot of art is a personal thing that reaches people in a myriad of ways.  But then they claim that it can only be appreciated by those who are well read on a variety of religions. Oh, it's elitist art!  A-ha!  If you don't ""get it"", you must be pretty illiterate, except gee, they can't figure it out either. Well, as a Jewish-born Buddhist who has done an extensive amount or reading and traveling in my lifetime, I got it.  ""Life is an illusion"". I'm so glad I'm well-read, I never would have figured that out!Like ""El Topo"", this film bombards us with shocking imagery, but that film didn't disguise itself as anything other than mere entertainment with some fashionable religious allegory thrown in.  That film said more about religion than this one because it was a nice balance of light and darkness. Here, it's all dark.  People are s**t (and people eat s**t - hey, this is a Jodorowsky film!). We see countless examples of man's inhumanity to man (notice it's not woman's inhumanity to woman or to man. It's amazing how it never even occurs to these directors to address that issue!).  Jodorowsky has nothing new to say and again, uses piecemeal of religious-babble (including the Tarot which like the I Ching, has pretty much gone out of fashion), to state the over obvious about losing oneself (one self) in order to find oneself.  It offends me as a Buddhist because the film exhorts Buddhist philosophies, but Buddhism is about balance and this film is waaaaaay off balance!  Really, every religion and mythology throughout history has created great stories of beauty, sacrifice, compassion and heroism among the endless stories of cruelty and human slaughter.  Well, you can see which parts have been Jodorowsky's favourites!  This is comic book religion pure and simple.  If David Croenberg was a hippie he would be making films like this.  There's no sense of tragedy for the endless human suffering we see. One can't just dull the audiences senses with grotesque images about the sickness and perversion that is (allegedly) humanity and then stick five minutes in at the end of the film where everyone laughs on a mountaintop.  It's actually quite frightening how people will call depravity without any kind of perspective art, simply because they don't want to feel that they are somehow shallow or stupid or weak or (eegad!) uncool.  It's quite silly really, when can see worse offences on the nightly news.There's a scene in this film early on when Christ (who is always walking around in a g-string, the usual example of Jodorowsky's fear of really exposing the phallus) awakens in a room of hundreds of statuettes in his likeness.  He screams in terror at what has been made of his teachings. I've no doubt that he'd have the same reaction if he saw this film."
30,The Holy Mountain,10,30 November 2016,The Holy Mountain: Review/Analysis,"The Holy Mountain is a 1973 Mexican-American surrealist fantasy film directed, produced, edited, and co-scored by Alejandro Jodorowsky. The film stars Jodorowsky himself as the Alchemist alongside a dearth of diverse and unique characters. The Alchemist enlightens a lost Christ-like figure known as the thief and leads him along with a group of planet leaders (who are all also thieves) to The Holy Mountain to find a group of immortal wise men. In this film analysis, I will explain how the film represents a reflection of our world and how we use religion, society, vanity, war, and material objects to keep us from achieving true enlightenment. After the opening of the film, we are introduced to the thief. The thief is a representation of the tarot card, the fool. When first created, tarot cards were used exclusively to play games. But after a while, tarot cards were used heavily in religion and spirituality. The Fool's tarot card number is zero. Upright, this means innocence. Upside down, it means foolishness. These two readings of the card embody the characteristics and ideals of the thief. The thief meets a dwarf with no hands or arms. The dwarf represents defeat, another tarot card. The thief embraces defeat, innocence, and foolishness until he is captured by the townsfolk. The town is never explicitly named but the town is a representation of the entire world. In the town, people profit off selling religious beliefs as well as the war economy seen through the death of hundreds of toads. Based on the human urge to consume and indulge, tourists throw money at the depictions of religion and war. The thief is taken by the townsfolk because of his uncanny resemblance to Christ. When he wakes up from his drunken state, he sees that his body has been molded hundreds of times over. He becomes very angry and destroys these molds realizing that he was played for a ""fool"" and was used for the profit of others. The thief's reaction can also be seen as a commentary on how Jesus himself might have reacted to such fandom when seen as the messiah. The thief keeps one of the molds to symbolize the burden of being looked at as the creator. The thief gets in a dispute with a priest because of his resemblance to Jesus and is thrown out of the church. The thief then eats the mold's face (eating the body of Christ) and sends it to heaven. The thief becomes the Alchemist's apprentice and is shown other leaders of different worlds who will be taking a journey of enlightenment and immortality with the thief and the Alchemist. Each world leader represents a thief of their own craft. The leader of Venus is the thief natural beauty. The leader of Mars is the thief of peace. The leader of Saturn is the thief of purity. The point is not what they represent, but that they all are thief's and in many ways authoritarians of their worlds. The thief of Earth or the fool represents the thief of forgiveness of sin and punishment or Jesus Christ himself. The opening of the film is a pretext for what steps the world leaders or thieves must take to go on the journey to The Holy Mountain. In the beginning of the film, two beautiful women are stripped of their beauty and self-worth. The leaders all must abandon what connects them to their worlds making them human. This is shown through the burning of their money and molded bodies.The thief and the world leaders (alongside the Alchemist) make their way to The Holy Mountain. On their way, many things happen. The thief is told that he must abandon his relationship with defeat by throwing him overboard. This is when we are shown that defeat isn't real and is merely a burden that the thief has held onto. The group discovers the city below the mountain and it's inhabitants. The group discovers these people think they know of The Holy Mountain and what it means. What the group discovers is that these people are delusional and are lost to their vanity. One man thinks it's about drugs. One man thinks it's about strength. And one man just likes hearing the sound of his own voice. The idea is that these things are what are holding them back from true self-enlightenment. This is why the Alchemist had the group detach themselves from what they were in order to take this journey. On their way up the mountain, each member of the group sees their deepest fears and desires. This shows that they too still are clinging on to their past humanity. Once the group finds the immortals, the Alchemist takes the thief aside to send him home. The thief is sent home because he as a Christ figure couldn't properly understand what comes next. What does come next is the realization that it was all a hoax. Or so it seems that way. The Alchemist explains that the journey was never about immortality. But rather, reality. Reality is the true enlightenment. Trying to understand religion or immortality is a useless task. Understanding what is, is what is most important. The Alchemist tells this to the audience because the film isn't about the enlightenment of the people in the film. It is about the people watching it.The Holy Mountain is Alejandro Jodorowsky's most acknowledged and acclaimed film for a reason. It has so much to say with such a simple message. The confusion of understanding the film is the confusion we all have understanding reality and ourselves. It may seem so simple. But without the proper knowledge, we become lost to the world. It was the film Jodorowsky was put on this Earth to make. It truly sets the standard for symbolism and surrealism in film and remains one of the most important films ever made."
31,The Holy Mountain,10,6 September 2016,One of the best movies ever created,"My personal favorite of the Alexandro Jodorowsky's films I've seen, and one of the current three films I have given a 10/10. The movie stars a cast of mostly silent characters who search for something beyond mortality and the ignorance of mankind, only to discover something even greater. This movie has some of the best surrealism I have ever seen in a movie if not the best. However it should be said that surrealism doesn't work just by its own. If it's just random iconography disbanded from a context, It looses all importance and meaning, effectively rendering it to be pretentious screen fodder. This movie however uses its stunning visual effects to convey messages on a level deeper and more complex than blatantly shoving it in your face. It's well used and effective. This movie plays with the themes of war, violence, conditioning, love, art, sex, humanity, fear, sorrow, childhood, and experience. The movie represents different cultures, ideologies, factions, and arts as their own planets to show how alien each is from one another, yet how they all come together to achieve enlightenment. 10/10 movie and a must watch."
32,The Holy Mountain,10,20 March 2016,Almost Impossible to Capture in a Review...,"""The Holy Mountain"" is a film that one must truly experience to get a grasp of. It certainly isn't anything you could describe. it's simply just too strange, beautiful, and brilliant to give a mere description of!In ""The Holy Mountain"", Alejandro Jodorowsky manages to make something that is truly new and original; it is something that only Jodorowsky could make. It is a weird, surrealist experience! At times it can be mystical and magical, at others it is quite disturbing and horrifying. There's definitely certain visuals in this film that you will never forget, whether that's positive or negative depends on your personality.Experimenting with various concepts and visuals, ""The Holy Mountain"" is an avant garde masterpiece full of fascinating symbolism, satire, and surrealism."
33,The Holy Mountain,10,25 October 2015,"""Real life awaits us"".","The Alchemist: ""We began in a fairytale and we came to life, but is this life reality? No. It is a film. We are images, dreams, photographs. We must not stay here. Prisoners! We shall break the illusion. This is magic! Goodbye to the Holy Mountain. Real life awaits us"".The story is about a Christlike figure wanders through bizarre, grotesque scenarios filled with religious and sacrilegious imagery. He meets a mystical guide who introduces him to seven wealthy and powerful individuals, each representing a planet in the solar system. These seven, along with the protagonist, the guide and the guide's assistant, divest themselves of their worldly goods and form a group of nine who will seek out the Holy Mountain, in order to displace the gods who live there and become immortal.The Holy Mountain is one of those movies that not everyone is going to like, as through out the years the movie has been a mix bag for a lot of people. Many called the movie ""A pretentious arty film, with no plot and nothing to gaps on to"". If you don't like this movie then that's fine, I mean everyone has different taste in movies and not everyone can like the same thing as other people because that will be quite dull. But in my personal opinion, I love The Holy Mountain and I would actually rank it up as one of the best movie I've seen in years.Alejandro Jodorowsky (The director of the movie) is what a call a ""spiritual director"", and what I mean is that Alejandro is a very spiritual person and I'm not such a spiritual person myself but I do admire his work. Alejandro Jodorowsky work of art is so open and so transparent that it makes his movies truly unique to watch, and that's why I think The Holy Mountain is a great way to start watching Alejandro films so you can get use to he's style of film making. Everything Alejandro Jodorowsky puts into his art as a personal sense of purpose in them and the ideas he's got isn't difficult to make out in each scene of the movie. The Holy Mountain is a work of art and Alejandro Jodorowsky directing is freaking superb.What I love about The Holy Mountain is how every single scene in this film is so true on reality and how detailed the movie is, and all of that is shown by Alejandro artistic look on life. The movie is absolutely absurd and what I mean is without spoiling anything; these a scene where a women is sitting on this super tall toilet and I'm not going to break it down like most people have by saying, ""The toilet is suppose to represent her as an upper class citizen to everyone"", no, what the movie is trying to get across (In my opinion) is how absurd it is and to make you think twice about the things we take for granted, I mean just look at everything that's still current in present day life, back in the sixties, seventies and eighties are still present today and all the things we do are suppose to me you think ""Wow, that's retarded"", and the point of the movie is to look at all the things that have become normality makes you realize it's absurd.These a lot that you can interpret in terms of statements that's in the movie like politics, religion and social life, and the movie says so much about every issue and it's so true and timeless. Every single second of the movie is making a statement and the movie has some much to say that it doesn't waste it's time doing so.The soundtrack in this movie is one of the best soundtracks I've ever listened to. Alejandro Jordorowsky, Don Cherry, Ron Frangipane and Andrew Arnold were the composers and I thought they did a magnificent job. The music in the movie really dose help on what type of emotion your suppose to be getting from the scene. Once you watch it a few times and you understand everything that's going to happen in the scene and you get the music in your head at the same time really adds to the experience, well it did for me. Now for the problems: I have none.Overall The Holy Mountain is a fantastic movie that really connected with me as a viewer. The movie never sloppily pretends to be doing anything different; all of it is completely self-ware of itself. The movie isn't for everyone so if you didn't like this movie then that's totally fine, but I freaking love this movie."
34,The Holy Mountain,1,28 October 2010,Useless Movie,"Its a F**King stupid and a pathetic movie which has nothing in its place....Its a stinking pile of S**T...Donno What was happening in the movie...y the gals were just naked roaming around and why was the Jesus Christ replica was wandering around the whole stupid city with some stupid people...i can't remember one thing except headache that should be taken from this movie....i am writing more and more just to complete 10 lines of this review or else it wont be submitted...but lemme tell u that i have done the biggest mistake of watching this movie but please please u dnt ever watch this movie for Christ Sake.It has nothing just some sadist scene, someone scrotum cutting, killing people randomly and some birds and veggies coming out absurdly from people's belly....HIGHLY UNRECOMMENDABLE...KILL URSELF B4 WATCHING THIS"
35,The Holy Mountain,6,28 April 2004,"Supernatural hunger, surreal art and a so-so movie...","So people who are crazy about this film, are fun to be around, but probably just plain crazy. People who hold this film in contempt, are not going to be much fun. I've seen ""Fando and Lis"" but not yet ""El Topo."" I'm happily surprised to see that a sequel to ""El Topo"" is evidently in the offing per IMDB. Or maybe that has been the case for the past 20 years...If you typically like ""experimental"" film (and I mean stuff like what the Ann Arbor Film Festival showcases not say Cronenburg's ""Spider""), then you should be able to sift enough gold out of this film. But there is plenty of gold's alchemical opposite as well.Imagination erupts out of this film like birds out of bullet holes. The plot with its quasi-mystical, anti-corporate kaleidoscope of world religions is there just to connect the dots between artistic film. As such, you could call this a fantastic film, but a horrible movie. In fact, the more seeming contradictions you can utter and pretend to understand, the more you will enjoy the spare dialog throughout this.The fact is you will be lucky to find it, at least for now. The japanese version I came across did have genitalia replaced by white splotches...it did sort of dampen the hippie heresy vibe, but the Don Cherry assisted soundtrack more than made up for that.A lot of the set design, especially when then set spinning was visually inviting for me. It would be fascinating to know more about this film, what did the extras think as Jodorowsky was guiding them on his very obscure personal vision? How much did this film cost him to make...despite its off-the-cuff vitality, it clearly was not made with spare hubcaps and rubber bands.The mingling of myth is fun, and while some folks may use this to slake their spiritual thirst, or satisfy their supernatural hunger, I'm not yet ready to buy into the chakra and awe. Who are we? Why are we here?For me, I just wondered, how did Jodorowsky make this film?And yes I am glad that he did...6/10"
36,The Holy Mountain,4,11 November 2008,"Beautiful images, barmy action","Finally I have had the opportunity to take in this reverently spoken-of film. It is clear that Alejandro Jodorowsky, the creator or perhaps the magus at the centre of the film is serious but not sombre. This attitude permeates this film, a narrative study of the alternative life philosophies emerging from the previous decade: there is humour to be had.The basic story is one in which a fallen Christ joins a group of acolytes on a journey to the mountain of the title. The images are wonderful. Full use is made of the strong Mexican light, locations and colours to create a cumulative tableaux of surreal images. The acting is an odd subject as it's clear that the cast regard Jodorowsky not only as director but also as more or less the guru he is acting. Their roles are treated with the reverence that one finds in the theatre of religious services.I take nothing from the narrative or its propagated beliefs. I didn't much care either for the hackneyed (even in 1973) sexual/corporeal fetishim deployed as an antagonistic substitute for drama at the opening and beyond. It's the extraordinary images and scenes constructed with care and conviction that I absorb, gratefully, from seeing this film. 4/10"
37,The Holy Mountain,10,7 June 2002,Either you get it or you don't,"This film is profound on so many levels (whether you agree or not is your opinion - the fact is that it is) but at the same time it doesn't want you to read too much into it. The ending is the main thing that totally blows you away. This film is not crap. It is a significant piece of cinematic art.  Most prints are duplicates of the Japanese laserdisc (widescreen with the nudity fogged out and Japanese subtitles). Most people who have seen this movie ARE, in fact, intellectuals. Let's face it - mainstream films are mindless violence or idiotic teen movies - not much more. I looked for this film because I found El Topo and Santa Sangre highly appealing. Thank God for eBay is all I can say - it's been a Godsend in finding these rarities that belong to the truly deserving people who appreciate them!!!!!!!!!!!!!!!!!!!!!!!"
38,The Holy Mountain,6,1 August 2000,The ascent of Mt. Carmelo with surrealistic dressing,"The film is based on The Ascent of Mt. Carmelo, by the spanish mystic San Juan de la Cruz, one of the closest catholic relatives to new age and buddhism. Only instead of Mt. Carmelo, we find Jorodowsky climbing the towers of Satelite, the shrine of suburban mexican middle class! I found it a great idea that, hidden in those towers, there is a gate to nirvana (the characters are hairless, for they have given up their selves).The first scenes (the conquest of Mexico with frogs and lizards, in the middle of the Basilica de Guadalupe) are great; the ending gives some enlightment. In the middle, you get the usual Jodorowsky salad dressing: freaks, blood, meaningless words, put there to make you feel you're watching something sooo bizarre and sooo special you are, alas, a ""chosen"" person.P.S. I believe the date of release is 1974. But I am not 100% certain."
39,The Holy Mountain,10,27 September 2010,"psychedelic, surrealistic trip","It is very hard to describe this movie. This is probably the hardest review I ever had to write. (It's hard enough, since my native language is not English.) Everything is absolutely surrealistic and unusual. I have never seen anything similar. This movie even goes a step further than David Lynch or Terry Gilliam. Everything can be taken as a symbol - or even as persiflage, since everything is exaggerated or ridiculed. The visuals are partly so crazy, that it almost feels like a walk through a modern art museum. Sometimes you get the feeling, that the director had the ultimate brain storm experiment going on; taking the paint brush, not knowing what you are going to paint and simply watching your hand. - Your subconscious will start to combine the weirdest symbols with each others. Partly the movie is abstract art, partly it's self-conscious constructed. On this journey the movie will allude a lot existential questions - in the search of an answer. It will not actually give an answer though.This movie has more music in it than conversations. Something I really liked, because mostly the music fit perfectly. The visuals are experimental but worked out most of the time. Compared with other movies of the same age, everyone will have to admit, that the movie is visually on a very high level. I give this 10 points. For the courage of the director making a movie that is as experimental as this one, and because I still have to ponder about this movie 2 days after watching it. - And I actually plan to watch it again. This film might be the most interesting experiment in movie history."
