,title,stars,date,r_title,text
82,The Holy Mountain,,24 July 2007,"It's a Less Personalized, but I Personally Feel That it is a Most Excellent Film.","***1/2 out of ****After Jodrowsky made EL TOPO, he would get better financing, more creative and artistic freedom to depict his vision, and the very handy use of more actors, set pieces, and music. It's not that EL TOPO didn't lack any of these things, but being able to make a more dynamic movie with more money kind of takes away from the ability to create things from the simplest sources, which is one of the things he did best with EL TOPO. Because he has all these great benefits and stuff, it means that his film will be less personalized. This basically means that it doesn't feel the same watching this movie as it did with EL TOPO.Aside from that flaw, this is a great film. It's a perfectly beautiful, unique, and intelligent film overall. It is really a joy to watch. If you haven't seen EL TOPO, it probably won't be a good idea to check this one out yet. If you did see EL TOPO and didn't like it because you thought it was too weird or messed up, avoid this film like the plague. Trust me, to you this will be far weirder. But for those people who liked EL TOPO and liked or appreciated it's weirdness, you will most likely like the film. This is really probably for people who appreciate the film making talents of Alejandro Jodrowsky. If you hated EL TOPO, or SANTA SANGRE, or FANDO Y LIS, chances are that you will loath this film.The plot, like EL TOPO, is impossible to describe without making it sound worse than it actually is. BUT, Unlike EL TOPO, this can actually be classified in a genre. Sure, it has several elements of different genres, but this film can actually be officially classified as a BIBLICAL SATIRE. Alejandro Jodrowsky has been the victim of religious intolerance before, and this film, THE HOLY MOUNTAIN, can be classified as his great revenge. In this film he pokes fun at different religious virtues and traditions as if it weren't such a powerful force behind worldly problems as celebrates and basks in what he feels is a funny and ridiculous subjective cult. He blows out of proportion the different religious practices and procedures by stating plainly with this film that it is all a joke and that people need to stop taking it seriously and enjoy life. You get this sense right from the beginning, in which Jesus Christ wakes up on the cross covered with bugs, climbs down, scares off a group of children that gather around him, and then smokes marijuana with a black midget with no hands or feet. It's really quite ridiculous.This film is definitely more elaborate than EL TOPO, considering it's massive set pieces. There are tons of chambers, electronic cityscapes, factories, forests, streets, and stages that are displayed in the film, and they are rich and full of color, life, people, and wonder. The attention to detail can occasionally be slightly overwhelming, However, i really quite enjoyed seeing this film. Considering that this is a lost classic that was just recently re-released, it's worth getting your hands on if you are fans of EL TOPO. But beware, this is considered to be surreal and chaotic cinema. These are films that have an extreme driving force behind all of the madness. Usually everything is personified. The directors of these film have been known to make personal choices in the making of these films by composing the music, dubbing all the voices themselves, editing and mixing the sound all by them selves, and even acting in them and being main characters. Alejandro Jodrowski and his films can be compared to in the likes of such directors as David Lynch(ERASERHEAD, MULLHOLLAND DR.), Peter Greenaway( THE COOK, THE THIEF, HIS WIFE, AND HER LOVER, PROSPERO'S BOOKS) and Luis Bunuel(BELLE DE JOUR, UN CHIEN ANDALOU). Alejandro Jodrowsky is considered to be one of the pioneers on personal and chaotic film making. The earliest example of this kind of film making is with Tod Browning's FREAKS(1932), and the latest example of this, in actuality, is with that annoying Tom Green dude with his debut film, FREDDY GOT FINGERED(2001), which i don't want to totally dismiss since i know a lot of people who like that movie. I don't want to throw rocks at anybody, so i won't criticize, although even i feel that just mentioning it in this review is giving it too much credit. Anyway, i guess what I'm trying to say is that these aren't the kind of films that can be considered typical or normal by anybody really. This is a very different type of film making, and i can only recommend it to people who are cinematically adventurous. I know that i like this film a lot and i am aware that i am praising it, but i hate the idea of the wrong person seeing this film. This is I can praise it but i do not recommend it to everybody. Having said that, this is a great film.Contains extreme violence and gore, strong sexual content and nudity, and drug use."
83,The Holy Mountain,10,2 July 2007,just watch it. . . decide for yourself,"One of the all time greatest films that I have ever seen.It was an amazing journey that I will take again and again. . .better than an acid trip. . . mostly because the trip is shorter, and I have often found myself in the middle of an acid trip wishing for it to end so I can do something more productive. . .then Voila! Holy Mountain on DVD. . .awesome. Never a dull moment. . . I want to make love to it. Is that illegal? If you are pontificating the pros and cons of whether you should spend the time to watch this flick or pass over it for something ""safer"". . . stop thinking! Just watch it. There are some over the top moments, but not as bad as some things that I've watched. . . It was definitely entertaining and funny and . . .and . . . just watch it already!"
84,The Holy Mountain,8,20 June 2007,Jodorowsky never lets you down,"What a difficult movie to write about! Always enjoyable with some sensational imagery, this is amusing, thought provoking, cynical and heart-warming (in the best possible way). It is possible that, as I did, it might be helpful to see the wonderful documentary, 'La Constellation Jodorowsky' (1994), before seeing this as it could otherwise appear a little naïve or pretentious. It is, of course, a film very much of its time so they is much nudity and talk of searching for the answer to the universe by sniffing flowers, but don't be misled - Jodorowsky never lets you down. It seemed just a little overlong but I think that was because I originally thought this was all about the ascent of a mountain and as we go through depictions of each various planetary influences, I began to think it would be more protracted than it was. Absolutely marvellous and an essential view."
85,The Holy Mountain,10,13 December 2006,A Psychedelic Experience.,"Jodorowsky is the top alchemist and brujo extraordinaire.This is an event of non-linear proportions. Visually traumatic and disturbing THE HOLY MOUNTAIN works its magic on the viewer like a good dose of magic mushrooms or acid ! Shamanistic symbolism abounds,reference to the esoteric enneagram system is made.An ancient occult system used by the Sufis. Alchemical process is one of the major themes in all Jodorowsky's movies,never so much as in THE HOLY MOUNTAIN. The cast of extras are always interesting in Jodorowsky's films,he out-fellinis Fellini.Casting cripples,amputees and weird fringe characters from the locales of Mexico. So many references to psychotropic compounds throughout this magik flick. Whatever technique Alexandro Jodorowsky uses to mesmerize and deeply affect his audience it is certainly effective. Beautiful and violent brimming with profundity."
86,The Holy Mountain,8,28 March 2006,...Wow...,"I must admit, Holy Mountain is one of the most bizarre films ever created. It took me several times to watch the movie to finally make it all the way through. This movie is such a shock to the senses and so unsettling it can be very hard to take it all in one sitting. I am not sure where the direction of the movie was going as the movie seems to be done in three different parts. The first part introducing this Jesus like character and a few of his strange exploits. After he climbs this tower (which at the time I thought it was the tower of Babel) he meets this sorcerer of some sort and then the movie shifts to something completely different. The second part is showing all these different people from different planets who seem to have extraordinary powers. The movie goes on like that for a while and then part three seems to kick in where apparently these people want to climb ""The Holy Mountain"" to become Gods. Now, I am not sure if that really helps to explain the movie, you really just need to see it for yourself and make the best sense out of it. But, like it or not, you will still walk away from this movie saying ...wow."
87,The Holy Mountain,10,25 August 2005,The most impressive movie from Jodorowsky (in an spiritual way),"I have seen this movie like 6 times, and each time I think Jodorowsky is really an artist. Just watch it and say. But it will be better if you read some of his books as: ""La danza de la realidad"" or ""El maestro y las magas"", edited this past years. This way you will understand better the universe this guy is moving in. There is a way of watching this,m without prejudices end trying to understand what is he wanting to say. There are scenes completely methaforics but with a clear interpretation. And the end is one of the bests in cinema history (in my opinion), it's something that has been used by some other people, but it has never been used with a complete reason. For the first time a deus ex machina has a real sense. What does this movie talk about? the way of living with a clear objectivity, ergo happy. Don't miss his other films, specially ""El topo""."
88,The Holy Mountain,,8 May 2004,Jesus in a g-string--what a flick!,"This movie has:**costumed frogs in battle **a guy pulling out his glass eye and giving it to a little girl **lots of nudity, often in close-up **lots of blood and yucky sound f/x **brunette fem-bots **skinned lambs on crosses **a mutant midget **Jesus running around in a g-string, screaming at statues of himself and eating his own face **a chimpanzeeAnd that's just the first half hour! I could care less what it all means (it's about a deranged fimmaker making a cool bizarro flick imho), this movie is fun. Mostly. Unfortunately, it was filmed in reverse--it starts with the exciting climax and works towards a boring, quiet ending. It's also long. And it's hard to find a decent copy. It's also really gross in many parts; I'd rather NOT know where gold comes from, thank you...This reminded me of ""Liztomania"" by Ken Russell, if you're in the mood it's a great ""trip,"" if not, it'll give you a major head-ache. It's equal parts Russell/Fellini/Bunuel and John Waters. Santa Sangre was more coherent and good prints are easy to find, but neither it nor El Topo are as spectacular or goofy as this journey into the excessive imagination of a truly unhinged director. I'm glad movies like this exist, even if only in bad prints."
89,The Holy Mountain,9,1 March 2016,Amazingly astonishing visuals... But kinda sickening,"The impression this movie made on me was like how I feel about Donald Trump: masterful propaganda that is bona fide genius in some ways, but at the same time gives me this uneasy feeling that it's really not all it's cracked up to be.A lot of glowing things people say about this movie are totally true. This movie has the MOST amazing visuals I have ever seen, and they were all done only using props and locations -- no CGI. Not even any particularly sophisticated practical effects like in a billion-dollar Guillermo Del Toro flick.And the ""symbolism"" very often does seem to point to interesting hidden truths. For instance, the protagonist resembles Jesus, but he is shown passed out and soaked in his own urine. Is Jodorowski encouraging us to have as much compassion for our debauched and unworthy selves as Jesus? Is his use of deformed actors a clever allegory for how we relate to aspects of ourselves which we consider inferior or unworthy? There's a lot of these sweet little rabbit-hole invitations throughout this movie. But then this profoundly allegorical vision-fest throws a whole lot of disgusting images and themes at me that don't exalt or provoke thought, they just repel. An army of people holding up skinned and crucified dogs? WTF does that have to do with anything? An old man giving his prosthetic eye to a pre-pubescent prostitute? A titan of industry who makes decisions based on whether the mannequin of his dead wife's pussy is wet or not? Oh yeah, and how seven of the world's most powerful and evil people are treated to a guided path to enlightenment rather than being punished. What's this supposed to mean? I guess that I should cheer them on because the movie is so visually amazing. Bleah. The whole thing is gorgeous and intelligent, but the spirit behind is just somehow decadent and sick."
90,The Holy Mountain,8,2 July 2015,Holy Moly!,"The only Alejandro Jodorowsky film I had seen prior to The Holy Mountain was El Topo. I thought El Topo was one of the weirdest films I'd ever seen with a gunslinger traipsing around the desert with a naked child on his back and encountering a corrupt town full of disabled people. Could things get much weirder than that? Yes they bloody could. You know a film is going to a little bit off the wall when it has the line, ""Your sacrifice has completed my sanctuary of 1,000 testicles."" El Topo seems as deadly realistic as a Michael Haneke film compared to Alejandro's The Holy Mountain. I made a list of weird movies a while ago and placed Eraserhead as my number one weirdest. If I were to revise that list, I'd definitely place The Holy Mountain directly behind Eraserhead. It's that weird.Casual moviegoers beware. This is a film funded by John Lenon and Yoko Ono so it isn't your average Owen Wilson cosy romcom. Within in the first half hour we're bombarded with bizarre imagery. A man who looks like Jesus walks around a dreamlike town full of frogs in clothes getting blown to smithereens, Jesus statues made out of sponge cake, armless dwarfs, sex in the street and eyeless paedophiles. All of this section is told without dialogue bar a few screams and Baldy Man styled gibberish.I was so taken back at the sheer amount of strangeness. Every single shot has severely strange imagery in it. It's like a Salvador Dali painting coming to life and the pacing is so fast, especially in the first act. There's no point trying to read the symbolism because too much happens, too quickly. The best thing to do is just let the film wash over you like some sort of fountain of oddness. Even after reading some ideas on the film I still have no idea what any of it means. However, my guess is that Alejandro isn't a fan of religion or weapons, but he is a fan of nudity and animals. In fact, I'm pretty sure that they cleared out London zoo to make this film.The second act takes a slower pace, but is no less bizarre. The production design in this section is pretty astonishing. I was particularly astounded by the rainbow room which seems like something from another world. A kind of plot does kick in with our Jesus hero meeting a 'master' (played by madman Alejandro Jodorowsky himself) who plans to take him and a bunch of increasingly bizarre misfits on a quest to meet the gods. We're introduced to nine new characters in quick succession. All of them have a detailed backstory involving everything from orgasm machines to testicle collections. This section does get a little repetitive and lengthy but it's entertaining nonetheless.The rest of the film follows the oddballs on the quest to meet the gods. Compared to the weirdness overload we've been having, this section does feel a little less weird so it's less memorable. I do have to say though that it acuminates into one of the best endings to a film I've ever seen. It's incredibly jarring and the most postmodern thing I've seen since The Cabin in the Woods.So what else can I say about The Holy Mountain? As its trailer states, it's a film which defies conventional plot and criticism. It's like a piece of art or music. It's something you have to feel and depending on what you felt, you either like it or you don't! As a connoisseur of the weird, I really liked it. It definitely leaves an impression and leaves you with an army of images you won't forget in a hurry. Unfortunately, it's not quite as hypnotic and dreamlike as it could've been thanks (or no thanks) to Alejandro's directing style. The film feels quite detached and objective. I think the film would've been stronger if it was seen more through the eyes of the Jesus character. The reason I love David Lynch films so much is that he takes us on an experience with the characters. Alejandro shoots like we're just spectators and so part of the experience is lost.The Holy Mountain is still an extraordinary film though. It's rich and full of surrealist imagery. It's almost like the ultimate surreal film with so much impenetrable symbolism crammed in to make your brain melt. Most average moviegoers won't make it pass the first ten minutes, but then again why would an average moviegoer attain a copy of The Holy Mountain? For the rest of us weirdos, this is unmissable!"
91,The Holy Mountain,9,18 March 2014,What a feeling!,"There are the obvious social themes and ideas that are pushed across in the film, which were relevant at the time, are still relevant today and a powerful message. But above all, above all! You have to just sit back and watch this film. Admire the care taken to construct a picture like this, of this caliber. The repetition, the color, the sheer beauty, really is unparalleled. The way Jodorowsky uses music I feel can't be compared to any other director. The way he uses tribal drumming and chanting to set a mood has your heart race in a way that builds suspense and keeps you on edge similarly to electronic music of present day. Such an eye opening and enlightening experience. This is how a film should be: an experience, a feeling. I was captivated and moved to tears. Lord, what a picture."
92,The Holy Mountain,9,13 August 2008,Holy Mountain... purely an experience made from awesome,"Jodorowsky's Holy Mountain is excellent. And when I say EXCELLENT I MEAN EXCELLENT. I can accept that this film may not be for everyone. But whilst this may be biased, it is moronic for those who CAN withhold the imagery to simply write it off before making the credits. Whilst there is debate on significance of symbolism and the like within the film, I feel that people who participate in such thoughts may be missing the moral of the story. The fact that Jodorowsky went to such an extent only furthers the message delivered at the end. (Which is what the whole film is built upon) I'd say its defintley worth some replay value, as they may have been some elements I missed on the first or second encounter with it. Moving on to watch other works of Jodorowsky, I'd say that this is easily the best. Plain epic.ALSO: I'm not sure about the validity of this, but originally Lennon was set to star in it?"
93,The Holy Mountain,10,26 July 2007,"Disturbingly beautiful, thoughtful, free from the cinematic boundaries","Much like Alejandro Jodorowsky's previous work ""El Topo"", ""The Holy Mountain"" is a deeply spiritual movie. Although here Jodorowsky takes that to the extreme, spinning a surrealistic tale about a man whose journey leads him on a quest for immortality. The film is a visual bombardment of the senses in which series of bizarre and often symbolic scenes are what is used to drive the plot forwards and Jodorowsky knits them together in a perfectly twisted logical way. Turning the film into a truly unforgettable experience.""The Holy Mountain"" is a confusing movie at first, but clearer and clearer as it moves to it's conclusion. And though chances are it won't make perfect sense after the first viewing, that is quite enough to spawn a general idea of what it is about.Jodorowsky has much to say about human nature. As seen from the early beginning of the film, a half hour compilation of violently humorous yet disturbing sequences that present several, uncomfortable facts about the world we live in. After those are through the movie's plot begins to move forward. As mentioned earlier it involves a man's quest for immortality. That man, The Alchemist played by Jodorowsky himself leads in his journey a group of nine other individuals searching for the same thing. Eight of them are leaders of a separate planet, each with a background explained. With them, Jodorowsky proceeds to further his criticism aimed at humanity. While different these backgrounds share one common and vital characteristic, those eight people are all vile repulsive human beings, drawing their gains from the suffering induced upon others. Though their motives are shallow and transparent their journey to the Holy Mountain where immortality lies will have a profound effect on each and every one of them. Thus leading into a conclusion that is equally satisfying yet unsuspected.Visually speaking Jodorowsky has made an work of art. Cinematography is perfect, set design is unbelievable, the music fits with the atmosphere and it's just oh so magnificent. Watching every scene, every shot, every movement of the camera, every weird act performed. Disturbing yet funny, perverse yet beautiful, violent yet touching the film carries so many distinct emotions that it become hard to categorize it in any of the known genres.Beneath all it's visual content - violence, disturbing and sometimes perverse imagery, ""The Holy Mountain"" is and forever will be one of the most morally conscience and humane movies made. A bizarre surrealistic satire that not only laughs at the diseased human nature but also offers a potential cure for it. Alejandro Jodorowsky's masterpiece achieves immortality."
94,The Holy Mountain,,18 October 2004,A strange film with no script and no characters,"The Holy Mountain is a piece of crap. The director Alejandro Jodorowsky seems to be still living in the 60's crazy days of Flower Power. However, the movie was released is 1975. The dream was over, the reality was cruel (the Vietnam war, America Latina's dictators etc), and there was no scape from the insanity of real life.This film is too symbolic that looks like some stupid story written by a 18 LSD addicted boy. There are no plot, no script, no characters, no performances. Some scenes resemble Pasolini's Salo (e.g., the faeces been boiled), but lacking the social context of the latter. Besides, the few dialogs resemble B science fiction movies from the 50's: ""I am from Mars"", or ""I am from Venus"". Come on, guys! Where is the so-called ingenious director? A mess of ideas is not enough to build a strong movie. A lot of people sweep the net in search for The Holy Mountain. Please, do not waste your time. The film is boring and an anachronism, a naive attempt to show the typical trait of a time that has gone. A good friend of mine told me this is a pop masterpiece. I guess he is out of his mind. Not even Jodorowsky should know what he did here."
