,title,stars,date,r_title,text
29,The Disaster Artist,9,3 December 2017,The greatest movie about the creation of the worst movie ever made.,"As someone who has recently been inducted into the cult fandom of the Room, The Disaster Artist really surprised me at how much depth it brings. The Disaster Artist doesn't just act like it's a comedy that pokes fun at The Room but gives you an understanding and appreciation of how that insane movie came to be. The story tells how the world kept telling Tommy Wiseau and Greg Sestero that they would never become famous and their passion project would be the worst thing ever made. The amazing result is that these two underdogs were both proved right and wrong. They achieved celebrity cult status by making the worst movie ever made. While this is a movie about the making of the worst movie ever made, the heart of the story is the friendship between Tommy Wiseau and Greg Sestero (whom are played by real-life brothers). From the moment a stage-frightened Greg watches Tommy let out his weird performance on stage without thinking about being embarrassed, a strange but beautiful bromance begins to form. Years later after moving to LA to get into the acting gig, Wiseau and Sestero vow to make their own movie when Hollywood refused to give them the chance. As production of The Room moves along, Wiseau and Sestero's friendship is tested. As Greg moves on with his life, it affects both his personal and professional relationship with Tommy. This then has a negative effect on the filming production with the crew and cast. But in the end you still care about Tommy and Greg fulfilling their goals. By getting you invested in these kinds of emotional stakes, The Disaster Artist never feels like it's going overtop just for cheap laughs. James Franco actually gives a lot of surprising emotional depth to his portrayal of Tommy Wiseau. Franco nails Wiseau's mysterious (maybe European) accent and bizarre pattern of speech but goes the extra mile to show how emotional insecure he is. There are times it is easy to laugh at Tommy since his naivety and lack of talent or experience portrays him as a fool. Other times his obsession with his vision antagonizes those around him while in certain moments you almost shed a tear for him because you feel his internal pain of being rejected by the world. Like some are already talking about, I do think it is worth putting Franco's name into consideration for the Oscars as best lead actor. Dave Franco should also be given credit as Greg Sestero, Wiseau's real-life friend, co-star and producer of The Room. As the only sane person who is close to understanding Tommy, Greg must try to keep things in check with him. But because Greg feels like he owes him for helping him with his career it causes him to enable Tommy with his ludicrous decision-making at the cost of their relationship. Seth Rogen is once again hilarious this time as the script supervisor Sandy Schklair. Here he serves as the audience's perspective into The Room by questioning the absurdity of Tommy's decisions and creative process. For the most part The Disaster Artist does not rely on audience already having an experience with The Room to love it. However you might have more of an understanding having seen The Room to get some gags and little easter eggs relating to it. The Disaster Artist at first may seem like a mocking at bad filmmaking but in the end its true message comes down to the value of friendship and having an appreciation for fulfilling your passion and dream even if not every agrees with it. It is easily one of my favourite surprises of this year"
30,The Disaster Artist,8,14 January 2018,Such a surreal experience.,"Very few times do we get to see an actor playing another actor so well, so crafty done.James Franco has excelled my expectations for the movie. Mind you, I am not a huge fan of The Room but I did get a ""What the hell am I watching?"" feeling when I saw it. 
I can honestly say watching this movie it almost feels like a companion to The Room, as it was as surreal and sometimes uncomfortable to watch but in a really good way.They have also managed to make it a funny movie, granted Wiseau is a funny character or caricature himself but as to emulate that so vividly without being disrespectful is a whole different achievement, one that is totally worthy of any awards you want to throw at it, especially on Franco, this is his definite performance."
31,The Disaster Artist,8,10 December 2017,An homage to a love of movies and making them,"Tim Burton showed how much he loves movies by giving us Ed Wood, and James Franco has shown a similar affection with The Disaster Artist. Although I firmly believe Troll 2 is a far worse movie than The Room, it was only a matter of time before someone made a movie about the making of a movie considered by many to be the worst movie ever made.That's not fair, of course, to The Room. What made The Room a cult classic is that it is not the worst movie ever made, but simply a jarring sequence of non sequiturs, whether dialogue-based or editing-based, and a handful of side plots which barely spin up, never to be returned to again. It's a cult classic not because it's a bad movie, it's a cult classic because it's unfathomable that anyone could make a movie like that with so much passion and think it was a masterpiece, but that's what Tommy Wiseau did, and as Greg Sestero points out, not even Alfred Hitchcock was talented enough to accomplish that.James Franco proves we need a stronger word than Schadenfreude at times, perhaps ""super-duper-über-schadenfreude."" Much like the neon sign shaped like Hitchcock's face in Rope, we see that Tommy and Greg live in an apartment building called OJAI (""O hai!"") and wow does Josh Hutcherson look terrible with Denny's hair.Too bad Franco chose to open the film with real-life ""tributes"" from such famous film critics as Adam Scott, and too bad he chose to close the film with a series of side-by-side comparisons of his version against the original Wiseau vision. Those last scenes smacked of Peter Sellers and the blooper credits from Being There, so out of place that many believed they cost him an Oscar.Tommy Wiseau is not as mysterious as he wants to be. He's probably a vampire. Who cares?"
32,The Disaster Artist,8,8 December 2017,Fills In The Background,"I saw ""The Disaster Artist"", starring James Franco-The Interview, General Hospital_tv; Dave Franco-The Now You See Me movies, Warm Bodies; Ari Graynor-Bad Teacher_tv, Nick and Norah's Infinite Playlist and Seth Rogen-The Neighbors movies, Zack and Miri Make a Porno. This is a movie that shows how another movie-The Room-got made. If you have never seen The Room-a 2003 cult movie-I highly recommend you watch it before you see The Disaster Artist and you will enjoy it even more. If you haven't seen it, you can still enjoy this one, but it's just better otherwise. James plays Tommy Wiseau, the eccentric-and that is putting it mildly-actor that meets Dave, playing Greg Sestero, another more normal actor and they become fast friends. Both are struggling to find work and finally decide to just make their own movie, with James/Tommy writing, producing, directing and starring and Dave/Greg co-starring. FYI: This is the first time that James & Dave have made a movie together. When I said James/Tommy was eccentric, besides his acting being over the top, he was very mysterious about himself. When asked where he was from, he would say, New Orleans, and you could tell from his accent that he was European-I later learned it was Poland. He was also evasive about his age-he looked to be in his 40's but said he was in his 20's. He had lots of money but no discernible income-my guess would be inherited. He would laugh at inappropriate moments for no reason. Ari plays the love interest in the movie and Seth is a script consultant. There are lots of cameos, both of James' real life buddies and other actors-I remember seeing Melanie Griffith, Alison Brie, Sharon Stone, Zac Effron and Bryan Cranston-and James directs this movie, which is based on a book written by the real Greg Sestero. Tommy & Greg both make cameos. As the end credits start, they divide the screen, showing scenes of both movies, side by side. And make sure that you stay after the end credits for an extra scene-you won't be disappointed. The movie fills in the background of The Room and how it came to be. It's rated ""R"" for language and sexual content-including nudity-and has a running time of 1 hour & 44 minutes. I enjoyed it and would buy it on DVD."
33,The Disaster Artist,9,9 December 2017,Incredible Performance by James Franco,"Recently viewed the movie on Dubai International Film Festival (DIFF). It was a great movie and impeccable act by James Franco. Frankly, i would not have had the chance, unless my spouse picked it among many others. You can see on the net people suggest you watch the Room, Citizen Kane of the worst movies ever filmed, as a prerequisite; believe me, it is not a suggestion. Please watch the Room (2003) before going to Disaster Artist. You will have so much more if you do."
34,The Disaster Artist,9,16 January 2018,"A Hilarious and Surprisingly Heartfelt Film,","The Disaster Artist is a fantastic movie with a very well developed plot and an outstanding cast. It is advertised as being a comedy, while it is delightfully funny and had me in stitches on many occasions, I was very surprised at how much depth and emotion there was in it. James Franco really made sure that he was not just making fun of this bizarre true story, but told it in a way that got us to sympathise with Tommy Wiseau and Greg Sestero, and I really did. We all desire greater things in life, most people have a dream, watching these people go out and pursue that, and the downfall that it leads to, was genuinely soul crushing for someone who is involved in a similar industry, which was conveyed in a very blunt, honest manner. My only real issue was that I did not find it focused on the making of ""The Room"" enough. While it is still the main bulk of the movie, there is far too much fleshing out of the story beforehand that I did not find necessary, anyone going to see this film wants to know how another infamous movie was made, they should have gotten to the punchline a little faster. The performances are all around marvellous. James and Dave Franco are, of course, the highlight as Tommy and Greg, the comfort they have with one another, being real life brothers, is very apparant, and it really is a pleasure to watch them perform together for the very first time. Their characterisation in both parts is very accurate and completely unlike them, they are also joined by a star studded cast in smaller, but memorable, roles that includes Seth Rogen, Josh Hurcherson, Alison Brie and Zac Efron. A great ride that had me experiencing many different emotions. Funny, meaningful and tremendously acted, I would highly recommend The Disaster Artist to anyone looking for a good comedy drama.
Close friends Tommy Wiseau and Greg Sestero move to LA to pursue a career as actors. When nothing works out for them, Tommy decides to make his own movie. 
Best Performance: James Franco"
35,The Disaster Artist,10,16 January 2018,A Masterpiece!,"This movie is an absolute masterpiece! James Franco is an absolute genius. The way in which he's portrayed the character of Tommy is absolutely incredible. The last scene of the movie had me in splits! By the end of it, I wanted to see it again. Highly Highly recommended. Leave aside whatever you're doing and watch The Disaster Artist!
10/10"
36,The Disaster Artist,2,15 January 2018,Disaster indeed!,"Why should one go back over a complete misfire of a movie, like Wiseau's THE ROOM, or Ed Wood's work? At least the latter, of the late 1990s, featuring Johnny Depp, had awesome performances in Depp and Landau. In this one, much as I might try, I could only be annoyed by Wiseau's accent and repeated stupidity. Dave Franco does well in his part, but it is not exactly memorable, either.Perhaps I'll be accused of lacking humor, but I could not see anything funny about Wiseau's extravagant behavior and the derision with which it was received by the rest of the crew. This movie within a movie drove me to snoozing about 25' into it, and thank God that I was able to catch on my sleep at least. In the end, this film pays homage to a complete failure. Perhaps it's symbolic of the way moviemaking is going, bereft of ideas, and increasingly unrealistic productions that teach one absolutely nothing about life and how hard it is to survive just the day to day.2/10 - mostly for Dave Franco's sympathetic and humane performance."
37,The Disaster Artist,1,15 January 2018,The original was actually watchable,"Watched ""The Room 2003"" then this back to back. The Room is strangely watchable but watching this was like listening to a drunk uncle trying to remember a joke. Perhaps in 15 years someone will make a movie about how bad this one is. It's a pity they cut the scene at the end when Logan Paul found the body, that was the best part."
38,The Disaster Artist,7,15 January 2018,good movie with alot of flaws,"Disaster Artist was kind of dissapointing. James Francos perfonmance is the reason this movie works basicaly best part of the movie cause he has that raw talent. Other actors were fine, Dave Franco was fine tho even if he basicaly played himself. The first half of the movie when tommy and greg are friends and stuff are so good and them trying to be in the movie i mean its perfect first act, second act when they start shooting room is ok tho they go more with shit like why is he having sex with her navel tho they are funny and i like that they recreated the scenes like how it was. Third act is bad and ruins the movie like when people are laughing is so bad and the fact that he immedietaly after says its a dark comedy isnt how it happened. But i recommend it watching i would give it 6/10 but since i admire the fact someone made a movie about this i gave it 7/10."
39,The Disaster Artist,4,15 January 2018,Confusing and awkward portrait of The Room.,"I have to admit off the bat: I have not seen and have no intentions of seeing ""The Room"". Why sitting through an awful movie has a cult following only lowers the bar for engaging and entertaining movie scripts, something that seems to be affecting the movie industry as a whole. I honestly think money is the only thing driving the success of ""The Room"" and that the ""cult following"" has been completely manufactured. What I can't understand is how ""The Disaster Artist"" is receiving such positive reviews. The plot is bland and scenes are uninteresting. The story contains no major plot twists or anything to engage the viewers. Characters are not established well, scenes are disjointed: the movie feels bland.How on earth James Defranco got the Golden Globe Award for Best Actor - Motion Picture Musical or Comedy is beyond me. Nothing James Defranco's Tommy Wiseau says is particularly funny, it's literally making fun of a man that may have mental health issues. There was no difficulty or complexity in creating the Tommy Wiseau character for ""The Disaster Artist"", all that was needed is a funny accent, a wardrobe copy and mirroring the shots from ""The Room"". That's not great comedy.Overall I am disappointed in this movie given the amount of hype it generated. It seemed like the cast and crew were piggybacking off the artificially created cult following of ""The Room"". If anything the nomination win and success of the movie shows how emotionally out of touch Hollywood is at the moment."
40,The Disaster Artist,10,14 January 2018,Franco Franco Franco you're tearing me apart !,"This bizzare take on the novel written by Greg Sestero about the making of the legendary bad cult-classic the Room, is a movie so well-done funny and brillant, where James Franco delivers one of the best performance for years to come in comedy ! Follow-up a great Oscar caliber movie about the making of the worst movie ever made ! Acting: 10/10: James Franco is amazing brillant he delivers that performance that make me quote myslef how can he be that good, he imitates Tommy Wiseau so damn well, with the voice the style the weirdest in it, it like if Franco waited his whole life to play this role! The rest of the cast are great too, simply kind of forgettable because of Franco's performance!Directions: 8/10: It felt slow sometimes ..... yet it was done really well, you just have to see the Room too get that this movie was done perfectly! Franco, Seth really are pretty much the only one that can always come up with an hillarious movie in the past years! What a duo !Humor: 10/10: Hilarious one of the movie I have laughed the most at ! Every humor comes with James performances is take on Wiseau is insane ! Can't say much I just loved the humor and rarely laughed that much !Enjoyment: 10/10: Hands down the best way to start 2018 for me was to watch The Disaster Artist not sure someone will beat this movie off my list this year ! It one hell of a comedy and it an honour for us Room fans to see this beautiful movie ! (yess 2018 since here in Montréal it was limited and had to go really far to see it !)"
41,The Disaster Artist,,14 January 2018,Brother Franco's fun piece,"""The disaster artist"" is a movie about making a movie. While this is not exactly a ""genre"", it's something that appeals to filmmakers. Coming to mind right away is Truffaut's ""Day for night"" (1973). A bit more recent is this little gem of a movie ""Super 8"" (2011). Movie about making a movie. I am sure there are quite a few others.The movie tells (not ""based on"", but truly ""tells"") the story of the making of ""The room"" (2003), together with the parallel story of a somewhat (but not exceedingly) strange friendship between Tommy Wiseau (James Franco, who won a Golden Globe for his trouble) and Greg Sestero (Dave Franco, James's brother).Clocking in with an IMDb user average rating of 3.6, ""The room"" is considered by many as a serious contender of the worst movie ever made. How did this come by? Well, it started with a chance meeting of Wiseau and Sestero in an acting class. The audience is shown Sestero first, doing a pathetically tentative ""Waiting for Godot"", with mispronouncing the name in the title to boot. Young, handsome and disarming as Sestero is, it is painfully obvious that the single most important ingredient for an actor is missing: confidence. Wiseau is something else. When his turn comes, he keeps repeating the one name that is among the best known in stage plays, ""Estella!"" as uttered by Stanley Kowalski in ""A streetcar named Desire"". Wiseau seems to be making a career out of this one word, spitting it out using an assortment of equally incomprehensible expressions and body movements which includes climbing up the side of the stage in the style of Caesar (""Planet of the Apes"" rebooted series). One person (the only one, most likely) witnessing this outburst is impressed. After class, Sestero approaches Wiseau asking for help in acting. The next thing we know, the two become friends and comrades, heading out to L.A. in a quest to fulfill their dreams and aspirations in the film industry.After an energetic start, while Sestero at least manages to get himself signed by an agent (but with no ensuing action), Wiseau is a complete washout. What follows is the meat of ""The disaster artists"": recreating the drama of the making of ""The room"", a project that Wiseau undertakes, financed by what seems an inexhaustible source of funds available to him. The rest is history. The ""The room"" was a total flop at initial release but managed to acquire a new life as a minor cult.
 
It is about time James Franco wins a major award as he did here with the acting (he also directed ""The disaster artist""). There are several concurrent Golden-Globe-honored movies with portrayals of real life persons, the success of which requires the actor to dematerialize himself/herself and inhabit the character. Gary Oldman is stunning with Churchill, won, and will no doubt go on with a clean sweep of all best actor awards all the way to March 4 (Oscar). Emma Stone did not win with Billie Jean King but did a commendable job. Franco shares Oldman's honor by his own win in the ""Comedy/Musical"" category here, fully deserving. Fortunate for him that Golden Globe has this category. Franco plays Wiseau with gusto and fun, leaving out the Dark Side of The Force in Wiseau, a wise decision.Brother Dave Franco as an easier job of playing a normal person, which he discharged with honor. The rest of the cast includes some familiar faces which are a delight to behold. Seth Rogen plays the straight-face, business-serious script supervisor. Jackie Weaver is in a couple of scene stealing cameos as one of the actors engaged for ""The room"". A little more than a cameo, playing another actor, is Josh Hutcherson whose face is impossible to miss after his ""Hunger Game"" and ""Journey"" movie franchises appearance. A big bonus is the epilogue which shows a dozen scenes on making ""The room"" as seen earlier. Now you see these scene again, a split screen parallel with the original scene from ""The room"". The meticulous re-creation (dialogue, acting, and down to every detail under the Art Direction department) of these scenes will take your breath away as well as hit you with an uncanniness that is almost creepy. I don't remember seeing this done anywhere else, and cannot help thinking what something like this will look like for ""Psycho"" (1998), Gus Van Sant's re-ake that purportedly replicated the original shot-by-shot."
42,The Disaster Artist,8,13 January 2018,James Franco's Ed Wood,"Funny recreation of what happen before, during and after the shooting of one of the officially worst pictures of all times, that became successful after gaining enormous cult status. It is James Franco's ""Ed Wood"" and it really does work as a modern times ""Ed Wood"" and does not really hide behind the classic Tim Burton film.
The film is slick, funny with many dramatic undertones. Its a great film about friendship, trust and the desire to be popular and loved. In that sense it is a film with topics that are relevant to pretty much everybody, even if everybody is not as freaky, weird and eccentric as Tommy Wiseau. James Franco fantastically takes on that role and gives one of the best performances of his career. He really turned into him and perfectly adapted his mannerisms. If that character appeared in any other film you probably would doom it to be unbelievable, but its a person that truly exists and Franco marvelously pays tribute to this cult personality. It is also one of Franco'S best directional efforts as I was never a big fan of his films before. His brother Dave Franco is extremely underrated for his turn as Greg Sestero. Its a strong character and Dave Franco plays it with such a gray self confidence and persuasion. His best performance to day. Seth Rogen had a fun supporting part. Some really good cameos by Sharon Stone, Bryan Cranston and many others. 
A light movie that hides a tragic human story beneath."
43,The Disaster Artist,10,11 January 2018,Fantastic,"I must be honest when I say I have never seen ""The Room"" and when watching this movie I though plenty of times about how I wouldn't be able to get some of the jokes and events that are occurring. But by the end of the movie, I realized I didn't need to, I loved this movie, and it is the best film I saw of 2017. First of all, there is James Franco, who kills it in this movie, you can tell that he has respect for Tommy Wiseau in his performance and how he wants to be as accurate as possible in this performance. I felt like he was actually Wiseau himself. The rest of the performances are phenomenal as well. Dave Franco, Seth Rogen, and all of the rest of the cast are great at what they do. However what also must be stated is the content of the movie itself, because when you look back at the reputation of ""The Room"" and how this movie was made, you realize how easy this movie could have been made. It would've been so easy to take cheap shots at Wiseau and bash on the room by saying how it is going to be so bad and how it ended up being that bad, but the movie doesn't do that. The movie goes in the direction of the why of Wiseau, about how he was not accepted by most of society and decides to make a movie to prove to everybody that he is worth something, which is a really powerful message. Granted, you do get some laughs in this movie, because the movie does highlight the absurd production process of the film, but this movie has layers, and when given these layers, you not only a have comedy telling the stories of production, but you have a heartwarming tale of friendship, struggle, success, and ultimately acceptance, and you walk out of the theater liking the movie more as you think about it. This was the best film I saw in 2017. 10/10"
