,title,stars,date,r_title,text
69,Trolls,4,30 October 2017,Can't Scrapbook Your Way Out of This,"Trolls was not that great. Definitely not one of Dreamworks' better films. The troll characters were adorable, but a bit over the top. There wasn't any attempt of characterization with anyone except the two main trolls. The rest were just filler and background noise. Making their personalities super happy and hyper was fitting for the quirky dolls I grew up with in the 1990s, but the dialogue and story were so badly developed that the whole movie lacked the entertaining aspects it should have had. Not even the villains were interesting. I couldn't even tell you their names. The animation was done really well (no surprise as Dreamworks is great). Making the environments look like arts and crafts, with felt textures, glitter and sewing, was a neat way to build the world, even if it looked cartoonish at times. The scrapbooking was super cute. I loved that Poppy made elaborate cards for all occasions (or just because). It resulted in some funny situations. It did feel like Dreamworks tried to make up for the bad story by making the imagery really busy as a distraction, and that didn't help the situation.I was expecting original music, and was a bit disappointed to find out that the songs were mainly mash-ups of popular hits. With the exception of a few, not even very good hits. Justin Timberlake's voice was wasted in this. He only got one song, but it was one of the better ones in the movie.Overall, I probably wouldn't watch this movie again."
70,Trolls,10,28 October 2017,This movie is a masterpiece,"this is the best movie ever and I am really surprised how this movie rating is so low, it should be given an eight out of ten in my opinion.It should also win an Oscar.It's that kind of impressive animation which makes u happy, delightful and confident on a gloomy day.This movie gives you hope, positivity to never give up. anyone's mood will be cheerful after watching this wonderful animated movie. please do watch, highly recommended."
71,Trolls,10,18 October 2017,Best movie ever made!,Trolls is like one big huge party all the time. Princess Poppy is such an amazing troll that I aspire to be like. There was not one second that I was not enjoying. I watch the movie at least twice a week. Branch is such a crucial part and how his character develops through out the movie is admirable at the least. Trolls is truly a cinematic piece of excellence! :)
72,Trolls,10,17 October 2017,Suggestion to producer,"I hope the producer of this movie reads this, I think you should make a Trolls 2 and it should have Poppy and Branch falling in love and getting married and tell a story about Poppy getting kiddnapped by the same spider creatures that she fell in the web of in the first one and then Branch rescues her and then poppy gets pregnant and has troll babies with Branch but make it like Trolls 3 for that part. :)"
73,Trolls,,17 October 2017,Trolls are good for kids,"The movie Trolls, directed by Mike Mitchell and Walt Dohrn, teaches young children that everyone can be happy and that you can be accepted for who you are. Bergens, the bad guys in the movie, believe that in order to find happiness you need to eat a troll. Once a year, they celebrate Trollstice where one Bergen is selected to eat a troll. Anna Kendrick stars as Poppy, the Queen of the Trolls and the happiest troll, who goes out on an adventure to save her friends that have been stolen by the hungry Bergens. Along the way, there is one Bergen named Bridget, played by Zooey Deschanel, who is love with King Gristle Jr.. Poppy tells Bridget that she can get the king to notice her in return for her friends freedom. Children should watch Trolls because it demonstrates happiness, courage, and teamwork as Poppy and her overly-cautious friend Branch, played by Justin Timberlake, go out on an adventure to save their friends.Poppy demonstrates a tremendous amount of courage in this movie. Poppy is given the responsibility of leading the Trolls just as her father once did. As the new queen, she is ready to take on the challenge of leading the tribe. Believing that they were safe from the Bergens, they threw a big, loud party with music. However, the cook for the Bergens found them capturing a handful of them to prepare for the King. Poppy knew that this was her fault and took on the responsibility to make up for what she had done. She went off to rescue her friends even though she was alone, but her positive and courageous spirit was enough to keep her going. Today, people should believe that when they put their mind to something they can achieve what may seem like the impossible.Even though Poppy's courage pushed her to rescue her friends, her friend Branch decided to help her on this crazy mission demonstrating the power of teamwork. Branch is the troll that is always finding ways to protect himself from the Bergens. Whether it's from numerous traps to always moving to another spot, he is constantly living in fear. He made the decision to step up and go off with Poppy in her efforts to save the other trolls. When Poppy and Branch reach the town where the Bergens live, they meet the sweetest Bergen of all named Bridget. The trolls help Bridget the Bergen catch King Gristle Jr.'s attention. In order to do this, Poppy needs the help of everyone who has been locked up by the cook. It isn't easy, but Bridget the Bergen is successfully given a troll makeover where she is dressed with a pink and brown jumpsuit and rainbow hair. Immediately catching King Gristle Jr.'s attention, Bridget goes on a date with him.This movie demonstrates that happiness can be found inside of everyone. Branch is the sad troll that had to witness his whole family being eaten by the Bergens when he was little. He thought that he would never be able to be happy again, but with the help of Poppy he is able to get his color back and start singing again. Queen Poppy also teaches the Bergens that eating a troll is not the only way to find happiness. As Bridget joins King Gristle Jr. on a roller skate and pizza date, they find happiness together. Since the date was so successful, King Gristle Jr. is sad when she has to leave because he's never felt so much joy inside. After the date, Bridget is so happy and cannot believe that the king went on a date with her. At the end of the movie, the Trolls and the Bergens are found singing and dancing together proving that everyone, even previous enemies, can be happy no matter what.This movie should be watched by children of all ages. It teaches youth valuable lessons that can be carried on with them throughout their entire lives. Sometimes people may lack courage, but with a little help from a close friend it may be easier to find it. Teamwork is used throughout our whole lives. From school to work and even sports, working together can make the job easier and even more fun. Happiness can be found inside everyone's heart, but it's just a matter of how we control our emotions and feelings. People can choose to keep that happiness within and display hate or anger instead. All in all, this movie is a fun way to instill important characteristics into a child and should be watched by children of all ages."
74,Trolls,8,16 October 2017,Exactly As Expected,"(Flash Review)These tiny little Trolls are full of gleeful jubilee, smiles and hugs who live carefree lives except for one gigantic fear; the Bergens. The Bergens believe the only way to feel happy is by eating Trolls. The Trolls have recently retreated to a land far from the Bergans. Now the Bergans are sad as a society. One Bergan catches wind of the Trolls location and now their village is in jeopardy. In additional to that storyline, there is one Troll named Branch who refuses to sing, dance or give hugs, which Princess Poppy tries to remedy. Will the Trolls escape the Bergans? Will Branch ever find happiness? There are a few other story lines but overall the story at times of filled with swirling and bursting colors, chases, some decent humor, some moral lessons as well as several singing numbers all of which little kids will enjoy. Young kids may be unnerved by Trolls in peril. Not as deep a story as Toy Story or Inside Out but still a fun movies to enjoy with kids."
75,Trolls,7,4 October 2017,Do you have a shred of inner child?  Or not?,"I am a 70 year old male who spent most of the last two months visiting family including my grandsons-in-law, ages 1 and 3. During the last week, Trolls was on endless rewind from morning until they went to bed. I paid little attention to it until I happened to hear/watch ""True Colors"". Later that day I sat down with the boys and watched it with them.So here I am reading all the IMDb comments on the value or lack there-of in this movie. The low-star crowd, have much to say, pages of words, about its lack of complexity, value, maturity, blah blah blah. I got here by way of looking up Cindi Lauper's song, which happens at the crux of the film, a song that is all about, ""Do you know who you are?"" and ""Do you know that I care?""So all you Burg dwellers, who are you? What do you care about? When was the last time you actually looked at a deep blue sky and multi-shaded clouds or the moon and stars? When was the last time you really listened to someone you care about? Or do you get all your happiness from your fancy car or McMansion? I know, I will rewrite Trolls to be more ""realistic"". That ought to cheer everyone up!Branch arrives a few seconds too late to save Poppy but decides to see if any of the captives are still alive. He arrives a few seconds too late to save them too but stumbles across the king's cape-bauble and frees Creek. The two of them head back and gives the Trolls the sad news. All turn gray and wait to die. But between Branch and Creek (who ""cOhmmmms"" them back to some semblance of self preservation) they all leave the area. Generations pass and the Bergens discover dentistry, skin care and barber shops and are not quite so disgusting looking. But inside they are as clueless and ugly as ever. The old myth about eating trolls fades into obscurity and they never figure out how to be happy on their own. They spread their dirty little town into cities of filth and coal dust to drive their trains and steam cars. They build roads and highways and spread their ""civilization"" to all ends of the planet.In the meantime, the Trolls, still gray, find that if they are quick and clever, they can make a decent living by stealing food and pretty baubles from the Bergens. Before he died of old age, Creek founded a religion, which was just as cynical and self-serving as he secretly was and his priests live off donations from the other Trolls.Just about the time that every square inch of the Bergen planet is covered in asphalt and every inch of sky is obscured by gray clouds of smog and coal dust; every plant dies from lack of sun and water, the seas turn to pink/gray muck from a super bloom of algae and the temperature climbs to 300 degrees which results in everyone and everything dying a horrible death.The EndIt's a kid movie! Get over it! Is it great? Well, it's not Casablanca or The Big Chill or Citizen Kane (Thank Goodness). But yeah, I liked it. And I think that anyone who has a shred of inner child left will like it too. Grownups! Phegh!* * * * * * IMDb. I realize that the following may get me kicked off but...Since my post, I have had a chance to watch my own TV and discover what's going on in the real world. My little attempt at satire is a little to close to comfort. Why am I surprised to find that the Bergens really are in charge and nobody seems to be able or willing to do anything about it? I stand by my original statement.Groan-ups! Phegh! Phegh! Double Phegh!"
76,Trolls,7,12 September 2017,Cuuute!,"This animation from DreamWorks really got me into it! Although I'm not a huge fan of this genre, there is something about this movie I do appreciate: the scenes full of joy and happiness which create a delightful atmosphere, the little trolls who make everyone smile and laugh and, of course, the fact that it has some music into it, which makes it a great musical, also. It's a kid's movie, I admit, but hey, there's plenty of room for others like me and you, who are a bit ""older"" to enjoy it and have fun watching it. So, what are you waiting for? Go see it!"
77,Trolls,3,3 September 2017,Hollywood must believe children have lost their ears and brains,"I just don't know what to think anymore. The only way this movie would be good is if you were on a lot of drugs because then all the colors might look mystifying. Otherwise it was horrid. The voice acting was laughable. I don't get how someone would hire Justin Timberlake again after the Shrek sequel he was in. Apparently, displaying that you're awful at voice acting does not keep you from getting voice acting roles. Yet, he is cringe-inducing again. As he has before, his lines sound like they're being read, not said. The script panders way too obviously. It's pretty much only written to get a LGBT endorsement so that nobody can say it's a bad film or else they will be tarred and feathered in public. Due to this, it loses all artistic credibility instantly and becomes another failed PC bandwagon movie."
78,Trolls,6,29 August 2017,An animation only for kids,"After escaping the infamous Trollstice, a tradition among Bergens which meant eating a troll in order to be happy, the cutesy and happy trolls are once again discovered by their nemesis. As some of them were captured, princess Poppy sets out to rescue them, accompanied by a sad and grumpy Branch which had a troubled childhood.This beautifully animated film depicts the musical adventures of two trolls who attempt to rescue their kind from extinction, while discovering the world and each other's difficult character. It's a very simplistic movie, which seems to be intended only for kids, or at least under 12, because the main characters behave just like them, or in some cases, even like spoiled brats. They are full of colors, dance and joy, leaving the plot and the action way behind. It's extremely predictable and boring, the only thing which saves it from the misery being the animation which is flawless and its music, which seems to be the cure for everything.It is really sad when you see such a film which can be much better that what was achieved here, fall into obscurity because the producers didn't know that even an animation requires a decent plot in order to be good. Even more surprising is the fact that it comes from people who directed Shrek, which simply cannot be compared to this one. It's a below average animation which unfortunately can only be enjoyed by kids."
79,Trolls,7,22 August 2017,Really good fun for kids and adults,"As with some other kids movies especially Frozen, I thought this was going to be a hour and a half of pain and suffering. To my surprise after watching it with my 2 and 4 year old, I was pleasantly surprised at what fun it is. OK not an original story but the pace of the film, bright and good animation with catchy songs puts a smile on your face. For those who are saying they don't get it, lack of plot and seen if all before, I would say; cheer up, life is too short to be a bloody misery. Good clean fun!Ps - might of given it an 8"
80,Trolls,10,5 August 2017,"Dreamworks, you still got it! :D","This film was awesome! I've seen this multiple times after buying it on DVD! This films still remains awesome after watching it over and over again!The music is this movie was really catchy and excellent and the characters were great and the acting and story line was again.... great! This movie is up there with my favorite movie Sing. However, Sing still takes the lead but this doesn't mean that this movie is not great!Overall, this movie was amazing and had great music and.... everything about this was great!10/10"
81,Trolls,10,29 July 2017,My Heart Swelled,"Maybe it was time for this GROWNUP to have a good cry about something important; like love. I have watched this movie three times with my grandson; maybe not ALL of it but most. The music is on point and the message is awesome. I recommend for anyone who wants to laugh, cry and hope."
82,Trolls,10,28 July 2017,Fantastic movie with a wonderful message!!!,"This is by far one of the best animated movies I've ever watched. It is creative, funny, colorful, and above all it has an important message..... happiness lies within! We don't need things (trolls) to make us happy, simple things like dancing, singing, and hugs can make us happy. It's a very moving movie if you think about the real meaning behind the movie. The music is fantastic, me, and my 1 and 3 year old daughters dance throughout the movie in our living room. This movie makes us happy! Thank you Dreamworks Animation!!!!!!!!!"
83,Trolls,4,18 July 2017,"Trolls is a pretty adorable movie, but it has little else going for it.","There's been a weird trend recently of companies making uninspired movies about nostalgic toys: we had Battleship a few years back, and the Transformers series has been a huge hit, so now we've got Trolls. Why is there a movie about brightly colored toys from the '60s? Sure this isn't as bad as The Smurfs, but it's nothing special.Trolls is a simple adventure movie starring the cheery Princess Peppy (Anna Kendrick) and downer Branch (Justin Timberlake). When a group of trolls is captured to be eaten by the evil Bergens, our leads set out to rescue them, and you can guess the rest of the story.Just about everything is bright and adorable, and the plot is punctuated with pop songs that range from Justin Timberlake to Earth, Wind & Fire. There are a couple original songs as well  my favorite is written by the duo behind last year's La La Land and Broadway's Dear Evan Hansen  and the big show-stopper is without a doubt the ubiquitous ""Can't Stop The Feeling!"".Despite featuring a whole lot of songs, though, Trolls is hardly a good musical. Very little of the music contributes to the story itself, and your enjoyment of the songs will come more from recognizing them than from their quality or what they accomplish for the story and characters. While this can work in another film, Trolls simply isn't strong enough to support itself under threat of its viewers thinking of something else. If you're not pulled in by the bright colors and flashy musical numbers, you'll sit there bored until you notice that you're only about 20 minutes in.It may appear unreasonable for me to care much about the quality of a kids' movie like this, but I want to hold DreamWorks Animation to a higher standard. They have put out some great work; their second film ever, The Prince of Egypt, features some of the best animation that I've seen in a movie, and the How To Train Your Dragon series has provided some of the best reasons for us to continue paying for 3D theater tickets. DreamWorks has been very hit-and-miss lately with their releases, though, and I would call this one a miss. Movies like Trolls, as well as Home from the year before it, just look lazy in comparison to what the studio can make.Overall, Trolls is innocent enough and is a fine movie to put on in front of kids; they'll be entertained by the colorful visuals, and it has a fine enough moral. You won't find much in terms of quality, though, and the movie ends up feeling about as plastic as the toys it is based on."
84,Trolls,7,6 July 2017,Trolls,"Everyone recognises the popular toy Troll dolls created by Thomas Dam, launched in 1959, becoming a fad craze again in the 1980s and 1990s, most popularly as pencil toppers, well it was only a matter of time before they were given a makeover and turned into a movie. Basically Trolls are small creatures living in almost everlasting happiness, singing, dancing and hugging all day, while the large creatures the Bergens can never feel happy, they only discover that devouring a Troll can make them for happy for a moment. The Bergens hold an annual festival, called Trollstice, for all Bergens to gets its feeling of happiness, caging Trolls ready to be eaten, but the Trolls escape through underground tunnels, on the day that Bergen Prince Gristle Jr. would eat his first Troll. Twenty years later, the daughter of troll leader King Peppy (Jeffrey Tambor), the extremely happy and optimistic troll Princess Poppy (Anna Kendrick), throws a big party to celebrate the Trolls' escape, but grey troll Branch (Justin Timberlake), who has a secret crush on Poppy, warns that the loud parties will attract the Bergens. Branch's fears come true when Chef (Christine Baranski), who was banished from Bergen Town all those years ago, sees the Trolls' fireworks, and captures numbers of them, Poppy and others manage to hide, but none of the other Trolls dare to venture into Bergen Town to rescue their friends. Poppy initially goes to save the captured Trolls alone, but a reluctant Branch accompanies her, when they reach Bergen Town, the Bergens are preparing to hold Trollstice that night, they witness Troll hostage Creek (Russell Brand) apparently get eaten by now King Gristle Jr. (Christopher Mintz-Plasse), but Poppy is hopeful he survived. The rest of the Troll captives are being guarded by Bergen scullery maid named Bridget (Zooey Deschanel), who Poppy and Branch discover is in love with Gristle Jr., they strike a deal with her: if she helps to free them and confirm if Creek is alive, they will help her get a date with Gristle Jr. While setting Bridget up for a date, Poppy argues with Branch who refuses to sing, he reveals that as a child he caused his grandmother to be killed after Chef found him because of his singing, he has blamed himself ever since, causing his colour to turn from blue to grey, Poppy comforts him, and Branch reluctantly agrees to help Bridget and the trolls. Using their colourful long hair, the trolls transform and disguise Bridget into Lady Glitter Sparkles, gaining the attention of Gristle Jr., they date at an arcade restaurant and roller rink, he asks her to be his ""plus one"" at Trollstice, and mentions Creek, who is alive and being held captive. Returning to Bridget's room, Bridget asks the Trolls if they can help disguise her as Lady Glitter Sparkles at Trollstice, but make her cry refusing because they can no longer help, the Trolls leave and attempt to rescue Creek. The Trolls are then captured by Chef, they are shocked to discover Creek had agreed with the Bergens to help them capture the rest of the Trolls, in exchange for not being eaten himself, Creek returns to the Troll village and uses a cowbell to bring out the rest of the hiding Trolls to be captured by Chef and the other Bergen cooks. With all the Trolls captured and soon to be eaten, Poppy loses all hope, she and the other Trolls turn grey, but Branch, who has been typically grumpy, sings for Poppy to cheer her up, and through the song confesses his love for her, singing together all the colours of the Trolls are restored, including Branch himself. Bridget is ready to sacrifice herself to save her the Trolls, before they can be served, but Poppy does not want to abandon her Bergen friend, Poppy reveals that Bridget was Lady Glitter Sparkles, and says that Bergens don't need to eat Trolls to be happy, as Bridget and Gristle Jr. found happiness, they all participate in a sing and dance with the Trolls, making them feel happy. Chef refuses to accept the peace, and tries to kill Poppy and Branch, but is sent rolling out of Bergen Town, with Creek, later to be eaten by a giant creature underneath them, while the Trolls and the Bergens agree to live in peace, Poppy is crowned Queen of the Trolls, and she and Branch share a romantic hug. Also starring John Cleese as King Gristle Sr., Gwen Stefani as DJ Suki and James Corden as Biggie. Timberlake and Kendrick are well chosen voicing and singing, as are the supporting cast members, DreamWorks purchased the Trolls brand and turned the Danish creatures into less ugly and more colourful critters, obviously nothing to do with the ones in the Billy Goats Gruff fairytale, the result is a visually scrumptious and upbeat experience, featuring a surprisingly great soundtrack of songs, including the fantastic Oscar and Golden Globe nominated song ""Can't Stop the Feeling"" by Justin Timberlake, a most enjoyable family animated musical adventure. Very good!"
85,Trolls,,26 June 2017,Bergens can only be happy with a little Troll in their stomachs.,"My wife and I watched this at home on BluRay from our public library. As usual the picture and sound on BD are first-rate.This is basically one long animated cartoon, almost 90 minutes long. It features a number of good singers and voice actors. The story is simple, the Troll village is near the Bergens. If we assume the Bergens are about the size of humans then the Trolls are about the size of a small Canary. The Bergens are perpetually grumpy until Trollstice (like Solstice) when they can catch and eat a Troll. But the Trolls are brightly colored and perpetually happy and in fact do a group hug every hour.When the Trolls get too happy and celebratory, and attract the attention of the Bergins, they have to escape underground but one of their friends gets captured. So most of the rest of the movie has them planning a mission back to the Bergens to bring their friend home before he is eaten.The main happy Troll is played by Anna Kendrick as Poppy, her childlike speaking and singing voice is ideal for this. And grumpy Troll is played by Justin Timberlake as Branch, who had lost his mother because of his singing so now vowed to never sing again. This animated movie is relatively entertaining but quickly forgettable."
