,title,stars,date,r_title,text
110,Trolls,5,2 February 2017,"Sorry to be a 'Troll', but...","Just the other day, I was debating with myself: why don't I enjoy the film Groundhog Day anywhere near as much as I used to? Bill Murray is hilarious, the plot is hugely original, so could my problem be?Then the reason became clear: It's the ending. Isn't Murray far more appealing as the sarcastic, wise-crack jerk he is at the start, than the all-loving, all-generous good Samaritan he is by the movie's close? No wonder I always turn it off twenty minutes from the end when I rewatch it... the dilution of this sardonic icon into a walking, talking Care Bear is too much for my fragile brain to endure.Now we have Trolls, which has a similarly detached individual, in an animated picture full of hugging, dancing, and unbearably cheesy songs (both original, and covers). Guess what? He's the only tolerable one among these big-haired, auto-tuned, singing little munchkins... So, I wonder what'll happen to him...Yep, it's Groundhog Day all over again (pun intended) as sweetness and rainbows are GOOD, and sarcasm and cynicism are BAD. Pur-lease. The same tragic brainwashing even befalls to a group of fierce ogres, who have their nice, metropolitan cityscape transformed into a garish, multi-coloured nightmare. I hope they have sunglasses for when they wake up every morning.So, the upshot is: You can keep your glitter-pooping trolls and your break-dancing ogres, I'll stick with the REAL interpretation of those monsters e.g The ones that live under the bridge, and the ones that'll break your bones to make their bread. Or, something. If that means I walk about with a raincloud over my head forever, so be it. Far more preferable than being a happy-clappy, hippy conformist, any day. I'm off to change my surname to 'Meldrew'. Ciao! ;) 5/10"
111,Trolls,,22 January 2017,A contagiously happy film,"This animation tells the imaginary story, where tiny trolls live very happy lives. They get hunted down by unhappy giants called Bergens, and these Bergens believe that they can only become happy after eating a troll.There can hardly be a happier film than ""Trolls""! The palette is super bright and colourful, which brings out happiness in people already! Then, the constant singing of popular songs augments the feel good factor. The cute and cuddly characters bursts into spontaneous dances and giving each other hugs. It just emanates fun, joy and bliss. The plot is simple, but effective in delivering happiness. I enjoyed watching it."
112,Trolls,10,10 January 2017,Great movie for kids.,"It absolutely sickens me for grown adults to rate this movie solely based off what they think. It's an animated movie geared forwards kids, and mine absolutely love it. It's a musical which you would expect since Justin Timeberlake and Annna Kendrick are the 2 leads. Every now and then, a somewhat sexual innuendo will pop up but honestly it took me a few times to watch it in order to catch them. While I may be sick of, simply because my 3 year old refuses to watch anything else, it's actually a cute little movie and keeps the kids entertained. I recommend parents show this their children and just hope they don't get as addicted to it as mine have."
113,Trolls,7,5 January 2017,Family fun,"Trolls is not the best animated movie out there, nor the most original plot out there, nor has the most outrageous characters out there. However, Trolls is family fun and has both fun and heart. The main thing is that the movie doesn't pretend to be anything or take itself seriously.The message is simple but powerful: there is always a reason to smile and be happy, even in the saddest moments you can find a glimpse of light to lift you up. Some people are grumpy because they are sad inside. Your people is important, so you care for and take care of them.The movie is gorgeous regarding coloring and texturing.The characters are likable, albeit a bit simplistic. Not original because, well, these trolls have been around since I was a kid, some decades ago.Some of the scenes are very funny! There is adventure, comedy, cheekiness, music, funny villains, dancing, singing, farting, some tears, and what's not.The music is lovely and uplifting. Justin Timberlake has done at great job at selecting the music score and composing the main theme of the film. Both Timberlake and Kendrick are lovely in their respective roles.I watched this movie during one of those cry sessions where the cinema is full of kids. Most small children didn't get the jokes in the story, so I think that the movie is suited for 6y.o+ and adults. Most adults there had a ball and laughed as much or more as their kids.To be completely fair, this is one of those movies that you can grab in DVD or BR and watch it at home if you have a tight budget and need to prioritize what you see in the cinema."
114,Trolls,10,31 December 2016,Great Movie for Kids and Adults,"When I was growing up, all you would see were Disney movies full of songs and while there was the odd good song, often it was just twenty minutes of rubbish music for the rest of the cartoon.Now ever since Pixar took over, the singing stopped or greatly decreased(thank god!) So seeing a movie full of song again, i was apprehensive.The good news is, there is something in it for adults too. Its an endearing movie with lots of classics from 70s and 80s. I loved it, my husband loved it(though not so much on tenth watch) and my two girls (5 and 2) love it.Its been a while since I enjoyed a cartoon as much, probably UP was the last one."
115,Trolls,8,23 December 2016,Worth every penny,"If you are not sure whether you like this or don't like this, then please crawl back under that rock you crawled out of and find your spine.This is a Merry Poppins type movie with trolls - not just entertaining but morally educational too, for children and adults alike. It's just a great watch. The idea is original, the singing and music are uplifting, and the plot is great.Money well spent to watch this on the big screen and money well spent for the DVD. It's refreshing and it's one of those movies you can watch a few times without getting bored of it.This movie deserves a better rating. Everyone involved in making this movie deserves an Oscar. Full stop."
116,Trolls,6,22 December 2016,Pretty good for a kids movie,"Surprisingly good! I had really low expectations for this movie as it really did look like it was going to be an extremely generic 'kids flick designed solely for entertaining your children for an hour' in trailers. And to some extent, yeah, it was- but it offered some extremely original visuals. If you're a person who appreciates good design, this movie had a surprisingly unique aesthetic, giving everything a fabric effect and using creative ways to turn it into a visually pleasing and colourful world. It was also surprisingly funny. A few predictable jokes, but otherwise some clever stuff. I found myself laughing out loud a few times.The plot was extremely predictable, however, and the songs got a little annoying in places. It's no masterpiece by any long shot, but it's good. Might be a little difficult for young boys to get on board with, but it's an easy hit for girls, and adults might enjoy it a little too. At least, more-so than being made to watch your usual generic stuff like the Tinker Bell or Minions movies."
117,Trolls,10,6 December 2016,"Best of the little kids movies (Disney, Nick, etc.)","My kids (son and daughter) both LOVED this movie. Finding Dory was cute, but my kids lost interest midway through the movie because the Disney movies tend to have boring moments. Trolls was different!!This was very interesting throughout its entirety. My kids were engaged, and so were other kids in the theater. Every kid started to dance when the songs came on, and even I wanted to dance because I knew the songs too. Very smart to use songs that appeal to both adults and kids. I liked the underlining message from the movie, and loved the colors too! Justin and Anna did a great job with Poppy and Branch. We can't wait to own the movie because it was that good. Honestly, we can't wait for a Trolls 2, so I hope that was already mentioned. :)!!!!!"
118,Trolls,10,27 November 2016,All Cupcakes and Rainbows!,"Took my 7 year old niece and expected it to be another boring kid's movie. This movie was fun, entertaining and had a decent story line too.Sort of like Cinderella with a modern twist but don't be fooled. There are many hidden messages adults will find quite deep and meaningful.But of course, you have to like music, singing and hugs because this is the basic premise of troll happiness. Which is really a metaphor for life.Trolls teaches children and adults what happens when we look outside ourselves for true happiness. It teaches us the difference between ""fake"" inner peace and true self acceptance.It also show us what happens when we choose to focus on what we lack rather than what we can appreciate in the moment.Of course it's all cupcakes and rainbows, so what? Trolls show us what happens when we decide to look at the world through a drab dreary grey lens. It gets depressing and boring. Sound familiar?I personally would rather live in a troll world where singing, dancing and hugs are the key to happiness, abundance and bliss. I guess we were the lucky ones! We shared a great theatre experience where all patrons were singing, swaying and doing a little toe tapping as the end credits rolled by. Children and inner children will love this movie! Highly recommended to kick off the holiday season."
119,Trolls,7,20 November 2016,"""True happiness is a lot closer than you think.""","Surrounded by four kids and their Moms, this guy got shanghaied into seeing the flick as a birthday excursion for my eight year old granddaughter. The bonus by the way for being eight these days is no more car seats! Anyway, it was a fun afternoon, as the kids enjoyed themselves with their over-sized bucket of popcorn. The movie is certainly colorful, with a somewhat Cinderella flavor to it with the story of Bridget and her infatuation with Bergen King Gristle. Helping advance the cause is the eternally optimistic Troll Princess Poppy who's goal starts out as a rescue mission for the kidnapped Creek, surreptitiously hidden in Gristle's amulet. The 'true happiness' tome comes into play any number of times, but definitely as a cure for Troll Branch's malady, having lost his grandma once upon a time to an enemy Bergen. In all my years of troll lore, I've never come across a reference to a Bergen, so I don't know if that was made up for the picture or not, but I guess they had to come up with something for the bad guys. There's lots of cute stuff interjected into the story with things like the summer 'trollstice' and Lady Glitter Sparkle, and I had to chuckle at one point when I wanted to blurt out to Poppy - 'More cowbell'!"
120,Trolls,7,17 November 2016,"that it's colorful is one thing, but it's funny too and has a good (if not groundbreaking) message","Maybe it was because this has been one of the worst weeks of my life; maybe it was because I missed seeing creatures, even if they were CGI animated creations from Dreamworks, that were out of Jim Henson's creature shop (one could say that the mix of very tiny and cute mixed with a fantsy quest that involves some magical overtones has hints of Fraggle Rock and Labyrinth); maybe it was because I needed some silly pop song renditions by a bunch of overly cute, rainbow-psychedelically colored thing. Whatever it was, Trolls actually did it for me, up to a point. As an adult it was delightful and cheerful, and for kids I can guess it's like getting a bowl of the most awesome tasty scrumdidliumtous cereal of the day: it'll taste great and surgary for now, and then later it'll be time to eat vegetables.It's not that I don't have criticisms of it as a movie, I know I do: the pacing near the end gets extremely lax - there's no real final big blow-out against the villain, it's borderline a cop-out because, frankly, how would we buy all of these tiny trolls defeating this bad witch of a villain (not the goblin king, who's a likable dunce, but the woman at her ear trying to get him to have ""Trollstice"" so all the trolls in the kingdom can be eaten for the sake of 'happiness') outside of the power of jubilant and over the top singing of a recent pop hit (in this case that earworm ""Dance Dance Dance"" or whatever it's called). And at other points, like a convenient moment a character goes turncoat to do that ratting-out-the-good-guys part that has been seen in countless movies, the filmmakers go into formula.But what's successful to me about this is the energy, the color, the total glee and joy that is apparent with these filmmakers (and don't forget what Truffaut said, that it's crucial to see either total joy or pain when seeing what the creative process must have been like), and I think that these creators set out to make a silly-smart musical comedy and succeeded. You might get some deep lesson from it about why it's important to be happy, and to that end I'm sure it'll never be as strong as something like Inside Out, which is also about emotional fulfillment and goes into terrain that pushes expectations by embracing sadness. This doesn't do that so much, though at the least it does acknowledge that trolls like the main guy troll Branch (the one voiced by Timberlake) should understandably feel sad and betrayed by the world they're in if total shock and tragedy comes upon them.I think it may also be a law of low expectations, which I had going in. I was simply hoping to get some vibrant colors and maybe some good voice work. What I got was more than that in the writing, which was very quick and clever and got in with a good joke or line or reaction from a character and didn't stay too long, and the animations in the songs is wildly creative and matches the jubilant tone of the movie: when the main girl Troll Poppy (Kendrick, duh) sings her first song when going on the quest to save the other trolls, the animators keep changing things up and moving along the story (somewhat) and by adding jokes it certainly never makes things dull. And I liked the whole part of the story with the lowly servant goblin girl who has a quasi-kinda-sorta Cinderella thing, only here it actually makes more sense than (dare I say) an actual Cinderella story usually does.But most of all, it's funny, and not just a 'oh that's cute' way, but in the way that set ups and pay-offs and genuinely clever, snappy dialog can get laughs from me. So if you got a kid or are a kid, this is not high art, but you'll watch it about 50 times. And if you're an adult, you might find yourself watching it with them, maybe more than the requisite once to get them to be quiet. This was a fun trip!"
121,Trolls,6,12 November 2016,Trollin' towards happiness,"""Trolls"" is exactly what the title says: a film about trolls, namely the little toy figures that have been really popular for quite a while now. So if there is anything surprising about this film, then it is how long it took to finally be made. But now is the time, in 2016. The makers (quite a few) have a great deal of experience when it comes to animation filmmaking as they worked on stuff like Shrek, Spongebob, Kung Fu Panda or Madagascar in the past already. And their collaboration here results in another mentionable achievement that adds quality to their body of work. The comedy works for the most part and the drama and emotion sometimes does as well, drama for example is really great at the moment the troll colors change and we hear the male ""hero"" sing again for the first time. In my opinion, the latter is really the crucial factor to determine nowadays how good and worth watching an animated film can be considered. Comedy and animation are at such a high level these days at animated films that these areas can almost be taken for granted, even if they maybe shouldn't and we could be more grateful for the quality we get there.Anyway, the heroes here are Poppy and Branch, voices by Anna Kendrick and Justin Timberlake. There are more known names in the voice cast here, but I will not mention these as you can check them out in the cast list yourself. Anyway, mentioning these two already tells you that there is a big musical component in here and yes, there are several music numbers included from start to finish, certainly more than you usually get in an animated film and singing being a crucial component of troll life is depicted this way. But it is not just about the trolls, it is also about their enemies and (unsurprisingly!) we find out they are not as evil as they may appear initially. The chef turns into the main antagonist and we don't feel sorry for her banishment early on because of what she does. And the old king has also died already and it is times for the new one to prove himself and define himself in terms of who he is. Yes this is a fairly predictable film, but thanks to the colorful characters and smart witty fun scenes (like a Cinderella reference), it's not really a problem that you will not really be surprised at all watching this one. One example would be the male main character showing up the very first time when the female is captured by a bunch of spiders and it was so so clear that he would shop up exactly then. So clear that the writers almost made a joke about it themselves by letting the troll girl say afterward that she also knew he would come.It is one of the better animated films of the year I would say, but maybe not one of the best. I watched the German dubbed version and I must say I was not really impressed by the music and songs performed in there. It felt somewhat estranged from the rest of it. And also in terms of comedy and drama there are weaknesses. Drama one example would be the story about the male troll's grandmother that felt so rushed in and ineffective although it really could have made an emotional impact. Comedy one example would be a cloud character that only delivered comedic purpose, but was never as funny as he could have been and disappeared as fast as he appeared too. Twice, actually. I would have liked to find out more about him or instead just would have preferred entirely without him. Butg these are just minor criticisms. I think overall the good easily outweighs the bad and this film is worth seeing. And with that I do not only refer to very young audiences, as the main characters imply. I also refer to grown-ups as the movie clearly has a great deal of depth on some occasions. And it was also done better with the other troll characters. They also may have very little screen-time and we don't know too much about them, but it makes sense they are there and it makes sense that they are shown when they are shown.Overall, I enjoyed the watch here and I have no problem saying that this is among the better animated films I have seen this year, even if it's certainly not a contender for best (""Zootopia"" at this point still). This work is another example of how strong animated films are at this point, in terms of quality and despite the strong quantity as well, it is (almost) always worth checking these out. Looking at the cast list, it also shows that it's easy to get big stars for projects like these because of how successful they turn out to be, also (or especially) from a commercial perspective. I enjoyed ""Trolls"" and it's not difficult for me to call it a success that definitely deserves all the awards attention coming its way as I believe it was quite a challenge to make the characters and story appealing for audiences of all ages, more than usual for the animated genre, and boy did they succeed. Go see it! I would also watch a sequel and looking at the films I mentioned earlier that the men in charge worked on previously, it would not be a surprise at all if we get one in the next five years."
122,Trolls,6,8 November 2016,"Though it's story is like most DreamWorks movies, Trolls is entertaining with fun songs and an animation style that's unique","You know those little dolls with the long hair that shot straight up? Those were the toll dolls (or action figures if you were a boy) and they've remained a staple for most children. Their small design and many options for clothing made them a hit and were probably more recognizable then Barbie as they were more fantasy-like then the regular dolls. I think I might have had one when I was six (I eventually found a naked troll sitting in a box of old toys I was donating to Goodwill), but they never had an impact on me like the toys of the Teenage Mutant Ninja Turtles or Spider-Man.I haven't seen the troll toys in years, and only when DreamWorks Animation announced that they wanted to make a movie out of them that they came back in my mind. Like a lot of other movies based on toys (Transformers, G.I. Joe, Battleship), this is clearly a cash grab. Or at least I would have thought that until I saw The Lego Movie, which I still see as one of he great comedies of the decade. If the right people can get behind a product they have passion for, then maybe a Trolls movie could work. In a fantasy world of some sort, the trolls are little creatures that live in a constant state of happiness, while the larger ogre-like beings, the Bergens, eat them as they have no happiness and think that doing so will give them that same feeling. After years of living in a tree where the Bergens hold an annual dinner feast, King Peppy (played by Jeffrey Tambor) leads the trolls to escape through underground tunnels. Cut to ten years later where King Peppy is about to step down and lead his daughter Princess Poppy (played by Anna Kendrick) into ascending the throne.Poppy loves to lead the trolls into constant song and dance to ensure their happiness. Despite the overly upbeat attitudes of trolls like Creek (played by Russell Brand), Biggie (played by James Corden), and DJ Suki (played by Gwen Stefani), the one troll who hates the constant parties and hugs is Branch (played by Justin Timberlake). One day, a party that Poppy throws proves too loud as exiled Bergin, Chef (played by Christine Baranski) finds them and captures a good chunk of the little people, hoping to restart the tradition. Branch and Peppy go on a journey to rescue their friends and help to see if the Bergins can find happiness another way.Based on this summery and the majority of the trailers, you would think that Trolls would be nothing more then cinematic junk food. While it is in some area, I was surprised by how much I liked this. Both Anna Kendrick and Justin Timberlake make for both a comedic team and a nice sounding duo when their required to sing. Speaking of which, the songs, with half being original and the other half being pop songs, are entertaining and seem to fit then context of the story when needed.The animation is cool, as the whole thing looks like an arts and crafts world. This allows Trolls a look that's totally it's own thing. I rarely see that in a movie (Tron, Sin City, and 300 are some other examples) where you could identify it from one picture.The story, while well meaning, is unfortunately clunky and follows the same road story that DreamWorks seems to be repeating all the time. It's not that it's bad, and the beginning and ending are nice; it's just that a lot of the middle seem to have character reveals and emotional cues that seem to be of the benefit of the movie rather then what would have happened. The best thing about the plot, which I won't spoil, does manage to make the Bergens sympathetic, as it would have been easy to make them standard villains. I can't help but think that this was meant to be an analogy on anti-bullying.I'll give this six troll dolls out of ten. Trolls grew on me finding a happy place, even if it can feel forced. There are better things that your child could be watching from this year (Zootopia, Kubo and the Two Strings, Pete's Dragon, Finding Dory), but this is harmless and I don't see why not to see this if they want to. If Home was a failed attempt at a story just for kids, this serves as a better pass. Perhaps some parents that watch this might find a bit of happiness."
123,Trolls,5,25 February 2017,Far too sweet. makes it weak.,"So I did not realize that trolls are still popular. I remember all the Tweens had at least one back when I was in jr. High a long time ago, but now I can see from this movie how diverse the toy line has gotten, in their plot to sell them to the masses.This movie shoves so much sugar into my throat I thought my teeth were going to rot. It's like some one just poured a big bag of it into some Kool Aid and you have to ask yourself do you like Kool Aid or the big sugar rush you just got?And by sugar, I'm talking about the parade of pop songs. The music is good, how could in not be when you got Justin Timberlake singing. Ana Kendrick is pretty good too starting us out off the bat with two original songs (possibly the only two)the film produces.The animation is really, really, I mean really colorful. Blindingly colorful once again used as fluff to sugarcoat the fact that the movie really has no substance.It's kinda insulting the lack of actual effort I'm getting from this animation.I'm not really into musicals but my mind is an open book. Trolls did nothing to change my mind on the musical. The songs are really good but I got little from it. Most likely because the film also uses some stock classics with very few original songs. I kinda hate it when musicals do that. Stop taking other people's songs and write your own for the movie.Hearing Timberlake and Kendrick duet off of True colors was beautiful, but would be just as satisfying hearing them do it on a soundtrack versus watching their voices come out of the Trolls.Just a little too pop perfect."
