,title,stars,date,r_title,text
111,Waltz with Bashir,8,23 May 2014,Animated documentary that is effective,"This a unique movie that is in a somewhat documentary form, but also follows the story of a Israeli infantry soldier that can't really remember or wants to forget the past during his military days because of guilt and thus can't remember. So he goes around asking others that are psychologist and other witnesses of certain events when it comes to the Sabra and Shatila massacre. In order to retrace what went down and recollect his memories. Watching this movie is like seeing the traumatic experience including some guilt that the soldiers go through even years after the military days. Some may say that the animation factor may take away from the effective seriousness of the situation. However I thought it made this film, more immersive and engrossing to the situation at hand. They could have used real actors, but it adds more of that psychedelic and psychological aspect to this film through the animation. Kinda like being in a dream like state, which actually adds more to the perspective of the soldiers. And when it comes to the perspectives of the witnesses that experienced the harsh event. The animation here is well done and effective, kinda reminded me of the animation of the show Archer except more realistic when it comes to the movements. This film is heartfelt and gut-churning, with a bit of humanity in it as well. The imagery when it comes to the animation is also innovative in a way that it adds quite a bit of emotion to the whole package. This is a thought provoking film with elements of seeing things from the other sides perspective, in another words it has a good dose of empathy. I am planning to see this one again to recollect certain parts and elements I might have missed.8.3/10"
112,Waltz with Bashir,7,21 October 2012,"Another one of those ""how special, it is animated""","This is nothing special really. Just your usual leftism documentary about war, nothing to brag about, nothing that normal people should lose their time watching. Also, to call it innovative because it is an animated ""documentary"", well, people, this is not a documentary at all. Unless you think that a documentary is a film with actors and script, which is what this is. This is a film that depicts real events (or is supposed to, I don't know the degree of distortion of the facts involved in making this film, it is usually high) that happens to be animated. This film is an interesting concept, but nothing really special and nothing to give a perfect score about, unless you are a sucker who thinks that it is ""audacious"" to make an animated film depicting real events. It is not. Period."
113,Waltz with Bashir,7,29 July 2012,Sad Story,"An animated film dealing with the Beirut War and Sabra massacre in 1982. Ari Folman was a nineteen year old soldier with the Israeli Army at the time. He is the writer and director of Bashir. In 2006, Folman meets a friend who also served and continued to suffer nightmares from the experiences, which Folman blacks out. By interviewing fellow soldiers, he realizes that he was responsible for firing flares into the air to light up the Palestinian refugee camp where so many people were slaughtered by the Lebanese Christian Militia. As the son of Holocaust survivors, he concludes that he was in an act of denial of the period which he was part of the murders of innocent civilians. Waltz with Bashir is well intentioned and made from Folman's haunted soul. Maybe someday the citizens of the world will figure out the dangers of religious fanaticism, whether it be Christian, Jewish, or Muslim. There is plenty of blood on all their hands."
114,Waltz with Bashir,10,3 March 2011,Outstanding story and animation movie,"A confronting and lacerating documentary animation movie that narrates the personal trip that director Ari Folman took to recover the memories of his participation in the invasion of the Lebanon and in the massacre of Sabra and Shatila in 1982, when he was a 19y.o. soldier in the Israeli Army.Different elements are shown in the movie, all interconnected.1/ There is a personal and intimate search for the lost memories and the reintegration of the forgotten traumatic past into the conscious. The story shows how post-traumatic disorder works in soldiers, how tricky and fanciful human memory is to forget anything that causes us inner pain and conflict. The recovery of the past memories as a way of psychological redemption of our identity. The trips and chats Folman had with some of his old friends and comrades in arms, and with one of the journalists who covered the events, helped him, and the viewer, to understand what happened to him.2/ There is a depiction of the reality of war, with its drama, blood, death, fear and happiness. You see the young soldiers, mostly teens, doing a job that overwhelms them and scares to death, and is that fear (and not hatred) what leads them to kill and to survive. I also shows the happy every-day moments in which there was no fighting involved: soldiers listening to music, talking about normal things in life, being normal people, showing their ignorance about what to do or how to do things, their lives back home, and so on.3/ There is the narration of the events leading to the massacre of Sabra and Shatila, in which thousands of Muslim civilians (mostly women, children and old people) were pitiless slaughtered by the Christian Phalangists with the passive-active connivance of the Israeli Army. We witnesses with horror, the impact that such barbaric acts had on the victims and on those who witnessed the events.The movie succeeds at presenting such a harsh story by combining different elements in a masterly way.[1] By creating an animated world that is alien and intimate at the same time, that sets the emotional tone of the movie. The animation style is unique, similar to rotoscopy animation, but is not rotoscopy but a mix of new animation techniques. The orange and beige hues of the movie, and the precise use of chiaroscuro, help to create an atmosphere that is ominous, real and unreal at the same time. The recurring image that Folman has -he and 2 other soldiers getting out the beach, naked, with a gun (the one reflected in the Poster) in a world full of destruction, oniric and unreal, shows very well the sense of spiritual abandonment, alienation and regret that such events created in the soul of Folman.[2] By pacing the research for the past memories as if it was a mystery movie. We walk side by side with the director ,putting together the pieces of his past at the same time he does. The tempo of the movie is great, as the uneasiness of the story and of the viewer increases, and ends with the final minutes of the movie, really shocking, not animated, with images of old news footage of the grotesque spectacle found after the ceasefire in the Muslim suburbs. They moved me to tears, bot of anger and of sadness.[3] By using an impacting and soulful soundtrack that touches the viewer. It mixes some classical music pieces, well known songs of the 1980s, and some songs and musical pieces specifically written for the movie.[4] By letting the oniric world to be depicted as a decisive element in confronting our reality and our past lying locked under our Conscious. The movie starts with a dream, and there are several oniric surrealist scenes in the movie.[5] By choosing to tell this story through animation and not through a conventional documentary, as it certainly has attracted more viewers and spread the story beyond what a normal documentary would have had.[6] By mixing the harsh images and sub-stories with others full of intimacy, lyricism and poetry, by showing the human and brutal face of humans.I truly loved the movie. Why don't give it a 100%? Because I would liked an explicit condemnation of the Israeli involvement in the massacre by the director, not only the implicit one in which the name of Ariel Sharon is clearly mentioned as the one who didn't move a finger to stop the massacre. In fact, the fact that just the Christian Phalangists are depicted as the animals and barbarians is incorrect, as if you see somebody killing somebody and don't do anything, you are are also guilty not to succour the person in need (especially when those are children, women and old people) and even more if you help them to do so by paving their way to the slaughter house.This is one of this movies that everybody should wash, not only because it is a piece of art, but not to forget that war debases us all, destroys the lives of all parts involved except of those politicians who started them, and whom we elect.One of the most amazing films of the last years.Fantastic."
115,Waltz with Bashir,,9 March 2009,Highly Original,"It's that time of year, after the Oscars, when I make the rounds of all the so called foreign language films, that is, the films not made in English (or even American....) Waltz With Bashir will be closely followed by The Class and Moscow Belgium (although the latter has only just been released.) Personally, I think some of the best movies come from overseas. I still reckon the German film, The Lives of Others, is one of the finest films I've ever seen.I love the medium of film, and I always find it fascinating to see how other nations use it. Ari Folman, an Israeli film maker, has certainly found a very original style of movie making, an adult documentary animation about war. When was the last time you saw an animation that wasn't cute and furry? I happen to love animation too, so this was a double attraction for me, foreign AND a cartoon. I'm not going to make any claims to be an expert on animation styles but it did strike me that Waltz With Bashir is extremely clever because it is deceptively simple; stylised drawings and a fairly straight forward but very effective colour palette. The grey buildings against the yellow sky will stay with me a long time, you could almost taste the dust in the ravaged city streets. It sets the mood for a heart breaking story about the nature of war where, as many others have already pointed out, everyone loses. It's a very original film, and had this jaded movie fan pinned to her seat barely moving for all ninety minutes - a rare achievement. The small theatre was quite gratifyingly full the night I saw Waltz With Bashir, but it was an art house theatre in a liberal town, so I guess that's not too big a surprise?An Israeli ex soldier has a recurring nightmare about being chased by a pack of 26 dogs - always the same number. He tells his friend Ari over a drink. Ari, an ex soldier himself, realises that he has blocked out his entire memory of the war in which they both fought, it's a blank to him. He sets out to talk to all his old colleagues and try to piece together his part in the conflict, the 1982 Lebanese invasion and subsequent battle that included the mass killings in Sabra and Shatila camps. The Bashir of the title was the leader of Lebanon whose assassination may have prompted the revenge killings in the camps.I really don't want to comment too deeply on the politics of the movie. It is obviously a labor of love from someone who was there and who was a very young man at the time, and who is still - almost thirty years later - trying to make some sense of what happened, and it is therefore both intriguing and moving. It could perhaps be viewed as some attempt at personal redemption. It is a worthwhile and noble enterprise and made, I felt, with great honesty. It is also a very fine achievement artistically and well worthy of its Oscar nomination. If you want to learn more about that period from what could, I guess, be called the other side of the fence, read Dr Pauline Cutting's book called - if I remember from this distance - Children of the Siege."
116,Waltz with Bashir,9,28 February 2009,"God save the Palestinians, we mean it, man","Would Alvy Singer take Annie Hall to go see ""Vals Im Bashir""? In the Academy Award-winning film, Alvy has his girlfriend sit through Marcel Ophuls' ""The Sorrow and the Pity"", a four-hour-plus documentary about France's collaboration with Nazi Germany during the war. Would it be in his nature to advocate a film that portrays his people as the oppressors rather than the oppressed? Victimization plays a big role in Alvy's persona, so a film about Israel's crimes against the Palestinians during the 1982 Lebanon War might not suit his narcissistic need to feel persecuted. ""Vals Im Bashir"" certainly has the intellectual rigorousness to meet Alvy's approval, especially for a, (gulp), cartoon. To dispel this ill-fitting label, the filmmaker uses Public Image Ltd.'s ""This Is Not A Love Song"" during the protagonist's sabbatical from the war in Beirut, as a way to comment on the motion picture's two-dimensionality; albeit an animated film, this is not a cartoon, content-wise, since ""Vals Im Bashir"" has more in common with the documentary form than live-action genres such as the musical, or science fiction. The song also foreshadows how the film drops its distancing use of animation during the jarring final minutes, when the hyper-reality of this pixelated dream-world starts to self-reflect in flesh and blood. ""Vals Im Bashir"" is a stringent parody, or rather, a drawn approximation of the filmic tradition that is neo-realism.Unarmed Armenians are gunned down in cold blood by a marauding Turkish army in Atom Egoyan's ""Ararat"", but then the camera pulls back to reveal that the callous bloodshed is just a scene for the film-within-the film. For this Canadian filmmaker(of Armenian descent), presenting the massacre without having that fourth wall to temper the loss of life might have been too graphic an ordeal for comfort. The Armenian Genocide, as the form suggests, is nearly unfilmmable, so Egoyan uses a distancing technique, a buffer, in which the slain extras get up from the ground. Likewise, with animation, the unfilmmable becomes filmmable; with animation, for example, the freedom to shoot a child, the smallest body in a lineup for an Israeli firing squad's disposal may not be a viable option in a live-action movie. Animation helps the violent imagery seem less palpable. It's non-fiction iconography told in a form, synonymous with fiction. In ""Vals Im Bashir"", the filmmaker's own private Lebanon War is pieced together by a number of interviews that he conducts with his former war-mates. Like Raymond Shaw(Laurence Harvey) in John Frankenheimer's ""The Manchurian Candidate"", nightmares keep the protagonist up at night in this filmic bildungsroman. Besides the hounds of retribution dream, the protagonist asks the interviewees to help him decipher his reoccurring memory of a moonlit night, in which he emerged naked from the black ocean with three other soldiers at dusk. As it turns out, this gathering at the shoreline probably never took place. The protagonist is dreaming about a dream; the dream of the unforgiven, in which the sea can't absolve his unpardonable sin. This invented happening is a psychosomatic levee to hold back the deluge in his mind. There's no Janet Leigh-type in ""Vals Im Bashir""; he's his own controller.In the aftermath of an Israeli bombing on a Lebanese homestead, among the victims buried under the rubble, a young boy can be glimpsed in eternal repose. And then the film starts to dream, as ""Vals Im Bashir"" breaks more than the fourth wall, it breaks time and space, by switching to live-action, as the animated mothers who mourn their loved ones give way to their material predecessors. To paraphrase John Lydon in The Sex Pistols' ""God Save the Queen"", ""Israel's dreaming,"" but the protagonist is awake now. The documentary footage coincides with the protagonist's recovered memory; the veil is lifted from the pixelation to reveal the horror of his participation in the Palestinian holocaust. The live-action diegesis includes that dead child under the rubble, in the flesh, not in the mind's eye of an artist, the unfilmmable. Suddenly, it's all to visceral for both the subject, and the audience.This is not a cartoon; this is a documentary. This is a love song, dedicated to peace among the Israeli and Palestinian people."
117,Waltz with Bashir,,17 February 2009,Well Done,"Waltz With Bashir This film was so uniquely done that I wanted to see it twice to even begin to analyze the layers of this work. The animation was almost disconcerting in that it was dark and somber and not at all the bright happy animation our culture in the US is accustomed to. Right off the bat we are introduced to animated characters sitting in a bar drinking and smoking while in an intense conversation. The use of shadows and lighting throughout the film gave it a realistic sense even without live actors. The voice overs were very natural and gave a sense as though we were listening in on actual conversations. The story takes place as a man retraces his steps as a young soldier to piece together the missing moments in his mind through interviews with other people who were there and experts who could help him understand why he and others blocked out the events of the past. The composition of the shots throughout the film is such that it often feels like looking at a painting. The people are staged in the scene so that our eyes can analyze the situation and really get a sense of what the soldier was surrounded by and the destruction on all sides. Though the style of this film is unconventional, we are given a chance at the end to realize through contrast just how effective the animation choice really is. This formalistic style of exploring such a gritty subject matter is a brave and creative choice of the writer/director Ari Folman, who lived this story and whose commitment to this project shows in the quality of the film."
118,Waltz with Bashir,7,16 February 2009,"Ari Folman, an Israeli Film Director, presents an animated Documentary recounting his own life in Lebanon (1982).","Ari Folman, an Israeli Film Director, presents an animated Documentary recounting his own life in Lebanon (1982). Folman uses an artistic choice of animation to narrate his film. The use of animation provides him with the complete freedom to express his viewpoint without any limitations. This is a non political film as it doesn't illustrate the other side to the Palestinian or Christian's point of view. In the final scene, he successfully alters the emotion for us with the switch from animation to real life footage. The shocking images combined with the silence of the scene grabs the audience's attention. The authentic footage connects everything that the animation informs the audience about. The factual history allowed the audience to really grasp the tragedy of what happened. The message is, that behind the beautiful drawings and animation, there are real people who were massacred including women and children. The subtext simply articulates that war is useless, it is not glamorous, nothing good can happen from it."
119,Waltz with Bashir,7,19 July 2009,"Emotionally engaging, technically intriguing, intellectually shallow.","After watching the 3 well-know foreign films nominated for this year's Oscar, it's quite obvious to me why Waltz with Bashir lost out to the Japanese masterpiece Departures. I would even consider Entre Les Murs to be a way better film than this one.It's hard to tell whether this film is a documentary or a movie, one of the minor reasons why it lost out in the Oscars. Whatever format it is meant to be, I could not see anything really insightful, just a lot of recollections and imaginations, punctuated by animation graphics. The film has a good mix of story-telling and fact-finding, which gives it an easy pace and gripping plot line. But not for one moment in the film did I find myself beholden in deep thought.I don't know enough about the technical aspect of animation, but it is the first film of this kind of artistic presence I have seen. Aside from techniques, decent entertainment, and a lot of self-pity and blame-shifting, I didn't see how it even deserved a nomination in the Oscars."
120,Waltz with Bashir,7,7 April 2009,good but not great,"the movie is good but not great, aside from certain political differences and reasons on how and why the massacre has happened and who is responsible, I will not say I know the truth about this but at least the movie shed the light on what happened that time, I didn't view the issue as a part of the ongoing conflict in the middle east but in a rather more broader humanly way that's how the movie should be seen for you or anyone to get the message its not about anyone as much as its about the director memories about the war and the massacre so its based on some personal opinions and stories so I am not sure about how truthful this facts was,but at the end we can say that we have an emotional and humane film about war aside from the political sides and everything."
121,Waltz with Bashir,8,15 February 2009,A stunning animated film,"Waltz with Bashir is an extremely emotional film that explores the massacre of Sabra and Shatila. The director creatively chose to do the film as an animation, which adds a unique formalistic element to the very realistic story line. The story explores the post war memory loss of a group of Israeli soldiers who try to retrace their memories to further understand their part in the massacre. The main character has a dream which he further tries to interpret by piecing together pieces of his memory of the massacre. Throughout the story the film sheds light on the serious effects of war on soldiers, and the role play that governments have in such events. The color hues, musical collaboration, and over all mise-en-scÃ¨ne of the film are so carefully constructed. The story is justified by the amount of artistic development that the director Ari Folman arranged for this masterpiece. The entire film is animated, but the ending scene is actual footage of the massacre, which hits the viewer like a brick in the face, and epitomizes the sorrow one should feel while watching this film. It is a great movie with incredible creativity and originality. I give it a two thumbs up, and suggest every one go see it sooner or later."
122,Waltz with Bashir,7,7 February 2009,Great animation but what is it trying to say?,"The animation in this film was excellent but at the end I felt unsure what point the director was trying to get across. Some of the imagery is stunning, the scene where the three soldiers emerge from the Mediteranean and walk towards Beiruit in particular.The film starts with the director meeting an old army buddy from the invasion of Lebanon. His friend has the same war related dream over and over again. This makes the director wonder why he has no memories at all of his time in Lebanon. He sets out to talk to others he knew from the army and he gradually realises that he was near the infamous massacres by Lebanese Christian militia in the Shabra and Shatila refugee camps in Beiruit. Most of the film is about veteran Israeli soldiers remembering things that happened to them in Lebanon. This is interesting in itself but would obviously be of more interest to an Israeli audience.Towards the end of the film we see an Israeli TV reporter tell us about going into the refugee camps after the massacres and how it seems the Israeli army did nothing to prevent civilians being killed. (Even now there is no definite casualty figure). The film ends with actual footage taken by this TV crew in the camps, showing many dead bodies including children. The part would be of more interest to an international audience but is quite short and only somewhat related to the first 80 minutes of the film. I think there is definitely scope for a film about the experiences of Israeli soldiers and a separate documentary investigating the massacres. Here however the 2 separate themes are shoehorned uncomfortably together. Overrall I felt the film was neither one thing or another."
