,title,stars,date,r_title,text
70,Waltz with Bashir,9,13 November 2010,A must see anti-war film,"In recent years Israeli cinema has been on the raise with more films being seen by an international audience and being praised by critics. Waltz with Bashir is seen as a highlight of this emergent, a powerful animated film and it was a big surprise that it was not nominated for Best Film or Best Animated Film at the Academy Awards.Waltz with Bashir tells the story of the director Ari Folman (playing himself), a filmmaker who when his one of his old friends tells of a recurring nightmare he has. When speaking to his friend Ari realises that he has no memory of when he served in the Lebanon War, particularly the Sabra and Shatila massacre. As he starts to have a flashback of the event, Ari sets out to speak to his old friends in the army about they war stories and memories so that Ari can recover his.Animation is not the usual format for documentary but Folman makes it work. The animation style is simple but very effective, with characters looking real, not cartoony. Folman is able to use animation to actually show the events these witnesses describe, whether it's the horrors of war, with young men being scared, shooting at random, being shot at and innocent people getting hurt to the more mundane things like soldiers relaxing on the beach and waiting for orders. With it's bleak view of war many of the characters speak with guilt and realism, many of them ordinary young men in their late teens who were conscripted into the army: the enemy was often in the distance, so we don't get to know anything about them, just that they are fighting them. Folman brings in moments of dark, tragic comedy, like when the Israeli forces try and hit a car with a gunman and end up shooting an innocent man with his donkey and blowing up a whole section of a town. The senior officers are shown to be uncaring men, who just sit back at a distance, unconcerned about events and looked the other way when it suited them.The visual style was incredible, with Folman handling the action, the period, the settings and the transitions from time and locations. The transitions were done with real effect, like when Ari was in the taxi and had his first flashback and to an aerial shot in Holland where the trees change from north Europe trees to Middle Eastern ones. The pacing was just about right, slowly building up the plot and the drive of Ari as he discovers when happened to the fast action of war. Because of the animation, Folman was allowed to get away with showing a lot more then a live action film could with the horrors of war. Waltz with Bashir is a powerful film, a criticism of war, the effects it has on men, during and after the conflict and how brutal war is. Men do not how to act, with some being scared, to some who enjoy the violence. Things can change in an instant, from casually driving to one shot turning everything turning to end. This is an anti-war period, with neither side being made out to be good guys and willing to commit horrible actions. The Israelis just stood by and watched the massacre and the commanding officers just let it, not caring about civilians.On a final note, I have to praise the score by Max Richter, using both an excellent techno beat in the beginning and a sombre piano tune for more violence, intense scenes. Plus some of the sequence could easily work as a short films.Art-house cinema at it's best."
71,Waltz with Bashir,8,21 September 2009,A Nutshell Review: Waltz With Bashir,"The trouble with memory, is more often than not, over an extended period of time, it tends to be faulty. We recall certain key scenes suspended momentarily in time, but with nary a clue how they move forward or backward, akin to knowing presence of the dots, but lacking the details to connect them up. Traumatic experiences may cause chunks to be buried deep and repressed into the subconscious, leaving behind gaping holes susceptible to imaginary inputs that we might assume to have happened.Based on the true story of filmmaker Ari Folman, his friend's recurring nightmare of being haunted by exactly 26 hounds, triggered his realization that he cannot remember a thing about his tour of duty as a 19 year old in the 1982 Lebanon war, except for a mysterious bit of memory that has him, and a group of unknowns, emerge from the beach, walking toward some a war-torn city under the illuminated night skies.Waltz with Bashir is a stunning animated documentary, possibly the first docu that I've seen that's being told in animated form. Ari's story goes about probing and getting more details about his stint, with no memories of his own, and being totally reliant on what others feed him from their perspective. From talking heads styled interviews, events get constructed in piece meal fashion, which provided the Roshomon Effect in technique even, since perspectives are always biased, and again open to inaccuracies.From the memories of his peers, we see countless of imagery of the war fought, each providing a key eventful piece that suggests Ari himself was present when they took place, from simple ambushes, to what slowly unravelled itself to be the Sabra and Shatila Massacre, controversial for the IDF's inaction to prevent a genocide from happening from under its watch in a refugee camp.The imagery used in the film, especially the fantasy, escapist sequences, allowed for some distraction away from the stark visuals on the horrors of war, and you'd have a stone cold heart should you not be affected by the senselessness of evil that Man is capable of. What I liked about the animation here is its lighting and keen use of shadows to suggest something bleak, hidden, and sinister. There's also a unique and beautiful style of animation used her that's invented by the ""Bridgit Folman Film Gang"" studio that combines Flash animation, classic animation and 3D, so those eager to experience something that's new, should make it a point not to miss this.Winner of the Golden Globe Award for Best Foreign Language Film 2008, the film also clearly serves a sharp critique against war. For an animated piece, it's hard hitting, challenging, and provocative even in questioning how we tend to be apathetic and do nothing when cruelties unfold right in front of us."
72,Waltz with Bashir,8,17 February 2009,War Should not happen,"Ari Folman's Waltz with Bashir movie takes the Animation style into a surrealism form, the real footage at the end represents the real life suffering of the Palestinian people as a whole. The assassination of Bashir Gemayel, leader of the Christian Phalangists caused them to go on to Sabra and Shatila to kill the Palestinians. According to history the Israelis did not commit the crimes but did nothing to stop the Phalangists from doing it. The movie involves Ari Folman going to a bar where he starts talking to a friend that shared time with him during the 1982 Lebanon War. He finds out that he does not remember his past, he admits that he experiences nightmares and flashback of horrible events but Ari is unable to differentiate reality, he also goes back to look for people that were with him during the Lebanon War. As the story develops Folman is telling us that wars only creates suffering, pain, and death. On the other hand, I respect the work of David Polonsky, the Art Director, Yoni Goodman, the Director of Animation for their amazing work in putting the surreal story in an animation style/form. The outcome of Folman's movie is magnificent."
73,Waltz with Bashir,5,1 November 2010,Animation Distances and Impersonalizes the Violence,"Many critics have lauded the use of somber animation to examine the reaction of director Ari Folman and other Israeli soldiers during the first Lebanon War, focusing in particular on the massacres perpetrated against the Palestinans by the Christian Phalangists at the Sabra and Shatilla refugee camps following the assassination of the charismatic leader of the Phalangists, Bashir Gemayel. This important story might not have worked as a conventional documentary. The film record of the war is slim. It probably would not have worked as fiction either.Folman's approach is certainly ingenious -- an animated ""documentary,"" concluding with actual pictures of the dead Palestinians, exploring the memories and reactions of individual soldiers and attempting to assess the degree of responsibility of Israeli forces for observing but failing to stop the massacres as they might have done if ordered to do so. The film lays the blame for inaction squarely at the feet of Arik Sharon, then the Israeli defense minister.It's an explosive topic to this day in the Israel Defense Forces (IDF) as well as in Lebanon and among the Palestinians. As I've said, I don't know how else it might have been done, but I frankly found myself distanced from the violence by the animation to the point of disengagement. To be sure, it's not Disney animation or Pixar -- almost the polar opposite. But one can think of dozens of war movies and documentaries that brought the deadly violence directly to the viewer and that successfully captured the emotional toll on individual soldiers.""Waltz with Bashir"" is certainly deserving of an A for effort and imagination but I turned it off in my mind long before it reached its grisly end. Sorry."
74,Waltz with Bashir,7,1 February 2009,Curious film that I admit I felt a little iffy about,"A unique film, a blend of documentary and animation. It definitely shares some aspects with Richard Linklater's Waking Life, but it seems fresh and new. Ari Folman interviews people with whom he served in the Lebanon War in 1983. He himself was a soldier at the time, but he seems to have blocked the entire period from his memory. The film is almost all animated, mostly because it wants to illustrate the events described by his interviewees. He also wants these horrible events which he doesn't remember experiencing to come across as dreams or nightmares. The style of animation is very odd, very simple, and very beautiful. It's an entertaining and mystical film, but it didn't win me over completely. I kept thinking, ""Wow, this is beautiful,"" or ""Wow, this looks neat,"" and then I'd feel guilty for that. The dreamlike quality of the film becomes kind of numbing after a while. Folman switches to live action, real-life footage of the atrocities he doesn't remember witnessing to show that it definitely wasn't a dream, but I felt like it was too little too late."
75,Waltz with Bashir,8,21 November 2008,A memorable and confronting biographical drama that is always interesting to watch.,"This year has been one of an abundance of animated features, good and bad, memorable and not so memorable. If there is one thing that can taken from the output as a whole however it's that the medium seems to be growing up, regardless of its general demographic. Waltz with Bashir, a certified 18 production is key to this movement; the visuals are striking and poignant, taking time to use the style as a way that delivers on the themes of the movie whilst retaining an engrossing aesthetic. This isn't a children's feature by any means but with themes of war and genocide it would be hard to assume otherwise, despite the stigma associated with hand-drawn productions. Instead director and writer Ari Folman uses the medium as a way to support his story without being distracting in any way. In this sense the movie immediately draws comparative features to recent adult-animations such as A Scanner Darkly and this year's Persepolis and yet manages to transcend both thanks to a much firmer script that invokes thought, provides insight into a much neglected subject in western history and reaches out, delivering the themes that Folman wishes to discuss. Through this strong sense of storytelling, the hard hitting visuals and Max Richter's score, Waltz with Bashir delivers what is quite possibly one of the finest examples of adult animation, which is a subgenre undoubtedly is still in its infancy. It's a sign of great things to come, and an effort sure to prove that the medium can be taken seriously and used to greater effect that live-footage may be able to accomplish.Taking a rather surreal documentation approach to his narrative, Folman presents his story through the eyes of himself as he tries to uncover his lost memory involving the Lebanon War twenty years past. Through this direct approach to telling a story, the movie immediately achieves a sense of realism, and when used in combination with the other worldly animation that touches on the rotoscope style featured in Scanner Darkly, strikes a poignant balance between dream-like reminiscence and in-the-moment revelation. In this sense Folman manages to bridge the gap between flashback and real-time storytelling with an ease that too often gets bumpy in other features. Taking his time to talk to several people involved in the war along side himself, Folman presents his character as conducting interviews with those he chats to. Their names will appear in the corner of the screen, and the ""photography"" styles used often echo those found in documentaries. In essence then, what unfolds is virtually an animated documentary of sorts, telling the story of how Folman in real life eventually started to remember his years as a soldier.Although this straight forward approach to indulging in a history lesson involving the Lebanon War provides ample interest, it is when Folman uses the animation present in his film to full effect; travelling back into the his memories of the war itself and presenting first hand accounts. Through these scenes the movie goes to great lengths to provide both hard hitting documents on life during the war as a soldier, and surreal images which deal more with the psychological implications of war. It is during these sequences that Waltz with Bashir achieves its greatest sense of relevancy, merging all three elements of its presentation with grace, significance and well conceived direction. As a war movie, the film and Folman seem to refuse to take a stance on the general concept of war, instead showing what life was like during such times with little to no bias either way; like the masterpiece Apocalypse Now, Waltz with Bashir isn't interested in the politics involved, but more with the humanity that makes war breathe, shoot and cower in fear. It's a story that lacks a position but is far greater off because of it; war is war and Folman knows this all too well, he just has his own personal story to tellÂ… that is, once he remembers it.For someone suffering from selective amnesia however, Folman tells a solid tale. Taken as a whole, Waltz with Bashir is a slow moving, but well delivered and insightful piece of cinema that not only sheds light on ourselves and a historical event often shadowed by larger accounts, but it allows the medium to breathe. There are some problems included here, but only in minor details, most of which reside in the somewhat oddly placed third act that seems a little forced and tacked on. Nevertheless there is no denying that what Folman has to say here is not only important and relevant to us many years on, but that it forms a story that moves and feels alive. There are moments of tension, comedy and insightful characterisation that go beyond even the most overt of films that force such elements upon you. Instead Waltz with Bashir is a gradually enveloping affair that slowly reveals itself as the runtime rolls in. Taking full advantage of the animated medium and combining it with a beautiful score and a coherent, intelligent and enlightening script, Folman delivers a memorable and confronting biographical drama that is always interesting to watch, even if it all does feel like a nightmarish dream.A review by Jamie Robert Ward (http://www.invocus.net)"
76,Waltz with Bashir,10,24 December 2014,Just Excellent,"The psychological conflict of the war brilliantly explained I must say this animation is very similar to the story of a book. Achieve illustrate all without taste of war, human stupidity, feelings and small flashes of humanity that can go into a war.Walts with Bashir could be described as a well-narrated film without vices or propaganda.Quickly, the story grabs you and you live the torments of characters in each of the situations presented.This is a film that should be present in the election of a film lover.For me completely exceeded my expectations, so I evaluated with 10"
77,Waltz with Bashir,9,20 July 2014,An amazing animated film and a personal favorite,"Waltz with Bashir is animated like nothing I have ever seen before. Friends have compared it to a grittier Avatar: The Last Airbender. This gritty stylized animation does wonders for the film, it always looks it's best when combat or some form of action is happening. In turn allowing the film to help convey the animosity of combat along with it's many other messages. The scoring of this film also does wonders for it, such as the juxtaposition of a soft piano medley over an intense gun fight. This film has it's moments that will blow you away and thanks to all the artistic trait of this film they are delivered perfectly. My only warning for this film is that it starts a bit slow, but it ramps itself amazingly in the second half in artistic value, character development, and plot. I recommend this to anyone who even only vaguely would like to see it."
78,Waltz with Bashir,10,22 July 2010,the poetry of horror,"I really, really love this kind of animated films. ""Waltz with Bashir"", along with ""The Grave of the Fireflies"" is probably one of the best expressions of the horrors of war, that it wonderfully manages to combine the violence and the cruelty with sequences of such beauty that makes us think of how even in the most bleak situations, there can be few glimpses of happiness, fun and joy, reaching an almost whimsical, poetic tone in some parts of it. Yet, those beautiful images aren't made to make us to forget the horror and the misery that we watch: The dreams and the poetry live at the same time with the violence, the injustice, and the oblivion. One character tries to reach in his memory many answers for the present, and what he found is something quite different that we could expect in this kind of films. Memory could be tricky sometimes. We choose what we want to remember, but the reality is still there, and past can be changed. But the past is part of what we are, no matter how bad or horrible it is, and no matter how much we make efforts to forget it. This was my very own opinion about this film. Not many times I was lucky enough to see films like this, but the whole experience of this movie was widely rewarding and fulfilling.""Walts with Bashir"" it is a masterpiece. No more, no less."
79,Waltz with Bashir,10,26 March 2010,Israeli director Ari Folman making good use of animation cinema to tell a horrific tale of violence.,"Animation in cinema has come a long way since American film ""Who framed Roger Rabbit"" was directed by Robert Zemeckis in 1988.A lot of things have changed both in real as well as reel life.This is something all directors have taken into consideration while making their films.In his first animation film Israeli director Ari Folman has chosen to keep a neutral stance.Although his film ""Vals Im Bachir"" talks about brutal, senseless killing of people during Israel's military intervention in Lebenon,judging by characters' facial expressions,one can surely feel that there is hardly any feeling of remorse.This has happened as everything is told in a plain,matter of fact style.One of the reasons why people have liked this film is that animation cinema reduces the trauma in a viewer's mind about a massacre.For a director,it is also economically viable to shoot a film with war scenes on animation format as traditional 35 mm cinema mode would cost a lot of money.Waltz with Bashir jolts and shocks viewers as something like this has not been made in recent times.The success of this film has paved the way for more serious topics being covered using animation in near future."
80,Waltz with Bashir,8,26 February 2010,"I can't say what it showed was entirely  true, but how it showed it was good.","The only excuse for making a useless thing is that one admires it immensely. All art is useless.Oscar Wilde's immortal analysis of art can find no better illustration than the movie who' review I have set out to write. Even as I write this I see myself surrounded by bigots and Hypocrites , all of them claiming to be the the most noble souls who ever walked upon this planet.The movie for me was a brilliant exhibition of skillful and delightful animation. The narration was splendid and the way the technical effects have been merged with real life situations is commendable. Technically one of the better movies I have seen of late. I saw this movie last year and watched it on T.V. at around 2 in the night (or morning) .As a filmmaker who is out to create art purely for the sake of art I would give the man all the ratings he wishes for and deserves.As far as the non-technical and factual part of the movie is concerned I am a little disappointed. Just a little , mind you.The movie's tone is surprisingly not blunt. All the facets of the conflict it tries to portray have been screenplayed from the Israeli point of view. Inspite of this we have here a storyline where the "" Who Did It? Who started it?"" are ably downplayed. I mean, the movie could have had a very violent and blunt outlook. Thus avoiding the blame game trap, the plot rarely strays into the whole accountability thing.The themes of disillusionment of the soldier who returns home and the social angle have already been depicted in many movies. This however is the first animated movie which takes an amelodramatic view of the things.I am not well acquainted with the ground realities of the Israel-Palestinian conflict , hence for me to jump down and take sides would be ridiculous as also a cruel joke upon all those who have lost their precious lives and livelihoods in this ghastly affair."
81,Waltz with Bashir,9,13 February 2010,waltz with bashir,"I saw this movie last year after seeing it getting an Oscar nomination and I have to say this movie is amazing , the director who also is the leading character explains the movie in a very strange and unique way . even though this movie is Israeli , there is nothing biased about it on the contrary they show towards the end (spoiler) that Ariel Sharon is the real culprit who happens to be a somewhat war hero for Israelis. The animation is amazing so is the artwork , the soundtrack too is good ,this movie should have won the best foreign film award.If you want to see something different and new go see waltz with Bashir you'll enjoy it."
82,Waltz with Bashir,8,9 August 2009,brilliant but.........,"this film is an awesome foreign film. i'm really into world cinema and what they have to offer. this film is beautifully made. the animation is fresh and startling and just the film in general is very good. there's a couple of things i didn't really like about it though and they are....... 1. even though the film is very short it got a little boring, not much but there was a lot of empty scenes......... 2. i love foreign films and i never usually think they should be tampered with English dubbing but i feel this film really needs it because the animation is wonderful but you have to keep taking your eyes of it to read the subtitles, i feel like i need a good shower after saying that remark but i do feel the film could be enjoyed more if it was dubbed.i think this film should of won best foreign language film at the Oscars because it is a landmark achievement and full of originality. hands down to ari folman for making this and trying to retrace his own steps of his life and putting it into film. if you don't know this already its the true story of ari folman (the director) and what happened to him through the lebanon war........ 8/10.......j.d seaton"
83,Waltz with Bashir,10,28 June 2009,A Masterpiece,"This film is a true work of art. Some people on IMDb have complained about the animation. This is an argument which I find odd. The film is about how the memory altering what really happened. Therefore Forman went for a dream like animation at some points. The soldier floating on the naked woman still seems like a mixture of cam and safety as a boat gets blown up.The animation may appear ""clunky"" to some, but its poetic. Forman's vision of the descending flares as he gets and two colleagues get out of the water is simply stunning. The dream like slowness of it, the sheer smoothness of it (suprising considering the clunky remarks) and the wonder of it all are simply incredible.The stories themselves are a mixture of the absurd, bizarre and shocking. The story of the soldier who was the only member of his tank to survive being treated like he betrayed his the unit, which left him for dead is a strange, tense and moving anecdote. The film is filled with such stories. Occasionally Forman goes for visual symbolism over the impact of the story but it doesn't lessen the film's power.It doesn't make judgements on Israel or Palestine, it does on the Phalangist Christians. It could be seen as neutral to Palestine while expressing the guilt some Israelis felt. But the stance is not what is important about the film. It is the psychological aspect of war that is studied and it tells it in stunning depth and power."
