,title,stars,date,r_title,text
34,Waltz with Bashir,9,15 January 2009,A powerful piece that uses its unique style to effectively describe the flaws of bot human memory and humanity,"It's difficult to appropriately say that this movie is ""enjoyable"" because, taken as a whole, it is a very intense and emotional piece of film-making. From the start it certainly grabs you by the collar, with its dramatic opening sequence in which the streets of Beirut are introduced to a thumping Max Richter score. You know that you are watching an animation but, seeing the beautifully-composed 3D imagery as the scene pans rapidly down a deserted road, your mind finds itself momentarily tricked into accepting the silver tarmac and yellow skies as real footage. And then the dogs arrive; twenty-six hellhounds charging their way through the city to mete out revenge on their executioner. By beginning this 'documation' with images from his friend's recurring nightmare, writer-director-producer Ari Folman perfectly sets the tone for the journey upon which the audience is about to embark; it is also the logical starting point for his own story, the realisation that he is not haunted by flashbacks or dreams from the 1982 Israel-Lebanon war, that, in fact, he remembers nothing of his participation in the conflict. In an attempt to confront his forgotten past, Folman travels to meet various individuals who were also involved in the war and begins to catalogue their responses and recollections, indulging in what his friend suggests might be a therapeutic exercise. As he gradually teases- out his repressed memories it becomes apparent that the pivotal moment of his experiences - and the last piece of the puzzle to be recovered - centres on the Sabra and Shatila massacre, in which hundreds of Palestinian refugees were systematically executed over the course of three days. Although the project began as a personal experiment, what results has far greater implications and becomes a tale that reaches beyond the lives of just those nine individuals who appear in the film - it grows into a polemic on the insanity of war and the way in which the human mind copes with inhuman situations. Folman's work is at home among the similar oeuvres of Copolla, Kubrick and Heller but it also stands out from such cultural landmarks for two key reasons: not only are the themes real but the events themselves are recounted first-hand, compiled and interpreted visually by the very individuals who endured them; and, furthermore, the power of this, rather than being diminished, is wholly enhanced by the juxtaposition of the topic and its animated portrayal.It is in the seamless blending of dreams, memories, hallucinations and reality that the choice to use an animated medium really comes to the fore. The same images could feasibly be shot as a traditional documentary but, in that format, the reconstructions of nightmares and teenaged combat would lose their potency and would even risk appearing superficial. However, by relying on a stunning blend of bold yet muted colours, 3D Flash scenery and traditional cell animation, the borders between reality and fiction - true memories and false - become blurred for the audience just as they had for the director. It is also poignant that, when pursuing his story in Holland, Folman is told that he can sketch his school friend playing with his son, but he cannot record footage of them Â– this represents a truth for the film as a whole; by employing animation, the protagonists are permitted a degree of distance from both the past and the final product. Even though two of the characters are voiced by actors employed to read the transcripts of actual individuals, it is apparent that the testimonials come from the heart with an honesty that the element of relative anonymity offers.And the testimonials are harrowing Â– the paralysing fear of war, penitence over the spilling of innocent blood, guilt for fallen comrades, desperation, survival and terror; the horror of being an inactive witness to genocide. For all the bleakness of the material, Waltz with Bashir balances each anguishing moment with a supremely evoking visual style and no shortage of humour. It is not by accident that the film takes its name from a scene in which all three of these elements are portrayed in harmony Â– as a soldier dances erratically in the middle of a road, firing his machine gun wildly in a blind rage and balletically dodging a hail of bullets, insanity is beautifully and comedically depicted.Ultimately, the film remains balanced in this way until its true point is ready to be made. As the final scenes of the animation unfold and Folman's last outstanding flashback returns, wails of mourning fill the air as black-clad Shi'ite women lament the loss of their families. And then you realise, as the images switch from animation to actual footage of the massacre's aftermath, that the voices are genuine, the wailing is authentic and the pain is utterly and horrifically real. As with Folman's life, the film is pregnant until this point with the conspicuous absence of that one remaining scene and, as the screen fades to black, you are suddenly confronted with the message that has been lingering out of reach throughout, just like his own memory."
35,Waltz with Bashir,,3 January 2009,Waltz With Bashir,"Israeli filmmaker,Ari Folman, takes a trip down repressed memory lane with his animated film about the Israeli invasion of Lebanon in 1982 and his unit's role in the massacres at the Sabra and Shatila camps outside Beirut.In short, nine days before President-elect, Bashir Gemayel was to take office, he was assassinated. In retaliation, the Christian Phalangists (with no objections from the Israeli Defense Forces) entered the Sabra and Shatila camps. Ari Folman's unit fired flares into the night skies to help the Phalagists see their way into the camps. In this attack, the IDF killed 700 to 3,500 Palestinians, many were women and children.This is an excellent film and worthy of seeing on the big screen. Folman shows how the war has impacted his life. Nightmares that haunt him are animated perfectly. I heard Folman interviewed on NPR yesterday. He said the only way to make this film was through animation since it goes back in forth in time and dream sequences. Moreover, he wanted to attract a young as well as older audience. Here is a what he said on NPR: ""For me, it was very essential to bring young audiences to the theaters to watch the film because I thought that if this film could influence even one teenager making the decision not to go the war, it doesn't matter where I did my job, I earned it,"" Folman says. ""All wars are useless Â… and sometimes in films we tend to glorify them by making all of those great characters and they show you it's all about bravery and brotherhood of man. And I don't believe in that."" And I do hope that high school kids thinking about joining our military see this film. War is not glorious. Ask anyone who has been in one.Folman mentions in the interview that his father did not want him to make the film out of fear Israel would never forgive him and he would be ostracized. Surprisingly, Folman said the exact opposite has happened. The politicians and government have welcomed him with open arms.After viewing the film, I thought for sure it must have been met with opposition by the Israeli government. It surely does not paint the Israeli Defense Forces in a sympathetic light. Anyway, go check out this film. And if you want more information on the invasion of Lebanon or assassination of Gemayel, check out Wikipedia. It is a fascinating read. Furthermore, it helps explain what is happening now in the region."
36,Waltz with Bashir,,24 July 2013,Effectively structured and delivered,"This film was a big deal quite a few years ago now and pretty much since then I have told myself that I should watch it because it is supposed to be very good. Of course the subject matter made my lazy, stupid brain always take easier options when it came to picking from the queue and as such Waltz with Bashir has kicked around at the bottom of a drawer for quite some time now waiting to be watched. I finally got over myself this week and did so and I really didn't enjoy the experience although of course this is precisely how it should have been.The film is a tough watch as it reconstructs memories from the protagonist and his friends who were all involved in the Lebanon War in the late 80's. It starts out slowly and takes the form of an documentary where we have the characters relating their experiences back to us through interviews (although mostly they are discussions). This device is common in documentary films and are supported by stock footage of the events; in this case the delivery is different as the film is animated so we are able to see events as they occurred in the character's experience, not just representative footage. This works very well and allows for some really cinematic shots but also the best shot selection as anything is possible in animation. The film builds through the stories and generally it is as horrifying as it is engaging Â– it is a series of well told stories and it works very well because you listen even when it is difficult to do so.It isn't fun and it isn't easy but it is visually very well made and the whole structure and delivery of the film is engaging and brutal. It is a great war film, a great animation Â– just generally a great film."
37,Waltz with Bashir,10,20 August 2009,"Waltz of Death on the Streets of Beirut, September 1982","Ari Folman's Waltz with Bashir (2008), a unique combination of Animation/Documentary/Biography/ Drama/ War is not easy to watch and almost impossible to forget. It is original and unusual but in its core it reminded me of a film from many years ago that explored persistence of memory which can't be stopped or avoided - ""Muriel"" (1963) directed by Alain Resnais. One of ""Muriel"" characters is a former soldier who was hunted by the memories of the war in Algiers and the local girl tortured and killed by the French soldiers. As in Muriel, the main theme of the Israeli film is reality vs. memory of it. Can we always trust ourselves with what we remember? Does our memory reflect the events the way they really happened or our vision of them is altered as time passes and new realities inevitably enter our lives? Ari Folman and his team use an innovative technique to tell the harrowing story. It is the first time, a film-maker blends documentary and animation, history and fiction to create such powerful, tragic yet beautiful film which I simply can't stop thinking about. By making himself a character of the film who tried to understand why he has no recollections of the events he had been a participant in some and an eyewitness to the others, and gradually unveiling the long hidden unbearable truth, it seems Folman made the film as a metaphor for the whole country trying to block from memory a very dark, difficult, controversial and shameful page in its history that is known as The Sabra and Shatila massacre. It was carried out between September 16 and 18, 1982 by the Lebanese Forces Christian militia group, following the assassination of Phalangist leader and president-elect Bashir Gemayel. It is not the purpose of this short review to comment on the Sabra and Shatila massacre. I just want to point out that the information available from the different Internet sources is not always complete. A very important fact has been omitted from Wikipedia that ""Israeli troops allowed the Phalangists to enter two refugee camps, Sabra and Shatila to root out terrorist cells believed located there. It had been estimated that there may have been up to 200 armed men in the camps working out of the countless bunkers built by the PLO over the years, and stocked with generous reserves of ammunition. When Israeli soldiers ordered the Phalangists out, they found hundreds dead (estimates range from 460 according to the Lebanese police, to 700-800 calculated by Israeli intelligence). The dead, according to the Lebanese account, included 35 women and children. The rest were men: Palestinians, Lebanese, Pakistanis, Iranians, Syrians and Algerians.""This is a very sad and powerful movie that left a lasting impression on me but I understand that not all viewers feel the same way. My husband kept saying, ""So what? What new did they say? The War, any war is dirty, unglamorous and destroying for every side involved. Thousands of innocent die tragically. The war brings shame and guilt, remorse and nightmares to the soldiers who follow orders."" I agree with him but I understand why the director Ari Folman who is a Veteran of the First Lebanon War has made the film and what he tried to achieve. For almost 27 years, the debates have never stopped regarding the responsibility of Israeli military for the massacre because the Sabra and Shatila camps had been under the control of The Israeli Defense Force (IDF). By the words of Folman, his goal was not naming the guilty parties but trying to understand what is going on with these who fought as the Israeli soldiers during the First Lebanon War in Beirut and saw the results of horrors with their own eyes. Explaining why he chose to make the film as a documentary in the animated format, Ari said that animation had given him the necessary freedom in his creative process and the chance to blend the facts of reality with the perceptions, feelings and deeply hidden images in the memories of the retired soldiers- his friends and comrades whose recollections of these few days in September of 1982 as well as his own made the film possible. The technique which is actually a combination of Adobe Flash cutouts and classic animation has produced simple, gripping and fascinating images. The atmosphere is surreal to which the dark disturbing color scheme appropriately contributes. The visual originality and innovation are accompanied by sorrowful haunting soundtrack and the songs written for the film that add to the deep emotional impact the movie made on me."
38,Waltz with Bashir,9,4 April 2017,"Inner turmoil, animated and true","""Waltz with Bashir"" is a documentary that uses very unique devices for the genre. And I don't mean only the fact that it's an animation. Fictional movies depicting real life events are often held back by their documentary style, but this one is a documentary elevated by its strongly fictional style of storytelling that leans on its psychologically fascinating structure, artistic visual qualities and effective, often very beautiful soundtrack.The biggest accomplishment here is the fact that ""Waltz with Bashir"" isn't only about the historical viewpoints of the Lebanon war and the personal journey presented. It transcends that initial premise and becomes a universal, effective story about conflict, about human nature and our violence."
39,Waltz with Bashir,9,4 January 2016,powerful movie,"Boaz is haunted by 26 dogs chasing him. As an Israeli soldier fighting in Lebanon, his job is to take out the dogs since he's unable to kill people. Ari Folman has blocked out many memories from his days fighting there. Boaz's story has waken something in his brain. He starts searching for his past by talking to old comrades about their time in Lebanon and discover the truth about what happened in Beirut.This is a harrowing animated historical recounting of a devastating incident and a devastating war. The war stories are as powerful as any of the great anti-war movies. It takes apart a war, memories and a massacre. It is a powerful movie."
40,Waltz with Bashir,10,24 December 2015,The horror ! The horror !,"'Waltz with Bashir' is an animated documentary written and directed by Ari Folman. The film follows Folman in his search for his lost memories from the time when he served in the Israeli army during the traumatic Lebanon War of 1982.The first thing that I realised while watching 'Waltz with Bashir' is the fact that the animation was absolutely indispensable and this film could never have been made in any other possible way. This is because although this is at the basic level a documentary, but Folman takes a lot of artistic liberty to recreate the real life events and these recreations would never have been possible without the medium of animation. So the animation actually enhances and assists Folman's storytelling instead of sticking out as a gimmick. Thanks to the meticulous animation and the visual attention to detail, the whole film looks gorgeous. Every still shot can be framed and laminated to admire the beauty that is on show. The surreal imagery of the animation will stay with me for a long, long time. Folman uses the animation to juxtapose the beauty of the visuals with the devastating nature of the events during the war that the visuals were capturing. There are multiple haunting images and shots which are devastating to watch like certain scenes in 'Schindler's List'.The screenplay for the film and the subject is deep and thematically rich. Although Folman never shies away from the heavy nature of the subject matter, but Folman's style keeps the film vibrant and energetic throughout. Even viewers who generally tend to avoid war films will find this engrossing.The primary themes running through the film are the loss of innocence and guilt. We see Folman interview other men who like him served in the Lebanon War. We see these men recall the horrors of war that they had to witness when they were just young boys pushed into this hellish environment. Pretty much all the stories and interviews are interconnected. All the stories underline the madness and the futility of war. The stories also establish the mental struggles that these war veterans have had to deal with after coming back. The singular element that connects these mental issues of most of these men is the element of guilt. The guilt of having to kill human beings and also the guilt of surviving the war when many of their colleagues couldn't. Water bodies like the ocean play an important and symbolic role in many of their stories. Folman uses this aforementioned theme of guilt very craftily and uses it to connect the issues concerning the nation of Israel as a whole in the political scenario with the personal issues troubling the individuals covered in this film.Another very relevant theme dealt with by Ari Folman is the dynamic nature of memories. He explores and establishes that someone's memories can be fabricated by others or by himself/herself. A person can choose to completely forget certain aspects of his/her life because of certain subconscious assumptions. 'Waltz with Bashir' is an artistic masterpiece. Its substance and style go hand in hand and complement each other instead of one submerging the other. It is a political film that is ambitious in its style and becomes more than just about politics and war. It becomes a transcendental work about human emotions."
41,Waltz with Bashir,9,25 September 2015,Why not perfect?,"I am usually rating movies based on their genre. Since there are few animated documentaries around, this by itself would place Vals Im Bashir pretty high, but while I was trying to find flaws in the film, I realized that I am having difficulty doing that. Perhaps the only one that makes sense is that the animation is very basic, Adobe Flash like, other than that, it is something that touches on both factual and emotional level, without being heavy handed.To put it in perspective, it is the story of an Israeli man trying to understand why he forgot what happened during the war in Lebanon and his journey to remembering. It is not a propaganda film, but a personal documentary film of the director's journey: the man in the film.I can only recommend it."
42,Waltz with Bashir,7,19 October 2008,"Decent storytelling, poor animation","Although I doubt it gives an ""objective"" account of events (and you never get the impression it's supposed to) it does a good job of showing the more chaotic side of war. The movie gives an impression that the Israeli soldiers are frustrated, horny, confused, scared and that they never quite know what they're doing - like when a group of soldiers are riding an armored vehicle just holding down the triggers of their automatic weapons, shooting wildly for hours and hours - or the bizarre ""dance"" that the movie is named for.No witty banter or everyday language at all is exchanged between the soldiers, instead contrast to the hellish events of war is provided by the interviews with the veterans.All in all, the story is well crafted and the movie is an enriching experience.The choice of animation as a medium, however, seems kind of poorly motivated -- I guess it was a choice made to slim down the budget, because the style of the movie strives to look realistic and it's not hard to imagine it being done as a regular film.Although the animators show potential, the movie is riddled with flaws - from simple errors of craftsmanship (heads too big, hands too small, wonky poses, too-smooth movement and so on) to all too obvious time-savers (the smoking in the bar scene at the beginning was downright painful to watch) that all combine to make sure this movie doesn't get the ""it looks the way it's supposed to look""-feel, a feel you seem to get so much easier with conventional film.It reminds me of last year's ""Persepolis"" which had a great story to tell and mostly good animation, but was sadly ruined by poor pacing and a really cheap-sounding soundtrack."
43,Waltz with Bashir,5,6 February 2009,Comics in the way....,"Sound track of this film is a very strong part of the presentation. The marijuana and porn scenes, actually are conducive to express the repression of the memories. (Combination of the words were intended here.) The most powerful dynamic in the film is this very subtle, not explicit, but inconspicuously obvious 'delegation of responsibilities'. Hierarchy/vicious circle of sources of the instances, which instigate/arrange the violence 'by proxy'. Public expects the government to protect, but Sharon/Begin let it happened almost by default. Army encircles and watches standing back, the killers (""Christian"" phalangists) act with expectation to be without any responsibility and end up being sacrificed themselves in more than one way. The Israeli boys, who were sent to implement the political goals of the government end up with nightmares and maimed souls.Nobody is guilty and, as usual, everybody is. The film doesn't answer any questions and isn't designed to give any answers. Just that: we always are guilty together. If we keep silent it will continue for ever. This project deserves all the awards - the most important one would be, in my opinion, for the courage to start this theme. I am afraid though - there will be no continuation of this discussion/topic any time soon....."
